text,author,date,like
It’s obvious this cloth isn’t particularly for the average Joe and there’s the reason it ships with the Pro XDR displays. It’s made for nano texture glass. And delicate displays to ensure no scratches. A display that expensive you want to protect at all costs. Like buying a case for your iPhone or a screen protector for it. Something that expensive deserves the best quality premium care.,Aadam Aperturē,7 ay önce,0
"People : Buying a Cleaning cloth with the Apple Logo on it for 19 buck's

Me: Cleaning using The Soft towel I shower with FOR FREE",Maisaan Mohamed,9 ay önce (düzenlendi),0
"Dear I will teach you on how to clean your phone screen properly:

1. Cover your phone screen with the premium screen protector. 
2. Buy a bottle of eyeglass cleaner and few microfiber clothes from the eyeglass shop nearby",M.Z.M.A,7 ay önce,0
They use to put those clothes in the MacBook Pro computers of the old. I love mine even though it’s 8 years old,Ultra Ryan2004,10 ay önce (düzenlendi),0
5:16 The cover of the box getting down was so satisfying,Just a stranger,10 ay önce,0
How expensive is apple cloth in the us compared to others? In my country is literally 8x the price of a regular cloth,Vito-HLB,10 ay önce,1
"1:10 yep that’s me right there Justine, everyone makes fun of me for getting the iPhone 13 pro etc ",PerfectPilot,10 ay önce,0
"There are other microfiber clothes that go for a similar price at big retail stores that they try to sell you when you buy a TV. I’d rather get the Apple cloth knowing it’s actually going to be the best. Otherwise, Apple wouldn’t release it.",VelvetThundR,10 ay önce,1
Let me just buy some $1 Tech cloths and slap an apple logo on it and boom Ijustine makes me rich.,aaron mbuzi,10 ay önce,0
"I think anyone who has tried to clean an expensive Camera lens knows how hard it is. Micro cloths are not all cut from the same ""Cloth"", see what I did there. If it cleans my Mac after my family have dragged their fingers all over the screen, ""No need to touch it, just point where you're looking, oh too late 9 year old finger prints"", Ok perhaps Dad needs to lighten up!. Long story short, I'll get one, but I love the jokes also...now where's my dish cloth, there's a smug on my screen.",Adam Spencer,10 ay önce (düzenlendi),0
I was going to say this is the most profitable joke ever from apple but then I remembered the Mac Pro wheels exist ,Damon Lam,10 ay önce,0
I think thinks it’s delivery date is delayed for demand issues. Its most likely a supply chain problem.,Giuseppe Hess,9 ay önce,0
Love it!,Marb's Music,10 ay önce (düzenlendi),1
"Does it come with AppleCare+ extended warranty? If so, will that cover liquid damage?",Neko Michi,10 ay önce,0
I'm assuming this means that Macbooks no longer include a microfibre cloth in the box so they can now sell it to you as an add-on. Just like with the power extension cable.,savagemadman,10 ay önce,0
Think I'll wait until it hits the Apple Refurb store.,Par Jau,9 ay önce,0
"This is like the Mac Pro wheels or the Display stand. Although, I wouldn't mind buying one.",Akash Sarda,10 ay önce (düzenlendi),0
Im waiting for the Pro version of the cloth,nerdking cool,9 ay önce,0
Do NOT use alcohol on non glass displays.,Axiarus,10 ay önce,0
You’re so funny ,Vitor Gomes,10 ay önce,0
"1:51 ""oh its the same one"" <-----------These are crInge worthy.
3:02 Justine i will buy you a better microfiber cloth at less price, w/o apple logo",Laxman,10 ay önce,0
I want one great video !!,Bridget Weaver-Hicks,10 ay önce,0
"I love how she made an 8min about a cloth, half of which talked about the AirPods and DIDNT EVEN USE THE CLOTH ON ANYTHING",DaniKat21,10 ay önce,0
I’m watching this 1-14-2022 and I just ordered mine yesterday and it’s arriving tomorrow ,mike4rmpallet,7 ay önce,0
Appel : it just cost 0.50 cents to made ,MATEUSZ Pyrkosz,10 ay önce,0
THEY COULD MAKE A CLOTH THAT STORES AND DISPENSES THE ALCOHOL CLEANING SOLUTION.,kris ertmer,10 ay önce,0
"Ya know, this video convinced me to buy it ",ah,10 ay önce,0
The polishing cloth is amazing.,THE-ONE,10 ay önce,0
Apple Care is $9.95.  Warranty is voided if you fold it.,OPUS Digital Audio,10 ay önce,0
"People say your crazy for buying it

Me who buys every add on for my Mac book",Mariano's Tech Tips,10 ay önce,0
This was so funny. Great job.,Dan Young,10 ay önce,0
You would buy a $50 Q-tip if it had an apple logo on it...,Yarwin,8 ay önce,0
I was sooo entertained ,Mark Mendoza de Vera,9 ay önce,0
"Been lurking here for a while, but had to drop a comment on on this. You're a rockstar! ",,10 ay önce,1
Perfect! I'm going to get one to clean my new Pixel 6!!,scupking,10 ay önce,0
"I don't think I've ever seen your anchor tatoo on your right hand before, have you mentioned it before? if so, what is the significance of it?",Pkgroovy,10 ay önce,0
This reminds me of the Pet Rock. which was another brilliant scam.,Ballin 13,8 ay önce,0
I need one of this ,Mirelle Ferreira,10 ay önce (düzenlendi),0
I’m more impressed that you found a way to make this video 8 mins long,LAUD DP,10 ay önce,0
Honestly i clean my gadget using my cotton T-shirt  hehehe ,Mohamed Badusha,9 ay önce,0
"I love ya Justine! I am an Apple fanboy, sheep or whatever. I understand your enthousiasm about Apple's products, 100%. I am buying that cloth asa its avaible again.",Paterne YAO,10 ay önce,0
"You do you Apple, you do you.",Amateur Game Dev,9 ay önce,0
Best review YET! LOL!,Spokane Stainless Technologies,10 ay önce,0
I love this lmao,MarioDude,10 ay önce,0
Best way to fool people into buying a micro Fiber cloth. engrave an apple logo on it  and loads and loads of fooled followers will buy them. ,Eric de Rozario,10 ay önce,0
People pretty much went ahead and purchased it because it had the word “Apple” on it. Amazing!,Chris Zayachkowski,10 ay önce,0
"Nita Ambani be like ""Ill use this as my handkerchief.""",Sanket Mandlik,10 ay önce,0
Seriously this is ridiculous this is madness among all those unboxers ur the only unboxer who unboxed this insane thing,CyberSpider127,10 ay önce (düzenlendi),0
OMG YOU ACTUALLY MADE A REVIEW VIDEO!!! I love twitter xD!,ItsYourBoyDT,10 ay önce,0
Such high tech fabric,Birim Racha Cheran Momin,9 ay önce,0
"Apple: It is our best product we have ever made, no company has ever done this or even comes close to our polishing cloth, it is our most exclusive product that we claim 100% of the marketshare in the cloth",Patrick Gamboa,10 ay önce,1
They weren’t sold out at the Dollar Tree ,Mike's Vegas,9 ay önce,0
Wow! Didn’t think we could sink this low… well every day is a school day. Way to go on reviewing a cloth...what next? Fresh air?,Kenny Cruickshank,10 ay önce,0
omg this is iconic,Emily Sousa,10 ay önce,1
"normal people: i saw this ad online
apple users: i saw this ad on my macbook pro,m1,16gb ram,512 ssd and 2 speakers.",Phenomics,9 ay önce,0
Almost as cool as the stand,Harry G,10 ay önce,0
I wonder how much apple paid her,Agam Gore,8 ay önce,0
Yessss I was wondering when something like this was going to drop,ben osowski,10 ay önce,0
Wonderful!!,Exoo8,10 ay önce,1
"Not gonna buy one, but I LOVE the video ",Lui Barsal,10 ay önce,0
At what point will they start selling cases for this cleaning cloth? (Spoiler alert: I'd buy one.),Bulletin Blair,10 ay önce,0
"Hmm, people may mock Apple for coming up with such a ridiculous product...but Apple probably has succeeded if those same people buy these cloths as a gag gift. Makes you think who is the Smarter One of the two since Apple has made a profit.",Typhoon_808,9 ay önce (düzenlendi),0
Amazing! ,Sydney Helton,10 ay önce,2
This is gonna be the most sold thing on the apple store,Bl4ckBl1zZ,10 ay önce,0
I came looking for a satirical review. Then she started justifying it and I still don't know if she's serious or joking. Or both,Vlad Ivanovich,10 ay önce,0
"It is like a sales interview challenge. ""Sell this ordinary piece of shit with all you got. Go!""",Krishnan Ramesh,10 ay önce,0
I feel like this trolling and being completely serious at the same time :D ...couldn't you get custom signature on the cleaning cloth though? :),Roman Cintula,10 ay önce,0
I love it how she can say “your not wrong”,Gorettie Tara,10 ay önce,0
"look theres no denying that this is a brand loyalty product. just like buying a disney mug in actual disney parks. But i will say that i have had bad cleaning cloths, of different brands and different textures. if youre telling me you can guarantee that this one will work with everything everytime and its soft-high quality? 20 dollars for forever? thats kinda worth it.",Fernando Gutierrez A.,10 ay önce,0
"Probably, I could say the same company that makes it for Apple could sell it for 15 dollars less without an Apple logo, girl you could find it somewhere is like paying for the logo.",Embargoman,9 ay önce,0
3M microfiber is just as great !!!!,StyngRay,10 ay önce,0
This channel is one of the biggest reason why I don't take Female tech reviewers seriously.,Piyush Joshi,7 ay önce,0
buy some nice polishing cloth for cars.. you'll be thoroughly surprised how good they are. since clearcoat is way softer than glass,Jonathan Wang,9 ay önce,0
The amount of salt in this video is amazing,Hari Balaji,10 ay önce,0
Girl managed to talk about a cloth for 8 minutes ,m i g x q,7 ay önce,0
Don’t forget to buy a $50 Apple case and screen protector for your $20 Apple cloth,Kickque,10 ay önce,0
5:17 THE BOX CLOSING IS SO SATISFYING,Manuelle B,10 ay önce,0
I love this.,joseph M,10 ay önce,0
Are you going to get the new Oura Gen 3? I am debating. I got my first one when i realized  it would alert temperature spikes (when COVID began) and I love it for sleeping and activity.,EvaLee,10 ay önce,0
If anyone can make an 8min video about a cloth Justine can ,Harry Rumble,10 ay önce,0
"Y’all miss an important point. This is the only product that is backward compatible to all previous products and will have unlimited updates. This is exactly what apple is about, revolutionary industry leading product that’s changing people’s life.",Philip,10 ay önce,0
That's a perfect gift,Mriganka Choudhury,10 ay önce,0
"I think that the cloth is good for people who have more than one device, for example like: Macbook and  Iphone. My question is: Does it work on a Apple Watch?",Oranges!,10 ay önce (düzenlendi),0
Justine is the best at treating buyers remorse,Luke P,10 ay önce,0
Someone’s going to use it as a mousepad,Noah Bailey,9 ay önce,0
"You are so kind, gentle, caring, passionate, hard working, enthusiastic, flamboyant, and still SUCH A KID at your age ...I honestly believe that you are a treasure to be protected at all costs! I'll always support you! 

Also, loved the video Justeeeeeene!",Jordan Bergstrom,10 ay önce,1
Omg it finally happened ijustine reviewed a napkin and went viral!!!!!!!!,Masiel Acosta,10 ay önce,0
"What material is it? fleece? :)
It's endearing you are self aware. And good thing you are a multimillionaire so you can afford the emperor's new robes. Maybe less ideal that you got there herding sheep to slaughter :)
Your shirt kinda looks like sheep's wool, I'm just saying :)",Dan Frederiksen,10 ay önce,0
I wish other polishing clothes are packed in recycled paper and not PP5 (practically unrecyclable) plastic.,Oscar Fernández,10 ay önce,0
"in 2027 ""Hello My name is Justine and am here to review apples new wonderful toilet paper iPaper""",armani zen,9 ay önce,0
You are awesome iJustine…,Richard Sosag,10 ay önce,0
I honestly thought this was an April’s fools video reupload… ,Haziq Shamshul,10 ay önce,0
THEY COULD USE A LASER AND UV LIGHTS TO SELF-CLEAN THEIR SCREENS. THE SIDING OF THE IPHONE OR DISPLAY COULD POP-UP SLIGHTLY EXPOSING A LASER AND/OR A UV LIGHT EMITTER ON THE INSIDE OF THE SIDING. APPLE NEEDS SELF-REPAIRING TOUCHSCREENS INCLUDED WITH ALL OF THEIR DEVICES AS WELL AS SELF-CHARGING BATTERIES. A UV LIGHT SYSTEM WOULD BE GOOD EVEN IF YOU DON'T HAVE A LASER-CLEANING SYSTEM.,kris ertmer,10 ay önce (düzenlendi),0
Very entertaining!,Linda Dinwiddie,9 ay önce,0
My first ever phone was an iPhone 3GS and I’ve never ever owned an android idk I find them so confusing to use,Daniel Vintila,10 ay önce,0
This is the best video I’ve ever seen on YouTube,Caesar Delgado,10 ay önce,0
Never thought I would be watching a YouTube video about a cloth review... ,Nathaniel Williamson,10 ay önce,0
"I've paid less money for a full sized bath-towel. This is a polishing cloth for the wealthy or people with money to blow, like Justine! I'm sure it works great but not for $20. I've gone 10+ years cleaning my screens with dollar store cloths and they've been perfectly fine, no dents, broken screens or scratches at all.. (: You're basically just paying more money for that tiny apple that is hardly noticeable. This video was entertaining but kinda sad knowing some people don't even have enough money to buy a blanket to keep them warm at night...but thank goodness people with lots of disposable money have their apple cloth... what a world.",Elizabeth Jean,10 ay önce,0
Haha why did I love this so much?,SaltyPanda,10 ay önce,0
"A good stocking stuffer, grasped a bunch of em tbh",Rk4sasuke,9 ay önce,0
Now delivering the end of January. Come on. Let’s get it into February!,Uncle David,10 ay önce,0
"I’m confused  was this a video to promote the cloth or the AirPods gen 3 , huh , wait , she’s an apple fan she can do both ,  just kidding I love your content you go girl @ijustine",JASWINDER SINGH,10 ay önce,0
I cannot wait until they release it in 5 different colors. I have to make sure I get every one.,Teacher Adam,6 ay önce,0
"Tim cook can basically burp in a jar and sell it for 199 and people would buy it :) artificial scarcity man, it's a hell of a drug",aL,10 ay önce,0
It doesn’t cost $20 it costs $19,TechNetwork,10 ay önce,0
"Rarely comment and I know this probably won't be noticed (understandably) . But there is legit a reason (well more than one) why this lovely lady is approaching 7 millions subs.  And This has nothing to do with tech, but I gained SO much more appreciation for her when she shared that, endearing, absolutely heart tugging story about the hummingbird.",scott a,10 ay önce,0
What about warranty?,saravanan kumar,9 ay önce,0
Perfect!,Michael Selewach,10 ay önce,1
How do you clean the cloth?,TheVFXbyArt,10 ay önce,0
I’ll stick with my rag from the dollar store  it does the same thing.,Trainer Hex,9 ay önce,0
Can’t wait for next year’s all new $399 Apple reusable toilet paper!,Jason Bhalla,10 ay önce,2
This is Tim Cook’s go-to handkerchief,Levi Floyd,10 ay önce,0
"It's worth getting if you buy a Macbook Pro worth over 2k to ensure you don't run the risk of micro scratches from lower quality clothes. 20 bucks is nothing if you've already spent over 2k which the new Macbook Pro 14 and 16 inch are. But honestly, any Macbook that starts out at 2K should include this cloth as standard, it would be a great way to separate them from the consumer Macbooks",Christopher Loughrey,2 ay önce (düzenlendi),1
The satisfying box slide!,Jenna,10 ay önce,0
*Makes a longer video about a ducking cloth than the new AirPods”,Anthony Evangelisti,9 ay önce,0
You have to be a  unique individual to buy that cloth :) iJustine,Camron Haye,10 ay önce (düzenlendi),0
"Lol, Actually I thought paper napkins and windex works the best",Rodney Sia,10 ay önce,0
"Sewing , stitching and engraving done separately",balakrishnan perumal,4 ay önce,0
I only wish that I could have the possibility to be free to order anything from an Apple Store since Iran is BANNED! Please speak to Apple and tell them let Iranians order Apple products.,Rayan Yari,10 ay önce,0
"They're gonna make apple toilet paper next.
And the worst part is that it won't be reusable ",BigHit,10 ay önce,0
Justine should be the brand ambassador of this product..,Sandeep Rath,10 ay önce,0
The real question is does it wash your body good xD.,Fivestarkill1,10 ay önce,0
how do you wash them once they get all dirty?,gilbert ramos,10 ay önce,0
Any microfiber itself does not scratch anything. But any microfiber will scratch anything if it has caught something abrasive on it,"鎮壓香港統一兩岸,剿滅一切反共逆賊",9 ay önce,0
your not the only one obsessed with Apple stuff it is just to good but some people just dont get it yeah i am talking about you Linus,ETB,10 ay önce (düzenlendi),0
I bet this gets more views than the new MacBook Pros!,Digital Nation,10 ay önce,0
GOOD FOR YOU !!!!!     I LIKE THE CLOTH ALSO !!!!!,Karon Oltremari,9 ay önce,0
"You can probably get exactly the same thing, micro-fibre cloths,  at the enormous cost of 3 for GBP1 at Poundland.

Ah yes, but without the packaging!!!",Will Newcomb,10 ay önce (düzenlendi),0
I bought one after watching this video! :),LookingGlass,10 ay önce,0
Apple polishing cloth is the new toilet paper craze,Chris Ose,10 ay önce,0
"Watching first video on this channel, i think I know she came up with the name.",Bobby,9 ay önce,0
"I have a black Apple cleaning cloth just like the current white one, including the logo. I don’t even remember how I got it. Maybe it’s worth money on Ebay. ",WB Fine Woodworking With Don Bullock,9 ay önce,0
This gotta be the most sheepish clip ever from a Tech reviewer. Lmaoo,slimTee,9 ay önce,0
I have the original air pods and want to upgrade. Should I get the pros or the new 3rd gen? Costco has the Airpods Pro for $189,WCKDend,10 ay önce,0
5:16 THE BOX IS SATISFYING! THE BOX IS SATISFYING! THE BOX IS SATISFYING!,Mike Gapasin,10 ay önce,0
I'd be remiss if I didn't mention how beautiful Justine looks in this video.,Randy Ragsdale,10 ay önce,0
ICONIC ,David Paris,9 ay önce,1
$20? Must have innovative iPolish technology at no extra charge.,Brandon Lesko,10 ay önce,0
This is revolutionary lol,Deal with syftify,10 ay önce,0
LMAO THIS IS SO GREAT HAHA,joseph M,10 ay önce,0
""""""" Congratulations to everyone who comes in every single second """""" ️️️️",Ajay Gaming,10 ay önce,0
"I don’t know what’s more ridiculous the fact it over 210,000 people have watched this video on a fabric square or that I have watched this video review on a fabric square.",MRBenchwork,10 ay önce,0
I love cleaning cloths but this doesn’t seem good value for money … though In the future will you invalidate your Apple warranty if you don’t use the Apple branded Apple cleaning cloth.?,Mike Coshan,10 ay önce,0
Огонь))),Кирилл Решетов,10 ay önce,0
Only Justine can make a video about a cleaning cloth that’s 8 minutes.,JakeyAnimates,10 ay önce,0
"Wow you just gave me an idea, I’m gonna buy 100 of those and stitch them together to make apple t-shirt and apple shorts",??????,10 ay önce (düzenlendi),0
At least she embraces her love for Apple products. These other ppl out here hating Apple products but do it USING an iPhone or a mac. Lol like cmon GWORL I thought you hated Apple ?,ThatJewishKid11,10 ay önce,0
"Dont buy this now, they will release cloth pro very soon…its already on pre-sale",Luciano 21,10 ay önce,0
It's almost painful watching her struggling to justify this.,Vyas Vasudevan,10 ay önce,0
"This video made me tired enough, to end my day this early. ",H!,9 ay önce,1
I wonder if they really are in demand…or if there are just a ton of them floating around on container ships off the coast of Long Beach just waiting to be received. Because I’m willing to bet it says “Made in China” on that box you opened. Probably also says “Imagined in California” on it too. ,Brad Ruff,10 ay önce,0
iJustine never fails to live up to her name.,JumpingOverClouds,10 ay önce,2
Now I’m waiting for Apple Polishing Cloth Teardown from JerryRigsEverything,TheGoldenMinecart // JCTGM,10 ay önce,0
"Nobody:
iJustine making a whole outfit out of apple polishing cloths",Corgi,8 ay önce,0
when has justine ever disliked apple,Waleed Imran,7 ay önce,0
No matter how you tell them you're crazy to get this $20 cloth just to clean display. A fan girl/boy will always have a way to counter your attack. This is the exact video of that scenario. ,Desmond Yeo,10 ay önce,0
I swear Justine would hype up if Apple sold Tim Cook’s spit.,Mpumi Mtembu,10 ay önce,0
Its prolly a window cleaner cloth ️,Amiera Naimi,10 ay önce,0
20 Bucks for Cleaning Cloth is the most Marvelous Apple things in this Universe,haque haque,10 ay önce,2
"If u get her an exactly same cloth without the apple logo, she would say it feels horrible and doesnt feel as premium..",bryan tan,7 ay önce,0
This is amazing. Imagine how successful a company has to be to sell you something like this. Like people don’t even care about the product or the money anymore. They only care about the name. Sad but true ,Mike,10 ay önce,0
God is with you all godbless and your families and everyone in the world amen god and Jesus are good,Izen’s 4K camera,4 ay önce,0
They’re just mocking it at this point,Hafiz,10 ay önce,1
"No matter how irrelevant the product, she does what she's paid to do.",Ahmed saeed,10 ay önce,1
"WHATS FUNNY is YESTERDAY i was talking to my mom about this like i wish apple did this for the phones and put a mini cloth like this with every phone you buy... I DIDN'T KNOW IT WAS A REAL THING AREADY, mind blown tbh.  i didn't know it was trending on twitter it wasn't on my end because i feel im up with the memes but OH MY GAWD i need to see these memes. HAHA",B A Y,10 ay önce,0
Everyone didn’t knew that justine is actor too. Apple gives her script and she acts. Keep it up. Apple’s unofficial official voice.,HËMRÆJ. G,10 ay önce,0
"But iJustine, why doesn't the Apple Polishing Cloth come in other colors? I need a space gray one for my new MacBook, a gold one for my iPhone 11 and a white one for my AirPods...",Slower Cuber,10 ay önce,0
"""She's proud of it.""
Well, I hope someday Apple releases a vibrator.",Avieshek,10 ay önce,0
Justine is again just proving to the world how much of an apple fan/sheep she is... i bet if apple came out with an apple toothpick she’d say its worth every penny...  hilarious!,yannie yann,10 ay önce (düzenlendi),0
Only Apple could sell a rag for $20 and sell out.,madcereal,9 ay önce,0
"Next innovation: new apple poop.
Tim cook: ""it just smells like pure 100% poop . and what makes it different is that person that this poop belongs to, ate the best quality apples for 3 days straight""",BigHit,10 ay önce,0
"""When I saw this as a $20 add on... I did not even think twice about it because"" I AM RICH",Jonathan M,10 ay önce (düzenlendi),0
Great video but product way overpriced.,Albert Abdul-Barr Wang,9 ay önce,0
Delivery time frame is now end of January ,Lisa Sheridan,10 ay önce,0
I want one now bc my MacBook is so crusty and it’s so hard to clean it :(,Exparxa,10 ay önce,0
I need this in my life! LOL,Tammy Paslay,10 ay önce,0
"If i were to buy this cloth i wouldn't clean anything from this cloth, oh no, i would keep that as a badge of honour, probably would keep in a glass frame to keep away from dust..",m..,10 ay önce,0
This could be the add for that cloth,Santhosh Mooga,8 ay önce,0
Why dont they incldue the cloth with the Macbooks. I mean for over 2K$ I think it's not too much to ask,Rima Kambar,10 ay önce,0
"Tim Cook farts ""Oh my god! It smells amazing! This is SO cool!"" -iJustine",Owl Birds,10 ay önce,0
"If Jony Ive farted in a jar and then slapped Apple logo on the jar, this insane woman would still buy it.",Sturgeon,7 ay önce,0
"Guys… she does have a contract with Apple. 
Btw.. I dare you find ONE video where she makes an objective criticism on an Apple product. Hell.. I’m an apple sheep. But she is hands down a fanatic, she doesn’t do apple products reviews anymore, she does Ads for apple.",Omar Juarez,10 ay önce,0
"I use an eye-glass cleaner to clean my MacBook, and some alcohol spray if there is a smudge that wont go",Travelling Yeti,10 ay önce,1
“The best polishing cloth I’ve ever used” HAVE YOU HEARD OF A T-SHIRT ITS PRETTY MUCH THE SAME,Alex,5 ay önce,0
"So… can you wash it? Or…

Btw awesome video",edur0m3r,10 ay önce (düzenlendi),0
I recently found an apple “glasses cloth “ whatever u call it in my iPhone 3g box and I have been using it since then for my glasses.,Christos Karaloizou,10 ay önce,0
"Haha, love it! So funny",Hero Marketing Agency,10 ay önce,0
"Ok, who is paying $20 for a rectangular piece of cloth, seems like the definition of an inflated economy!",Robert Lonski,10 ay önce,0
Little disappointment there is no include apple liquid detergent…,Mohamed ibrahim Basith,10 ay önce,0
$50 on EBay… I regret nothing ,KiLLJOY,9 ay önce,0
some people haven’t got something to eat…apple:,blueprint,8 ay önce,0
This is probably the perfect accessory for an iPad kid because they make their screens smudgy and gross,Tod the Toad SMM2,10 ay önce,1
"I purchased a microfiber napkin cut it in 4 pieces I used 1 for my andu phone, my monitor, one for my bike display, one for my sun glases... In JUST LESSS THAN $3    I feel I am the smartest person among those made it out of stock",Kiran Mulik,10 ay önce,0
Next big thing will be apple nano textured tissue papers,Paluru Sai Durgesh,10 ay önce,0
Justine I can’t keep defending you ,Ryan,10 ay önce,0
Does it have the M1 Max Chip?,Matt Magtoto,10 ay önce,0
"imma ask
do you get to keep ur ETN outfits and if you do do you still have them",Kuriaru,9 ay önce,0
I just love her,Cosmos Then,8 ay önce,0
Lol best review ever,Rebecca Wemyss,10 ay önce,0
"This is called advertising. There's no other reasonable explanation for such a video.

Could you maybe review a sim card next?",Unknown L,9 ay önce,0
Lol I used to sell these things on Amazon for 30 dollars each.,Gary Jahman,10 ay önce,0
