text,author,date,like
"I've gotta say, I've watched a ton of reviews but this one really showed how a regular person would use the phone. Thanks for highlighting all the cool aspects an average consumer would fangirl about!",That Junior Church Teacher,11 ay önce,538
"The quality of content, scripting and just the way it is finally exported is just amazing. Your content is just getting better day-by-day. Amen on that. More blessing to you. I love watching both of your sisters' content and I actually wait for your videos and final thoughts on products. The fun way you enjoy your work and smiling and jolly nature is just pure bliss. Keep up the good work. Also, You are beautiful, P E R I O D.",Ankit Khanna,11 ay önce (düzenlendi),103
This just made me 10 times more excited for this phone seeing how all the new camera features actually work on real life situations.,James Sheridan,11 ay önce,67
"Wow..Justine, you really are a true INFLUENCER. Until I watched your video, I thought there was literally no difference between 12 and 13, at least in terms of designwise and a slight upgrade. However, the quality of your video that gives us a general rundown made me change my mind. It’s about time upgraded my iphone 8 plus. Thanks, Justine!",Dan Lee,11 ay önce,73
"By the way, that phone's cams is super impressive. I'm more impressed with what I've seen in this video than the promotional one, honestly. I'll be grabbing one as soon as Filmic, Moment and Beastgrip get their gear for it.",Nathan Walton,11 ay önce,46
I think Macro and Cinematic mode are gonna be so fun to play with! Thanks for showing us camera tests!,CHITUS💙⸻⸻⸻⸻⸻⸻⸻⸻⸻⸻⸻⸻⸻⸻⸻⸻⸻⸻⸻⸻⸻⸻⸻⸻⸻⸻⸻⸻⸻⸻⸻⸻⸻⸻⸻⸻⸻⸻⸻⸻⸻⸻,11 ay önce,12
"Can we just take a moment to appreciate the production quality of this video. The music, the editing, the overall experience. Excellent job and so much better than a talking head just pontificating on the phones. I wanna see them being used in the wild and iJustine delivered :)",Nick Simard,11 ay önce,290
"Amazing video, I love the work you put into all of your vids. Also, that cinematic mode is looking really cool, definitely considering upgrading.",390,11 ay önce,6
this camera testing video is so fun to watch!! youre able to demonstrate the features casually and in such a fun way,Iskandar Zulkarnaen,11 ay önce,15
Such a great review. You did an amazing job! I’m loving the 13s camera ,Kaycee Bishop,11 ay önce,5
I thought cinematic mode would not be so good. But now I'm impressed. The focus tracking is nice.,Just a stranger,11 ay önce,3
l never watch a full video of tech reviews because I get bored-but I enjoyed this so much- the visuals the music and the vibe was wonderful. Great job. Can’t wait for my phone to arrive.,The Mexican Viking,11 ay önce,2
Did NOT expect cinematic mode to look THAT good,,11 ay önce,"1,1 B"
Awesome video Justine :) your production just gets better and better! Always love to hear you’re thoughts about the new iPhones ,dualnon,11 ay önce,3
Fantastic video! Very well shot and put together. Just what I was looking for. Thank you and keep up the great work! :),Grant Hartley,11 ay önce,3
You are amazing and you did a phenomenal job on this video! This is the best comparison video I have ever seen out of all the products I have searched looking to compare. I wish I had creative people like you in my life! Amazing job thank you!,,11 ay önce,4
"I’m…speechless about cinematic mode. That’s amazing! As a Deaf user here who primarily uses ASL every single day, this is A ONE MUST FEATURE TO USE! I wonder how good and consistent it would be if I keep waving my arms around because that’s how it is when one speaks in ASL! ",Deaf Prof,11 ay önce,49
"so interesting how different reviewers are experiencing cinematic mode. It totally failed over at the Verge, yet here and other places it has been excellent.",Cy Starkman,11 ay önce,8
"I’m personally suuuper encouraged to get one of the Pro models as an enthusiast macro photography ️
And lemme guess, Cr will keep the macro feature and maybe next year or the one after they’ll put a light ring around the lenses just like the Oppo X3️",GL0Wℹ️🆖 GNARLY ♨️,11 ay önce,1
"Preordered mine at launch. Really hoping they add LiDAR to improve cinematic mode even more over time. It’s seems to be really good at common stuff, like animals, humans, maybe a Starbucks coffee cup, hah. But other things have the same issues as portrait mode when it doesn’t use LiDAR.",rob / 𝚛𝚞𝚋𝚋𝚝𝚘𝚜𝚑𝚒,11 ay önce,0
"Great video. Thank you. One question. Cinematic mode seems limited to 30 fps.

Do you think Apple will update Cinematic mode soon, to be able to film to 24 or 25 fps? (I’m in the UK so PAL/25 fps is the “Pro” format here) Thanks ",Rags Martel,8 ay önce,0
Loved this video Justine! I’m definitely pumped to try out the macro and cinematic mode!,Jamalllllllll,11 ay önce,2
"This review video of iPhone 13 Pro Max is really great because it was shot in the environment, not like many people take in the studio, but you turned it into an energy video. Good luck to you, continue to be like these videos in nature and with your movements, it is really wonderful.",Emad Jasem,11 ay önce,3
I’m definitely gonna upgrade after your review. The cinematic feature is dope dope.,,11 ay önce,760
Your reviews are so much fun to watch. Love your energy :),Gabriel Moro,11 ay önce,2
I love what YouTubers have done with cinematic mode already. Every single one looks straight out of an Apple ad ,Daniel Duff,11 ay önce,14
"I think this is your best review ever , amazing production , amazing work ️",seeni gzty,11 ay önce,2
My absolute favorite review of this phone so far. Love the vibe,Cory Mayo,11 ay önce,2
Thank you so much for the detailed comparison … I’ve been looking for a comparison with the iPhone 12 Pro Max so thank you! ,Sumayra K,11 ay önce,0
"Very good review, you really break the narrative and actually show the differences instead of just saying that there is nothing new. For quick videos with two people and without a crew the cinematic function is pretty completing. One can just turn the bokeh effect off if it's too much.  The new cameras look good. I like to have a little bit more on the zoom side, but it's what it is.",Jaime Duncan,11 ay önce,76
This was such a well produced video.  Thanks for sharing!  Can't wait to order up!,Chris Clark,11 ay önce,3
"Justine, that was one of the best iPhone Review I’ve seen you do of all time. Very impressed with iPhone 13 cameras. This phone is worth the hype. This proves all the doubters wrong. Great Details!!! I would love a regular 13 & mini review as well.",Nathan Allen,11 ay önce,4
"This is the only video that has successfully persuaded me to upgrade my phone even though I just did this year  

Excellent job, Justine! I appreciate your videos!",Shabyla Imanie,11 ay önce,9
"really excited for this. I am one of those people that switch every so often to Android. But I have owned basically every iPhone except the 12.  I traded in my 11 pro for the Galaxy Z fold2. The fold has its issues. its delicate. The folding screen is starting to crack down the middle from folding in less than a year.   When you open it its basically a tablet, and closed its a phone. And that messes with apps badly. They need to be restarted or restart themselves when you open and close the phone. its annoying.  Cool concept. But its not perfect yet.     I cant wait for my 13 pro to get here. the camera looks great.",LOL,11 ay önce,0
"Out of all the reviews I've watched, this is the most aesthetic focused and I love it",louie alipat,10 ay önce,27
I always love Justine's excitement and how it can influence others as well. I have this urge to go out and test the camera while watching this video can't wait to receive my 13 pro on friday!,Ignessa Davina Toh,11 ay önce,34
I love how comprehensive your review is Justine. Great job!!,Randy Ragsdale,11 ay önce,0
Thank you so much for your articulate and mesmerizing demonstration of the difference between 12 and 13 definitely worth getting the 13th. I think you have greatly improved and evolved since the beginning when I first started watching. You,David Mace Sr,11 ay önce,0
"Cinimatic mode is only available up to 1810p on the 128gb models, something to be aware of if you’re choosing for that",Grant Mckenzie,11 ay önce,1
"I usually only upgrade every 3rd iPhone (currently still on X ). Needless to say, I'm usually long overdue and super excited for an upgrade! The 13 has absolutely blown my original expectations out of the water and I cannot wait to get my hands on this thing  Your content is incredible, superb editing and overall feel to your videos, and it was great to see such a well-crafted review!",morrisahj,11 ay önce,6
I’m soooo glad the cameras of both pros are the same! Thank youuuuuuu I wasn’t sure from the keynote but you clarified it ️ I’m definitely getting the regular pro this time  I have the iphone xsmax and I’ve always felt it’s way too big.,Kristen Malick-Hatta,11 ay önce,0
I’ve noticed that a lot of top tech YouTubers have become too cynical in their reviews to the point of giving misleading information. The tone of this review reminded me that you can be genuinely cheerful and optimistic and have some fun and not get too hung up on minor obstacles. This is a great showcase for the new features. Congrats ,Yare Koog,11 ay önce,150
Wow…all your pictures and videos are so well shot. I’m really impressed with the iPhone 13 Pro and how you used it.  I originally wanted to buy a 13 (because of the weight but I’m now thinking about 13 Pro…),rosemars8,11 ay önce,1
"she never disappoints in her videos, my fav since forever <3",Jannelid Roman,11 ay önce,2
"Covered every detail of this phone and just as we viewers expected. Great job Justine, please upload more tech videos.  I liked it.",Anurag Sakure,11 ay önce (düzenlendi),0
I really love that she records her content in 4K. I purchase everything for the best possible resolution and hate when I'm back to 1080p or less.,Jon Jon,11 ay önce,17
Happy Holidays Justine  love  your videos for the sheer enthusiasm and quirky funny moments. ️ Thank you for sharing. The cinematic mode is definitely a fun feature.,Zia B,7 ay önce,0
Wow! Those cinematic shots around minute 12 looked Apple keynote worthy! Really a great showcase of the camera quality and capability on these new iPhones! Well done.,Kanev05,11 ay önce,3
"Awesome review.   I am just sitting here thinking of all of the real world possibilities of using this phone as my main camera.    Thanks, Justine.",Sam Walker,11 ay önce,0
"Very nicely done video!  

I can't wait till Friday and my Blue 13 Pro.  ",,11 ay önce (düzenlendi),2
"The energy, the music, everything about this review is just amazing. Great job ️",Ahmad Ismail,11 ay önce,1
"I think this is one of the best videos I've watched on iJustine. The editing is just 
I really want an iPhone 13 Pro now",Billy Joe Sarangelo,11 ay önce,2
"I enjoyed watching the video.

I have a question.

Is it possible to edit a raw file within iPhone 13 without using another app and save it as a jpeg?",Santa K,11 ay önce,0
"Didn't come here for macro mode, but wow! Also the stabilzation on it even though Justine wasnt using a gimbal was nuts. I can still tell which is the iPhone vs. Justines camera because of HDR, but excited to see how 'look's help to combat that. Superb video!",Gabe Sanchez,11 ay önce,7
The cinematic mode looks really cool.  Probably not gonna upgrade for another 6 years tho so excited to see what comes out then,Matthew Penner,11 ay önce,0
"So I’ve been taking the entire day watching videos for the the new phones. I clicked on this thinking she was gonna explain the entire phone (which I was kind of hoping), not just the camera, but after watching it, I’m even more solidified to buy this phone. Good god. I don’t take pictures but I might just start. I’m starting to have like…a good anxiety attack because I’m so anxious to get this phone ",Trevor Wright,11 ay önce,0
"I really like your videos, you put a lot of work in them ",Cătălin Ciprian,11 ay önce,3
"You crushed this review. It’s everything I needed/wanted to know and is awesome looking besides. I am soooo stoked my13 Pro Max 1TB is on its way to me and not one iota of buyer’s remorse, not even in metrics!!!",grlRex,11 ay önce,11
"The cinematic video can only shoot up to 1080p30 but your video is in 4K.  Did you apply any post-processing to upscale those videos?  If not, it's quite impressive.",William Cheung,11 ay önce,0
Justine’s reviews are always so fun to watch!,Shreya Saha,11 ay önce,17
"Great video. But how about the performance of the 77mm equiv. telephoto camera for portraits? Can it create a convincing  softening of the background in portrait mode? Is it comparable to the telephoto camera in the 12 Pro Max, despite its smaller aperture?",Christian Nilsson,11 ay önce,0
The cinematic mode is so good ️,Gading,11 ay önce,1
Great video. Really enjoyed watching it but also super informative ,Leigh Richardson,11 ay önce,0
Love the macro mode! Now I am torn apart between 13 and 13pro :((,Ria Acasio,11 ay önce,0
Macro mode is very impressive! I’m excited to get my hands on that,EV6's Dash Cam,11 ay önce,22
Thank you Justine for yet again another amazing review!!!!,Adriana Tower,11 ay önce,1
Thank you so much for this amazing content! I have watched this review 10 times!,Dakota Anderson,4 ay önce,1
"Fantastic showcase and review of the phone. I love that you shoot in the vibrant mode, I do too!",Mouth Freshner,11 ay önce,0
I'm planning on getting the 13 Pro Max hopefully next week so I'm binge watching reviews. All I got to say is wow. The quality and effort you guys did for this review is on another level. Really entertaining and I like how you incorporate it to how people would normally use it. The shots especially the videos captured on the iPhone are amazing.,Dandalandan117,1 ay önce,1
Best IPhone 13 review I've watched so far! Had a smile on my face the entire time  Keep up the amazing passion for apple!,Aamir Shafi,11 ay önce,14
This review was so good and enjoyable to watch!,Joseph Yap,11 ay önce,1
"Amazing video thank you Justine. If I may request a test from you, would it be possible for you to try an astrophotography shoot, like both photos and videos to show how good the new wilder sensors are?

 from New Zealand!",Matthew U,11 ay önce,0
"First of all, great video!!! 
I can’t decide to go with the 13 pro or 13 pro max, I would like the big screen but am kinda scared that I think it will feel to big to take with me me everywhere. What do you feel about the size?",Claraaa422,10 ay önce,1
"Loved how this video turned out! 
Would love to see how night mode with a tripod looks. Maybe try out some astrophotography?",Gregarious747,11 ay önce,0
Excited for the cinematic mode .. thanks for camera review,Arjiz Goodtimes - Bengali Vlogger in USA,11 ay önce,0
Damn… the cinematic mode and macro mode is just,Ramana,11 ay önce,14
I appreciate your review. It shows the difference in macro mode that I am curious abt.,Musang Ei.,11 ay önce,0
"The camera’s just keep getting better on every generation of iPhone, and now we have Macro and Cinematic modes.",Ron Brown,11 ay önce,9
Awesome review! Always love your videos. My 13 Pro arrives tomorrow! Can't wait to shoot some macro photos and videos.,Jeff Alderson,11 ay önce,0
Great video great work!!! But I think my 12 pro still does well and I can hold on to it until next year. Trust me 14 and 14 pro is worth waiting for.,saquib mohammed,11 ay önce,0
Justine’s camera reviews are the best.,A,11 ay önce,17
I just recently discovered your channel and I can’t believe how well produced your videos are. I can only imagine how many hours and hours of work went into putting together this 14 minute short film. You are a true professional.,amit nagpal,11 ay önce,14
I would love to see the new night time lapse feature! :3,Calvin Carlo,11 ay önce,0
You make me want to buy the new iPhone even though I know that I don’t need one. Your videos are just enticing! Apple should hire you for their event.,Francis Olbes,11 ay önce,0
i love your  iphone test videos.  Always my go to when new iphones launch!  I am so excited for macro mode!  i raise miniature dachshunds and macro is going to make my images so awesome!!!!   Anxiously awaiting my 13 pro max tomorrow!!!,Michelle Perlick,11 ay önce,1
"I'm sure it's because your cinematic shots were taken in good lighting that I feel they look better than even apples own videos. In apples darker samples the halo, from the digital bokeh, is very noticeable. The apple cinematic promo had me thinking I could wait. Your vids have me looking for iPhone 12 trade in deals.",J D,11 ay önce (düzenlendi),12
"wow, im impressed with that cinematic mode",Pineaple Head,11 ay önce,0
"Thank you, Justine for getting straight to the point with the viewing of the iPhones. Definitely loving that you didn't leave us in suspense. We obviously all know what comes in the packaging and would really be interested in the functionality of the device.",Aurencia Barton,11 ay önce,4
Nice work iJustine!  Really good demo of cinematic mode.  And you’re a sweet spirit.,mclaren f1,11 ay önce,1
Потрясающее видео с шикарными  локациями и великолепный обзор на камеры!,Артем Ионов,11 ay önce,0
Great insight and review. Love the new iPhone 13. Thanks for this video,Anthony F.,7 ay önce,0
"Nice review ,  Apple makes incredible phone camera lenses if they really wanna up the game they mighest well install real DSLR Lenses In iPhones  and take it to the next level eventually I think  its leading to that direction in the near future since  so many people wanna video blog and edit technology  improve  as time goes on anyways",MR.TIBBS,11 ay önce,0
WOW. that macro lense is absolutely amazing. i cant believe this is a brand new feature on the iphone! im so so excited for my 13 pro to arrive. i got it in sierra blue!,Susanna,9 ay önce (düzenlendi),0
Cinematic mode is insane !  Can’t wait to make some small films with it.,Historical Redemption.,11 ay önce,34
"Hey, I gotta tell you that the quality of video that you are producing is top notch! Keep it up. Nice review, as well.",Nathan Walton,11 ay önce,0
I absolutely love how informative your videos are !  can’t wait to recieve mine,ketzia ruiz,11 ay önce,0
Thanks for your incredible camera test! I love it  That’s the best iPhone camera ever!!!!,PalmOLivre Channel,10 ay önce,0
What do you think about the battery on the new iPhone 13 Pro and the 13 Pro Max? Did it managed to hold the entire whole day? By the way that was an amazing review on the new iPhones! Keep it up!!,Mike Kounelakis,11 ay önce,0
"This was such a fun review, also it helped me decide which one to buy. Thank you",Pelin,11 ay önce,2
"This is by far the best review out now. Legitimately fun to watch and informative because you provide examples. Verge and MKBHD made very boring first impressions and reviews. And most of the camera tests I've seen online are of ugly buildings or pets or cars. This is not only fun, but true to life. The golden hour cinematic shot looked so great.",Adam L.,11 ay önce (düzenlendi),16
"Cinematic mode is sick, love the music in the video too great edit!",Living on the Tyne,11 ay önce,0
"I finished getting my S9 paid off so decided to try apple again. Loving the 13 Pro Max! Takes some getting used to to be back on IOS, slightly upset at the loss of Tachiyomi as a manga reading app, but I still have an android tablet to read on so it’s not a big deal.",William Brown,10 ay önce (düzenlendi),2
Justine you’re my inspiration. You’re so good at what you do. ,ksksjsk jenenndneneme,11 ay önce,1
I just got the 13 pro and I love it.  Your video was so informative because I love to take pictures. Thank you. ,Patti.J,10 ay önce,0
"I’m a switch every two years with the flagship iPhone since the first ever. I was not impressed with their presentation this year. (Watched live with popcorn style fan… and was so disappointed). You have seriously done so well on this video presentation… Apple needs to thank you… well done! (Sold). You AMAZING person! X
Do an all iPhone footage + edit battle vs a guy in Linus’s team! Ugh would be fun.",PCWVKSW,11 ay önce,42
"I really enjoyed watching this review, and I want to upgrade now. Thank you ",Davin Johnson,11 ay önce,1
"Great video!
Apple website says there is differences between the sensor of the 13 and 13 Pro (aperture ƒ)",Lior Livyatan,11 ay önce,1
"Hey ijustine, I’m new to your channel and All i can say is. Wowwww. Thank you so much for this review and it has made me even more excited in reviewing my iPhone 13 pro max today ",Dominic Bamber,11 ay önce (düzenlendi),0
Wow amazing. I’m definitely getting the upgrade from the 11 pro. Thank you for convincing me of how awesome the 13 pro is. ,Grace Gama,11 ay önce,0
Love this review The best tech review profile . I love watching your videos .,Secretgarden,11 ay önce,0
"before watching this video I wasnt considering an upgrade from my regular 12, but after watching honestly speaking I am impressed and I have to reconsider my decision to buy the 13 pro due to the camera improvement!",Syafiq Johari,11 ay önce (düzenlendi),5
Impressed as always with apples camera just wow!!,NitroSenpaii,11 ay önce,0
Am loving it.. u are making videos perfectly. Am impressed ️,Ahamed Safy,11 ay önce,0
"The macro feature uses the Ultra Wide camera, so if you’re going to make a comparison to the 12 pro max I’d suggest using the Ultra Wide camera for a fair comparison",Danie Bello,11 ay önce,10
she did the best iPhone 13 review I've seeing of all the top you tubers. it was about the experience rather than the technical stuff,ENDWARO7,11 ay önce,0
"Amazing real life use of the photos and video especially how clear the photo was of your eye, not like the same old boring videos of others comparing specs.  Keep the videos coming!  Time to upgrade my 6s Plus.",Sam Byun,11 ay önce (düzenlendi),1
"The macro is so amazing! I think it is so cool that apple was able to use the ultra wide for that, instead of just some random low quality sensor.
And wow, in the clip with the front facing camera you could hardly hear the wind ",phonepup_mk8DX,11 ay önce (düzenlendi),21
I like how you’ve especially articulated this video . It’s kind of what MKBHD does . Good job ,Faiyaz Muttoo,11 ay önce,0
Dope Video Justine! Probably my favorite iPhone 13 Review I’ve seen so far!,Jay Jonze,11 ay önce,0
"I’ve been your subscriber since like forever and yet I’m always amazed with your production, creativity, quality and of course your charisma. This is such a great stuff! I love your videos.",JENNIE's Wifey,11 ay önce,1
"I’m upgrading from the 8 to the 13 pro.

Needless to say, I’m excited lol.",SilverFox,11 ay önce,1
wow the difference in cameras is substantial I'm really amped for this upgrade,Bella Carroccio,11 ay önce,6
"haven't seen iJustine's content in almost a decade, and it feels like checking up on an old friend ",Lucid The Lifestrider,11 ay önce,50
"Apple brings the features late but whenever brings, brings with perfection. See Samsung's live video and Apple's Cinematic mode.",Mandeep Makker,11 ay önce,1
Quite enjoyable & informative review.  Thanks...,Dan Fehrer,11 ay önce,0
"What an amazing and detailed review.
Been a viewer of your channel since the iPhone 3gs days!!",M.A Malik,11 ay önce,0
Great video in all aspects! You both rock!,Omar C.,11 ay önce,0
"Awesome video!!!!!! Thanks for explaining and showing the camera’s shots, videos, and pics. Very well done, so glad I go the 13 Pro Max today in gold.",Paula Lee,6 ay önce,0
Cinematic Mode is the game-changer this year for mobile videography. It is the first iteration of machine learning that bridges the gap between amateur videos to potential movies being filmed... FROM A PHONE. It's not perfect and still needs work but it's definitely a MASSIVE step in the right direction! ,ThreeTwentyTech,11 ay önce,4
Truly appreciate your videos! Interesting watching different people in this space doing videos on this particular product and very wide thoughts and views on it. Some views are extremely analytical and thoroughly tested for various functions and how well they actually work. Others are what feels like an advertisement for the product really tried to make sure whatever information comes forward is supportive of the brand they’re advertising this way not to upset or say anything that’s not positive about the product. This makes me pause.,Garfield Crooks,11 ay önce,0
Just ordered the Sierra Blue and the leather Midnight case! Super excited!  Thanks for an awesome review ,Celina Rydén,11 ay önce,0
Fantastic video. Macro and Cinematic modes look super fun. Can’t wait to try them out.,Dan Young,11 ay önce,0
Finally upgrading to the 13 Pro Max from the iPhone 7 Plus. Stellar review and I can't wait to play with Cinematic mode and Macro the most ,KC,8 ay önce,1
"I loved the way you demoed cinematic mode, amazing. And my answer is B.",Guillermo Serra,11 ay önce,0
"Can't believe the Cinematic Mode would be so cool and useful! 
Looks like shot on a high end cinematic cam! Legit!",Uday Singh Chauhan,11 ay önce,31
This video literally made me feel good for deciding to buy this as my first iphone ,Unboxing Angel,11 ay önce,2
"Had me gigglin like crazy testing the macro on your eye  love this review, thank you for your hard work!",Rhonda B,11 ay önce,1
