text,author,date,like
"After being a Google person since day 2, I noticed that after subscribing to your channel, that I bought a 12 mini LOL. Not falling for it again with the 13. Might again with the 15. LOL.",Box Fan,11 ay önce,1
You picked a great location to take photos in Justine.,Randy Ragsdale,11 ay önce,0
im so excited to see your Oled switch unboxing,Richie Bradley,11 ay önce,0
"Guys, should I get the 13 pro or the Max? Btw I live in Argentina so, smaller it is,  less chance to get robbed xD",Santino Martínez Merli,11 ay önce,0
Finally a Macro that works,Danni Portillo,10 ay önce,0
great video justine. i need to purchase iPhone 13pro for my youtube channel video.,jee shopper,11 ay önce,0
"Iam dissapointed with Blue color Iphone 13, looks pale and less elegant than Iphone 12 ",bayu adrian,11 ay önce,0
The Starting Of The Video Looks Like A Movie Trailer!,Feeha Mazhar✨,11 ay önce,1
@ijustine can you please do a review on iPhone 13 pro vs Nikon 850D.,ali zahoor,6 ay önce,0
"That macro mode switches on automatically tho as soon as you get not even that close, I think at about 10-15 centimeters...and you can't switch it off. Not cool",Alex Larsen,11 ay önce,0
But I heard the extra camera is a spy camera ,Lexis Lex,11 ay önce,0
This feels like a HGTV show!,Azan - اذان,11 ay önce,0
I have a question. Where can I buy the mint-colored 13 Pro Max case in the video?,변선양,11 ay önce,0
nice vid! can you make more videos about iphones,iphone,11 ay önce,0
Sierra blue is lit ,Faith Evans,11 ay önce,0
Really enjoyed watching this.,Aurélie Pottier,11 ay önce,0
Wow. Just the same as last years,Pedro Garcia figueroa,11 ay önce,0
what's the trip pod you are using for iPhone 12 and 13 comparison?,Meiii!,11 ay önce,0
Great intro!!!!!!,Mai Siegel,11 ay önce,0
"I love love love the cinematic mode! I recently started to vlog with my iPhone 11 and I so want to upgrade.. but I think I’ll wait another year to do justice to my iPhone 11 
Thank you so much for your iPhone reviews! You’re my go to girl for any apple related information ",iDillyD,11 ay önce,1
Looking forward to the improvements they will make to Macro and Cinematic modes in next year's iPhone.,VJ,11 ay önce,0
Loved this review. So detailed and so much fun at the same time. Keep being you Justine ,Ravindra Ramkallawan Photography,11 ay önce,0
"Your videos have always been great, but I must say these iPhone 13 review videos are so great! I love how you did everything in the video and just wanted to let you know that you’re doing an amazing job!! I’ve been a long time fan of yours and I’ve always loved your positivity",Katelynn Taylor,11 ay önce,0
Cinematic & Macro are the two take aways and I'm sure Apple is going to work a bit more on fine-tuning them as reviews from professional cinematographers have not been great so far. How exactly do you feel the Sierra Blue color? I loved Blue in iPhone 12 Pro Max (I have one) but I'm yet not convinced with this slightly lighter blue color on 13 Pro's. May be seeing in hand will give a better understanding of color.,Ruchir Shastri,11 ay önce,0
"Very extensive reviews in a short time. Information packed and fun video, Justine. Cheers!",Kshitij Gangwar,11 ay önce,0
"I ordered the new 13 pro just because of macro - you did a great job showing off all the new features.  I was feeling a little worried about the purchase, but your video made me feel much better.  The camera upgrade really looks worth it - cinematic mode also seems to work well on people.  I watched mkbhd before your video and was worried about the cameras.",mixtus,11 ay önce,0
"Thank you so much for this video! I was set on the 13 but now I'm thinking of going Pro, that macro photography was insane!",Holly Lavender,11 ay önce,0
Wow!!! I love the camera modes on the Pro iPhones. I'm glad I ordered going from a 11 Pro.,Bill,11 ay önce,0
Amazing content as always! Gosh the camera upgrade was superb.,rumpampampum,11 ay önce,0
Great review! Can’t wait for the fun with the Macro and may even get into the Cinematic stuff as well..,SmokyMtn_EDC,11 ay önce,0
"3x digital on the mini looked pretty darn good ! If the mini had the macro, I would go mini.",Rob P,11 ay önce,0
You have me way more psyched for this new camera upgrade than the Apple event did! Friday can't get here any quicker.,MamaBearsDiamonds,11 ay önce,2
Still going strong with these videos! Amazing job on demonstrating on what the iPhone 13 is capable of doing. (lowkey kinda wanna get one) ,UltraDave,11 ay önce,0
"Amazing video, can u show a night-mode comparison btw the 12 and 13? And also can u shoot macro and cinematic at the same time ?",Aya Nabil,11 ay önce,0
"iJustin is truly the goddess of all things Apple! ️️ what would we do without her, her awesome team and this wonderful community   love the iPhone 13, iPad mini 6 and love you all!",Marklin Ho,11 ay önce,0
You are the only reviewer who really tested end reviewed them properly! Thank you.,Yah Productions,11 ay önce,0
Such a well done video. Justine is in her element during new iPhone season!,Snakpakk,11 ay önce,2
"Thank you for the awesome and in depth camera review, the whole reason I’m getting the 13 pro haha, can you try and do a shot of the moon? I want to see if that’s finally possible to get at least some decent detail of it",Artinmaheart,11 ay önce,1
"Great video, really showing off how great that camera is. So pumped for mine now",Almostgfx,11 ay önce,0
"Apple initially told Wong that the automatic camera switching is intentional to help users better capture close-up details, according to his review, but the company has since issued a statement to Wong and others that says iPhone 13 Pro users will gain the option to turn off the switching in an iOS update that will be released later this fall.",JR Richards,11 ay önce,0
Great video! Would be curious to see some night mode and sky/star shots.,Derek Kopet,11 ay önce,0
"I thought not much had really changed with the cameras and camera system from 12 to 13, but this video shows that there is a HUGE difference. So cool!",TwoTailedTornado,11 ay önce,0
The cinematic mode looks so good !!,Kihi J,11 ay önce,0
Omgggg love the cinematic mode  it looks amazing!,Fher Guada,11 ay önce,0
Very excited about camera test Thanku so much for your amazing camera testing ️🇮🇳Love from India,ATH House,11 ay önce,0
I can always count on you to get me excited for the new iPhone  Pre-ordered the iPhone 13 pro max in Sierra blue! Can’t wait!,Joel Andara,11 ay önce,0
Can you please make a Night Mode camera test!!! Really wanna see how well it works in low light ,Elton Thie,11 ay önce,0
i super love this review. thanks Justine and friends! ,Ben Elly Andrade,11 ay önce,0
I am so excited to be getting my iPhone 13 Pro Max 1TB.  These camera features seem very nice especially the three times zoom and also the macro mode.,Addison Huy,11 ay önce,1
wow you are so good at this I love your videos!!!! the way you edit and film your videos are so thoughtful and high quality. great job,MsIpodtouchqueen,11 ay önce,0
"Justine, did you still have your image preference custom preset to high saturation on the 13 Pro Max when you shot the 13 Pro Max/12 side-by-side comparison footage, or is there a significant difference between the look of the images between the 12 and 13PM?",Michael J Hoffman -State Police-,11 ay önce,0
Thanks for this video.  I have a 13 Pro Max coming Friday.  You’ve got me hyped even more now. ,Mine Aim,11 ay önce,0
Thanks for the demo on these features!,OV Innovation Outlet,11 ay önce,0
Woahh can’t we just say thank you for all your vids there amazing and satisfying and she went all the way to get the phones like cant we just thank her,nattehrat,11 ay önce,1
"These technologies have been around for 10 years, and finally Apple made these services available on its phones.",Mohammd Algassme,11 ay önce,0
Always the best content keep up the great work!,Apple Bias,11 ay önce,0
Thank you for your reviews. I’m so excited to upgrade to this new phone,njanks,11 ay önce,0
I always love to watch iJustine's iPhone unboxing. Love from the PHILIPPINES,J Lumoy,11 ay önce,0
That was another level of review. Unbelievable. ️ justine and ,Ohne Name,11 ay önce (düzenlendi),1
Cinematic mode is next level supeb amazing ️,Sourav Das,11 ay önce,0
"I was really debating the gold.  The new blue looks great , ended up pre ordering that one.",ChainDrive,11 ay önce,0
The cinematic mode looked surreal!,Mohamed ahmed,11 ay önce,0
Nicely done and very useful. Thanks!,Princas Hamletas,11 ay önce (düzenlendi),0
I’m honestly super excited. I can’t wait to order my graphite iPhone 13 pro. Significant upgrade for me as I’m upgrading from my iPhone Xr.,Jordon Elliott-Johnson,11 ay önce,0
I really love your vlog review..camera review with vlog.. it's crazy nice! Not boring and very very enjoy watching it.,Chorreyy,11 ay önce,0
The camera is so impressive this year!,Sara K. E.,11 ay önce,2
Specifically The iPhone 13 series is great for video recording and photography. Thank you Apple ,MostafizurRahman02,11 ay önce,0
"I am using 12 mini and I really love it (except for the battery life). Tbh I don’t like the lenses design on 13 series and I thought I’ll not change my phone for at least two years , however your video change my freaking mind lol….",Lok Yin Chan,11 ay önce,0
"Woah....What a review and work in the last section of this video
Great work Justine",Ali Ahmad Khan,11 ay önce,0
omg the pro max macro and cinematic mode is a GAME CHANGER !!!  love it,Hoàng Nguyễn,11 ay önce,2
If i can say about justine's videos is THE QUALITY never fails!,Brian Reinhard,11 ay önce,1
"Wow, Sierra blue , I really love this sierra blue much better than pacific one. It is really nice.. I can't wait for my13 pro max ",JJ,11 ay önce,0
You always do such good reviews but there's no way one would buy iPhone 13 (any model)... So few new features and improvements for a craaaazy price compared to the competitors. Apple is no longer the brand they once used to be and I don't see them coming back their peak anytime soon :(,Dardrol,11 ay önce,0
"When iJustine reviews a phone, you really do feel like selling your kidney and buy one. Quality content ",Vish,11 ay önce,0
"Anyone else go back every year to her original IPhone review?  Still just as happy, just as smiley, just as awesome. Maybe a bit more ",Nick,11 ay önce,0
"I love your review.
Thank you for sharing.",Mafia Zaleng,11 ay önce,0
There's a reason this channel has 7m subs. Amazing review honestly,Xenios Charalambous,11 ay önce,1
For Apple products' reviews there is no competition at all it's Justinee all the wayyy! ️,Adhith Mathew Jacob,11 ay önce,1
Amazing video! Feeling very inspired to get out there and take some photos!,BUZZKEIL Tech,11 ay önce,0
That cinematic video is incredible.,Joseph Chapman,11 ay önce,0
Apple never dissapoint these cameras look unreal,Someone,11 ay önce,1
cinematic mode is awesome!,Kazi Itquan,11 ay önce,0
"I love it as much as anyone, but I can't help but notice how my old LG G5 could all these camera things in full manual mode besides hdr video.  

'Macro mode' 'portrait mode' etc all very gimmicky.  Regular cameras do it via optics ️.",Robert Wilson III,11 ay önce (düzenlendi),0
The camera system on the Pro models uses different lenses compared to the Non pro. Pro model has a faster f1.5 aperture lens and f1.8 on the ultrawide with AF.,Ryan Reyes,11 ay önce,0
The ending of this oh wow so incredibly pro! One of my fav videos of all time Justine!  Btw is anyone else obsessed with this soundtrack by Soleil? ,Andres Olivieri,11 ay önce,2
I love your reviews always fire an your so genuine,Yung Slimer,11 ay önce,0
I love your enthusiasm. Great video and review!,T LC,11 ay önce,0
"I really like the mood in the video, so nice and I think apple should hire you for these kinda video, so pro...l just hope they didn't pay you for this review because you just talked about good stuff everything look perfect. I wish you talked about everything... can't wait to see it in the video your review count a lot for people who really wanna buy the phone, thank you",Dr Splendid,11 ay önce,0
Every year your videos convince me I need to upgrade lol  and this year you’ve done it again. Looks like I’m upgrading ,Lisa Sheridan,11 ay önce,0
"AHH I can’t WAIT for my phone to come, this is exactly the video I’ve been waiting for.",Smam,11 ay önce,0
Thanks for this video really enjoyed it️,Owami Mhlongo,11 ay önce,0
"Best review so far, good job.",Jes Coson,11 ay önce,0
Your photography and videography from the 13 Pro Max is better than the official marketing ones from Apple. ,Mikey G,11 ay önce,0
apple did a really great job with the 2 in 1 camera lense,Bl4ckBl1zZ,11 ay önce,0
Am a proud subscriber of this channel. I get to see things first ️. Great review,Nathan,11 ay önce,0
I think those photos and videos from the iPhone 13 looked extremely good.,DS VLOGs,11 ay önce,1
"Woah!? That macro mode!!
I can think of all the things I can take photos of inside unwanted crevices and surfaces XD",Jon Gallardo ,11 ay önce,0
I enjoyed this so much. Thank you @iJustine :),Jorge Alas,11 ay önce,0
Oh this has made me so excited for my 13 Pro to arrive on Friday ,lydiaslife,11 ay önce,0
11:58 is such a GREAT shot. Super impressed with these things and I can't wait to get my 1TB Pro Max on Friday,Chris Leiter,11 ay önce,0
One of your best videos. Great job!,Joey D,11 ay önce,0
"Thank you for letting us see that the 13 non pro didnt have macro, we did all think you were lying.",Bleezy D.,11 ay önce,0
Do you shoot pictures in high efficiency format or most compatible format thanks ,Chantelle Follows,11 ay önce,0
Cinematic mode is DOPE!,Michael Chambers,11 ay önce,0
Omg look so cool photography macro and cinematic i love love iiiit!!! I have an iPhone 12 Pro Max upgrade to 13 Pro,Voicu Catalin Georgian,11 ay önce,0
Very good video! Can’t wait to get the 13 Pro Max,JermoMKE,11 ay önce,0
Was expecting to see Night Mode with the new sensors on the phone. Guess I’ll have to wait until my phone arrives.,Darvin Joel,11 ay önce,0
Justine does a better job than Apple at showing off what those cameras can do! Simply breathtaking...,Rusiru Nawela,11 ay önce,0
"@iJustine, fun fact iOS 15 photo to text feature ... for phone numbers captured you do NOT need to copy/paste into the dialer app on the iPhone ... just tap the number straight from the camera capture and dial away.",Don-Dadda,11 ay önce,0
Do the MagSafe magnets test! See if the magnets are stronger in the iPhone 13 series compared to the 12 series,Zeus Flores,11 ay önce,1
Awesome video - thank you! ,Deon H,11 ay önce,0
A is iPhone :D the individual hairs on the B picture reveals real bokeh since the hair strings are still in the same focus area they shouldnt blur like they do on the fake bokeh. But great video samples on both. It's great for being a phone tbh! Great to see a happy Justine glowing again doing what she does best: Covering whatever she loves! ;),David Wallin,11 ay önce,0
I felt like I was in the journey with you Justin ,Dhanush Kumar kn,11 ay önce,0
Love you still do this for everyone every year!! They’re the best!!,Christopher,11 ay önce,0
How does Cinematic Mode look when video recording in the evening? That’s the next video I love to see,Zandersaurus,11 ay önce,0
Love both of them ,Destiny Palin,11 ay önce,0
that shooting star in the timelapse! great vid Justine! Thanks for reviewing.,Ma Reya,11 ay önce,0
reviews by Justine are far the best on yt,#Repeat After Me,11 ay önce,1
Loved your review justine ,Santosh K Munuganti,11 ay önce,0
I just don’t understand why the CINEMATIC mode doesn’t use 24fps…,Villy B,11 ay önce,1
"iJustine our iPhone QUEEN!!! We’ve been WAITING for this! Such a cool video, our internet mom️",jeremy,11 ay önce,0
This is the best review ever thanks Justine,Quontranon Burks,11 ay önce,0
What a super fun video this was! ,Prathamesh Ektare,11 ay önce,0
great video as always my pro max will hopefully be with me friyaaay,tony kemp,11 ay önce,0
"Yea, It's so good but for me, I can't see it more than a second phone like.. I'm not a samsung guy or smth but foldables really catch me so I'll remain to my z flip 5g, and upgrading to z flip 3 soon as I can. And maybe if I'll still have enough money maybe I'll upgrade the second phone to a 12 mini or 13 mini, not rlly sure, cuz' even if I'm basically an android guy I still miss an iPhone sometime, I like both of them, android for u know, customization etc, it's my confort zone, I can make anything I want from android, but apple have a better synchronization.",Visen Dorin,11 ay önce (düzenlendi),0
What do you do with all the phones you give reviews on ? Do you buy them outright or are they given to you to review?,Doug Macrae,11 ay önce,0
This macro mode have real Worth ,Sam LG,11 ay önce,0
"never get bored to watch your video
🇲🇾️",Mohamad Raiz,11 ay önce,0
I love your videos ️,Juan,11 ay önce,0
"Just to be clear you mentioned all cameras on the 13 model line up are the same.  Which is not correct.  
13 pro & max                 13 & mini 
Telephoto : f/2.8        No telephoto ",Mia_Mk7.5R,11 ay önce,0
By far best iPhone 13 video I've seen yet!!,Luis Higareda Jr,11 ay önce,0
How hilarious even Justine didn't mention the smaller notch :D I guess nobody care. LOVE IT,Hussam,11 ay önce,0
I think I saved the best video for last!! Great job Justine! The music is really good!,Francesco Palmieri,11 ay önce,1
This review is sooooooooo fun!!!,Jon Gallardo ,11 ay önce,0
How do the speakers compare with last years models ?,Matt Packer,11 ay önce,0
"Raw reaction from fav YTber @ijustine
Always be happy to ur vlog style videos",Sathish Kumar,11 ay önce,0
"The music is lit in this video, also the videos on iPhone were impressive, but it still needs some improvements but by the two generations more I’m sure it could replace a big professional camera",BoomerBoi,11 ay önce (düzenlendi),0
"Can cinematic mode be used with telephoto, ultra wide, and selfie camera?",huh huh,11 ay önce (düzenlendi),2
Picking mine up on Friday. Can’t wait ,Freddie Sheekey,11 ay önce,0
This video was amazing Justine!,TheBrandonBrews,11 ay önce,0
2 videos in just an hour! JUSTINE IS ,iSirMac,11 ay önce,0
Damn that camera is good ,VenoStuff,11 ay önce,0
"Can you record a camera test between the iPhone 13 pro, 12 pro and 11 pro?  
PS I adore you ",Cristina Thrash,11 ay önce,0
That Sierra blue looks so good!,Cee,11 ay önce,0
Great work. Really great work.,Brian Carter,11 ay önce,0
I wish it have pro mode or manual mode camera like setting shutter speed or iso.,Hitesh Joshi,11 ay önce (düzenlendi),0
How’s the flaring compared to 12’s?,amo nijj,11 ay önce,0
"Apple should send you a check for this video. People have been saying the iPhone 13 is ""boring"" but this video shows that narrative is false. Great way to show off the new cameras and cool features...can't wait to get my 13 Pro Max on Friday.",Lamar Taylor,11 ay önce,0
"sometimes you are overexcited - I really like this  thank you, great video.",Elmar Hoenig,11 ay önce,0
As a photographer i have to say that the camera's of the iPhone is getting really good!,Arnoud van Houwelingen,11 ay önce,0
This was such a great video.,Eric Mwangi,11 ay önce,0
Great  video Justine!:),Andrius Mostauskas,11 ay önce,0
The energy is contagious!,Andrew N.,11 ay önce,0
Haha that macro mode is sick. Sips coffee. Can’t wait to use it with the iNaturalist app.,Dana Brown,11 ay önce,0
that shooting star at the end wraps everything up. can't wait for the iPads,artofphoenix,11 ay önce,0
Great stuff Justine! ,Sydney Helton,11 ay önce,1
Not a huge difference when walking around with 12 and 13 pro. Minor differences.,Mr. Forgettable,11 ay önce,0
"God, you make the best videos.",Uve Santana,11 ay önce,0
"Pull back on the iPhone 12 or 13, take a picture, and then crop the photo yourself. The macro mode is just cropping an ultra wide photo for you. Nothing special.",toucheslapper,11 ay önce,1
Wow  can’t wait!!!,Alex Projexx,11 ay önce,0
"That dessert looks so good what cafe was that?!  but anyway awesome video Justine, you got yourself a new subscriber!",Will Hero,11 ay önce,0
I think b is the iPhone because it’s mainly focused on Justine which is the latest feature in the iPhone 13 Lineups.,Revusa,11 ay önce,0
apple should hire you for their ads,Oh Yoon Hee,11 ay önce,1
The weather just makes the photos and videos more ,Satyaki Bhagat,11 ay önce,0
I LOVE THEEEEE NARRATION! GREAT JOB! ️,Zhiren,11 ay önce,0
"Loved the ending, also Venice ️",Aditya Sharma,11 ay önce,0
Awesome ,EliteGamingNP,11 ay önce,0
"11:17 I really don't like that Apple uses fantasy f-numbers. The 13 Pro main camera hardware is approximately equivalent to a full frame camera with 26mm f/6.7 lens. So f/16 should actually lead to much less background blur than the default non-portrait mode. Even the ultra wide angle camera is equivalent to a full frame camera + 13mm f/15 lens. The only explanation would be if they compare it with large format cameras instead of full frame (but I guess that this isn't the case either as I assume that every iPhone camera has the ""f/16"" setting )",Quoutub,11 ay önce (düzenlendi),0
"Hey Justine, would love it if we could get that wall art picture as a wallpaper",Daniel Banson,11 ay önce,0
Easily the best day one video.,Keary Walker,11 ay önce,0
the positivity in this video makes me smile,That Modern Dude,11 ay önce,0
Is iPhone 13 pro Graphite slighter lighter than iPhone 12 pro Graphite?,Vivan Sankhe,11 ay önce,0
Is iPhone 13 pro Graphite slighter lighter than iPhone 12 pro Graphite?,varsha sankhe,11 ay önce,0
Love it!,Ananth,11 ay önce,0
How have you not aged Justine? Ive been watching your videos since middle school and i turn 23 in a couple of months,David Tolosa,11 ay önce,0
Apple has pulled so far ahead of the competition in the camera department it’s not even funny. Pixel 6 better bring the heat.,robert haibi,11 ay önce,0
How are the boxes sealed?,fuad,11 ay önce,0
"The mini is the only choice for me because, if rumors are correct, it’s the final one.  I’m over lugging around a brick.   I will get the pro redesign (iPhone 14?)",OPUS Digital Audio,11 ay önce,0
This is super cool!!!,Dilak Daniel Manoh,11 ay önce,0
"In comparison to other phones that had the macro, macro wasn't so much of a good feature... Now the 13s have it and it's a reason to upgrade?",Ohene Moses Pharsttee,11 ay önce,0
Since this IPhone is subsidized by Apple all the reviews will have Pros and no Cons.  Just like she made the iPhone 12 look like it was the best invention since sliced bread. This is just a commercial for the iPhone 13. I love her videos but don’t feel this is an unbiased review.  She should sell phones for Verizon/AT&T,Samuel Morado,11 ay önce,1
The gold is goooooorgeous!!,oDOTTYo,11 ay önce,0
I need iPhone 13 vs 13 pro camera review with cinematic mode,Shivansh Tandon,11 ay önce,0
i have to get tha iphone 13 pro max  wow  i love it,jan krejza,11 ay önce,0
We need more VLOGS!!,Νεκταριοσ Κεφαλοσ,11 ay önce,0
iPhone 14 will now have a DSLR-like cameras next year ,AvGeek Toby,11 ay önce,0
best iPhone 13 Camera Review ever,NZTYNAZ,10 ay önce,0
"This my nth time watching this, contemplating about where I'll get the money to buy this",Pauline D,11 ay önce,0
Apple  should pay you for your videos and pay me for watching it ,Divine Spiritual Guidance,11 ay önce,0
Apple should just hire Justine to show off the new iPhones. She does justice to them.,Rohan Thigle,11 ay önce,0
It's so hard for me to pick witch phone I want to get the iPhone 13 or the Samsung z flip 3,Coffee and Book Meal Delivery Review,11 ay önce,0
Sierra Blue is so beautiful!!,Kaycee Bishop,11 ay önce,0
Классный телефон!!! Скорее везите в Россию 🇷🇺,rotor000,11 ay önce,0
Apple needs to step up their game. I see no reason one bit to upgrade from the 12 pro,Evan Fagerty,11 ay önce,0
Congrats on #34 on Trending.,Ace,11 ay önce (düzenlendi),0
"You did not mention the weird ""Halo"" effect that surrounds the subject in focus when using the ""Cinematic"" mode!. Peter Mckinnon have mentioned it in his video and that ""Halo"" effect is REALLY DISTRACTING! ; So basically it means 'for now"" the ""CINEMATIC"" mode is just another ""Portrait"" mode for videos! i guess! ? ",Justin James,11 ay önce,0
why is iphone 13 telephoto aperture is f2.8 while iPhone 12 has telephoto aperture is f2.0?,Enosh Yeluchuri,11 ay önce,0
No they are not the same. The main shooter has a different sensor!!,Chrono Tyson,11 ay önce,0
Ok but why didn’t they make a pink one for the 13 pro max ,dominicanchu1ita,11 ay önce,0
Wow it’s definitely Getting Ordered Now……. Happy Days Brilliant Review…,Daddyof13,11 ay önce,0
Very beautiful phone ,OneStopGuy,11 ay önce,0
Love you mam  you are great ,Ismail sharkar Shuvo,11 ay önce,0
That intro reminded me of like when you have a intro on the show on the tv and it’s really good,PianoPlayer,11 ay önce,0
"“Say hello to the new *iphone 13*”
“Like the previous here we’ve got the *12 PRO*”",Chloe Lin,3 ay önce (düzenlendi),1
Best Review of Iphone 13 till Date..,MOHAMMED MALIK,11 ay önce,0
"The cinematic mode still looks like it smudges hair at the edges, the bokeh gets rid of fine details",kidlzr,11 ay önce,1
waiting for the 14.,clarvve,11 ay önce,0
battery test is blocked by apple...why?,Paweł Olszewski,11 ay önce,0
So if I understand correctly the Marco photos happen on both the pro and the pro max right?,Becca Foley,11 ay önce,0
Less of a review and more of a fangirl getting  excited  for not that impressive features!,Swapnil Lonkar,11 ay önce,1
