text,author,date,like
I love your band and case matchy matchy I want to match with the pink chalk color! I’m so happy they brought the pink case back!!!!! And a pink phone!!!!!!,gloriasings,11 ay önce,0
I’ve had 256gb since 2016 and I’ve yet to even hit halfway….. really puts into perspective creator backlogs.,yuitr loing,11 ay önce,0
I got a 11 pro max and plan on getting the 13 pro max but its going to be a BIG ass phone but the pro is smaller than what i got now i cant go backwards,Tvco Productions,11 ay önce,0
"Exactly, so simple, don’t upgrade, you don’t have to.",Alejandro Cotilla,11 ay önce,67
Is the green orb still there when taking pictures with the sun or light in the frame?,Rick Cortez,11 ay önce,0
"I think im going to wait for the iPhone 14 and hope that it incorporates Touch ID into the off button like the way the iPads have it. if even the iPhone 14 doesn't have it, lol I don't think I can be patient anymore",xx meow xx,11 ay önce,0
Video starts at 1:15,DSquaredDan,11 ay önce,0
I like the colours of the Pro hopefully they keep them or similar ones for iPhone 14 Pro Max. Because my 11 is fine so I’m upgrading next year. Hopefully,Morgan Smith,11 ay önce,0
Hello to me that’s still using iPhone 6S plus!!!  so excited to get that iPhone 13 pro MAX pink!!!,MeeDeey TV,11 ay önce,0
"I have a iPhone XR! I will upgrading to a iPhone 12 or iPhone 13 pro which one should I choose? Let me know!, I will be let you know which phone I will get later when I have a new phone",Cas van Arkel,11 ay önce (düzenlendi),4
"I am so excited to upgrade from Samsung Note 9 to iphone 13 pro. I'll be buying on February though, I'm still saving some money. But still thinking if I need the cinematic mode or not ",Ria Acasio,11 ay önce,0
Apple should have either added 8K or increased an image sensor to highlight their camera upgrade.,Roosevelt,11 ay önce,0
I use a secondhand iPhone X and I'm really tempted to get the iPhone 13 Pro just for the sierra blue but I honestly do not know if it's worth it lol,Juls,11 ay önce,0
For sure getting the iPhone 13 pro since I do YouTube it would be a great choice...dumping this iPhone 7 for the iPhone 13 is gonna be great ,Mk 2lit,11 ay önce (düzenlendi),0
My iPhone 12 Pro Max will serve me just fine for the next 12 months,Seavers Gomes,11 ay önce,0
"If you don’t want to upgrade it’s as simple as “don’t upgrade” lol. Stop complaining. No one is forcing you to buy an iPhone.

Exactly.",Terrence Caldwell,11 ay önce,3
Thank youuu Justine ,Ruan Rodrigues,11 ay önce,0
Wish the pink came in the other options for the 13. Then again I’ll be glad just to upgrade my dinosaur! ,Georgia Smith,11 ay önce,0
"I am ️
So so excited for the unboxing of the phones!!!!!!! 
Are u kidding me : me 
It’s here the IPHONE 13: Apple ",Rajitha Bogoda,11 ay önce,0
I’m gonna upgrade next week from my Xr but Idk if I should get the 12 pro or 13 pro I can’t tell the difference other than the chip which I don’t really understand,Francesca Aapple,11 ay önce (düzenlendi),0
"i have an iphone 7, 128 gb and i am getting the pro in sierra blue!!! so excited!",Navyash Jain,11 ay önce,1
YESSSS ANOTHER VIDEOOOO ,vihani is a mirrorball,11 ay önce,17
"I’m not a content creator, But I am a photographer, so the iPhone 13ProMax will definitely be the one I get. The 12 ProMax is awesome, so I know from what I’m hearing the 13 ProMax is even Better.",Jennifer Ingram,11 ay önce,1
They could definitely add cinematic mode to current phones,gwvaio,11 ay önce,0
I’ll be upgrading from my 12pro max honestly I said not this year unless a bigger battery because even if I work an 8 hour shift and only use my phone during lunch and break I can see it take a 20 percent hit some days soo that’s a bit too much for the 1hour in total of break and lunch together watching YouTube at 1.25 speed,Julian Figueroa,11 ay önce,0
"I have an iPhone 8 Plus right now and just pre ordered an iPhone 13 pro max. I’m super excited for all the new quirks in it. However I did see something about the phone having touch idea on the screen, I could be wrong. But that’s something I have read before.",Emilie Waldman,11 ay önce,0
"upgrading from 8plus to 13 pro Sierra blue, 120hz is the main reason",gunnerrn,11 ay önce,0
Sass level was turnt UP ,Renegade Eats,11 ay önce,29
"Word of advice for the average user, You never really have to upgrade if you have the previous year’s phone. Apple will never make a phone that completely blows away the previous year. That doesn’t make business sense.",Bassmith1,11 ay önce,1
I am upgrading from the 7 with 32 storage to the 13 with 256 gb storage. I will get a Pro model that is notchless.,Kate Russell,11 ay önce,0
Which color would you get for the Pro max the blue or starlight,Michael Rubin,11 ay önce,0
ijustine and unbox therapy   my two favorite youtubers.,Beth Mills,11 ay önce,1
When will u upload unboxing and review of the new iPhone 13,Irfan Ahmed,11 ay önce,1
The only thing that annoyes is that there isn't a red version of PRO models. I'm stuck at normal versions because of that,Cláudio Coelho,11 ay önce,5
already have it pre-ordered can't wait!!!!,Angelo Perez,11 ay önce,0
YES there is a need to upgrade..... MUST always upgrade!!!! going from 12 pro max... to 13 pro max 1TB,Shot on My Iphone,11 ay önce,0
Still have my iPhone X it’s been great upgraded from 6s,UPTOP DELMAR,11 ay önce,0
"As much as we like/love/appreciate Apple, we do have to admit that it’s hard to defend them at times. insert all the complaining voices here ",toijg avnnr,11 ay önce,0
I wanna switch from my android to see if filming on the 13 is better than filming on my Sony zv1,Ole-Head Sneaker Closet,11 ay önce,0
I've been waiting for this ngl,°ˢᵘᵏᵘⁿᵃ'ˢ ᵀᵒᵉⁿᵃⁱˡˢ°,11 ay önce,4
"I love how everyone’s complaining that this isn’t much of an upgrade. I only upgrade once every 3-4 years. I have the iPhone X and I’ll be getting the iPhone 13 Pro and I’m very excited about the upgrade. FYI…..When the addiction of always buying better takes over so bad, it causes you to always see the NEW as boring.",OneTruth,11 ay önce,2
I’m going to trade in my iPhone 12 Pro Max for the 13 Max. Only $400 to pay on my side. I’d say that’s a good deal and good thing Apple did. Excited to get to the Apple store!,Auguasto Adams,11 ay önce,0
Xsmax to iPhone 14 pro max. Tempted but gonna have to wait. Come back next year and agree with me ,Ruj B,11 ay önce,0
"ok for the record... I think the opposition doesn't think its a bad phone, they just know that apple has the funds and brains to make it a lot better but chooses not to because they can get more money out of all the fans who upgrade every year. Its not bad, its just disappointing because they could have done way better and all the people upgrading could keep their new phones for longer.",Evan LeFevre,11 ay önce,1
I just got my 12pro max 2months ago but still wanna get pro max 13 ️,RoseMary Gorman,11 ay önce,0
"Ijustine: you don’t have to do anything you don’t want too

Tell Fauci and Biden that ",Marley Marl,11 ay önce,3
"To be honest, nowadays I just find it a bit sad when people get so excited about new phones, and Apple have definitely been taking their blue pills!",Alienated Being,11 ay önce,1
Slow motion 240 fps 1080p with night mode and 3x optical zoom and 128k base storage = great live concert stills!,cnmmd qiuoo,11 ay önce,0
I have the iphone 8 so i'm looking into getting the 13 pro. great video!,Anahy Burciaga Hernandez,11 ay önce,0
Lol she makes me laugh every time a new iPhone comes out.,NycCigarGuy29,11 ay önce,1
Can anyone tell me if the iPhone 13 pro max cases will fit on the 12 pro max?!?,Alexis Guerrero,11 ay önce,0
"You’re so beautiful and your impression of the naysayers 
Thank you for this",Sika R.,11 ay önce,5
Upgrading from my pacific blue 12 pro max to the graphite 13 pro max!,Cole Bukowski,11 ay önce,0
Thank you for saying how I feel. No one is making anyone buy stop with all the negativity you’re the BEST !!!!,Bridget Weaver-Hicks,11 ay önce,0
I’m definitely upgrading coming from a iPhone 8 Plus,Senji ツ,11 ay önce,0
"Apple’s innovation has slowed down so much, it’s kind of sad. Still ordered a 13 pro, but it’s so underwhelming.",Clarity Auto Details,11 ay önce,1
Just got my preorder in this morning! iPhone 13 Pro Graphite 1TB. Can’t wait!,Jack Manning,11 ay önce,0
Chill ijustine not everyone could upgrade every year.,AM-Tv,11 ay önce,4
"Your videos are so cool, funny, cute, informative 
How do you actually do it
And you do Kali!!!!!",Leigh Richardson,11 ay önce,0
Love you ! Great presentation,Penina Harshoshen,11 ay önce,0
I have an iPhone 7 Plus. So yeah I need to upgrade now because it’s finally giving out. So for me it’s a big upgrade. Like u said not everyone upgrades every year,dotmatrixxx,11 ay önce,0
Finally a phone i can save more storage for doing video projects,Benjamin Stephen,11 ay önce,0
Im actually going from an Samsung A10 to an iphone 13 pro hopefully,JusLuxNia,11 ay önce (düzenlendi),0
The camera is diagonalised that’s iPhone 13 lol ,JASWINDER SINGH,11 ay önce,18
Please use 18:9 aspect ratio in your videos as then videos will play at full screen on landscape mode (without Black bars on sides). Just like Marques Brownlee,Nirmit Gupta,11 ay önce (düzenlendi),0
If I ever get money…definitely getting a starlight or pink iPhone ,ari edits,11 ay önce (düzenlendi),0
I have an LG q7+ and I'm buying the iphone 13 pro because I think it's worth the upgrade,Amwrtvy,11 ay önce,0
I'm one of those people that dont upgrade every year and I'm that person with an iPhone 7 plus. Super excited to upgrade to that gorgeous cinderella blue 13 Pro Max!! ,Jess Lo,11 ay önce,0
Still debating if I should get 128gb or 256. ,Itz Hectiic,11 ay önce,0
"The philosophy of the rich and the poor is this: the rich invest their money and spend what is left. The poor spend their money and invest what is left,How many millionaires do you know who have become wealthy by investing in savings account? I rest my case.",Paul Francis,11 ay önce,16
"I watch such a video that which i can't afford but see and imagine......I never touch an iPhone in my life...
I really love your videos and the way that you communicate.....Love from India🇮🇳🇮🇳🇮🇳🇮🇳🇮🇳🇮🇳... ""DIDI""
In India ""DIDI"" means ""Elder Sister""",BIJOY THAKUR-1246,11 ay önce,0
"You should make a new podcast episode, I like to hear you on way to work ",Maxym max,11 ay önce,1
"I have an iphone 7plus since 2016..should I upgrade this year or wait for another year?
I’m just disappointed that there’s still no fingerprint..",Mary,11 ay önce,0
Have they made the magsafe magnets stronger from the 12?,Masson,11 ay önce,1
Ya I’m definitely getting the 13 I still have the 8+,Aye D,11 ay önce,0
I have the iPhone 6! And I just bought the new pink iPhone 13 on Friday last week. And I CAN’T wait to get it! My excitement is unreal!,Live Ringsby,11 ay önce,0
Can’t wait to get my gold 13 Pro ,venom5809,11 ay önce,2
"Wait, only a 3x zoom? Is that normal for iPhones?",Stephen Meese,11 ay önce,0
Unlocking with Apple Watch is great but it does have its flaws. My phone will unlock in my pocket sometimes. I think the code doesn’t exactly look to see if you have a mask on but just notices that it can’t read a face and automatically jumps to opening with the watch. Annoying but a minor first world problem lol,Peyton Womock,11 ay önce,0
Will you test out if the iphone 13 pro max cases fit the iphone 12 pro max because i really like the pink case. And i do not want to upgrade,Freya De Clercq,11 ay önce,0
"Already got my product red 13 pro max silicone case delivered today, just need to preorder the 256gb 13 pro max blue tomorrow :)",NerdPixelz,11 ay önce,0
"Mulher, eu pensei que você já tava com telefone. Tá me levando a pagode ",Thaís,11 ay önce,1
we want camera comparison like last year.,truesham,11 ay önce,0
"The key of this video: ""YOU DON'T HAVE TO"" love it!",dolita windo,11 ay önce,0
I haven’t upgraded in awhile I have iPhone X and am planning on upgrading this year! Can’t wait!!,mrowe1204,11 ay önce,0
"Im upgrading to 13 pro max from a XR. The reason being the battery on my XR isn’t that good anymore. Kinda feel guilty for upgrading already tho, I mean I’ve only had my phone for about 3 years now, but I’m very excited for the bigger screen ^^",melquexnz,11 ay önce,0
Would the new cameras have the same awful green dot flares when recording in low light?  ProRes is promising.,Tim Galletas,11 ay önce,0
So I have a 12 pro max but I also have a business where I take pics of my products like makeup brushes which camera/phone is best for this?,Krystelle Lee,11 ay önce,1
If I upgrade it’s literally just to have that 120Hz,Strategic Sam,11 ay önce,1
"Looks like iPhone 13s were launched keeping Justine's needs in mind (pink color, 1TB storage etc...)",rambot670,11 ay önce,0
Which iPhone 13 do you recommend?pro or pro max? Upgrading from the 6!,Leah Menasha,5 ay önce (düzenlendi),0
So basically this phone is only for the 5% of content creators lol. If it only took a year to make these upgrades they should have just waited an extra year to implement it on the 12 pro,CheetoHD8,11 ay önce,1
Is the iPhone 13 pro max worth the upgrade from my current iPhone 11 Pro Max?,Ben Doran,11 ay önce,0
If im going to buy a new phone which one should i choose iPhone 12 or 13 is the difference really matter,Farah Mohamed,11 ay önce,0
I mean…. Surely a customer can critique a product without being a troll or seen as a hater no? I like apple I will continue to get apple but it first still have a bezel lol that’s not hate or trolling it’s just such a beautiful phone and that pesky thing is still there that’s all. Critique can be healthy. Great video as always though.,TrophiesNClips,11 ay önce,0
I've had my iphone 7 for almost what 5 years now...ya'll should I upgrade to the 13?,Parker Cruz,11 ay önce,0
"hi justin, what would you get silver or the sierra blue? ",daphus,11 ay önce,0
finally upgrading from my iphone 8 ,nat,7 ay önce,1
I have a Xs MAX so I def can’t wait to have this on my hands!,Hazel Marie,11 ay önce,0
I will be upgrading from an 8 plus to the 13….. a day all my friends have been waiting for,Taesha T,11 ay önce,1
Wish they would’ve made a white for the iPhone 13 pro max but since they don’t ima go with the blue,Kenny Thao,11 ay önce,0
I think I’m ready to put my 6s plus to rest lol,fabs,11 ay önce,1
I experienced 120hz back in 2010 when i bought a Samsung 2233rz and have never looked back!,Sam Cableguy,11 ay önce,0
6:45 Getting the 12 pro max because the 2.5x zoom wasn't on the 12 Pro and not 13 pro.,Fonyam Asaah,11 ay önce,0
LOVE the shirt ️,mercy main,11 ay önce,0
I got clickbaited  I thought she actually had the phones  I’m having trouble deciding on the Pro max or the pro. I own a XSmax and don’t know if I would like the smaller size or not. The ONLY thing that bothers me with the bigger phone is the weight but I will deal with the weight if a bigger screen is better.,Pua Watanabe,11 ay önce,0
I’m upgrading from an 8 plus to an 13 pro and I’m sooo excited,Emily elng,11 ay önce,0
It’s weird how Apple only has 4 different colors for the pro models but on the mini and the regular size it has more colors options to choose,Dominic Tenorio,11 ay önce,0
"I got an iPhone XR, and ima trade mine in for either the iPhone 13 Pro or Pro MAX",Austin Norman,11 ay önce,0
"I got mine in red, looking forward to see it in person",Andrea Hernandez,11 ay önce,0
"THANK YOU FINALLY SOMEONE SAYS IT @1:53 SO SICK OF HEARING THAT. if you already HAVE THE LATEST PHONE, WHY WOULD YOU COMPLAIN, you spent a lot of money to have a phone that lasts for more than a year.. 
Also... when the youtubers gonna get the iphone in hand... is it gonna be the same as the rest of us when it comes out? no early looks?",Quantum Kayos,11 ay önce,1
"Most phone contracts in the UK are 24 months, so unless we buy the phone outright we have to have our phones for 2 years... so definitely don’t upgrade every year ",Andrew Anderson,11 ay önce,0
LOL thank you for the comment reminding people they don't HAVE to upgrade. I broke my iPhoneX on vacation last month and have been mustering it out with my 6S in until the 13 comes out. So thank you helping me decided between the 13 or 12! <3,Grace Santiago,11 ay önce,0
"I’m totally fine with my iPhone XS Max still works great, apple is like call of duty we get something new every year and it’s same totally shit",DontToyNagatoro,11 ay önce,0
As always you have a beautiful energy about you. Always enjoy your videos,Carlos Martinez,11 ay önce,0
Waiting for price drop for iPhone 12 ... ,Pervy Sage,11 ay önce,1
I have an iPhone 8 Plus and I just preordered an iPhone 13 pro max and I’m so excited! I’ve been in the need for an upgrade for quite some time. So I’m ready to catch up with the rest of the world lol,brizzleyoh,11 ay önce,0
"I have a iPhone 10 right now.....u think I should upgrade to iPhone 13 when it comes out?  I think I should,....what do u think?  Yea I’m going to.... Ya I’m gonna do it......I love that product red colour, red is my favourite colour.  Maybe I’ll get the iPhone 13 pro or pro max....I like the one with the macro photo,....not sure which one that is tho...still, excited and can’t wait for it to come out !",Skyechaser L,11 ay önce,0
I'm just a little disappointed that they'll release the new Watch in green yet there's no green iPhone.,xFlowerpot,11 ay önce,0
"I’m going from the iPhone 6 to 13 
I preordered it and and it’s the pink and I’m so STOKED can’t wait to experience everything new",Within_meaning,11 ay önce,0
I wish the 13 pro max came in red ,Terry Robinson,11 ay önce,1
I’m curious to see how many of your subscribers are going to pre order a brand new electric Cadillac.,D Day,11 ay önce,0
"great video, great summary... :-)",Whatsup FPV,11 ay önce,0
"Even MKBHD has mentioned that ppl upgrade after a few yrs, bcoz all those tiny upgrades sum up to give a big jump",Raviraj N K,11 ay önce,0
hella late but if you have the 8plus you should definitely consider to upgrade to the 13 (regular not pro) i’ve been loving it so far,Lifewithlay,9 ay önce (düzenlendi),0
I have an iPhone 12 and I upgraded hehehe so excited ️,ketzia ruiz,11 ay önce,0
"i had the 8+ for about 5 years can’t wait to upgrade

Edit: Spelling Mistake",jonathan godina,11 ay önce (düzenlendi),0
Yay another video,JL’5,11 ay önce (düzenlendi),0
Should I upgrade from my iphone 11 ?,21B0028 Muhammad Hazim,11 ay önce,0
"My iPhone X is mostly fine except the lightning port is dead. Official repair is too expensive so I've just been using it with wireless charging. I thought if the 13 was gonna be a huge update I'd just get a new phone but now, I guess I'll take a chance at a local repair shop and hope they don't mess it up lol. (I watched a few videos on swapping out the lighting connector but it feels too easy for me to mess something up)",Nouman Khan,11 ay önce,0
"Coming from iPhone XR 2018, is it time to upgrade? ",Denmark Reyes,11 ay önce,0
"Me trying not to watch videos about the iPhone 13 pro, me now pre-ordering the iPhone 13 pro because the cinematic mode is just too much!!! It will change filmmaking! I do want to thank you for addressing that we don't need to change our phones every year!",Chocolate & Dutchy,11 ay önce,0
So dope!!!!,Cullen H,11 ay önce,0
this video really help i pre ordered my iPhone 13 pro max and i made the right choice. so excited!,Lizbeth De Los Santos,11 ay önce,0
Hello. Is it worth upgrading from the 11 pro max to the 13 pro max?,Sanat AVS,11 ay önce,0
Average upgrade rate : every 3.5 years…,Michel de Guilhermier,11 ay önce,0
If they put the touch id in the power button how would they make edits to cases?,Ja’lyn Wright,2 ay önce,1
Apple blatantly did not show the charging port since it is still the lighting port.  They should have had the Pro model equipped with USB-C or Thunderbolt.  Good luck sending that Pro-resolution video to your computer via USB 2.0 speeds.,Chase Manning,11 ay önce,0
Trying to downplay the backlash  It’s more about them not offering the best of the best and being two years behind the market. They have been playing it too safe,Ace,11 ay önce,0
Going from the 64GB 11 pro max to the 256GB 13 pro max with a $1000 trade in credit… I feel like it’s common sense I make the jump.,Ordinary,11 ay önce,0
The only thing I don’t understand is why the 13 pro max and 12 pro max are the same price for the base version??,Brennan Garvey,11 ay önce,1
It’s ashame they didn’t make the zoom lens better,Daniel Mazz,11 ay önce,1
I hope it can now do the “always on display” like the other OLED phones,Jaybrio Vlogs,11 ay önce,0
Can we get your hands on already  I am so excited for Friday!!!!! I can’t wait to pick up my new pro max and experience that promotion display! ️ can it be Friday already ,Gabriel Mesa,11 ay önce (düzenlendi),0
"We have been asking for a smaller notch for four years now. Now that we have it, we complain. ️

I like it though",Marcello Gonzalez,11 ay önce,0
i have an iphone xr got it when it first came out and that was my biggest regret i hate it i phone 7 and 8 have better camera quality so i’m looking forward to getting the 13,Mando Local,11 ay önce,0
"Cadillac was high tech before they went green. I can't wait to watch this. I'm sure they're even more amazing now. Wait, did you say, ""culinary?"" I'm sorry but, one does not eat burritos in a Cadillac. :D  Champaign maybe but... gosh, who eats in a Cadillac? What would one even eat? Paté? Okay, back to watching the video. Sensor shift!! Do they have an iPhone Amateur? I don't think my phone skills are pro level yet. :)",Sunfrog,11 ay önce,0
I love the fact that you give advice to some people that they are not obliged to upgrade everytime theres a new iphone model,Godric Music,11 ay önce,0
Why is Center stage feature not included in iPhone 13 series??,Ramesh Kumar,11 ay önce,0
Thank you my Queen  ,cybrz0n3,11 ay önce,0
"OMG!! Lol you read my mind. I have a iPhone 7 Plus love love love it for the past 5 years…
Time to upgrade!",Keigi Chan,11 ay önce,0
I find MKBHK reactions to be more realistic. Just my opinion,Unikly,11 ay önce,0
I hope you can livestream on Twitch soon,Jayershan Kumar,11 ay önce,0
Holding iPhone 12 and clicking thumbnail like holding 13… ,Akash Kant,11 ay önce,0
Justine You're a Legend,Mitch Dore,11 ay önce,0
can't wait to upgrade from my iphone 6 ,Sebastian Hinestrosa,11 ay önce,0
You should make more baking videos I miss them!,mckenna k,11 ay önce,0
"Overall s21 is by far the most complete Smartphone. This was not the Steve jobs vision.
Apple don't put the best tech on their devices because iphone buyers keep buying their devices regardless the others offers better   devices. 
So what's the point giving for iphone buyers a complete phone like the S21 Ultra.",Rui Monteiro,10 ay önce,1
"I am an audience from Taiwan, I am very satisfied with your review video.",晉佑Jin you,11 ay önce,0
AT&T giving up to $1000 might as well  trade the 12 pro in,Kc Skee Skert,11 ay önce,0
"Yes ppl we get it, we don’t have to upgrade every year but…ITS PINK, also I want the 5G and faster and better performance",maria rojas,11 ay önce,1
I’m so excited because I got the iPhone 13 mini! I have the iPhone 12 Pro and realized it just wasn’t for me. I miss having a smaller phone. Plus like you said THEY HAVE PINK! Real pink!,Elle x3,11 ay önce,0
Why they didn’t add purple as in 12? I just had the purple one and I hope to improve with the same color. I wish the iwatch get that range of color. Do you think is there any reason why some colors are not included?,Romy Liz,11 ay önce,0
Idk if I should get iphone 11 pink 256gb or iphone 13 pro blue 128gb!!!,Cookie n Cream,11 ay önce,0
Imagine being someone that thinks the notch is an issue XD,Angel Lawson,11 ay önce,2
Funny how people are only trolling Apple for making minor upgrades to their phones every year when literally other brands do the same thing. Just admit that iPhone season always gets the biggest hype every year whether you like it or not.,Iman,11 ay önce,0
"I am on 11, not much of excitement yet to go to 13 I don't think ",fffw,11 ay önce,0
"I love the way Justine says those dumb comments from people out loud! “Android already had it blah blah blah”, “I don’t want to upgrade, blah blah” -  ! Hilarious! I love watching this channel! Justine is awesome. ",Benjamin DePaz,11 ay önce,0
Justine we need a video of what u have on ur iphone 12 pro.... We want to see what u have on ur phone that has taken 512 gb memory...,Shaunak Gupte,11 ay önce,1
"Justine kids be like
Mom i want the new i phone 
Justine be like 
Waiting outside the apple store with her knife  to get her son a new iiiiiiphone",Aparna Jaiswal,11 ay önce,0
I thought this was the unboxing already! ,Roberto Garcia,11 ay önce,1
"Hi, will you be reviewing the camera like last year?",paddy mcvey,11 ay önce,0
"I’m so excited for the iPhone 13 Pro Max, I’m upgrading from my iPhone XS Max and I’m definitely in need of an upgrade cause I have 2 GBs left out of 64 GBs",Trent Sanchez,11 ay önce,0
Every year since I bought iPhone XS there is some flaw that's stoping me from buying a new model. With iPhone 12 pro it was crappy battery life and with 13 pro it's overweight. Let's see what next model will bring.,binaryblog,11 ay önce,0
