text,author,date,like
cool,sunny simmons,10 ay önce,0
5:28 €magining with u ,code x,11 ay önce,0
"The kittens has a home, right ?",Roxality,8 ay önce,1
Justine is such a beaut,Justin Lee,11 ay önce,0
Let’s just say I am SOLD,Briana Jones,11 ay önce,0
U r looking so beautiful like iPhone ,Zahir uddin Ahmed,11 ay önce,0
MoooOooooom the lady taking pictures of the wall again…,E M,11 ay önce,0
“B” is the iphone,Rohidhan Rajendran,11 ay önce,0
Ummm love your videos but wheres that ice cream shop at ? Lol,Christina Hamilton,11 ay önce,0
ijustine is best youtuber ever,Tech Expert,9 ay önce,0
this is sick,Hussey,11 ay önce,0
Can i have your older phone? ,Jc Castro_23,11 ay önce,0
I want iPhone but I haven’t got money,Giorgos Militsopoulos,11 ay önce,0
You should giveaway any iPhone To me I love iPhone,Abdullah Zaheen,11 ay önce,0
Stop saying “12”,Julio Bustamante,5 ay önce,0
Omg I’m Upgrading bc I don’t have a iPhone lol bc I’m 12 so yes I’m,OCmz fan,9 ay önce,0
Can boys get the pink iPhone,Theyluv_luke,10 ay önce,1
"I'm a big fan of Justine ... I can't afford to buy an apple ... I live in India ... You give me an Apple products, please Justin give me an Apple product ...  please gift me apple products..... Justine... please",Gaming iconic,8 ay önce,0
I hate using my iphone 4s from 2011 October 4  10 years old! On ios 9 (ios 9.3.6),iPhone 4s4s4s,10 ay önce (düzenlendi),0
Stop lying I have the 12 and it does take good zoom . U guys really need to stop . Same damn thing,Loveable Alexander,10 ay önce,0
I think A is an iphone,Hanz09,10 ay önce,1
Omg you were in Pomona  I didn’t get to see you,Daniela Vargas,10 ay önce,1
I say A is the iPhone,Meredi Keshishzadeh,11 ay önce,0
@ijustine can you buy me an icecream,Incredible Vines,11 ay önce,0
4:20 A is iPhone,Takuya Kimpara [ Piano ],11 ay önce,0
The ultimate shill.,W. Dearth,11 ay önce,0
5:02 I like Justine in niqab. allahu akber,al pacino,10 ay önce,1
she said 12 pro and pro max,Breah Maness,9 ay önce,0
It's iphine 13 Pro u said 12 pro,Irfan,11 ay önce,0
"I'm a big fan of Justine ... I can't afford to buy an apple ... I live in India ... You give me an Apple products, please Justin give me an Apple product ...  please gift me apple products..... Justine... please",Gaming iconic,8 ay önce,0
"I'm a big fan of Justine ... I can't afford to buy an apple ... I live in India ... You give me an Apple products, please Justin give me an Apple product ...  please gift me apple products..... Justine... please",Gaming iconic,8 ay önce,0
I love Yerba mate too,Felipe Arroyo,11 ay önce,0
This new displays are even worst that Samsung s21/s21+ and obviously s21 Ultra have best display on the market. Nice job apple. :D,Vit. C.,11 ay önce,0
divonica,luís fernando,10 ay önce,0
A shoot with iPhone,Aivan Mahmud,10 ay önce,0
çok tatlısın justine,suat yeşilyurt,11 ay önce,0
بله ذولي بشر واحنه بشر خرب حظي,Ahmed alrobaye,11 ay önce,1
Vai tuhara pas to bohot Chara iphone he mereko 1 gift  kardona plz  middle class hu isliye khrid nehi pata ,-𝙼𝚞𝚜𝚒𝚌-♪𝚕𝚘𝚟𝚎𝚛-,11 ay önce,0
12 pro ? 0:5,Pineapple,4 ay önce,1
Where did the cat come from,Hell Hound,11 ay önce,0
Pengen,gtw,11 ay önce,0
A is the iphone,DREADOEVFX,9 ay önce,0
Is this a movie? ,Owee Mir,11 ay önce,0
a is the i phone ;-),Rishi Singh,1 ay önce,2
I want ice cream too,@Pascalwalter7 : TWITTER,11 ay önce,0
Please give me iphone  13 pro max,Hossein Shafiei,11 ay önce,0
Using iPhone 13 Pro Max to comment,Mayu Watanabe,11 ay önce,0
I am new subscribe  from southindia,HOSANNA Photography,8 ay önce,0
give me one please ,jun carlo bihag,11 ay önce (düzenlendi),0
No offense but iphone has a very bad camera. Why do people pay so much for it?,Tim Cook,10 ay önce,0
Don’t drink too much coffee,Melissa Spoor,9 ay önce,0
Macro mode: use it twice in the first week and never again. Basically a gimmick feature.,Jeff Knott,11 ay önce,0
lol..wow,nazmul ahsan,11 ay önce,0
Did she say 12 pro and max,Michael Kamiza Aguda,8 ay önce,0
"6:46 , Oh i see you doing something fake",Mens Ustaad,11 ay önce,0
هذ اعلن مفيد في  عالم  تكلونجيامع تحياتي,emaad Alooo,11 ay önce,0
YOU HAVE A SCAMMER IN THE COMMENTS PRETENDING TO BE YOU.,ritamix33,10 ay önce,0
,jvzau,11 ay önce,0
Can boys have the pink iPhone,Theyluv_luke,10 ay önce,1
"Android have these years ago .
But ok.. it's iphone  I don't see the difference with iphone 12 and 13  and mi 11 ultra and galaxy flagships ",TECHXO FIX,11 ay önce (düzenlendi),0
Love but no money ,BORA KEO,11 ay önce,0
Mam please give ipad mini please mam,ANY ŠHØRTS,11 ay önce,0
B is iPhone,matthew,11 ay önce,0
Your video it's just a apple ad,sahil Shah,11 ay önce,0
You are looking gorgeous,tarun patel,11 ay önce,0
PLZZ gift me an iPhone 13 pro,wHitEStroM GaMiNG,11 ay önce,0
️️️️️️,Lbenn HTX,11 ay önce,0
It’s b or not,Mattjeff45,11 ay önce (düzenlendi),0
बंदी बड़ी प्यारी है यार ,Vinod Bisht,11 ay önce,0
2:32 Mike Wazowski!,Melvaughn,11 ay önce,0
Please Give me this phone,Parveen Parmar,11 ay önce,0
I love you,Tim Cook,11 ay önce,1
Omg what happen w the kitten? ,Michelle Gallegos Valencia,9 ay önce,0
a is the Iphone,Progamer7511,8 ay önce,1
Superphone blondie ,Dante Saint,11 ay önce,0
A is iPhone for sure,Carlos García Molina,11 ay önce,0
Plz gift me I phone 13 proax and S7 ️ I Justine I request to you? I love I phone ️ pz gift me,hammad Siddiqui,11 ay önce,0
i  lOVED tHE bIGGER oNE bLUE,Moez Mohamed معز محمد,7 ay önce,0
I think it’s b?,Valery Leyva,11 ay önce,0
A is the iphone,Catalina Arango,11 ay önce,0
A is the iphone,190O027 Babu Roshan Jha,9 ay önce,1
B is iPhone beacuse there is blure at back,Galaxy Gaming,5 ay önce,1
"Please give me a gift from your youtube channel Apu, I am from Bangladesh",S.S.COOKING WORLD,5 ay önce,0
A is the iphone,Ameen Kasim,11 ay önce,0
Worst i phone ever,Sherali Khan,11 ay önce,0
Super girls ️️️️️️️️️️️️itp ,Łukasz Draszczyk,11 ay önce,0
Copy paste from s21 ultra,So99,11 ay önce,0
I think it B,Joanna Cheng,11 ay önce,0
ปังมากกกกกก,The Foy,11 ay önce,0
i love u mam,rahul kumar,11 ay önce,0
thanks,Sandeep Deswal,11 ay önce,0
12:53    * E N I *,pinta_vodki,11 ay önce,0
I don’t use insta was it a or b,Michael De Louisa,11 ay önce,0
2:33 hollywood next movie alien,md.shariar kabir,11 ay önce,0
A is iPhone 13,Andrej Bartulin,11 ay önce,1
A is iphone,Abhishek Thakuri,11 ay önce,0
I will not buy iPhone until its do something truly evolutioning like Steve jobs did in 2007 touch screen,Random world,8 ay önce (düzenlendi),1
MAM PLEASE GIFT ONE TO ME THIS CRISTMAS.,MEHTAB ALAM,8 ay önce,0
"How on earth are you 37, it doesn't seem possible",Fray Bentos,10 ay önce,0
I love iphone pls send me mam,VÏẞHÑÜ 🤘,11 ay önce,0
B is the iPhone,Thomas Tevis,11 ay önce,0
I'll pass. Iphone has been boring for years. I don't do videos nor am I so dedicated to Apple's ecosystems so it's pointless. Upgraded from iphone to android. Not looking back anytime soon. And I was hard-core sheep,T_Will77,11 ay önce,1
Top,Canal Fox Tech,11 ay önce,0
It looks bad honestly.,Г.Анхбаяр,10 ay önce,0
B - iPhone,MRIDUL FROM INDIA,10 ay önce,0
can't Handel shit shown in this video,Chidghan,11 ay önce,0
"Hi please can I have one of those please I don't have any, can you dash me one please am using little android phone",princess G,4 ay önce,0
a little creepy,Rose 🌹 Media created by Paul Rose,11 ay önce,0
Pure garbage ️️️️,John Gamba,11 ay önce,0
Am iphone 13 use,Sayed sumon,8 ay önce,0
why u wearing a mask still cali still do that ?,Schofrenzy,8 ay önce,0
"Downtown Claremont!
Do you live in the area?",Lui Salazar,11 ay önce,0
A Is the iPhone I quess,marcelmcyd,11 ay önce,0
A is the iphone because skin tone looks whack,Ceazerleo,11 ay önce,0
giveway ,unique Gaming,11 ay önce,0
i love you,MAD GANGSTERS,4 ay önce,0
just ordered mine… says it’s gonna ship in October ,stripe801,11 ay önce,0
,刀齐 拔,4 ay önce,0
You’re so beautiful,Tombose Channel,11 ay önce,0
"sister, can you send me the money please, if I deposit the money in your account 13 pro max 128",Adilbek Ernafasow,11 ay önce,0
B is iPhone,Family Cui,3 ay önce,1
I want to be your man,Winner Singh,11 ay önce,0
Sana all hehe,Network Tweaks,11 ay önce,0
WHATS JAKE @ QUEEN JAKE KINDA FINE THO,Ev,11 ay önce,0
Hye sø sweet your voice very very _ sweet your voice ___,ziddi Ankit,11 ay önce,0
Meh,Barbs Stampede,11 ay önce,0
Please give me any of your second hand phone or new I phone I need phone please start giveaway,Success Achiever ( Great to Live),11 ay önce,1
Beautiful girl ,sheikh G,5 ay önce,0
A is iPhone,Speed_s0ngs,11 ay önce,0
"2:35  ""mikaela wazowski""",Sa Adarsh,11 ay önce,0
Very very very your eyes ️,Adnan Radeon,11 ay önce,0
give me i phone place ,سك ليمون,11 ay önce,0
从西瓜视频上面看到的你，追你到这里来了,L Robert,9 ay önce,0
I am back.,A K,10 ay önce,0
I am back.,A K,10 ay önce,0
I am back.,A K,10 ay önce,0
I am back.,A K,10 ay önce,0
I am back.,A K,10 ay önce,0
I am back.,A K,10 ay önce,0
I am back.,A K,10 ay önce,0
its A,AgentOreo,11 ay önce,0
Nelson,Rev. Tyler Mallari,10 ay önce,1
Hi Justin,Vishal Kushwah,11 ay önce,0
God you are so beautiful,rountreeeightyfive,1 ay önce,2
B for sure,Arjay Miller,11 ay önce,0
"Please make a  video and camera comparison between the new Iphone 13 pro max and S21 ULtra. thank you. Been following your videos lately, they are amazing and informatic. Thanks and keep up the good work.",Elite Khan,11 ay önce,0
Thought I have seen the best iPhone 13 Pro camera review until I realized that night time mode wasn’t tested.,Hiren Prajapati,11 ay önce,0
Superb features . Thanks dr,Sheez Mohamed,11 ay önce,0
iPhone 13 Pro Series is simply amazing!,Robert Louise Baker-Hyde,11 ay önce,0
"Wow, I definitely sure I will buy the iphone 13 pro max. I love it.",Aiden Khant,11 ay önce,0
Best review of iphone 13 series ️,Taank Squad,11 ay önce,0
Oh my ….. I’m in love with this model …..,K Kitsune,11 ay önce,0
"Ijustine,can you release a Sony a7s3 vs iPhone 13 pro video?
That would be dope",L,11 ay önce,0
"A is the iphone as in the new cinematic mode, you can see some edge blur, so i would guess A is iphone",Aadi,11 ay önce,0
"Can you make a night mode review, please?",AHMED ESMAEL,11 ay önce,0
"Oneplus and Samsung has had this macro mode for 2 years, they have been using the 120hz display for 2 years. Iphone is bringing that now and showing off features that are actually copied from others. Even the somewhat fast charging and wireless charging were also copied from samsung after 3 years. Only things apple can come up as new renovations is removing accesories and features. Removing earphones jacks, earphones, removing charger etc. That's what apple is good at.",narendra irengbam,11 ay önce (düzenlendi),0
I’m stuck deciding between the Sierra blue and Gold!,Clair de Lune,11 ay önce,2
It's B. And I'll be seriously considering an change/upgrade from my OnePlus 6t. I never liked apple phones at first till the iphone 12 cause they were all basically the same but I regret that now lol.,Dominick G,11 ay önce (düzenlendi),0
Your videos make me want to switch back to the iPhone as soon as possible.,M,11 ay önce,0
iPhone 13 series support video stabilization.   10:55-11:00 a little bit shaky.  I believe that iPhone 13 stabilization can solve shaky problem.,Cheng Yang Song,11 ay önce,0
Watching this on my 12 pro max  the video is amazing but I’m not upgrading thanks ,YasmínMMF,11 ay önce,0
ok now I'm REALLY excited for my iPhone on Friday ,Valeria,11 ay önce (düzenlendi),0
I just ordered the 13pro  can't wait,ajoke hussein,11 ay önce,0
Love ️ it,Alim Shah,11 ay önce,0
Is it a phone or just a camera !! Someone make a iPhone with good battery life !!,Tejesh Maramreddy,11 ay önce,0
Please do a Cinematic Video Clip with the Iphone 13 Pro and DJi Osmo 5.,Zacki Pillazo,11 ay önce,0
I love how you keep calling the new iPhones “iPhone 12”,Dust fost,11 ay önce,0
iPhone 13 more like iPhone 12s but the 13 Pro is kinda a great upgrade,iAmDickel,11 ay önce,0
What to see night mode and astro photography how it comes with 13 pro,prajwal poojary,11 ay önce,0
I would just take a photo from my iPhone 12 from a distance and then zoom in!!,Kiran Ramakrishnan,11 ay önce,0
Legends - can't afford but still watching ,azm and you,11 ay önce,0
Is the macro only for pro max?,Reyna Kristina Manuel,11 ay önce,0
the 13 pro max is better for heavy user like gamers because the battery is 4300mah than of 13 pro,GingkaSnapss,11 ay önce,1
I just got a 12 Pro Max... they are offering 790 at Apple.. might get the 13,Hector San Martin,11 ay önce,0
I just found your channel and guess what I'ma NEWLY BLESSED SUBSCRIBER I gotta say I love your channel and your vids they're calm and interesting,ST_KUOLI,11 ay önce,0
I really noticed you are making best video compare to other tech master,Jaswant Singh,11 ay önce,0
Can you test the night mode on the iPhone 13?,LORENZR,11 ay önce,0
Oh its so tempting. Must buy ,ZAIDI HASSAN,11 ay önce,0
Appel can make iphone12 looks like iphone13 just with an update,Mustapha Mus,11 ay önce,0
I’m guessing that you pre-ordered them and Apple gave them to you right away,EJ Rose,11 ay önce,0
I think I might just upgrade in the near future. I love taking pictures this phone became my new goal and I dont even like iphone after a bad experience.,Alexandrina Baca,11 ay önce,0
"@ijJustine Like the previous year we have the iPhone 13 Pro & 13 Pro Max. 

You said we have 12 Pro / 12 Pro Max / iPhone 13 & iPhone 13 mini ",Argiris Ramandanis,11 ay önce,0
production quality done  this video :),Luis Barbosa,11 ay önce,0
Great review thanks. But that's super gross letting someone hold your phone to pay. Eek,Okin Nivlek,11 ay önce,0
"My country does not import new phones, I watch these though. Lol ",Nuwan Ekanayake,11 ay önce,0
"When she said ""we found the bug"" i wonder if it in the software hahahaha",Muhammad Faizal,11 ay önce,0
"Pretty disappointed with the ""cinematic"".... Looks as same as on my mid-range S20 FE  Please don't start a war on me, I like iPhones as same as other phone brands",Kenn Y,11 ay önce,0
ZOOM IS AMAZING !,Romana I,11 ay önce,0
Great Video!!,TBoneMalone,11 ay önce,0
Is it a phone or just a camera !! Someone make a iPhone with good battery life !!,Tejesh Maramreddy,11 ay önce,0
12 pro max is batter price and overall batter,i m Alin,11 ay önce,0
Top  top  top  l iPhone  13 j adore,Nadir Bouba,11 ay önce,0
"""like the previous year, we've got the 12 Pro, 12 Pro Max, the 13, and the 13 mini"" this is the second video she calls these phones the 12???",Jeffrey Lawrence,11 ay önce,0
This video should be official video of iPhone 13 review ,Davinder Singh Sandhu,11 ay önce,0
"Looks like the MOST POWERFUL IPHONE IS REAL HERE
or maybe the most REALY REALY POWERFUL IPHONE IS NEARNEXT YEAR 
Whos also EXITED what is apple next move in IPHONE 14",Gabriel_OFFICIAL,11 ay önce,0
"This is unbelievable, especially the close shot... every time when I''m trying shot closely to take a detail,  suddenly it becomes blurry. Actually I don't have any mind to buy 13. But after I watch this video it makes me confuse........",22 Savage,11 ay önce,0
Macro a reason to update becouse its very important to shoot photos from that distance ,Tupacovic,11 ay önce,0
i wish i can have one for my online class,Martin Trazona,11 ay önce,0
I'll just get this one in like 6 years when the price dips down,BingeFest1,11 ay önce,0
"Why is huawei p50 pro better than iphone 13 pro max in the camera area? And this only for 799$???? 
Why Apple why????",KingPin KingPin,11 ay önce,0
Let's see that low light astrophotography!,SuperDuty Zack,11 ay önce,0
I want the 13 pro ,Clouddi Aesthetics,11 ay önce,0
I like iPhones but iJustine videos have nothing to do with reviews -  these are more of adverts than anything else,Adalbert93 _,11 ay önce (düzenlendi),0
How do you get those things?,EJ Rose,11 ay önce,0
"Apart from this review, I haven't seen even CNET and Verge praising gimmicky features so much. Apart from the large sensors, there is no much improvement in low light photos too.. so much to be a fan girl.. No other review said this is an upgrade from 12 pro series, except you.. so much to say this is a paid review or too much fan girlism..",Harikrishna Reddy Midde,11 ay önce,0
Loved the way you described,Ammar murt,11 ay önce,0
2:09 I can´t believe I want to watch a video of someone recording a wall,Mygu3l,11 ay önce,0
"hey justine
I wanted one pro max ",Daniel Lee,11 ay önce,0
"95% about camera, 5% about iphone",ashok,11 ay önce,0
"In the start you said ... 12 pro , pro max , 13 and 13 mini... lol you got mixed up with 12 qnd 13",Zain Zox,11 ay önce,0
Please post a video of how to make fes of photos that I click on 13 pro max 1 tb. Thanks,Nilufer Doctor,11 ay önce,0
Nope just got the 12 I’ll upgrade after my phone broke omm,Next Satan,11 ay önce,0
The iPhone 13th will come out on September 24 it’s too early for you to buy it,EJ Rose,11 ay önce,0
Apples inovations are so underperforming that all you  can tell has changed is a new camera mode. Wtf,Elom Nusk,11 ay önce (düzenlendi),0
superb video makes we wanna dump my 12promax and jump onto this.... hmmm maybe i should just go have some ice cream instead,thinkpadx60,11 ay önce,0
Stop updating the camera and do something really exciting. There’s nothing new in IPhone since the X model,Chen,11 ay önce,0
Not me being broke while this beauty comes out,Eline,11 ay önce,1
Justine you said 12 and 12 pro max again just like the unboxing video. ️ ,Amo 427,11 ay önce (düzenlendi),0
Shots 11:50 ,Prabakar R,11 ay önce (düzenlendi),0
Hi Justin Can I get a chance to win Iphone 13 pro... Love From India...️️,PK,11 ay önce,0
I’m not trying to be mean or anything but you said 12 pro and 12 pro max at the beginning ,CP Designs,11 ay önce,0
Iphones without cases cause me anxiety ,MiroticVamp,11 ay önce,0
Maybe next year Apple... next video,Max Ziebell,11 ay önce,0
those features are on android way back 2018 -_- not impressed...,R R,11 ay önce,0
another iphone collection from ijustine,Kuya Jher's TV,11 ay önce,0
Daebak!!!!,Erika Co,11 ay önce,0
At least she didn’t drop it! ,CP Designs,11 ay önce,0
What state is that? everything looks nice ,AdiM,11 ay önce,0
A is definitely the iPhone,choke me like you hate me but you love me,11 ay önce (düzenlendi),0
Hey guys which was recording by iphone A or B???,Quang Pham,11 ay önce,0
MMmmMmmmm Macro Mode drools,Lioncrud,11 ay önce,0
I like you' re video s.,nindi badal,11 ay önce,0
Did Apple pay her? ,Mae Love,11 ay önce,0
"so, basically its a camera advertisement but a phone? hmmm",ISAAC Lalnunzira,11 ay önce,0
"I got the 12 pro Max and the only difference is nothing just the camera difference , I would want something better than the camera",Luis Ortiz,11 ay önce,0
"An egregious error right off the bat— “12 Pro, pro Max” ….no, we have the 13 Pro. Every time I check a video out from this chick I swear she says something incorrect/off. Yeesh.",Jacob Prosser,11 ay önce,0
Do a giveaway for the 13 Pro Max  i’m broke and need that phone ,Mark Nijboer,11 ay önce,0
Damn! ️,Kristine Belle Bisquera,11 ay önce,0
The cinematic mode soLd me,Bennie,11 ay önce,0
Tomorrow i will got my iphone 13promax,Azan Butt,11 ay önce,0
"@iJustine YOU JUST SAID 12 PRO, PRO MAX!!!! At 00:05 omg",Aryan Khandelwal,11 ay önce (düzenlendi),0
i wish i can have one of your phone ad a giveaway for my online class,Martin Trazona,11 ay önce,0
They haven’t even came out yet,EJ Rose,11 ay önce,0
Wow what  a marketing  for apple !$$$$,Ticos,11 ay önce,0
She's fully bought by apple,A.,11 ay önce,0
Iphone 12.5 ...,J J,11 ay önce,0
Español por favor ,Rusty dj,11 ay önce,0
I would like one of the iphones but they are too expensive if had a phone that is about 100 dollars for to years i did get bullied because it's an Android,Leina,11 ay önce,0
Wow,Ball Ball,11 ay önce,0
"Is it just me or did she say iphone 12 pro and pro max, 13 and 13mkni? In the beginning?.??",Dino Dino,11 ay önce,0
Apple is just making money in the world. It is incomprehensible to make your mobiles so expensive.,Apna Rakhshan,11 ay önce,0
Next try taking a picture of the moon.,nacanieli nalewabau,11 ay önce,0
Apple could poop in this girl’s hands and she’d say it’s the greatest thing ever,austin bevis,11 ay önce,0
Man plz give me one 12 pro max  I am wait to your replay,Fazal Rahim,11 ay önce,0
Apple not is good!,Ella Johansson,11 ay önce,0
How is this a review so you're telling me there is no negatives about this phone that's all you can focus on for an iphone the camera lol talk about and apple sheep,Flanking Foxtrot,11 ay önce (düzenlendi),0
Goood work. Up,Youssef Dbar,11 ay önce,0
50 rupaya overacting ka shall be deducted,Usman Ghani,11 ay önce,0
B is the iPhone?,dak85016,11 ay önce,0
this is the same phone apple  just change colors,Marijo Nikolic,11 ay önce,0
When you drop its onley crachs,Ella Johansson,11 ay önce,0
Camera A is absolutely the iPhone because your hair fades into the background,Adeetard,11 ay önce,0
Useless review. it is a phone not a camera,الهجرة لاستراليا - الحلم الاسترالي,11 ay önce,0
Ok besok beli ,sgt alf,11 ay önce,0
A is the iphone,Anton Horváth,11 ay önce,0
Is there anyone wanna my Kidney. I need a iPhone 13 pro.. . Otherwise I can't afford to pay for this.. ,Tech Twitte,11 ay önce,0
"Me encanta esta mujer, y encima esta tremenda de buena , guapaaaaaaa",JARANOR FILMS,11 ay önce,0
مسرعكم ,Bin Masoud - بن مسعود,11 ay önce,0
Olala here we go again :),Henry Nino Cardino,11 ay önce,0
Why so many cameras on one cell iphone,Superman,11 ay önce,0
plz i want iphone.,Nitin Autade,11 ay önce,0
A is the iphoe,louigie perez,11 ay önce,0
INTERESTING,YouTube Zone,11 ay önce,1
B Is a iphone,Drum fun,11 ay önce,0
A is iPhone,ផុន សុផាន,11 ay önce,0
"trashphone, mid range android phone has way more better feauture than this pure garbage outdated trashphone. ",kid from ashia ARGJ,11 ay önce,0
your eye is beautiful!!!!!!,Lioncrud,11 ay önce,0
OMG,,11 ay önce,0
ดวงตาของคุณสวยมากๆ,สุวรรณา อ่ำอ่อน,11 ay önce,0
อยากให้ลองเอาเคส12มาใส่13ค่ะใส่ได้มั้ย,สุวรรณา อ่ำอ่อน,11 ay önce,0
Love u dear,SABBIR CTG,11 ay önce,0
I want buy sister️️,ហ៊ា សេង,11 ay önce,0
b is iphone,vishnu prashanth,11 ay önce,0
nothing special again,ianwar,11 ay önce,0
im here to see her only,Mohit sehdev,11 ay önce,1
I’m so excited for the new iPhone I’ve watched all your videos Justine and I also watched the event so excited. And hi by the way. Biggest supporter.,Luis Hernandez,11 ay önce,1
Honestly this video convinced me to buy iPhone 13 pro. I was in hesitation.  thank you,Swastik Sahu,11 ay önce,0
love this iphone 13 pro review the most.,Cryptodogg,11 ay önce,0
"My question, iphone 12 pro and 12 pro max has different sensors in the camera, what different between iphone 13 pro and 13 pro max this time?",Imposters 😂,11 ay önce,0
U Didn't  mention that in cinematography  mood it actually  smoothens the edges... But its one step ahead in videography.,Saif Zisan,11 ay önce,0
wow the cinematic mode,Akhi Hoshino,11 ay önce,0
Your videos are awesome!!! New subscriber!,Q17,11 ay önce,0
Cinematic mode is super,Firoz,11 ay önce,0
I got the base iPhone 13 but after seeing this I will also buy the pro max ,Itz Kieron,11 ay önce,0
"Uhm! Macro mode existed on android devices like a long time ago. 
And the cinematic video is just a little better than Samsung's. Still artificial and has poor edge detection.
And the answer is A. It's pretty obvious.",Xfinity Phantom,11 ay önce (düzenlendi),0
"At3:52 , 3:58, I saw some flare dot which is the same problem as on 12pro max. Is it hardware or software issue?",Sorn,11 ay önce,0
Excellent content ,Gil Hernández,11 ay önce,0
"That video felt like 7 minutes, not 14. ",Bo Öhman,11 ay önce,0
Fire AF video Ms.Ijustine,1977NOBODY,11 ay önce,0
"Apple doesn't sell any hardware anymore, instead it sells some ""cool features""...",Behzat Çitlembik,11 ay önce,0
iPhone 13 / 13 mini without Cinematic Mode / 13 Pro & Pro Max with the Cinematic Mode,ARYAN Phones,11 ay önce,1
"Justine, I wish you'd told everyone iPhones don't do vertical video at all anymore instead.",The Fabled Wingnut,11 ay önce,0
"The pro max looks like an iPad, in your hands…",J Fry,11 ay önce,0
Please make a full review of i pad mini .  Love to i Justine ,Al Mahi,11 ay önce,0
"Красивая девушка и отличный обзор, спасибо!",druid,11 ay önce,0
Apple should hire Justine for the promotional chief position!!!,Roy G,11 ay önce,0
How would we know how much GB to buy for a Average phone user?,Moments w/Kathy,11 ay önce,0
What if I DONT TAKE Pictures?how did we get to phones having strictly only camera upgrade reviews,Coach Richardson,11 ay önce,0
This video is making my 12 pro max feel cheap lol,jay brooks,11 ay önce,0
Finallyyyy I was waiting for your review justine!  please give this a like,Archie Kenneth Sabay,11 ay önce,0
It looks like amazing the phone looks like great,SuperChiko 2.3,11 ay önce,0
The mobile phone needs another jump in paradigm because these are starting to look old now.,Jg235,11 ay önce,0
The cameras on the normal 13 and 13 pro aren’t the same lol. Even the normal wide camera is better on the pro version..,S Q,11 ay önce,0
