text,author,date,like
Real cinematic mode has to be 24 fps and 21:9 aspect. Non of them is here . Just changing focus is not assumed as cinematic mode .,pouya delavari,11 ay önce,0
Video turned out great!,,11 ay önce,254
I'm interested in seeing the difference in ProRes 4k and 1080p,Lesly Salgado,11 ay önce,0
"insane camera showcase. Love it love it love it. never thought I'd be buying another 1,100$ apple. But damn, this is one fine apple I must say.",RichiesLens,11 ay önce,0
Finally would upgrade from my xr to the normal 13,Adex Smith,11 ay önce (düzenlendi),0
Does the 13 Pro have macro mode as well or just the 13 max?,David,11 ay önce,0
Glad I upgraded to the 13 Pro Max from XS MAX!  It’s a totally different beast!  Everything is so much better!  But the only drawback with the 13 Pro Max is its weight!   it’s like a gold brick!,ss5153,11 ay önce,0
Music is a mood on this video! Good stuff Justine ,Savanna- 𝙾𝚙𝚎𝚗 𝙼𝚢 𝙿𝚛𝚘𝚏𝚒𝚕𝚎,11 ay önce,14
"Damn, I ordered the Pro Max in this Sierra Blue, and all the way through the last 5 videos I’ve seen of it, it keeps looking purple. Even on MKBHDs unboxing videos. And you’re already angelic. ",G. Dubyou,11 ay önce (düzenlendi),1
"If I want to shoot regular, simple vlogs for YouTube, do you recommend the pro or mini for long term usage? I love the form factor of mini.",Soumya Marhual,11 ay önce,0
"You are not only the best reviewer ever, No, your videos are just pleasurable to watch.. They are full of enthusiasm, colors, vibrancy, and creativity..Love you so much iJustine ️️️",Hesham Abdou,11 ay önce,1
"I wasnt sure about ordering the iphone 13 Pro Max, but after watching this Im glad I did. Arrives Friday!!!!! Bye bye 12 max pro! I love the fact that the display is brighter, and the camera is yet better again.",John M,11 ay önce,0
"Best phone review ever loved it  the new ""super phone blondie"" is here  great  <3",Saad Uddin,11 ay önce,0
"As an android user, I'm a bit excited for her making incremental updates look like LEAPS AND BOUNDS.",Weston Bryan,11 ay önce,5
Such a great video thank you!!!,Alanna Lionetti,11 ay önce,0
"Wow this was showed off better than Apple presentation!
Can’t wait for my IPhone 13 Pro to be delivered!",Bob J,11 ay önce,0
I'm impressed ️‍,Wafa Zxya,11 ay önce,1
Was it just me or was this video really that amazing???,Trey Vincent,11 ay önce,1
I just received my iPhone 13 Pro Max a few hours ago and this was the first video I watched on it. I didn’t know about the camera features you mentioned so it was a nice surprise. I’ll be taking photos of bugs in the garden tomorrow!,shemsureshot,10 ay önce,0
"I’ll wait for the 14 or even 15 , I’m on the 12 now so no point until there’s a reasonable upgrade",ImzVidsZ,11 ay önce,3
"great vid but the first line ""we got the 12 pro, pro max, the 13..."" I was like wait a second, what happened to 13pro haha",Matt,11 ay önce,0
Looks amazing.,Shonnie,11 ay önce,0
"All of these are there on most other andriod phones, do a comparison to see how this phone fares and what they should improve on.",Mikumiku4u,11 ay önce,0
the quality of your video and review is amazing.,monicando,11 ay önce,0
The beginning already confused me when she said 12 pro and 12 pro max. And then that the reason to choose the pro would be the telephoto lense while in fact all lenses are different..,felixshengyang,11 ay önce (düzenlendi),1
"Mate, finding bugs on my plants is exactly what I need in my life. Roll on Friday!",WicsB,11 ay önce,7
You're alwys made great review love from INDIA🇮🇳,Tashi Nampo,11 ay önce,0
I currently have the iPhone se 2020 and I’ve had it for almost two years and it’s so glitchy so I’m so excited to upgrade to the iPhone 13 in pink,Kaylanee Sierra,11 ay önce,1
"your content is so good! I watch a lot of 
tech...",Alexander Trivedi,11 ay önce,0
i preordered the pro max 1TB on Saturday super excited!,Charmmy Ros,11 ay önce,0
"I upgraded to iPhone 12 Pro Max last year from my iPhone XS Max after getting into vlogging, and now after watching your video i am so tempting to upgrade again for the cinematic and quality of the new iPhone 13 Pro Max!",Jaeden Jace,11 ay önce,0
Welcome to our new episode of I can't afford ffort but still watching ,Nisha Singh,11 ay önce,5
I am from India but your review was just amazing.......,UDAYKIRAN RATTI,3 ay önce (düzenlendi),2
Omggg I always love how you make your videos and now im thinking of an upgrade ️️️,itschangiii,11 ay önce,0
"Amazing review! I'm watching from Brazil. I'm your fan, iJustine",João Paulo Brito,7 ay önce,0
"Really enjoyed this video, it highlighted the camera features",SoundWave081,11 ay önce,0
I love this video so much! Thank you!,Ana Membreno,11 ay önce,0
The moment we’ve all been waiting for!,DayDay Selaht,11 ay önce (düzenlendi),9
amazing review! manifesting for ip13! hopefully next year...,Jon Ferrer,11 ay önce,0
"i impulse bought a 13 pro max that i cant really afford at 3am last night and i was super mad at myself for it but now i am actually so stoked for when it arrives.. im a photographer for my job and as a hobby and carrying around a bulky camera all day every day is so inconvenient but this camera looks awesome, honestly it has better quality than my actual camera",Richie or Dean idc,3 ay önce,1
Nice Sharing  Amazing phone especially it can detect a missing wallet. How to do that? Is there any settings to set up or it was automatically detect or how?,Athnalia yoely,11 ay önce,0
It was a visual treat and so detailed ,Travel and Lifestyle vlogs,11 ay önce,0
Thanks mam for giving the legend ifone 13 pro max information. n I am from India ️️️,Belagavi Legend Boys,11 ay önce,0
"Nice!! Can’t wait to hopefully see one in person!

4:14 I think B is the iPhone",Gravity Tech,11 ay önce (düzenlendi),7
That was pretty freaking amazing.,Cre4m ppy,8 ay önce,1
Love the time laps,Frankie E FUENTES,11 ay önce,0
Its so pretty   i hope i can upgrade my iphone 13 pro max ,itslalable,11 ay önce,0
just got my 13 pro today️ can’t wait to play around with the camera after watching this.,blinkbb00,11 ay önce,1
The editing is awesome!!! ,Dondizm!,11 ay önce,0
Oh she's still around...I'm happy for her...and her fans,Scribe13,11 ay önce,3
Hella throwback channel thanks for all of your hard work Justine,Jacob Childs,11 ay önce,1
My phone arrives this Friday…I was excited for it but now after your video I’m REALLY excited! Thank you for this!,Phillip Paree,11 ay önce,0
U r the only one  I seend doing review  perfectly,Asif Muhammad,11 ay önce,0
Should i go with 128gb or 256gb? Since the specs say that on the 128 its only 1080 fr 30fps and 4k on the 256! Advise pls,Kettya,11 ay önce,0
Which one should i go for? Iphone 13 or 13 pro?,Aayushi Singh,11 ay önce,0
"How the hell would you know if the phone is new or used without the wrapping or at least a security tab when you open the box?
Going to be a lot of scams out there with phones being sold as ""NEW"" even though they're used.",Alan Anderson,11 ay önce,10
"4:09 when I first watched this video on my iPhone at my office, I couldn’t tell the difference between the two videos. But now that I am watching it again on my 65 inch 4K TV at my home, I can tell that A is the iPhone.",Risayogi Sitorus,11 ay önce,0
This was fantastic ,RELkay,11 ay önce,0
"5 years from now,We don't need DSLR camera's.
Mark my words!",samir pant,11 ay önce,0
Thank You! What is the rig you are using?,Cosmic Queen,11 ay önce,0
"You really good on cinematic video before iPhone 13, unlike others just talking and compare the spec",ANSON KIEK,11 ay önce,0
i love iphone 13️️,,7 ay önce,3
this video editing is insane. the amount of work put into this is crazy,Nick Tasker,10 ay önce,0
"Basically most features in iPhone 13 is catchup for Android. The lens feature in pixel 3xl which is 3 years old could read labels and interrupt the text. It is what it is.. I am getting an iPhone 13 pro max, but I am realistic.. Android phones like the Samsung  or pixel lines are ahead in many aspects for features.. I was really hoping for always on display on the 13.  What I like about Apple products is they are polished usually when they release features. The cinematic mode is neat, but how much will the average user really use it. Macro is a feature I will use.",James Steffensen,11 ay önce,0
Can you test the 120 HZ in your next video Justine ?,Victor Delacruz,11 ay önce,0
I watch your reviews about the Apple products very year since your funny dance in the Apple shop. Thanks! iJustine!,cyruswhy wong,11 ay önce,0
Totally off topic but I love the case you have on your 12 where did you get it from?,Bopps Hops,11 ay önce,0
Macro ️,,11 ay önce,78
Brilliant work ,Tony Johansson,11 ay önce,0
Does the 13 Pro have all of the same features at the Pro Max?,Raff Ball,11 ay önce,0
enjoyed the vid and review :),Sha A,11 ay önce,0
I'm so excited to get mine!!!!,Oscar Wilkinson,11 ay önce,0
"proper review, thanks",Aleš Bajc,11 ay önce,0
this shows me how a normal daily person uses a phone and how someone else could use it.,Javmj,3 ay önce,3
"Dayummm the pro camera was so good! I just obsessed the details, idk which one should I pick",Xiao Xiann,3 hafta önce,0
I have to say this is been best in depth review of iphone 13 pro.. even though i am watching while iphone 14 launching next month ,Siddy Pie,3 hafta önce,1
Your review quality just wow,Tuna Tunir Ranna Ghor,10 ay önce,1
Your iPhone 13 Pro Review is very impressive.  I am watching it again and again so that I get the inspiration of your great work.,Xi Le,11 ay önce (düzenlendi),1
Looking forward to upgrading my 11 Pro Max to the 13 Pro Max. Love the kitty too  ️ ️ ,brenda1968bu,11 ay önce,0
It would be almost a perfect phone if they added a function that you can switch from the back to front camera WHILE recording. Apple hear me out on this one.,Ay S,10 ay önce,3
Your videos are always beautiful Justine ,FOCAL LENGTH F1.8,11 ay önce,0
I can’t believe how advanced cameras on the iPhone are getting. Hate all you want but I truly love apples work,Ruby Victoria,11 ay önce,0
When will iPhone 13 Pro Max come out?,Funny Kids Crafts,11 ay önce,1
La mejor review de iPhones.,Sosa,11 ay önce,0
Well made! Loved it,Arun Muralidhar,11 ay önce,0
THE QUEEN HAS DONE IT AGAIN ,David Paris,11 ay önce,5
"Mine gets delivered on Friday  watching your videos makes me want to move to a sunnier place, I live in Scotland so no sunshine here ",Gavin McCormick,11 ay önce,0
How was the battery holding up through this camera testing? Significant improvement?,9004- BALAJI P,11 ay önce,1
Damn I should have held off on buying a new Sony camera! These cameras are getting SO good,Madyson Ancell,10 ay önce,1
"Very nice video Iphone13 / Mini, I wish everyone a nice day and a pleasant weekend in strength and health!",wenepzoli,11 ay önce,1
"Amazing iPhone, really enjoy watching your video",Pangsabsab แป้งแซ๊บแซ่บ,11 ay önce,0
That's quick! Right after the unboxing!,Grand Audio,11 ay önce,39
Good video. Can’t wait for an anti tik tok Instagram camera. The selfie sticks were terrible but now kids everywhere getting in the way.,Sleepynatured,11 ay önce,0
"aside from the amazing review and production, your choice of music is astonishing",Islam Mohamed,11 ay önce,1
You make it so fun and suddenly I decided to buy Iphone 13 pro,Feedaa,11 ay önce,0
"The cameras are not exactly the same on the pro and non pro, I think the pro gets a slightly better aperture on the wide and ultra wide lenses.",Matpels,11 ay önce,0
New here ... never experience having an iphone but i feel like I wanna make a try. Thanks for your video ,Cristine Cabuan,11 ay önce,1
Beautiful Sierra Blue ,,11 ay önce,442
Watching on my gorgeous new 13 Pro Max. Daft me didn’t realise Macro Mode activates automatically and I was trying to manually zoom in ,J Ryan,11 ay önce,0
I wonder if you can use micro SD cards for the iPhone 13 pro/pro max so you can have more to save?,R-Rod,10 ay önce,1
Imi place cum te prezinti cu produsele Apple ∆ Esti super!,Adrian Popescu,11 ay önce,0
"Loved the fact that you were in the Village in Claremont . I went to school at the Claremont Colleges and we would go to that ice cream shop all the time .

On a side note, would you recommend the switch from Note 20 to the 13 Pro? The cameras are a huge improvement on the iPhones. ",89frmartin,11 ay önce,0
"Tbh, iPhone 13 series at first sort of same as iPhone 12 but when I have watched this video, its pretty cool! And convinced to upgrade my iphone 11 to iphone 13 pro max! Thanks a lot!",C M,11 ay önce,0
The demo of how terrible iPhone 12 is at macro shots wasn’t fair at all. All she had to do was have the 12 be in telephoto lens and hold it a tad bit away. You can get great macro shots that way.,Ben Leong,11 ay önce,4
Her videos are so worth timetaking.,Senegal Daily,11 ay önce,1
"The camera’s just keep getting better on every generation of iPhone, and now we have Macro and Cinematic modes.",aola wili,11 ay önce,0
you are truly selling this phone for sure :D amazing,Make up by Vanessa Martinez,11 ay önce,0
Just the examples how a normal user would use the camera. Thoroughly enjoyed this review. Thank you.,Rishi Ashar,11 ay önce,0
I just bought my iPhone 13 Pro Max today and im loving it ️,Eiska 57,11 ay önce,0
KITTY! Great video JUSSSS,,11 ay önce,190
Justine!!! The production value of this video is beautiful.,Edward Culpepper,11 ay önce,0
Macro mode is very impressive!,joseph M,11 ay önce,0
An Amazing hack thanks a lot Greg for fixing my device I’m grateful.,➡️ OCTATOOL On INSTAGRAM ⬅️,11 ay önce,0
"I wasn’t gonna upgrade,,, but you just sold me! ",Sam Santos,11 ay önce,0
Nice review ,Benit Raj,11 ay önce,0
Such a great review!,Nicholaus Donald,11 ay önce,0
"Wow, I was going to skip the upgrade, but then I saw your video and now I want one!",EyeNtheSky,11 ay önce,0
Good evening from Philadelphia My new iPhone 13 Pro Max came to my house today set it up for transfer from XS Max was a success and the battery is a SUPER MEGA improvement and I must admit the display is also unique and improved. I'm vet pleased with this,Susan Graham,9 ay önce,1
Currently waiting for my 13 pro max to get shipped. I’m so excited.,Ozmine Carvajal,10 ay önce,0
"8:38
In iPhone 13 
HD 60 and 4K 60 is the best set-up for video.
As you can see in HD 30 set-up it has a flickering effect its because its not for action video.",michael butalid,6 ay önce (düzenlendi),0
Keep up the grind Justine,Lanz Paqueo,11 ay önce,0
Really enjoyed this review. That ice cream though!,Cassandra Boros,11 ay önce,1
"Even my 12 can do all the tricks the 13 can do, it's just Apple won't push the software.",drillerBoy YT,11 ay önce,0
Getting my 13 Pro Max tomorrow. I'm so excited.,Simon Gibbs,5 ay önce,0
just got my 13 pro max and I'm so glad I watched this video so I know what I can do w my phone,Setherine,4 ay önce,0
Cannot wait to receive mine on Friday ,Alex Joynes,11 ay önce,0
This video changed my boyfriends view on iphones and he decided to switch from android as he needs to upgrade his phone after several years and I am finally upgrading my iphone 7plus as well! I can’t wait to have iphone 13 pro in my hands! I will definetly miss my oldie 7plus Cuz he was such a good friend for past years But it’s time to say goodbye,Juliana Janovická,11 ay önce,0
Ngoài thiết kế cũ ra thì cũng rất đáng mua,Nguyen Gia Phu,11 ay önce,1
I normally skip skip skip but Justine :0 .... I enjoyed your camera review so much with all that background music. Keep it up!,Kenneth Frimpong,11 ay önce,0
"And this is the moment I regret getting the 11 too soon and now I have to wait till next year to get the 13 thanks to my current phone carrier !

Update: I have an iPhone 13 pro max in Sierra blue now️!",Kevin Casey,11 ay önce (düzenlendi),0
Na espera de vir pro Brasil 🇧🇷 msm q n compre rs,Mario Nascimento,11 ay önce,0
What kind of tripod were you using for your phone? When getting a new iPhone I have always found your videos very helpful!,EAL’s Pop Shop,7 ay önce,0
Makes me want to run out and buy the 13 pro max. ,2000fordhd,11 ay önce,0
One word JUST AMAZING,Hunain Hamid,11 ay önce,0
this is more like a advertisement. you have done a great job as a paid review. apple is gonna happy with you,MD Pavel Hossain,11 ay önce,0
"Watching from INDIA🇮🇳
      Loving from heart ️️",Gaurav Tavar,10 gün önce,1
Test it at night to see how much light can those new lens/ sensor get ,Christopher Castagnet,11 ay önce,0
Apple users getting mad over Macro Mode . But android is having this from ages. ,Deven Mhabdi,11 ay önce,0
"iPhone 13 battery test shows a marked improvement on a weak spot of the previous generation. Also iPhone 13 Pro has a noticeably smoother screen than the 12 Pro. Once you experience a 120Hz display, it’s hard to go back to a 60Hz one. ",MyCamSight,11 ay önce,0
Awesome review ️,Nghi La,11 ay önce,0
This is the video which will be played on every apple store ,Vishal Sancheti,11 ay önce,0
"God, I love watching this ",Felipe de jesus Morales Mena,11 ay önce,0
Macro n cinemstic mode ,Darkus what's next,11 ay önce,0
I can’t wait to see videographers making cinematic with the iphone 13 pro max,🌱,11 ay önce,0
Debut time: We can literally buy a new iPhone in the price of her makeup ,Justarandomguy,11 ay önce,0
I just watched this video and I’m already loving you. Thank you. You are so funny.,하늘하나,6 ay önce,0
"Remember when Samsung was mocked for making pictures too ""saturated,"" now all of a sudden its accepted and fine ! Cinematic is cool but you can definitely see the imperfections in blur, which is no problem to me, its just that Samsungs live video was ""disappointing"" since edge detection was off, seems like its ok now since Apple has that too! ️️️ Its perfectly fine to go with whatever company makes you happy, just don't look down at another for its flaws since one day, the company of your choice may have similar flaws too!",1993rufus,11 ay önce,0
Can someone explain to me how you get the live text? I can’t seem to get it work. Is there a setting you need to put on?,TV&M Guide,11 ay önce,0
I love how no phone reviews in 2021 actually discuss how the phone calls sound. ,Jason V,11 ay önce,0
Yes so exited upgrade from 7plus to the new 13 pro max ,vespawoman,7 ay önce,1
Yep I’m sold No longer a debate upgrading from my 12 pro max. ,don taylor,11 ay önce,0
Omg such an amazing home the pro models seem to capture it so beautifully. It doesn’t help you’re so gorgeous!!!,Louis Schmidt,11 ay önce,0
Man this video really made me want to upgrade from my 12pro,J.R. Araquel,11 ay önce,0
Pre ordered mine today in blue can’t wait upgrading from 11 pro max midnight green ,The Alpha Female,10 ay önce,0
"Watching this on my iphone 8plus
Fun fact: I was inspired to buy iphone 8plus because of you Ms Justin
-much love from Philippines <3",Nino Mabini,11 ay önce,0
I wish they did the pink colour in the pros really struggling to choose between the 13 and 13p ro max!,Poppie Felix,11 ay önce,0
"GENUINE POV: I bought the iPhone XS Max the day it came out 3 years ago and it STILL takes the same quality photos as the new iPhone 13 Pro Max. I tried it at Apple store last Friday here in SF. Apple is good at sprinkling new features onto their camera but at its core most of us stick to XS Max for a reason. The inky colors and clarity is no different than the new iPhone on a normal photo. But Apple needs to make money so marketing is their best friend. PLUS I still get all day battery life (this is my primary computer), it even has zero scratches on my case-less phone and WEIRDLY enough in direct sunlight side by side my 625 nits of brightness screen was brighter than the 1000 / 1200 nits of brightness screen on the new iPhone. Even an apple employee thought that was strange. Perhaps it’s the type of screen? The new iPhone is definitely worth getting if you have an iPhone 8 or less. But just wait until there’s no notch, a usb-c and wide angle in the front camera.",Fig,10 ay önce,0
Looking to get a new iPhone.. this is the place to come. Love it ,Danielle Syddall,2 ay önce,2
Is it true that the cinematic mode only works on 1080 30 fps? Not 4K,S.Craft Blendz,11 ay önce,0
i really love u review with cinematic.. iPhone best smartphone camera,Daysneo Creative,10 ay önce,0
Your videos are such high qaulity. Seems like a lot of thought goes into your content. Great work Justine!,Darren Sanon,11 ay önce,0
Great Video. Yesterday 13 hrs. of  straight rain in Georgia. Seeing sunny California what a beautiful place,kdm313,11 ay önce,0
Interesting content️,Andry Ume87,11 ay önce,0
wish i woulda saw this before i got the pro cuz i wanted the cinematic mode and coulda got the regular 13… at least i got a 120 hz display ,brendon_560,10 ay önce,0
The camera on the new iphone is amazing!,Randy Ragsdale,11 ay önce,0
I cant wait to pick up 13 pro max this Friday!!!,RN,11 ay önce,0
"Was on the fence, probably not going to upgrade from 12 pro - ordered after watching  video ️ thanks for helping me make up my mind ",Tim S,10 ay önce,0
"The emergency part LOL, great video",Daniel R. Erthal,11 ay önce,0
K it was super cute when you genuinely offered ice cream lol. Thank you for the great review!,Rose S.,11 ay önce,0
8K videos recoding and more for iPhone 14 next year coming like the camera 48 MP and the design will be completely changed  and for iPhone 14  pro max will be titanium ( light & strong ) instead off SS material. ,Yahila Million,11 ay önce (düzenlendi),0
"Anyone have samples of the new ""larger"" sensor on the 13pro vs the 12pro, i.e quality of pixel clarity for the same resolution?",Scott Snyder,11 ay önce,0
Just when I was sure to buy the 13 mini I see this video LOL thanks Justine,Arch Domster,10 ay önce,1
Useful review!!,joseph M,11 ay önce,0
This deserves to be trending,Michael Vuong,11 ay önce,0
Fantastic review!!!,Lorenzo Barone,7 ay önce,0
"Want to see more of 13 (๑>◡<๑)
The pink color is so natural and looks so royal!",PT,11 ay önce,0
kisses from Brazil !! Your videos are amazing.,Educosta,11 ay önce,0
You helped me get the 13 pro thank you Justine!,Ezra Brannon,5 ay önce,0
The beach is so pretty. The city too! I wish I lived somewhere like that for the nice scenery. There’s nothing but gravel and dead grass near me,Stephanie Ross,11 ay önce,0
Great video! ,Adam Rebel,11 ay önce,0
This is so impressive ! ,Kùddò Sáchí,11 ay önce,0
Haha trying out the macro-mode like I would do and try to make a close-up picture of your eye  loving the quality on the 13 pro  but I will be holding my 12 pro max for now,Michiel Boerjan,11 ay önce,1
Getting my iPhone 13 pro max in the first of November! I will try to make a review about it. I’m pretty exited!!,Mr Pumpkin Toons!,10 ay önce,0
Amazing ,Diego 元喜 Marín,11 ay önce,0
"The cameras are not the same on both iPhone 13 and iPhone 13 Pro, the lens specs are different.",Miguel Ruivo,11 ay önce,0
Its so beautiful! Might get this as a graduation present for myself next year.,INFJ-Tin,11 ay önce,0
"If i dont end up upgrading to an android I’ll probably get a 13 mini. Not because its the cheapest version, because it can actually be easily used 1 handed and fit in my pocket",mariofan VIDEOS,11 ay önce,0
Great shots! I am in the brink of switching or not to switch ,Jeunet,11 ay önce,0
"The reason I should upgrade is so I can snap clear photos from 2 centimeters … uh, no.",J A,11 ay önce (düzenlendi),0
"Thank u! I was gonna get the iPhone 13, but now I know to get the iPhone 13 pro :)",Lia💖,5 ay önce,0
"My parents and sister upgraded to the iPhone 13 Pros during thanksgiving break and my mom sent me a photo of our dogs in the winter storm we’re having while I’m away at college, and wow the photos were insane. Like quality level photos I could get with my DSLR camera that’s $600+. I’m upgrading mine from the 11 pro to the 13 pro in the next month. Of course the 11 pro has a good camera, but it really seems like the 13 pro is 10x better.",Mike Capalungan,6 ay önce,0
"After watching this video, I'm sure to buy this pro Max series",Alveni Dayanti,11 ay önce,0
Anyone know what the camera and lens used for this video was?,Justin J. Wood,11 ay önce,0
We need a review of the 13 mini!!!,María Reneé Sevillano,11 ay önce,1
just got my iphone 13 pro... thanks for the video,Danny Ordonez (Kiss Jock),4 ay önce,0
this is the first-ever video I have seen from you. Got yourself another fan :D,Raf,6 ay önce,0
Thank you Justine. You are the best.,Tam Nguyen,11 ay önce,0
Omg can’t wait to upgrade my phone to iPhone 13 ,GA 9,11 ay önce,0
What software do you use to download your iPhone videos so you can edit them on your computer?,Mark Sullivan,11 ay önce,0
Thank god i got the last iphone 13 pro max in the apple store :D people in germany now have to wait until November fore their new order. Craaaazy! I love the Macro mode.,Vani Brey,10 ay önce,0
"Hello people and Ijustine ,i have a issue regarding macro video! i can not get mine to work when using 4k 60fps  is this normal? it works fine at 4k 30 fps and photo  mode  please advise would love to hear back from you thanks (ps great video Ijustine love how you show features that normal people would use )",s lewins,10 ay önce,0
I want it! Lol. I’m not done paying off my 12 pro max ,Kristina,11 ay önce,0
"i have just got my iphone 13 pro gold i had the 11 pro, wow love this and the camera damn..",Alison Alibongo,9 ay önce,0
Amazing video!,RADD Gaming,11 ay önce,0
