text,author,date,like
Exactly the opposite reaction to Marques . Love it! It's cool to see two different reactions to the same device.,AYAN SINHA,10 ay önce,139
"Love you ️ Justine, you make the best unboxings and reviews ️",Miguel Perez,10 ay önce,19
"This review is so bright compared to MKBHD’s video, I like to see positive aspects on different approaches with this kind of devices, most popular form factors are not perfect either",Mauricio Montoya,10 ay önce,25
"Wow, great review Justine!!  I love watching your videos because I can tell that you really enjoy what you are doing, and seeing you happy makes me happy!",Time 4 Tech,10 ay önce,8
Justine always is and will always be excited for a tech unboxing! And her knifes.. obviously.,Jonathan Cortez,10 ay önce,10
"Duo 1 made me a believer. My Duo 2 is on the way and I'm excited. Definitely a device not for everyone depending on their needs.

I love using it as a DS to play games on gamepass or Among Us lol.",Eli,10 ay önce (düzenlendi),16
This is a much more pleasant positive review of the device. Even informed us of new features. ️️️️️,Peter Howell,10 ay önce,4
"I wish iJustine would do an All-Knife episode. Devote the entire episode to the knives she has and her thoughts about them. Like, she might really like certain knives, but which ones are her favorite daily use knives? And for which functions?",Allen Schubert,10 ay önce,15
It looks like an advance Nintendo DS when in Landscape mode,ImAlexSaur,10 ay önce,61
"I was just talking to my wife about the Microsoft Duo 2 and... Nope! I am passing on testing this gadget this year. If they decided to release a Duo 3.0 in 2022, sure I may give that a go. Sticking with my OnePlus 9 Pro, Apple iPhone 12 Mini, and the Samsung Galaxy Z Flip3 - those three portable gadgets are enough for me. Nice review & promo Justine ",Peter Herget & Gadgets Anonymous,10 ay önce,1
I love your videos! So entertaining!,Ishveer Bhogal,10 ay önce,6
"Although the Surface duo is a great device, it still has some flaws that I hope Microsoft fix soon.",M i Α vℓσg gσ тσ му ¢haηηєℓ!,10 ay önce,4
"Best overview of the Duo today Justine! I can see you understand HOW the device is supposed to be used.

Most other videos are harping on the fact that when you span 1 app to both screens that there is a gap.... Duh!",iTuber012,10 ay önce,13
"When Apple does their dual-screen and/or flip versions of the iPhone someday, Justine will probably buy 5... 

One for each color.",Jordan Bergstrom,10 ay önce (düzenlendi),2
These videos is the thing we need,Help me reach 38k subs without any Videos,10 ay önce,2
Always love your video Justine ,Aditya Raj Tiwari,10 ay önce,2
I think microsoft is underrated. This device looks awesome ️,Henrŷ Perez,4 ay önce,1
"Good video, informative.  I'm surprised at the price tag though...",DaPoets,10 ay önce,0
surface duo is a nice product even tho i dont think that it'll succeed at all. Nice Video!,Alaa,10 ay önce,3
So many awesome phone options it's hard to choose. Have you seen the new Pixel 6 yet?,Sunfrog,10 ay önce,1
"Looks amazing, deffo on the buy list",Alan McClure,10 ay önce,1
Every time I am so exited to see Justin’s video,𝔹 𝕃 𝕀 ℕ 𝕂,10 ay önce,5
iJustine getting excited over Microsoft products now too? I NEVER THOUGHT I'D SEE THE DAY,Bobby Barnes,10 ay önce,1
"Yeah, I'm intrigued by the fact that you can have two social media accounts open side-by-side. The camera not keeping up with the Jones is not that disappointing, but I hope that the get that worked out next time.",David Kneitel,10 ay önce,6
Seems like two different product when watch it here and MKBHD's. Power of influencer is quite strong,Tle Watchanon,10 ay önce,10
"great review. You made it refreshing and not like Marques where it felt it was the end of the world.. these are all first world problems at the end of the day. if you have the money, buy what you like for what you use it for.",Freddy Hill,10 ay önce,2
Great review,Gro Thorbjørn Berg Sørensen,10 ay önce,0
"Very helpful information you shared about gadgets,  keep going, looking forward to upcoming videos,  god bless you ",Technotronicss Official,5 ay önce,0
"Every time I feel depressed, I watch your videos. Good vibes all the time! :) :)",Aiken,9 ay önce (düzenlendi),0
Cameras not the best but think I'd prefer that duel screen than the folds fold still totally noticeable! I couldn't live with that on such an expensive device! Love my s21 ultra take Alot move!,Charlie,9 ay önce,2
"Refreshing to see someone who gets it. It's not supposed to be a candy bar phone that is wrong, it's something new, different and cutting edge.",Sean's DIY & Reviews,10 ay önce,1
Anyone else prefer this over the fold 3? ️,ThreeTwentyTech,10 ay önce,28
The new studio is looking awesome!!!,Agent Buzz,10 ay önce,0
"""This is a dream come true"" - ijustine about opening Instagram and tiktok at the same time lmao",iwilitu,10 ay önce,4
Nice one Justine. Have been looking forward to this one.,John Howell,10 ay önce,1
Morning Justine!!! I have one coming this morning! Can't wait to use it since I didn't get the first one.....should be fun,Vyyyper,10 ay önce,2
I have the Duo 1 and it's my favorite phone.,Muyanzi Reid,10 ay önce,0
"This video is so nostalgic ️ white background, super excited justine with some crazy stupid knifes ️",Ali Abbass,10 ay önce,2
"Son : Mom , can i get a Nintendo DS?
Mom : we already have the Nintendo DS at home.
the Nintendo DS at home :",Pew.mp7,10 ay önce,51
Finally a positive review,SociallyDysfunctional,10 ay önce,1
THIS IS MY LIFE I NEED IT,ItsDunneh,9 ay önce,0
Thank you . The only sensible review out there for this device. .,Hk,10 ay önce,0
Where did you get the Duo cover? I can't see it on the MS website.,Garry G Bain,10 ay önce,0
I hVe the first one I would really like to try the second one but idk about spending another 1500 if it's still buggy I love the duo still my daily driver multitasking is amazing make my iPhone feel dumb but it took a wile for this phone to get to where it is with updates. But also the camera is it really worth the upgrade idk but lastly I could actually get android 11 lol idk man. good job wish I got a testing dummy b4 I invest a 3k total for the newer model lol,toneAD3,10 ay önce,0
"Well you are the first YouTuber that is positive about it. People need to understand, that it is not a phone, it's a working station for people on the road that has a phone option. 
I have the first Duo and I Don't  miss the cameras because I'm using it as a mini laptop for work when I don't want to carry heavy backpack.",The Toy Frontier,10 ay önce,0
"""look at you"" is all I live for",maxwell,10 ay önce,2
It reminds me of the New Nintendo 3DS XL.,Baconface McGee,8 ay önce,3
Love how the first two videos I see on my feed are hers and Marques’ LOL,Rhee Bee,10 ay önce,2
MS Surface Duo 2 became more exciting. Device looks bigger and did the screen got bigger a bit ?,SHISHIR KUMAR BANERJEE,10 ay önce,1
Great non-bias review other reviewers act like it won’t even turn on. Just subscribed and liked.,DBC3,10 ay önce,0
Man. This Nintendo DSI revision looks great,TommyTheLizard,9 ay önce,1
One day lol I've been watching ijustine since I was probably 13 now I'm 17 and it's like give me anything I'm so jealous lol anyone else watch these videos and just dream?,Maia Sheard,8 ay önce,1
This is the first review where I saw a case!,A D,10 ay önce,0
"Justine, well I could imagine if you could review the Motorola Razr the first Smartphone flip phone, to say what is your reactions to it?",Embargoman,9 ay önce,0
Who  at microsoft thought it would be a good idea to have a Nintendo DS as a phone?,Gabriel Volpi,9 ay önce,0
"Did MS send the review unit? The pen cover isnt even available to buy yet. It will be on sale in a few months. I got burned with the first Duo. I like her as a person but the reviews always seem a bit too positive, never said anything poor about the device. The thing has a ton of flaws",Eric James Alpha,10 ay önce (düzenlendi),0
Ayyy Justine……..huge fan from Bangladesh 🇧🇩,Imrul Khan,10 ay önce,1
Justine lets be real…it’s not that great…but love how you are excited about everything ,rohan ingle,10 ay önce,10
Fold 3 user here. Man..that gap in the middle is unbearable. But dual screen would be really useful if they were optimized properly for this phone,RyanM,10 ay önce,1
Epic hybrid phone!,Alan L,10 ay önce,0
"If Microsoft can get their software right, this could very well be the phone of the year.",ThreeTwentyTech,10 ay önce,6
Great video,Crunchy,10 ay önce,1
"Every “review” is like an iJustine commercial. She’s always excited, everything is always great, and we know she won’t actually use them past the video.",willkid123,10 ay önce,1
The best tech YouTuber ever!!!!!!,Kevin,10 ay önce,0
"the next surface duo 3 should have external screen. like e ink should suffice. and can answer call, take photos, without flip open the device.",Raja Sharidan,10 ay önce,1
"I miss the background, you should keep it in the new studio.",haarp35117,10 ay önce,0
I think it would be the SurfaceTuo,1977NOBODY,10 ay önce (düzenlendi),1
does anybody remember having a DS? this is kind of like the modernized version of it. also i have not owned one before but i love to see if it’ll let me watch youtube and let me play my favorite blocky game EVER. if you think it’s roblocks the. you’re ABSOLUTELY WRONG. AND A GIANT DISAPPOINTMENT.,Cow_Queen2000,10 ay önce,0
Wow it's cool,Apple Iphone,10 ay önce,1
"Every since I watched Marques's video on this, I can't get over the gap between the two displays. It's really bad for reading and consuming other content.",DctrGizmo,10 ay önce,3
"Sat, 23 Oct 2021
    May I say, Ma'am, you seem as lively and pretty as the new iteration of the Duo - Duo2.
 Well, almost.
  And that's why I'm in the UK saying this, because I don't want my ears boxed....",Geoff Adams,10 ay önce,0
basically doing everything the Samsung Note does when working in split view.,Tony,7 ay önce,1
"A little SUS... iJustine ""loves it."" MKBHD ripped it to shreds...",Albert Naranjo,10 ay önce,1
Wait so you can play XBOX games on this thing? ,JoJ LaL,10 ay önce,3
I like the black. I just don't like the camera set up. I need the new generation of phones to have the same camera systems but flush with the rest of the frame.,Palamecia,9 ay önce,0
True Fact : Parents are the only people who never feels Jealous or sad after seeing their child's success️,Click'Me Now⚠️,10 ay önce,7
Your the best person when it came to tec,Jaco Winterbach,10 ay önce,0
"You can always count on Justine to give a positive review no matter how bad the product is.  LOL
“Always look on the bright side of life… do do, do do do do do do!”",James Baker,10 ay önce (düzenlendi),0
"Really, soo cool!",Tudor Coman,7 ay önce,1
I’ve never really seen people buy Microsoft’s surface duo phones. Is this like a limited supply kind of thing?,Brian Fung,10 ay önce,0
"It remains a huge flaw, in my opinion: impossible to take pictures relatively discreetly, without looking like a Japanese tourist with its tablet, since it is impossible to do so when it is opened and turned over. By definition, the cameras would be covered by the other half. And that seems to me to be a crippling daily point! Shame.",elpabar,10 ay önce,1
Great  ,Amazing,10 ay önce,0
"I don’t get this device. What problem is it solving?
Most medium to high end smart phones have better quality cameras.
It’s bulky, so would be a pain to carry around all day and an iPad is far better for media consumption.
Suspect this will bomb like the first one as I just can’t see a market for it.",Phil McWilliam,10 ay önce,2
Nice video iJ!,Campwise05,10 ay önce,0
Making a tablet look like book is like making a car look like a horse.,ANISH DHAKAL C 2,10 ay önce,1
How exciting for that! ,Sydney Helton,10 ay önce,1
I need that iWatch you know .. ️,Zachary Mitchell,10 ay önce,0
that looks more like a small tablet than a phone... too big for such small hands ️,meme GOD,10 ay önce,1
MS should try Neo Win11 instead of this with phone call capability,A J,10 ay önce,0
awesome. i wish this was available in my country,Jason Yu-Gi-Oh!,10 ay önce,1
Who tf cares about the surface after that seeing such an insane knife. Leave the surface and link all ur knives ffs.,Goda Kartik,10 ay önce,2
the way this device doesn’t excite me  here for iJustine,Hazim Abron,10 ay önce,1
"The cameras sadly still suck. I am still using my LG g8x thinq and while it doesn't look as pretty esthetically, it still seems to have more features. And for 400 bucks",GrimmyReaper,5 ay önce,1
Does it comes with a charger?,Stéphane Selikoz,10 ay önce,0
Super cool,Amazing,10 ay önce,0
"It looks cool ,but that's where the fun ends. The price is 1400usd, the camera is not best in class. There is nothing amazing on this device to justify the price",warcrab cyber,10 ay önce,1
"Accidentally found your channel. Felt happy to find another female tech youtuber. I almost subscribed after watching this video. But as feared, this channel is polluted with apple content. ",Arnold M Xavier,10 ay önce,0
"I love Duo 2, it is just second version it is a lot better than the Google Pixel the second version",kim soy Piseth,10 ay önce,0
Awesome ij,DEB V.C,10 ay önce,0
You still have that iPhone you're so excited about back in the day?,The Zombie Guy,10 ay önce,0
"At 1'st I watched review ""Surface 2 DUO"" by iJustine... and WOW!!! Cool!!! 
Then I watched review ""Surface 2 DUO"" by ROZETKED... and... hm... so-so device by NekroSoft... NEXT!!!",Александр,9 ay önce,1
THEY NEED ALOT OF WORK. IF THEY COULD JUST ADD A FRONT SCREEN  AND HAVE A FOLDING SCREEN INFRONT INSTEAD OF THE SPLIT 2 PANELS BECAUSE I'VE USED IT AND WHEN WATCHING ANYTHING IT CUTS OUT THE FACES IN THE MIDDLE,L,9 ay önce,0
,KAYAL PHOTOGRAPHER,10 ay önce,0
can you ditch the iphone and use this device for the next year if you think its so good ,Turtle Power,9 ay önce,1
Microsoft going to sale all the unsold surface Duo 2s to Nintendo.,xguy9,10 ay önce,0
Was that a Starlight aluminum Series 7 Apple Watch I saw on your wrist!?,klxz79,10 ay önce,0
I like your videos,Feels Bier1,10 ay önce,0
"That is a cool 
First ",yeah ronish,10 ay önce,2
THEY SHOULD REPACKAGE ((NINTENDO 3DS)) GAMES AND MAKE THEM FOR THIS DEVICE.,kris ertmer,10 ay önce,1
0:48 ijustine realizing her apple watch is in the shot.,Eric Gonzalez,10 ay önce,0
Maybe I missed it but show us opening a web page with on both screens or some game on both screens...read the TEXT in the middle .. you cant?  Have to also say I don't know her form Adam but love how happy she always is and I pray its ok to ask these kind of questions.. granted the so called FANS treat you so awful.,Mary Wow,10 ay önce (düzenlendi),0
love you from Iran🇮🇷🇮🇷🇮🇷️,mohammadmahdi masumzadeh,10 ay önce,0
that wouldn’t break easily will it,The Random Sound!🔉,10 ay önce,0
How did you get a Pen Cover ? Jealous :(,Vannebago,10 ay önce,0
This is a First Look not Review guys!,James Andrews,10 ay önce,0
"If apple make this, i will buy",Mat Pauen,10 ay önce,0
AND THE FOLD 3 WOULD BE GREAT BUT ITS TO BIG AND THE SCREEN IS WAY TO SMALLER IF THEY THIN IT DOWN AND ADD 1 INCH OF SCREEN IT BE WORTH IT TO SEE WHOS FIRST,L,9 ay önce,1
"prodano,uzimam  ",Zoran Bakotić,10 ay önce,1
I just have one thing that to me is weird af. The notifications through… the hinge? I guess it’s smart if it’s exposed anyways buutt seems a little lazy?,SketchTheParadigm York,10 ay önce,0
I'll take the black one. Cars for function one would order a white one. A black vehicle has class. Classy.,Jack Sanchez,10 ay önce,0
"“I’m here to tell you right now…we don’t care, we don’t care”",ASVP HIOS,10 ay önce,0
"I… I kinda want it. But just like the iPad mini, wtf would I use it for?",Collin J,10 ay önce,1
Keeping my duo 1 its better,owo グーチmoshi :),10 ay önce,0
Whear is that cover from?,The Star Wars emperor,10 ay önce,1
If it was just a bit cheaper...,Nic_CCC,10 ay önce,0
I’m pretty sure people will use this to play games rather than use it as an iPhone,Christian Rodriguez,10 ay önce,1
"I dont really like this idea...

Microsoft sells a mobile device which runs Android..
I've watched MKBHD's video about this and he mentioned many key things. There are tons of SW issues and bugs at the moment.",MRZsiir,10 ay önce,0
Who makes the magnetic case? Its not on the Microsoft website?,Michael Bando,10 ay önce,0
I watched Marques and hated the phone and watched iJustine and want the phone LOL,Dillon Chan,9 ay önce,1
,Tech From A2Z,10 ay önce,0
,De mel Production,10 ay önce,0
Yes new video!,Wyatt,10 ay önce,2
"Iam here after watching this from Windows Central, lol",Abdul Malik,10 ay önce,1
"A sharp knife is safer than a dull knife.  I am a professional chef.  ""Here within an Hour""  I wish I could afford a surface pro..I am saving money for a medically necessary surgical procedure..Medical expenses come first unfortunately.",Stephanie Fritsch,10 ay önce,0
it's the surface tew-tew. LOL,Okafor Michael,10 ay önce,0
Now this I like.,Dante,10 ay önce,0
Tech Burner Viewer Be Like :- Bhabhi ,Binod Tharu,10 ay önce,0
This is upsetting: what's the point of pre-ordering (the day of announcement even) and not getting the product the day it's launching!? I love your reviews but it pisses me off that I didn't get mine yet.  Never pre-ordering again unless I know there's an advantage!,conartistic,10 ay önce,0
why are you the only reviewer who loves the duo 2....$1500 for this uck!,Eric Rosner,10 ay önce,0
good,Mohamadreza Ahmadi,10 ay önce,0
You are that excited over the surface Duo? Faf,Skeleton Report,10 ay önce,1
Hey how many smartphones do you have,Jef,10 ay önce,1
,Travis Garnett,10 ay önce,0
Hi Justine You,Rebbecah Israel,10 ay önce,0
Is the cover case just one side? Is that a joke?,Terry Situ,10 ay önce,0
hi! So you promote a give away on other videos and then you don't send the product after requested to send you money? THIS IS A SCAM!,skatalize,10 ay önce,0
Hi Justine ️.,Tony Rodriguez,10 ay önce,1
Nice,Namashivath Saravanan,10 ay önce,0
How much ?,Alfred Albert,10 ay önce,0
You have so much things but you just use it for little so you need to use everything things you have too,it's about gaming,8 ay önce,1
Good,LEE CHIN LEONG,10 ay önce,2
️️️️️,Rajendra Davey,10 ay önce,0
first comment from nepal️,Sabin Gautam,10 ay önce (düzenlendi),1
I have the duo 1 lol has lots of glitches and after 4 months today stopped working I have an appointment in best buy tomorrow for warranty,meme NOPro_22,9 ay önce,0
What is this for?,Tom S,10 ay önce,0
Team Lefty ,Kylo,10 ay önce,1
The fact that it can't lay or fold flat anymore.... Ugh...,Alf Lenni Erlandsen,10 ay önce,0
"Nice but not pocketable, Fail Microsoft",Lazzar,10 ay önce,0
,Md Saqib Ans,10 ay önce,0
When will you unboxing Pixel 6 pro?,Ram,10 ay önce,0
Love you,Heather Astbury,10 ay önce,1
"marques didnt mention the stuff youre talking about, very fishy",Muaynudeen Sangay,10 ay önce,1
So windows phone is kind of back?...,jeremy enjaynes,10 ay önce,0
Wheres the Neo though?,Sebbir,10 ay önce,0
Nah this phone is a big no from me,Flávio Fonseca,10 ay önce,0
She's so sweet,DAVID GARCIA,10 ay önce,0
Good morning Justine,Edward Sanchez Productions,10 ay önce,0
C  type?,Lucky Roy,10 ay önce,0
This vs MKBHD lol,Dougie James,10 ay önce,0
Justin forgot to put a link to buy it.,Aaron Hendrickson,10 ay önce,0
Woooow,aliakbar Rasouli,10 ay önce,1
You look different in 2008 or 2007,The joker,10 ay önce,0
You're the only reviewer that seems to like it ... how much they paying you! lol,digitalave2,10 ay önce,0
Why would they have a sequel on crap product?  It's going to be half price after a few months.,Ken T,10 ay önce,0
You need to answer those 10 text messages,A toda madre,10 ay önce,0
I dont like this tablet its old school tech circa 2009 nintendo DS and sony tablet P. Also at 1600 bills microsoft are smoking on something strong..,fendi gucci,10 ay önce,0
A phone or a tablet,Angel And Liam,10 ay önce,0
Justine my favorite blondine,mitchel marvin,10 ay önce,0
Its a ds 4XL,I404,1 ay önce,0
HI crazy,Maathulan,10 ay önce,1
Like LG,jp lipura,9 ay önce,1
Cool Justine,starbook5,9 ay önce,0
justin is getting old,zidan khan,10 ay önce,0
Double Bubble...,tibor kovacs,10 ay önce,0
and this is better than samsung fold and flipz,altintosh,10 ay önce,0
3DS XL,PC_PRO,2 ay önce,2
очередной ширпотреб..лучше АЙФОН ПРО МАКС 13 НЕТ  И НЕ БУДЕТ,Suliman sultan,10 ay önce,0
"I don’t know which organ she used to see, for my eyes those photos suck",Mohamed Nasharth,10 ay önce,0
I love you girl u r beautiful,abdulrazak mawaldi,21 saat önce,0
Sumsung galaxy flex laptop and galaxy cloud pink use it,MIR MIZANUR RAHMAN,9 ay önce,0
I justine the new xbox is out now,Nick Silva,10 ay önce,0
YAY,Dimitris Christou,10 ay önce,1
これGalaxyですよね,kazuya賀津也,10 ay önce,0
It just doesn’t  make any sense to buy this. It’s useless!,Dreamer A,10 ay önce,0
2021: 1:00,Vanja Dobrijevic,10 ay önce,0
Claim your “here within an hour” ticket right here,,10 ay önce,86
Wifey!!!,emoji_mie,5 ay önce,0
This feeds ADHD.,Canada HQ,7 ay önce,1
Should have made it bezzeless ️,MikeStrafaci,10 ay önce,0
Question! Are you a Trumper or a Bidener?,M T,10 ay önce,0
Can play COD or PubG,O+1=O,10 ay önce,0
"spacs and what is it good for,.absolutely nothing",cris snickers_frog,10 ay önce,1
Here within a minute,Jacoz CODM,10 ay önce,0
️,,10 ay önce,0
No. No it isn't.,SwitchBlade,10 ay önce,0
Back with the white background,Alfie Davis Singer,10 ay önce,0
Hi Justine,Ben Espinosa,10 ay önce,1
that thing looks horrible.,Nicolas Rivera,10 ay önce,0
Noise,juicy fruit,10 ay önce,0
,,10 ay önce,0
"With a Straight Face too, Justine",Jay'Ce Crenshaw,10 ay önce,0
Can I have a shotout,Ebyn merkley,10 ay önce,0
Hii,Dina Babaei,10 ay önce,1
Cause the first one was such a winner??  I owned it. Horrible garbage. How much did they pay you to shill this garbage.,Alex Alexzander,10 ay önce,1
Here within 2 minutes,Jacoz CODM,10 ay önce,0
yooooooo,Ishveer Bhogal,10 ay önce,0
2nd and ,Francis Chaske,10 ay önce,0
Hiii!,iilux Knight,10 ay önce,0
hello justine!! first comment,Divija Yerneni,10 ay önce,1
Shessh,Charley,10 ay önce,0
First?,Jake Parks,10 ay önce,1
"The Z fold 3 is superior in every way. Three screens. better software, five cameras and etc.  Don't waist your money on the Microsoft flop two.",Armtech,10 ay önce,0
Firsttt,Dhruv Ahuja,10 ay önce,1
First view here Justine,kirby's Dream Buffet,10 ay önce,2
when u will marry ?,Shikhar,10 ay önce,0
4th,Clapz ツ,10 ay önce,0
You're do dramatic,Hassan Ger,6 ay önce,0
W,Unknown Memer,10 ay önce,0
Shiw,Edio Corrêa Jr,10 ay önce,0
I think it's time to retire ijustin,Luis,10 ay önce (düzenlendi),0
Sorry but this thing is worst than before,Subhadip Paul,10 ay önce,0
amazing unboxing once again! ,David Paris,10 ay önce,1
