text,author,date,like
"Really considering this keyboard, looks neat! On a completely irrelevant side note: The amount of content creators I see who were glad the TouchBar has gone have their MacBook closed and plugged into a monitor ",Eric Cartman,9 ay önce,100
"The MX Keys Mini is a lovely keyboard. I'm very happy with mine. My only criticism is Logitech's decision to go for non-standard F-keys. Not having the normal shortcuts for screen brightness, launchpad, and mission control is a little annoying. You can remap the F-keys in Logitech Options, but standard Mac F-keys would've been better. Other than that, it's great to type on and looks lovely.",Ben Adamson,9 ay önce,31
Just watch the video showing the capabilities of the MacBook M1 MAX I really love it,,9 ay önce,37
"I just want to say that Justine and her team are amazing... I have been watching you for many years, always checking your reviews before making a purchase. It is truly an honor and a privilege to see how this channel has evolved over the years. You are an inspiration to myself and many others. Don't ever stop what you do and how you do it. Hope to meet with you one day in the future maybe. Blessings and Forever love to you... The queen of Gadgets. and the next CEO of Apple marketing.",Ryan Durgacharan,9 ay önce,2
"Great vid!  Thanks for the tour of your space and accessories, Justine.  I have the gray and white logitech keyboard and love it.  My only concern is that it doesn't have computer brightness settings, which is a strange choice to have left off the keyboard.  It's easy enough to go to the control center, but it would be quicker to have it on the keyboard.  Otherwise, I love it.",Dennis Perkins,9 ay önce,1
"Thank you so much for the video, Justine! I love how you're able to run your two massive displays and all those drives straight off of your Macbook ! Can't wait for more news about the studio! If you don't mind my asking, is it your new house or just an office you drive to?",Jordan Bergstrom,9 ay önce,8
"That reminds me of my MX Keys wireless keyboard, it has a numpad so it's bigger, the key stroke is excellent, but the main point is that it's compatible with both PC and Mac, with a single key press I can instantly switch from my PC to my Macbook, so convenient.",Ching-Chen Huang,9 ay önce,4
"As always a great video Justine! I noticed in your videos that you could take a great advantge of a motorized standing desk. I had back problems in the past and as I started changing positions, it improved 100%. Greetings from Slovakia ️ (if you know where that is )",Jakub Stafa,9 ay önce,1
"I got this keyboard in September, and it is so amazing! The fact that you can connect this to your iPad is absolutely amazing for when you are writing/editing on the go. I also really love the feel of the keys on my fingertips.",Ash,9 ay önce,0
I have the MX keys mini and MX anywhere 3 and LOVE them. It’s truly a perfect combo ,Lizz Dimaano,9 ay önce,3
Thank god you got that Mac Pro so you have a place to stack your drives on.,mogolfiero,9 ay önce,35
"Why I love Justine - she caters for the hard of hearing viewers like myself - I normally have to wait a day or 2 after her uploads for the captions option to show up but they always do, every one of her videos has English captions to help out viewers like myself. Thank you Justine, you're the best!",U A,5 ay önce,1
"I've been rocking an MX Keys and Master for Mac for a while now, and love them both.  I'm using Anker Dock with my MacBook Pro, but how do you deal with all the drives connected to the dock being disconnected when you disconnect the Thunderbolt cable from the Mac to the Dock?  Are the incorrectly ejected messages not annoying?  I'd love to make them stop!",Adrian Williamson,9 ay önce,1
The MX Anywhere is my all-time favorite mouse. I've had the original and the second generation. Want to try the third generation.,dgeviper,9 ay önce,19
"With USB4 standard being out for awhile now, and it being backward compatible with previous USB standards, and being Thunderbolt 3 at heart feel that this should be in more products.  In fact from a technological standpoint could be in all products that have a USB connection even if you have to use an adapter for the older type A ports.",Brent Smithline,9 ay önce,1
"I'm going to upgrade my external keyboard to the new Mac one with the fingerprint scanner for my maxed out M1 Max 16"". that feature is just impossible to beat when using an external display.",Austin Ball,9 ay önce,0
These are great recommendations. I've been looking for a reliable hub to power my Lenovo Yoga and accessories. I'll checkout the OWC hub. Thank you!,Ericson Herbas,8 ay önce,1
EVEN THE OLD WIRED LOGITECH MICE STILL HAVE THAT SATISFYING CLICK SOUND! Logitech never disappoint! ️,Reno,9 ay önce (düzenlendi),6
MAKE A REVIEW PLEASE!!!!! Thank you for the accessory options btw hahaha! I really can’t wait to see your review I love you ️️,Jzappia101,9 ay önce,1
"ive got the MX Keys full sized- picked it up a while a go for a easy carry around the office... if only i didnt need a numpad lol like the size, still prefer a mechanical board though. Also picked up an Aker 65w power adapter for travel- sooo much smaller than the brick that comes with the new MBPs- loving it!",Andrew P,9 ay önce,1
Seeing the set up is mindblowing!!!! . Thank you for another review IJustine!!!,Dis Familia,9 ay önce,1
I loved this video!! Thanks for all of the awesome content!,Time 4 Tech,9 ay önce,1
Omg these all look so cool! Love the vid Justine!,Marissa Haselwander,9 ay önce,5
Linus gonna be pissed seeing u replaced his storage setup with this new shiny black one haha :D,AllStar1568,9 ay önce,28
I have the MX Master 3 mouse for Mac and the MX Keys! Awesome products!,Jonathan Maes,9 ay önce,2
"If you have all those drives connected to the MacBook through the dock, do you have to manually eject each one before unplugging the dock? Or is it ok to just unplug without ejecting?",JerBer1218,9 ay önce,8
I have the full sized Logitech MX Keys and it is a fantastic keyboard that is essential to my work going between Mac and PC.,Ryan Longacre,9 ay önce,2
I love the logitech mx keys mini and mx anyware 3 I use them for my macbook air wihtout any problem and the typing is really fast plus I  if you are working with excel and data bases the horizontial scrolling is the no 1 feture. One more I use with the mobile office bag si the satechi usb-c on-the-go  very good hub and is very compact and it has extra usb type c and gigaethernet and bonus vga adapter for some old  monitors,Συμεών Τσαμαντουρίδης,9 ay önce,1
The new MacBook Pro looks so awesome,Edward Sanchez Productions,9 ay önce (düzenlendi),0
great setup. The easy switch feature is very useful.,Otumar,9 ay önce,1
"Justine: “the main sort of storage solution is the  Thunderbay Flex”
Linus: “am I a joke to you?”",Keegan Goerz,9 ay önce,6
Do you have a list of keyboard commands that you use when editing in Final Cut Pro especially when scrolling through footage?,Jenna Kathleen,9 ay önce,0
Love that the Mac Pro is seemingly just a pedestal for the drives. ,Semikami,9 ay önce,2
"Love Logitech gear! Do you have any on-the-go MacBook accessories you use (cases, sleeves, etc.)?",ChunMan,9 ay önce,0
Awesome Video Justine your the best ,Ben Espinosa,9 ay önce,1
I love those accessories especially the pink ones. Pink is my favorite color too :). Thanks for sharing :).,Autumn Prestwood,9 ay önce,0
The MX anywhere 3 mouse's Magspeed scroll wheel takes scrolling to a whole new level. The ultimate mouse for Coding,Shibalik Dhara,9 ay önce,0
The new M1 Macs are so beautiful ,Madeline,9 ay önce,1
Great video! I might get the 14 inch macbook,Harish world,9 ay önce (düzenlendi),2
"I’m interested in the mouse for sure (have been looking for a good one) 
Not sure about the keyboard though…. seems unnecessary",Terri K,9 ay önce (düzenlendi),2
it’d be nice if you make a setup tour. since like you have got pretty damn good modern tech in your room which connect to each other,kenvs,9 ay önce,2
I love your computer set up!  I wish I can have that,Kevin Dagostino,9 ay önce,0
"I just priced that RAID ThunderBlade, and my eyes went . LOL I guess I need to keep shopping around. A bit out of my price range. The specs look impressive though!",Jeffrey Ward,8 ay önce,2
Has your Mac Pro been turned into a a hard drive stand? ,nTV,9 ay önce,4
Would consider if the MX Keys Mini had Touch ID - so used to it now on my M1 24” iMac keyboard - assume Touch ID is proprietary to Apple,tjd3434,9 ay önce,0
They should make one with a number keypad. I love to crunch numbers on the fly ,Alan L,9 ay önce,1
I love ️ the way you edit  your video I love  watching your video you make amazing  video you make awesome  video you make amazing  video,Saleita Smith,9 ay önce,1
Beautiful Accessories ,Ghita Aster,9 ay önce,1
When does ijustine test universal control with the new keyboards ?,Alexander Hilberger,9 ay önce,0
Not usually a fan of TKL keyboards but these do seem nice though!,Lurick,9 ay önce,2
"I got MX Keys mini and MX Master 3, I think it's the best combo for everyday use/work.",Browney,9 ay önce (düzenlendi),0
Hi Justine I was just wondering when you will be putting the 16 inch M1 max  through its paces thank you I’m eager to see what you think I’ll see what I can do,Matt Lemos,9 ay önce,7
That's so cool!! Cant believe the Logitech keyboard works with mac and the iPad!,Ishveer Bhogal,9 ay önce,1
Can you do a full day of how you use the power and the setup please?,Catalyst X,9 ay önce,0
Justine has blessed us with a lot of videos this week. She must really love us.,Randy Ragsdale,9 ay önce,0
I really liked how she is using her Mac Pro as a stand for her hard drives.,Naveen Gupta,9 ay önce,3
That would go great with my $12k monitor set up…,Italo de Paula Filho,9 ay önce,0
"You got a dangerous assassin knife there. But great review, love the silver white keyboard ",Paterne YAO,9 ay önce,1
3:18 Like how she says ‘I like that it has a scroll wheel on it.’ Because she’s probably used to always using the apple Magic Mouse,Jason,9 ay önce,2
ok so justine in this video suggests accessories for those that want to work with their macbook pro but only through a display connected to the macbook (e.g the pro display XDR). so i think that if you just wanna work on your macbook pro you dont need them!,MLTN,9 ay önce,1
"And your workspace is awesome, is that an Ikea tabel?? :)",Robert Ekeroth,9 ay önce,0
"I hav the MX keys and it's by far, THE BEST keyboard I've ever put my hands on.",Iliana B.,9 ay önce,0
I LOVE THE LOOK OF THIS MACBOOK ITS AMAZING,ReaperTK,9 ay önce,0
"Justine 2021: I can’t believe we used 512gb.
Justine 2031: I cant believe we used 1tb now we use 20tb",Kenley Tui,9 ay önce,1
Love your channel!  I remember you were in the intro for the Legendary Shots 6 video back in September 2010.  Wow time flies haha,TheBallers131,9 ay önce,0
justine seeing your face gives me so much joy because you were a big part of my childhood!! love you always,oreosandmilk<3,8 ay önce,0
"really like the MX Keys mini, can it work with my iPad pro?",Lydia W,9 ay önce,1
Awesome desk setup. I like your new desk setup with your Mac Studio and Studio display.,Matt Halpain,1 ay önce,0
Hi  @iJustine I have a question between the MacBook Pro 14 or 16 inch which one should I choose for video editing?,Mr_Shanefrost,8 ay önce,0
Do you leave your macbook m1 max plugged in all the time (unless you go out with it)? I'm a complete luddite but would love some advice about how to protect the battery over time!,Tex,8 ay önce,0
Certainly a very affordable setup!! ,Rodrigo Macedo,9 ay önce (düzenlendi),0
I like the videos but all these amazing toys makes one jealous sometimes.,Nick Ice,9 ay önce,1
Do you prefer the Logitech keyboard or the Apple one? The Logitech one looks dope!,Pranav Gupta,9 ay önce (düzenlendi),16
Lol if I saw this a decade ago I would’ve thought that storage was her Comp and the MacBook was the external storage ,choco,9 ay önce,1
I can’t be the only one that thinks she can build a whole house with all the Apple boxes she has lying around her house ,Khobie Anderson,9 ay önce,5
Can you not use one Thunderbolt Port for 2 Pro Display XDR’s using a Thunderbolt 4 dock? I think this was possible on the old MacBook Pro 16 inch.,Crafter 89,9 ay önce (düzenlendi),2
2 Pro Display XDR’s with the stand. Love to see it.,Niinja Slayer,8 ay önce,0
I just wish the MX Mini Keys had full size arrow keys,Huddlespith,9 ay önce,1
"""I like how the the mouse has a scroll wheel on it"" I'm dead ",The Troll himself,9 ay önce,0
Good job Justine beautiful and nice as always!!,Alvaro C.C. 5/7/2006,9 ay önce,2
Amazing Ijustine! ,Sydney Helton,9 ay önce,2
Like this keyboard ️ 🇩🇿 🇩🇿,karim gaouaoui,9 ay önce,1
Can we take a second to appriciate that she has THE coolest knives???,💚Aesthetic🍀,6 ay önce,1
I Love iJUSTINE videos ️️️️️️️,Streamy Youtuberov,9 ay önce,1
"I understand a gal’s gotta make a living, and thank you for all your great videos by the way, but this was really just a commercial for Logitech with mention of a 75TB thing that’s relevant to almost nobody so it’s not purely an ad. So just do a full on ad for them and get paid, by all means! But this left me wondering what you really think of this stuff compared to other like items.",Scott Wallace,9 ay önce,0
"Hi Justin, Enjoyed you video on you Tesla! If you can do a follow-up. On the cool features it has!  Many of us still have the gas cars and are afraid to go electric.  That would be very cool. I think others would enjoy. Enjoy you enthusiasm! It makes you channel lots of fun!!",Sjtabor2000,9 ay önce,0
"To be honest, makes me feel a little suss buying accessories for a laptop that is already so expensive.....",Amanda N,9 ay önce,0
So did you keep the 16” or the 14” for your personal use?,Sohel,9 ay önce,0
Wait!!!… You bought a keyboard for a laptop ,RAP TREND - راب تريند,9 ay önce,4
Have you considered getting a standing desk for your new office?,Catriona Hanafin,9 ay önce,1
"This would be the perfect keyboard for me, but it has no prev/next buttons , why Logitech?, why?, you were so close...",Daniel Commesse,9 ay önce,0
"I love the knife, what brand is it????? :D",Robert Ekeroth,9 ay önce,0
Hey Justine I can’t believe your computer tower is 75TB that is massive amount of storage. I don’t think that I have heard of a device having that high of storage. I love Technology as well. I got the new iPhone 13 pro max silver in 512 GB I didn’t think that I needed the 1TB.,Seth Beske,9 ay önce,0
You are awesome I love apple I want it all. I definitely want the pink keyboard and mouse. New iPad new laptop etc……  a lot help  after buy everything. Lol,Cynthia,9 ay önce,1
Boom! this is awesome!,Kettinj,9 ay önce,0
Is the mouse fully Bluetooth? Or does it need to run with the dongle plugged in?,Ayerams,9 ay önce,0
1:04 it looks like the very first apple wireless keyboard.,Fireblaster 207,9 ay önce,1
"75 tbs? Holy crap, I don’t think I’m remotely close to using that much in my lifetime",saverlater123,9 ay önce,0
"I got the same mouse, it's really really nice,",Yaman Tarakji,9 ay önce,1
"Justine: So there's a lot of plenty space for me...
Me:  speechless hearing how much space she got",eilishmood_,9 ay önce,0
what is your opinion on the Magic Mouse 2? I'm considering getting it for my office work as well as editing,Personal One,8 ay önce,0
"You are my favourite Justine, iJustine :)",Myuki Angel,9 ay önce (düzenlendi),1
Watching this video makes me reconsider buying a MacBook knowing you don’t need any of this crap,Stavros Hatzigianakis,8 ay önce,0
These accessories are also great for the M1 MacBook Air,Wise Thinkers,9 ay önce,0
I love the old fashioned chuncky look of the keyboard and massive mouse,Jon,9 ay önce,0
"if I may suggest, you should push the display more to the back and put your elbows on the table. It is not good for your circulatory system if your elbows are hanging below the surface of the desk. Optional setup is when you have a space in front of you that is enough for an A4/Letter paper, then the keyboard, then monitor.",stenza,9 ay önce,0
Do an office tour!! If love to see it!,trashy megs,9 ay önce,0
"Hey, do you have a link to the OWC Thunderbolt Dock?  I'm trying to look for the exact model that you've got.",mtb_rene,9 ay önce,0
"I always love it, when you say „very“",Felipe Gutiez,9 ay önce,0
I love you so much justine…all the way from Jamaica ,Mr Meats,9 ay önce,1
SD card slot on the new mac is nice for at least drones I’m sure.,Mateo Navarro,9 ay önce,1
What is the name or link to the monitor?,Valentine Jackman,9 ay önce,0
"Justine - any issues with the dock getting kicked off when your MacBook goes to sleep? 

I have the sonnettech dock and all of my drives disconnect and ultimately the computer reboots itself after it’s gone to sleep. Highly annoying.",Dave Battle,9 ay önce,0
"How's the M1 max as compared to the M1 Pro? btw, subscrubed!!!",Aadi Dahoo-Singh,9 ay önce,1
I swear iJustine has the coolest knives,Sean Chen,9 ay önce,0
What do you use if you don’t use SD cards anymore?,Peach,9 ay önce,1
How these compare to apple keyboard?,andrew illingworth,9 ay önce,0
"I'm a Windows guy, but the new MacBook Pro is looking tempting, at least to try it out.  But what kind of monitors are those?!?  They look great!",Grayton W,9 ay önce,0
Hello... I really like your videos...I wanna buy a 2 in 1 laptop with a very good configure for regular uses....  The Budget is Between 600$ to 1800$ which one should i buy. Please help me with your suggestion..... I'll be ver greatful....  Please...,Palash Ghosh,8 ay önce,1
Looks great!,Pia Justynn,9 ay önce,1
"Szép napot kívánok mindenkinek! Remek kis videó! A gyönyörű hölgy fantasztikusan mutatta be ezeket a termékeket! Fekete színben kapható remélem a billentyűzet és egér!
Legyen szép napja mindenkinek, erőben és egészségben!
️",wenepzoli,9 ay önce,1
Really good keyboard I really I like it .,sarela manco,9 ay önce,1
"Why not use the doc to connect the monitors so you only have one connection leading to the MBP? I'm using a similar device from Razor, which looks almost identical and it works fine outputting to 4k display at 60Hz",Christian Krautwald,9 ay önce,0
That mouse looks clean Justine.,Randy Ragsdale,9 ay önce,0
That benchmade knife made me happy,jesus ruelas,9 ay önce,1
What about the storage NAS Linus installed for you a couple years ago??,ReturnAlt10Playz,9 ay önce,2
If they add a fingerprint sensor to that keyboard... uff.. Perfection.,Jesús Zayas,9 ay önce,0
serious flex on the gear:),thinkpadx60,9 ay önce,1
"I CAN'T WAIT FOR THE KEYBOARD TO HAVE A PRINTER BUILT-IN. I WOULD ADD A PRINT BUTTON,SD,USB-C,A DUAL SIM CARD TRAY,HDMI,
MICRO HDMI,A TOUCH DISPLAY STRIP,A CAMERA,AND A PROJECTOR AND APPLE PROPRIETARY CONNECTOR PORTS.",kris ertmer,9 ay önce (düzenlendi),0
What model of 4k monitor does Justine use?,Jonathas Oliveira,8 ay önce,1
I thought you used a network server for storage ,phynx2006,9 ay önce,0
Can you identify the two external monitors you are using?   They are not listed in your equipment list. Thanks,Richard Wagner,9 ay önce,1
Nice video iJ!,Campwise05,9 ay önce,1
The new little mouse is cute as can be. Just adorable.,Hof79905,9 ay önce,1
Love the knife!,Wei Luan,9 ay önce,1
Can you show us how to connect a Macbook air to 2 monitors?,OVERSCOR _,9 ay önce,1
using an xdr display as you vertical secondary... not overkill at all...,Robert idonotsharemyfullname,9 ay önce,1
Hola Miss Justine and everyone have a blessed and wonderful Thanksgiving ️,🐲 My Kitten Is A Black Belt 🐉,9 ay önce,1
How do you transfer you content now from camera to disk of you’re not using SD cards anymore?,Fejkok,9 ay önce,1
What’s type of monitors are those,Lemuel Simon,9 ay önce,0
Been almost 2 months. Pllzzz we need a full detailed review,,8 ay önce,0
"I'll never understand why anyone would use chiclet keys on a desktop, on laptops you do it because there's no choice but on desktop get regular keys that feels so much better.",Dante,9 ay önce,0
I love the new MacBook,jackson horton,9 ay önce,1
What you should do is a video with knife recommendations ,Cormorando,9 ay önce,0
Linus is looking on in shame at that OWC thunderbay flex.,Section82,9 ay önce,1
Is there a link to the hub?,Chris Davies,9 ay önce,0
Just don't spill coffee on that keyboard. I did that to my master keys and it just died. Plus you can't just take it apart like other keyboards. My Mac was opening random applications and making annoying beeping noises in quick succession.,Jason Gooden,9 ay önce,1
I want that knife…,KDS Tech,9 ay önce,0
"iJustine is a treasure. 
She must live forever.
I'll never unsubscribe her ever.
I wanna be her friend forever.",George Saviour,9 ay önce (düzenlendi),0
What’s the name of that docking station (owc and what exactly)?,Anton Antini,8 ay önce,0
Do you really need to push affiliate links for a keyboard to go with a MacBook? Doesn't that already have a keyboard? This would make more sense if you were promoting this with a Mac Pro. Or iPad.,Kyle Koala,8 ay önce,0
Nice wide resolution! :D,Guido SC,6 ay önce,0
Am I the only one that figured out that Justine was in an episode of vampire diaries??? S3:E10. The scene where Damon and Alaric are discussing Jeremy’s paper that he copied off the internet. She’s the girl that tells them Jeremy was fired!,Hi I’m Jai,8 ay önce,0
"our monitors are awesome, are they Mac?? :)",Robert Ekeroth,9 ay önce,1
"3:28:Cable Management isn’t bad its ok for now but i like to see improvement but lets not give her hate,the video is fantastic and I’m getting this keyboard because its so cool",Catalyst X,9 ay önce,1
I don’t understand why do u need extra accessories to compliment the most expensive laptop ,shravan dhadiwal,9 ay önce,0
Your office looks nice Justine.,Randy Ragsdale,9 ay önce,1
That is a villainous knife used in the unboxing.,Daryl Cheshire,9 ay önce,0
"Hey, I like that knife.  Could give more information? Thanks",JPM024,9 ay önce,1
Where’s the jellyfish server Linus helped setting up?,Bruun IT,7 ay önce,0
Hai Justin. How to you make 2 apple XDR like that? I like it... what I need to make 2 screen Apple XDR like that? Thanks,Rudy Effendy,9 ay önce,1
Logitech has the worst keyboard. The keys get stuck after a few months use and their support staff says they have no replacements for warranty even tho I see shelves filled at best buy.,Richard Torcato,9 ay önce,0
Super cool!,Perfect Cupcakes World 🫶🏻,9 ay önce,0
I love the thunderbolt dock,Cowbos,8 ay önce,0
Bluetooth accessory?! hahahaha...no...that's for non-bluetooth connections.,Hans Sabastian,7 ay önce,2
Do you have a link to the OWC thunderbolt dock?,Biggie Smalls,9 ay önce,0
Have you ever bought any hardware? Probably never…,Tom,9 ay önce,1
"bulky af, mouse with scroll wheel, black cables........
hey Logitech, wanna make a killer product that sells like hot cake? make a wired multitouch mouse for mac",John Smith,9 ay önce,0
"Me when I saw the thumbnail: TWINS?!?!?! oh, just good at photoshop.",Cyd Villegas,9 ay önce,0
"Awe geez. You are so awesome. I Just wish it wasnt all about apple, all I can think when I see anything apple is foxconn nets.",Spaghetti Monster,9 ay önce,1
yes a new ijustine video :),•Gabriel•,9 ay önce,1
You say you don't use SD cards anymore but I swear I see an SD card plugged into your OWC Dock at 4:47,CompoundProjects,9 ay önce,1
Do you prefer Space Gray or Silver Macbook Pro?,Canturk Civelek,9 ay önce,1
how much did logitech pay for half the video,Its Mzty,9 ay önce,0
Expensive setup.,Baconface McGee,8 ay önce,0
omg you're my favorite youtuber,Tamara Al Bahkali,9 ay önce,1
You might just have to use SD cards too I see it as more storage for you I’m using SD cards I have (2) 4 tb  externals because my laptop has 256 gb SSD I need all that space to backup my laptop and My YouTube videos and my iPhone never thought I would be using multiple 4 tb externals but it good that you them if you need them,WILLIAM WILKINSON,9 ay önce,0
“bluetooth accessory” that’s a dongle!,warrenrose68,9 ay önce,1
"Wow, you're the best.",Star Boy Atlantian,9 ay önce,1
Why does those accessories look like they’ve been bought from wish. Wtf is that design. ,enri burba,9 ay önce,0
you should make a knife collection video.,Delia Cid,9 ay önce,0
Awesome news ,Gaybrial Avery,9 ay önce,0
,Ms. K's TV,9 ay önce,1
what about the last 6 years!   .... I felt that haha,coin manila,3 ay önce,0
i got a logitech pebble from amazon and omg so smooth and cute,Maitha alhammadi,7 ay önce,0
Wait… are the keys really concave? That sound terrible. You mean convex right?,tzimtzum,9 ay önce,0
I felt the mouse clicks right here Nice,Love Live,9 ay önce,1
Never expected to see a bench made bug out in this video,Darren Neiger,9 ay önce,0
Are you still gonna post the ipad 9th gen video??,laila officer,9 ay önce,1
how do you get so much stuff?,Aidan Lorenzo,9 ay önce,1
What is it you actually do now? What’s all this footage you edit? Where do we see it?,Nate,9 ay önce,0
Hi Justine! Happy early Thanksgiving! How’s your Tesla been?,Wyatt,9 ay önce (düzenlendi),1
Wanna donate some of your apple products to me ,Naris X,9 ay önce,1
02:05 ️,Fernando P.,9 ay önce,0
Why get a separate keyboard when the MacBook Pro has its own keyboard Justine? Please help. Thanks.,Ee Tang,8 ay önce,0
LETS GO BRANDON,Kbeezyk,9 ay önce,0
Is it possible that they make 3TB OR 4TB IPads?,Seth Beske,9 ay önce,1
you should make a knife collection video.,Delia Cid,9 ay önce,0
