text,author,date,like
you should make a knife collection video.,Delia Cid,9 ay önce,0
you should make a knife collection video.,Delia Cid,9 ay önce,0
Do a colab with the property bros who did Ro entire house,John Maloney,9 ay önce,1
Hi I love your video,FLG JAI,9 ay önce,2
Akka love apple products from India,banu mathi,9 ay önce,2
That mouse pad ,Nicklas Toft,9 ay önce,1
Like the desk .... Can you put a link somwhere in the discription... :),It is I.,7 ay önce,0
"Have to upgrade that pink chair, that thing can't be good for your back after a couple hours!!",josh jay,9 ay önce,1
hey use your new LG vac to clean your set up! Happy thanksgiving! its dusty as heck!,Grillozilla VFX,9 ay önce (düzenlendi),1
,KAYAL PHOTOGRAPHER,9 ay önce,0
me who wants the OWC thunderbolt dock but don't want to pay 400$ on it,Catalyst X,8 ay önce,0
Casually says 75 terabytes ,Bobby Kerns Jr.,9 ay önce,0
Uploading and editing on 8k is just stupid idk why youtubers do this,Mihir Misra,9 ay önce,0
Have u tried the Hidrate spark 3 smart water bottle?,PugL1fe,8 ay önce,0
What the * do you do with all the mac (books) you collected in all those years?,Jan P. van der Wolf,9 ay önce,1
"That’s the point, SD is old school now.",Asmund Maeland,9 ay önce,1
"Looking at this video, I just feel how poor we are.",Tanmoy Debnath,9 ay önce,0
I miss real reviews,Mindful Positivity,9 ay önce,0
I got the Space grey one with black keys and full size hybrid,Jason Gooden,9 ay önce,1
just hopes MX keys price tag is lower ...,William Chen,9 ay önce,1
Oh a new AdJustine video !,Pascal Prugna,8 ay önce,1
What monitor are you using?,Minh Ng,9 ay önce,0
all bow down to ijustine,uzzy,9 ay önce,1
is that 2 pro xdr displays?,Alek,5 ay önce,0
Can you show us how to edit YouTube videos I wanna make my YouTube videos more better but I don’t know how to edit please,FOXSY,9 ay önce (düzenlendi),0
I love stevejobs I love apple  awesome super,Ga.vijaymurugan Vijay,9 ay önce,0
Scratches on new M1 mac :(,Bartosz Gołębiowski,9 ay önce,1
симпатюля :),Степан Марков,9 ay önce,1
What monitor are you using?,Hadiman Rusli,9 ay önce,0
"ah, an accessory sales lady",william fitzpatrick,9 ay önce,0
"hey justine do u still have ur mac pro, cause u did not show it in the vid",Ken Quimque,9 ay önce,1
wow. first time being this early. so this what huge youtuber’s comment section looks just minutes after the video publishes. ,Lloyd Sim,9 ay önce (düzenlendi),3
Shes Litterly the queen of apple,Random human1122,9 ay önce,0
you should make a knife collection video.,Delia Cid,9 ay önce,1
“oMg iM eArLy”,Tech Factz,9 ay önce,3
How much is that set up?,Derek Fisher,9 ay önce,1
"ALMOSt ordered that Keyboard, BUTTT no Screen Brightness controls?!! What's up with that?",Justin Pulitzer,9 ay önce,0
"Can you leave links to the products you use, like kb, mouse, monitor, the mac's, the dock etc....But, you listed the gear you use to make videos twice. HUH ?",Gio D,3 ay önce,0
اعطيني هديه ,M&m,9 ay önce,1
Where did you get that pink chair?!?,Tu Thanh,8 ay önce,1
Wow!,Aveeraj Sharma,9 ay önce,1
Nice Benchmade.,Jay Goodman,9 ay önce,1
Can you show us how to edit YouTube videos I wanna make my YouTube videos more better but I don’t know how to edit please,FOXSY,9 ay önce (düzenlendi),1
"no way, you bought apple hardware????",Nature and Gaming,9 ay önce,0
My blonde wife wants to buy an iPhone 13 Pro Max.,Younes Ten,9 ay önce,2
That is so cool,nhohio316,7 ay önce,0
Download setup software? That's very 1990s.,joarez pj,9 ay önce,0
thats such a big knife lol,Denis Martel,9 ay önce,1
Pink and beautiful ,Calvin Dean,9 ay önce,1
,Traveling local miedia vlogs,9 ay önce,1
what kind of monitor is that?,monteiro,8 ay önce,1
Hi Justine nice video you luck beautiful I love you ,pothuraju udayakiran,9 ay önce,1
Next clean up the stuff on the table ,Ræine van Zilwer,9 ay önce,0
Justine you are. Good person,Mahek YT,9 ay önce,1
"Justine, your wrinkles look amazing!",,9 ay önce,1
Little hype :D,Jakub Kóša,9 ay önce,1
Your such a dork i love you!,Daniel Wolfman,8 ay önce,1
Hi Justine how are you any giveaways I would wouldn’t say no to them airpods max ,Glen Farrelly,9 ay önce,1
Where's the m1 max review Justine?,Fycstion,9 ay önce,1
Love you,Heather Astbury,9 ay önce,1
Add a case to your MacBook,RABBIT SQUAD,9 ay önce,0
i want i phone 13 pro max,Jhay'ar Pader,9 ay önce,0
Woow that's great but remember your fun from Ghana would be coming to the UK for his MBA course and needs a laptop for digitization course please you may be of a help my helping me to get even any old Mac to gradually start new life on Campus.. Uni. Westminster,EMMAKUS VLOG,9 ay önce,0
Airpods pro vs Airpods 3,JannuJacintha Flora,9 ay önce,1
Happy thanksgiving jusitp,AwesomeAdam From 2099,9 ay önce,2
I hope you have a great thanksgiving tomorrow,Edward Sanchez Productions,9 ay önce,1
Justine ,Randy Ragsdale,9 ay önce,1
Don't you use windows computer at all?,Hossein Fazli Osanloo,9 ay önce,1
The pink keyboard looks like it was buried underground for a month.,Mahmood Zidan,9 ay önce,0
ok jusine but what is this cablemanagement?????,Nikkolai,8 ay önce,0
I LOVE your channel but I HATE apple. Glad to see that you review other products from other company's. Plz respond to my comment so I can say I've talked to ijustine.,Teardr💧p,9 ay önce (düzenlendi),1
You already know that Justine will not use a single accessory of these,BMO 3804,9 ay önce,2
Cute ️,yuranduran,9 ay önce,1
75TB….. what ,DumpOrange,8 ay önce,0
Justine is  looking good for 37!,L Andrews,8 ay önce,0
Now i got it why you are called as apple guru....,Khalid Salman,8 ay önce,2
I think you like shopping more than me lol,Soothe & Relax,9 ay önce,0
Careful someone was using her name to get in touch with you!,The last Airbender,9 ay önce,0
You are my dream girl,Raahim FF,9 ay önce,1
Nice,Namashivath Saravanan,9 ay önce,0
I have the M1 Macbook Air,Catalyst X,8 ay önce,0
i dont believe santa is a male. ,iShare by jBee,9 ay önce,1
Nice,GAUTAM SHIVRAJ,9 ay önce,0
7:08 LOL literally tho,Shwa #savetheaudiencerating,6 ay önce,0
this entire video is just a commercial :/,silverflash1,9 ay önce,1
Hey Justine do you remember escape the night!?,floreixaa,9 ay önce,0
Give me please sister my dream laptop sister' from india,World Story Seconds,9 ay önce,0
,Sheldon Haynes,9 ay önce,1
You look like a model or something,Raahim FF,9 ay önce,0
Review samsung please,Shaan Khilnani,9 ay önce,1
A pink wall ,Samuel Garcia,9 ay önce,0
Must be nice to have that rich white privilege which gets your free stuff from apple all the time.,B TheGawd,8 ay önce,0
Give iMac for me,Oskierex,9 ay önce,1
For true justin look like dani daniels u know what I mean,Kishan kishan,9 ay önce,0
"Hello Justine,

You most likely won’t see this message but I Have always been a fan of your YouTube videos and I was wondering if you could help me out ! I’m having a hard time getting a hold of the new Nintendo Switch Oled version  my old Nintendo switch lite was stolen from me unfortunately and really want to get my hands on the new version. I’m okay if it’s used ! I just really want it and haven’t had any luck finding it ",Janett Guajardo,9 ay önce,0
,2McRecords UrbanMusic,7 ay önce,0
This is unnecessary but it is necessary lol,Andrww,9 ay önce,1
IJustine  why do you choose to ignore the ethics of apple products. I want to hear your views on the issue. They are currently exploiting people across sees and that’s not okay. I understand you like apple products and I’m not asking you to stop. But as an influencer you should let your viewers know the whole picture of these products. You are a wonderful person and I just wanted you to know what you are promoting.,Jesus,8 ay önce,0
Please do you do giveaways I need an ipad Pro for studies since it is the best option I beg you,Ophelia Omaboe,9 ay önce,0
Xbox setup.,Ferdous,9 ay önce,1
First like and comment ,Miss Tech Savvy,9 ay önce,2
You seem to be sitting with quite some tension on your shoulders? Take good care of your posture...,Andy Scherpenberg,8 ay önce,0
Omg  two Justine,Khadra Abeeb,9 ay önce,1
Beware of blondes wielding big knives for whatever reason.,W Petty,9 ay önce,0
Unbox Thinkpad pls,kaung ye,7 ay önce,0
"I'm a big fan of Justine ... I can't afford to buy an apple ... I live in India ... You give me an Apple products, please Justin give me an Apple product ...  please gift me apple products..... Justine... please",Gaming iconic,8 ay önce,0
AHH NEVER BEEN SO EARLY,Ben Williams,9 ay önce,1
I find it surreal that Logitech is sponsoring a M1 MacBook Pro video while not even having a software that works on it yet! I am a Logi user having the MX series and I’m so disappointed. I just installed a new M1 Pro Max and found out none of my devices will work unless I install Rosetta on it! So basically you invest on top gadgets and have to use a software to emulate an old intel based op to use your stuff… fantastically disappointing!,Maria Porto,9 ay önce,0
IJustine  looks like Kenzie Madison,Roni Ghosn,9 ay önce,2
Yay ,Zexxo,9 ay önce,1
"I'm a big fan of Justine ... I can't afford to buy an apple ... I live in India ... You give me an Apple products, please Justin give me an Apple product ...  please gift me apple products..... Justine... please",Gaming iconic,8 ay önce,0
Good,Mohammadreza Ahi,9 ay önce,1
good,wajid shahab,9 ay önce,2
Ijustine only fans when?  ,Unmei Tobaku,8 ay önce,0
Please studio tower,Mohammed Mekaheel khan Durani,9 ay önce,1
зачем все это,bossmatsymoto,9 ay önce,1
Where is home?,Traveling local miedia vlogs,9 ay önce,1
Hoping you can notice my comment ,Lee Mojica,9 ay önce,1
fenkyu JUstin Macbook Pro akcesories,Mateusz Jamrożek,9 ay önce,1
how about a full keyboard?,Robert Schneider,9 ay önce,1
There's two?!,឵឵,9 ay önce,1
"Я ненавижу ваш тупой медузный сервер, распределенный компьютером по всему миру, и я ненавижу эту дурацкую скорость Thunderbird.",Win10 fan,3 hafta önce,0
Okay ️,Spyridon Antifalos,9 ay önce,1
here after 1 min!,Finn Patrick,9 ay önce,1
Looks very unprofessional I totally would recommend black apple keyboard and black mx master instead of this crap,Peter DeVil,9 ay önce,0
Monitors,Joe Russell,6 ay önce,0
Hi please give me a ipad pro 12.9 2021 please ,Mohamed Alsayh,9 ay önce,0
I got here two minutes before the one hour mark,God5,9 ay önce,2
Do you like country music? Do you want kids? Do you only speak and understand English?,Armando Aranda,9 ay önce,2
must be a really lonely life of a youtuber... just showing the internet your new gadgets.. .alone. lol,Jane,9 ay önce,0
:D,Rishabh Roy,9 ay önce,1
comment under 100 great videdo,Jump Around,9 ay önce,1
"People might not see this comment, but everybody stay safe and have a blessed day may God be with you all Take Care Everyone ",NYC Dancer J,9 ay önce,2
Ayyy i'm early,Stixx,9 ay önce,1
video for promo = dis,Aleksandr S,9 ay önce,1
Omg hiii early,Keirstyn Osinski,9 ay önce,1
Hi,Traveling local miedia vlogs,9 ay önce,1
Hi Justine,Omar B.,9 ay önce,1
Wo I’m in the first 500,Mohammad Aaban Asim,9 ay önce,1
26 views wth!!1,High Peak Mapping,9 ay önce,1
yay!,Emily Sousa,9 ay önce,1
Early,preppybybecca,9 ay önce,2
Early,Azaryn DeGolier,9 ay önce,2
GAGAG,ReasonablleDoubt,7 ay önce,0
gettings from is Azerbaijan,Raul Ismayılov,9 ay önce,2
57th in the comments!,cool asmr 😎,9 ay önce,1
First,jackson horton,9 ay önce,3
First,Marissa Rainford,9 ay önce (düzenlendi),2
First,Tucker M.,9 ay önce,1
Hy,Paras sharma,8 ay önce,0
"️""Literally 99% of people ignore this message: God save you and your family from the diseases ",NYC Dancer J,9 ay önce,0
"The QUEEN of Apple is taking over Logitech, I’m here for this video! ",Zola 🔥F-'ck M'-e - Check my P'ro'fi-le🔥,9 ay önce,1
"The MX Keys Mini is a lovely keyboard. I'm very happy with mine. My only criticism is Logitech's decision to go for non-standard F-keys. Not having the normal shortcuts for screen brightness, launchpad, and mission control is a little annoying. You can remap the F-keys in Logitech Options, but standard Mac F-keys would've been better. Other than that, it's great to type on and looks lovely.",[MARIA]H0T Girl-C0me 0ver L!ve,9 ay önce,0
"Really considering this keyboard, looks neat! On a completely irrelevant side note: The amount of content creators I see who were glad the TouchBar has gone have their MacBook closed and plugged into a monitor",Janey 🔥F-'ck M'-e - Check my P'ro'fi-le🔥,9 ay önce,0
