text,author,date,like
I literally got these three days ago and already lost my right air pod ,Lilxhery,10 ay önce,0
"Shame you didn't showcase the MagSafe on the case, wonder how strong that connection is.",Shayan Rastegar,10 ay önce,0
Y'all remember when ijustine use to make actual content. And not review and unboxing videos?,A A,10 ay önce,0
AirPods are good but companies like Jabra and Sennheiser have WAY better music quality.,TechOutAdam,10 ay önce,1
Those might fit my ears better than the Pro. I don’t know what it was about them but they hurt my ears so badly.,Jeffery Jones,10 ay önce,0
"(John 3:16,17) ""For God so loved the world, that He gave His only begotten Son, that whosoever believes in Him should not perish, but should have eternal life. For God did not send His Son into the world to condemn the world, but that the world might be saved through Him."" (Romans 10:9,10) ""That if you confess with your mouth the Lord Jesus and believe in your that God has raised Him from the dead, thou shalt be saved. For with the heart, man believeth unto righteousness and with the mouth confession is made unto salvation.""",Jesus is Lord,10 ay önce,1
Hi what's the charging unit you used on your desk as well please. Ta ,deadpool2e,10 ay önce,1
im still using the 1st gen airpods from 2018 so im probably going to upgrade to these,Escanor,10 ay önce,0
Is it better than Pro ? Sound quality wise. ?,Boss Reviews,10 ay önce,0
I jst got mine they are amozing,Aminu Yazid,9 ay önce,0
“Look at that…That’s a long stick!”,spicedcurry,10 ay önce,0
Airpods pro forever …! ️‍,[StArBoY2022],10 ay önce,0
Okay I’m buying them ️,Angel,10 ay önce,0
nice! I get mine today! Tuesday oct 25th!!!!,Tyler Iwamoto,10 ay önce,0
FINALLY I WAS WAITING PAITENTLY FOR YOU TO GET AND REVIEW THE AIRPODS 3 AND FINALLY YOU GOT THEM AND REVIEWED THEM YAY!!!!!!,Naiyah Patel,10 ay önce,1
Has Justine ever given a bad review? Lol,Jeffery D,10 ay önce,0
Ooo!!!! They sound promising!!,MrMark28,10 ay önce,0
Oh I thought they had noise cancellation and transparency mode :(,Maria,10 ay önce,0
I was iffy until the sound scared the shot out of her. I want now!,Renn,10 ay önce,0
Just remove the ear bud pieces off the airpods pro and uve got urself the airpods 3 ,Zed Nation786,10 ay önce (düzenlendi),0
I’m gonna pick ‘em up tomorrow let’s goooo,A.4311,8 ay önce,0
There need to put in a plug in the air pods box,PKJKJ22,10 ay önce,0
"Earlier version better tho with ear tips. Again these air-pods will block the mesh with earwax.
Big no..",Jamesbond007,10 ay önce (düzenlendi),0
I m viewer from India.....yourr fans are there in India too....love from India ,Smita Doshi,10 ay önce,1
"Goodbye embargo, Hello AirPods 3 reviews!",Scyclone,10 ay önce,1
Who else watching this with AirPods Pro’s on,SMD,10 ay önce,1
I want to feel the spatial audio may be soon,MrExaggerated,10 ay önce,0
I’m gonna have to check these out now,you know with Marty Kauffman,10 ay önce,0
iJustine invades my YouTube notifications today. ,Stéphane Selikoz,10 ay önce,0
the pros have spatial audio as well... seems like you didnt know that?,Broncos,10 ay önce (düzenlendi),0
Does Spatial audio only work with Apple music?,Danmajor555,10 ay önce,0
Does this have a button on the back to connect the Bluetooth to my phone for the first time?,David Kitchens,2 hafta önce,0
Now you'd think you've got a Christmas present!,꧁AR 2022 ツ꧂ / SPDB / Deer squad / DELETE FNF PLz,9 ay önce,0
I personally like that they moved the silicone part. Easier cleaning and I just don’t like the way they feel in my ears,Nikell Williams,10 ay önce,0
OMG I CAN NOT WAIT TO GET MY AIRPODS,Jade Gill,10 ay önce,0
I’m watching this with my AirPods 2,"Naruto, Ninjago, and The Flash are the best",10 ay önce,0
omggg yesss i wasnt a big fan of the airprods pro look but this gen 3 one is looking good,4,10 ay önce,0
Love your video,Roberto,8 ay önce,0
My favourite youtuber ️,DawoodSAVAGE 𝗛𝗜𝗡𝗗𝗜,10 ay önce,0
Best Tech Youtuber ,Bhavin Kumar Bole,10 ay önce,0
Airpods 3 or beats studio buds? (Coming from the 1st gen airpods),Whizzzy,10 ay önce,0
Expecting mine tomorrow.,roy,10 ay önce,0
I love you I Justine I have been watching you since the iPhone 3gs,Isaiah wilcox,10 ay önce,1
"Ijustine says the 1st generation AirPod’s design was taken from the wired earphones which i am sure many of you remember . 
Literally me who still uses the WIRED EARPHONES",Rhythm Rahman,10 ay önce (düzenlendi),0
I’m getting them. The 2nd gen is always falling out my ear.,cj wins,9 ay önce,1
These are actually cool,Vidusha Nawalage,10 ay önce,0
"Thanks for the vid, Justine!",Arese,10 ay önce,0
I honestly live apple AirPods but I just have the ordinary ear pods with xr . But even then I can feel Atmos effect,Rajendra Biswas,10 ay önce,0
"They’re AirPods Pro without rubber seals
Still good improvements though",Ahmed IB,10 ay önce (düzenlendi),2
It's weird that we haven't gotten a new AirPods Pro version yet.,DctrGizmo,10 ay önce,0
A beautiful airpods 3 very nice video thank you so much Justine you so beautiful,Abubaker Jandan,10 ay önce,1
Don't know why people are hyping so much for these. I still feel that Airpods Pro are much more value for money especially with the noise cancellation and comfortable in ear tips.,Suraz Libro,10 ay önce (düzenlendi),0
"Probably too thick for me too, wonder why they did that?",Joe Brig,10 ay önce,0
Cant wait for the airpod 10 to come out,test channel,10 ay önce,0
Spatial audio kinda messes up the sound quality for surround sound.,George Mbirikira,10 ay önce,0
“That’s a long stick!” ,Loveless,10 ay önce,0
AirPods 2nd Generation And AirPods Pro Had A Child……,Jamie Adams,10 ay önce,0
All you have to do is take off the silicone part from the AirPods Pro and there Airpod Gen 3 just saying,A kid.,8 ay önce,0
Covering and having all this tech shit constantly … seems like a depressing life once all the lights and cameras turn off,For Your Consideration,10 ay önce,1
counting down the hours until mine arrive!!,Renée Rivera,10 ay önce,0
"Clearly in apple’s pocket ffs. Claiming to be blown away by the AirPods, and claiming the airports pros sound great. Absolute nonsense.",kev2427,10 ay önce,0
What is the microphone quality like?,Be Healing,10 ay önce,0
Nice it is time to upgrade our old OG Airpods,Ian,10 ay önce,0
Чёт они какие то здоровое посравнению с вторыми(((,Homer Simpson,10 ay önce,1
Thank God no in-ear buds!,Steven Bird,10 ay önce,0
Airpods pro Not in the top 10 in terms of sound,Legend,10 ay önce,0
"walking around with your Macbook Pro and spacial audio,,, wow just wow,,,",David Tallent,8 ay önce,0
This will be my first Airpod..can't wait to get mine.,YoungPro,10 ay önce,0
"""That's a long stick"" jokes in 3,2 ,1 ...",MundoFacundo,10 ay önce,0
"""that's a long stick"" ",Alec Hilliard | How To Invest In Real Estate! 🏡,10 ay önce,1
"Hey Justine, you did the same rave review for the Apple Homepods that were not very good. Thanks for the review anyway!",hernanc,10 ay önce,1
I’m getting these next week,007,10 ay önce,0
I have tiny ears too!  But I like the new design.  I didn’t buy the AirPods 3 tho  love your vids!,Leah Dykema,10 ay önce,0
What's that massive external battery?,Donnation,10 ay önce,0
"I might actually get these, I hate the suction cup part of the GEN 2s.",Patrick Ross,10 ay önce,0
Best tech YouTuber!!,Kate Joy,10 ay önce,1
The airpods pro you got on christmas would be replaced now,UREGON MAINGAMING,8 ay önce,0
Random suggestion i know it might be quite old but can u do a review of the apple mouse please?,sienna,10 ay önce,0
I just bought these omg your right such a big upgrade from 2nd to 3rd,Avery Hosler,8 ay önce,0
It looks like AirPod pros with no eartips,Chasew45,10 ay önce,0
"Am I missing something on spatial audio? I got AirPods pro and was excited to try that feature but in my opinion is sounds kinda “void”’, idk how to explain it. I tested with several songs where it’s available and I’m not really impressed by it.",Gustavo Alejandro,10 ay önce,0
thank god ive been needing an upgrade but I hate the squishy AirPods pros,Liberty Johnson Medina,9 ay önce,0
"everybody this past weeks: yelling Pixel
Justine:",Yuan Clarin,10 ay önce,0
Oh My  I Just Got my Airpods Pro A week ago now apple release Airpods 3 hahhahah,Mikyla Joyce,10 ay önce,0
Lmao the drones gone eat this up and buy it,KING,10 ay önce,0
I only have my airpods 2 for like a year and I want to get the airpods 3 bec of that spatial audio ,Jay Daniel,10 ay önce,0
Watching this video on my AirPods 3!,TristenTech,5 ay önce,0
"Hi, you didn’t tell us about the quality of the microphone? Better on this new version or on the Pro version?",Damien Robinard,10 ay önce,0
I’m still using the OG ones ,I_Dawg123,10 ay önce,0
omg double upload today i feel so blessed,nickitansupreme⁷,10 ay önce,0
"I prefer double tap to control the misic, Siri, answer etc",Denver Colorado,10 ay önce,0
Why not explain new magsafe charging?,코코,9 ay önce,0
Amazing video,Michael Orta,10 ay önce,0
"Me being bad with my money.

I must have them…",Sir Michael Cera,10 ay önce,0
whatever good or bad product apple released this girl will wondering about those. ,Nimesh Perera,10 ay önce,0
My opinion AirPods Pro is best by far as 3 different sized tips for different ears noice cancellation these just look like they will fall out of my ears,SpoiledGaming,10 ay önce,0
Apple just wants your money because the air pod pro are great if you think about it,Steven Neal,10 ay önce,0
iJustine- that's a long stick the real test is what's it going to fit like,Camron Haye,10 ay önce,0
Did anyone else mistake them for the normal AirPods,Erica Li,9 ay önce,0
should i bye the airpods pro or the airpods 3 i am so confused omggggg,Pantelis Nikolaidis,9 ay önce,2
2:59 yoooooo i want the link for that giant power generator thingy,Li Tom,8 ay önce,0
Looks similar to the air pods pro,Camron Kell,10 ay önce,0
I’m sticking with my OG … if they aren’t broke I’m not buying. They still work great my with Apple 4 series watch and Apple 8 plus iPhone ,Suzanne Taylor,10 ay önce,0
"""that's a long stick""

that's what she said",Christian Zgheib,10 ay önce,0
Can’t believe they don’t have the noise cancellation…,Marc Cioffi,10 ay önce,0
Like comparing iPhone 12 to the iPhone 13....no difference what so ever... Well except the 12 being rebranded as 13. Oh and the same old OS since 2007. And she's over dramatic.,P Gendron,10 ay önce (düzenlendi),0
"Justine: based on the old fashion wired apple headphones if you can remember. Me, listening to this video on the old fashion apple headphones : yup I remember",doire aintu,10 ay önce,0
Love from India 🇮🇳,Amlan Biswas,10 ay önce,0
Love from India 🇮🇳,Sahil Malik,10 ay önce,0
Damn airrrrpodddd 3 wtf I don't even have money to buy the first airpod generation ️,Maria Nader,10 ay önce,0
Watching this with my 1st gen airpods,Alexander Mendez,10 ay önce,0
I personally will wait for the AirPods Pro gen 2,Noah Buchmeier,10 ay önce,0
She’s always over reacted with apple products & we know these products are ok not like she acted out of this world.,Prahlad Karki,10 ay önce,0
"I just bought them. Never had AirPods before. 
I am disappointed. You can’t control the volume directly. You must use the phone or Siri. I don’t see myself talking to Siri in the subway or in the street. And when my iPhone 12 Pro Max is in my bag because it s too big for my pockets, Siri doesn’t respond…I think I might take them back to Apple.",Bruno COLLIN,10 ay önce,0
Funny I literally just got mine today perfect timing!,Joshalyn,10 ay önce,0
I have to say I like the white background better then the black background,Marjan,10 ay önce,0
"Hey Justine
Love your videos 
Can you give me a shout out in your next video
Thanks",Fathima Zaina Mohamed Rawsan Faiz,10 ay önce,1
Pass we need that noise cancellation,madeline gulapa,9 ay önce,0
I am listening to this on my AirPods 3,Rick,3 ay önce,0
Since its larger will it feel uncomfortable after some time?,xuanカイ,10 ay önce,0
there once was a time where you were clowned for wearing these,C RN,10 ay önce,0
"Planning on buying these after i had my airpods 1st gen since 2017, they only last like 45 minutes max now",Jbyln,10 ay önce (düzenlendi),1
Justine what should I get: Airpods 3 or Apple Watch SE? I can only choose one. ,Mauricio Flores,10 ay önce,0
Is Apple Aware that the AirPods Pro is the same price as these …179 in most stores so why would anyone buy this shit when the Pros are the same price with noise cancellation,Adam,10 ay önce (düzenlendi),0
They gotta make black AirPods. They just get dirty easily ,Alan L,10 ay önce,0
Nice video iJ!,Campwise05,10 ay önce,0
"when i try to use the spatial audio in my control center, it wont let me use the button for it",Omgitsolivia191,10 ay önce,0
"as soon as these came out, i ordered the airpods pros.",lil marz,10 ay önce,0
I had the first gen and the left side went out. Then my boyfriends did the same thing. I bought the new AirPods Pro hopefully they don’t do the same ,Lydia Molina,6 ay önce,0
Do they got airflow,Dutchthijs !,10 ay önce,0
Gen 3 looks like pros without the bud tips,Zencann,10 ay önce,0
The drum roll sounded like someone was farting. Lol keep up the good work,Forza horizon lover,10 ay önce,0
Did you know if you have AirPods and an iPhone and have the live listen feature on set your volume to max put your mic on your chest you can hear your own heart read it on an article,Tiny_VR,8 ay önce,0
Great!   I waiting in india 🇮🇳,MyTibet,10 ay önce,1
THIS IS A BLESSED DAY2 iJustine videos,ph_ gatz,10 ay önce,0
so close to 7 million! :D,erebus,10 ay önce,0
Lol I’m watching this with the AirPods 3,NBW Sun,9 ay önce,0
SO pro cases wont fit?,Kambalaya MN,10 ay önce,0
"justine: You guys might still remember the wired earbuds.
Me who is using them to watch this video: NO WAY I TOTALLY FORGOT ABOUT THEM",Tarush Garg,10 ay önce,0
Wow 2 videos fantastic in 1 day omg,Don Marco,10 ay önce,0
Something else I can’t afford lmao,Jack Hannaford-Hill,10 ay önce,0
i got them on launch day and they fall out of my ears ,Payton Powell,9 ay önce,1
"I was praying that you wouldn’t tell that these are better than Airpods pro, Coz i just got an Airpods pro!",Hari Prasad,10 ay önce,0
Apple releases a actual piece of shot with a apple logo she will be “omg it smell like poop whoah”,Richard Reveles,10 ay önce,0
Are u comparing these to the AirPods Pro or the regular ones,Joshua Santhumayor,10 ay önce,0
"0:21 I don’t just remember the design I still use them, but I am looking into getting AirPods maybe gen 2 or 3",Sam Hulse,10 ay önce (düzenlendi),1
I love you. she's always 1st on all Apple every thing.,xy,10 ay önce,0
"Airpods pro vs AirPods  3 , Which one is good ?",Sandheep Official,10 ay önce,0
When are you going to do a review for the iPad 9th Generation?,Mary Ann Fay-Lee,10 ay önce,1
I didn't know about the airpods 3 so when my dad bought I thought he got a fake one,Kavinesh Anuragavan,9 ay önce,1
"I’m getting mine tomorrow, I’m excited",Charlie Thoms,10 ay önce,0
Quite the apple day!,Simon,10 ay önce,0
Woah. It looks like she has aged a ton in this video,FluffiestWalrus,10 ay önce,0
Will this work with IOS 12?,Jose Noel de Jesus,10 ay önce,0
Crazyyyyyy that they are the same thing but 200$ more exepENCIVE wow good apple!,Spencer Son,9 ay önce,0
i love your videossss,Rashaad Cox,10 ay önce,0
So i have the AirPods Pro should i get the AirPods series 3,Tobias Morandell,10 ay önce,1
"1:26 it’s not that little 


Lmao",Anthony Evangelisti,9 ay önce,0
the best air pods pro,Soham Kumbhar,10 ay önce,2
Is it okay for iPad Air 4?,AlexTheMiner,10 ay önce (düzenlendi),0
Me using my first generation airpods while watching this,ToyoSauce,10 ay önce,0
so would you recommend these over the airpods pro,evan,10 ay önce,0
Just got mine today I love them already can’t hear any out side voices are  drama,Kendalyn Harrison,2 ay önce,0
2:22 - I need to do an eating test AirPods Pro always fall out when I’m eating,fake chris,10 ay önce,0
IM SUCH A BIG FAN,Tamara Al Bahkali,10 ay önce,0
Anyone in uk having problems to buy them from 3rd party retailers ? Amazon has no date still.,Nerowin_22,10 ay önce,0
0:52 Woooaow !!! ,dancolin,10 ay önce,1
I’m picking it up today,Andrei Bon Nodado,10 ay önce,0
Hola Miss Justine and everyone ️,🐲 My Kitten Is A Black Belt 🐉,10 ay önce,0
The fit of airpods 3rd generation is same like OnePlus buds... Which is 1 or 1.5 yrs old..means .not everyone going to enjoy the fit of these airpods... The classic airpods design is way better .... It's fit satisfy every single user...,yash birla,10 ay önce,0
Do they have noise cancellation because in apple event they said it comes with spatial audio not noise cancellation.,Jay Patel,10 ay önce,0
Early and I love ur videos,The crazy guy,10 ay önce,1
Reaction Queen!,AppleAndPhysics🇮🇳,10 ay önce,0
Im using the wired ear bud right now,RED Elham,10 ay önce,0
Just wow ,M.N. KHAN,10 ay önce,0
She never went over all the stuff it doesn’t have ,#Shytszx Hott,10 ay önce,0
Love from Nepal🇳🇵🇳🇵🇳🇵,Ashish Pariyar,10 ay önce,0
Apple_In_India(Lakshay Bhai) Follower️️,Piyush Popat,10 ay önce,0
Does anyone else have cracking/static sound in airpods 3? ( when music is not playing) ,E.G.A,10 ay önce,0
couldn’t u just take off the tip off the pros ,xMaddog,9 ay önce,0
I guessed it was AirPods 3 I’m so smart ,MEKAdmon 108,10 ay önce,0
Ur ozm mam keep going,Jagadish k.s,10 ay önce,0
"Notice  I’m tracking a pair right now , even better they’re free  (credit card sign up bonus)",Terrance Wright,8 ay önce,0
If you wanna know how these fit and own AirPods Pro. Remove the silicon tips and place airpod in your ear… you’re welcome!,Mark Hughes,10 ay önce,0
JUST GOT MINE TODAY!!!,Uzumaki Naruto,10 ay önce,0
yay i’m early!! love u justine,esy2011,10 ay önce,0
Me wondering what she does with all her left over stuff,Madie Garcia,10 ay önce,1
yay it's almost my birthday and I am getting those AirPods :),Anna_Bear,9 ay önce,1
Hmm can’t you loose it faster or ( highly buy this for sure ) Ijustine,Official Angrygoldstar,10 ay önce,0
Can’t wait for mine to be here with the MacBook,Georgio the Boss,10 ay önce,0
I know you hate Google Pixel series.,BadBot Studio,10 ay önce,0
When will these be available?,Jessica Avila,10 ay önce,0
Does Bluetooth have to be on when using the AirPods? That’s worrying. I don’t like having Bluetooth on when I’m not using phone,Bradley Wellington the 40th,10 ay önce,1
"This was only made, for consumers who are currently still using the AirPods Gen 2.",TypeAlpha,10 ay önce,0
Niceeee ,Sam Fisher,10 ay önce,0
"“That’s a long stick”

I Justine",Moke,10 ay önce,0
Luckily I saw this just got mine,Chelsea Bright,8 ay önce,0
Spatial Audio?  My earbuds never heard of that concept.,onimarikar,10 ay önce,0
Notification yesss EarPods 3 but got EarPods pro ,TreyWay lifestyle,10 ay önce,0
"No link in your video, which so many YouTubers say they put while recording and didn’t in post. Just so that you know.",Leng Hong Ang,10 ay önce,0
Damn the word shook went from urban slang to white girl slang…I guess I’m shook,T P,10 ay önce,0
"0:05 I guessed, ""yup totally not in the title.""",Nicholas Hoi,10 ay önce,1
Smaller means more prone to losing it? ,ramarmalade,10 ay önce,0
3:30 that’s it I’m buying them,Yogesh,10 ay önce,0
Ordered them.,John,10 ay önce,0
Maybe apple gave you money for these videos huh,Harris O,9 ay önce,0
Justine is always dramatic with all apples products lol ,Rox.loved.c,10 ay önce,0
I got my pros stolen ️ so I am trying to get new ones.,Valerie Mejia,9 ay önce,1
When will the ipad 9th gen video come out??,laila officer,10 ay önce,0
you can easily fly around for fun when you are rich.,Stefan Egger,9 ay önce,0
Support from Thailand 🇹🇭 ,BIGWIN,10 ay önce,0
Yessssss queen ,Vinnie_ does art,10 ay önce,0
"I just know spatial audio is gonna scare me in school, im gonna think everyone can hear my music",Khari,10 ay önce,0
"I just got from the Airpods 2 to the Airpods 3. I don’t like the size of the Airpods 3. I definitely prefer the size of the Airpods 2 because they fit my ears better. My ears hurts, after having them in for a while ",Julia Mathiasen,6 ay önce,0
"Pro fits Better in my ear, let me know when the pro 2 comes out ",Damian Wolf,10 ay önce,0
love from india,HARSH DEEP SINGH,10 ay önce,0
"Iphone 13, m1 max MacBook, now airpods three. What are the odds?",Pirzthia Playz,10 ay önce,0
"At this point if you don’t have airpods that doesn’t mean you are poor, it means you believe in wired earbud supremacy",Sajith Prasad Samarathunge,10 ay önce,0
Listening to this using my Airpods pro,SuShi_bAcOn,10 ay önce,0
I don’t know if I should get AirPods Pro or AirPods 3 because translucent mode would be perfect for me so idk ijunstine a little help maybe,mh_universe,10 ay önce,0
Yeah yeah but the reason I got the pro was the noise cancelling and transparency and the silicone tip all of which this is missing,Cool Kiasha,10 ay önce,0
So none of the new airpods have ear tips like the older airpods pro or?,ArtFartzy,10 ay önce,0
Is the iPhone 12 to a iPhone 13 pro max a reasonable upgrade,Itszbenofficial,10 ay önce,0
Thank you Justine,Kevin Dagostino,10 ay önce (düzenlendi),0
AirPods 3?? I literally just bought the pros,Lara Branbo,10 ay önce,0
She s the daughter of apple ,KP Creations,10 ay önce,0
Why have AirPods when Pros exist?,Michael Najera,10 ay önce,0
I got them and they fit so good and am still young,Gamer,6 ay önce,0
She said that she is taking a plane only for the video as if it’s something good…,1xoxolovexoxo3,10 ay önce,0
"its ijustine, so no bad review for apple products. favorations",Rodny ChristuZ,10 ay önce,0
do we have a new editor in town?,Rj Yee,10 ay önce,0
“That’s a long stick”,1SA9090,8 ay önce,0
LoVe my 3 gen never had any before x,Diane Harrison,3 ay önce,0
Today my bday and I got those airpods there amazing,- 𝙰𝚖𝚎𝚝𝚑𝚢𝚜𝚝-,9 ay önce,1
I think they’re called AirPods air,DRS Zone,10 ay önce,2
"Oh, brand new hair dryers",Nunus,10 ay önce,0
Dose spatial audio work with Spotify?,Sam McQueen,10 ay önce,0
Dang I have small ears too and was hoping they would fit better. Major bummer.,Amy Earley,10 ay önce,0
They are way too expensive,Aminah,10 ay önce,0
So they have noise canceling?,Zingler,10 ay önce,0
"Over excitement is justified if reviewing sony Xm4 , Soundcore liberty pro 3 , Jebra elite 7 pro etc .. but not this old school toy ..",Waqas Nasir,10 ay önce,0
Am I the only person that hates the airpod pros because they’re always sliding out my ear,Jada,8 ay önce,0
They should start making different colors,Emmanuella,10 ay önce,0
This is the earliest I've ever been to one of your videos!,G H,10 ay önce,0
I pre-ordered mine last Thursday with money for I got from my job and I got them today and when using them all day and feels like they gonna fall out and so so big it doesn’t feel like they’re in all the way but it’s just that they don’t it’s just irritating though you’re saying you need to get your head around,Sniffle 9,10 ay önce,0
You didn’t mention for how long the airport battery life in case n out,Sameer Rai Thulung,10 ay önce,0
I just bought the AirPods Pro like a month before this came out I wish I waited,Aamna Ashraf,10 ay önce,0
Yea do the review of macbook 16 inches gotta check that out,Chris Goldberg,10 ay önce,1
Hahah the way she got scared ,Cesar Serrano,10 ay önce,0
it look very much like the air pro 4 tws earphone,Moira Crisel Seballos,10 ay önce,0
The OLED MODEL Switch Justine!!!???,AMV edits2757,10 ay önce,0
ok i love this? i dont like the pros bc the rubber things doesnt fit my ear no matter what size shdksnd,drawn,10 ay önce,0
I came here after watching her 13 year old video that yt algorithm decided to recommend me lol,august,10 ay önce (düzenlendi),0
Lov them new airpod,Paul Taylor,10 ay önce,1
My airpods 3 just got here during lunch I bought them on the 19th!!!,Jaden wallace 95,10 ay önce,0
"fell out of my ears in less than 20 minutes, especially when smiling/talking.",Robert Bigouette,10 ay önce,1
"""That's a long stick."" ~~~ That's what she said.",Drewsky89,10 ay önce,0
“Bad sound makes good video look bad.”,BJS 2022,10 ay önce,0
airpods 1 and pro mixed,Kipper The Man,10 ay önce,0
So so so cute!!!,Lia Fei,10 ay önce,0
I really can’t wait for mine tomorrow,theicytides,10 ay önce,0
No noise cancellation a ,Richard Johnson,10 ay önce,0
Good,Hossein Jafari ali por,10 ay önce,0
"“Look at that little stem”, that’s what SHE said!",OldGrowthRedwood,10 ay önce,0
Why don’t these have noise cancellation?,Abby Stephens,10 ay önce,0
"She overreacts a lot.. 
Same Pods, Another year! Nothing major changes.. ",HunterX,10 ay önce,1
"After watching the new MacBook from Justin, I was like: where is the video of the new AirPods? Then I just refresh and here I am ",Divaldo Dias,10 ay önce,0
Hello madam... you're perfect paid product of apple. I wonder why you're feeling so excited for all apple products even though they are not world's wonder.... ? They are simple expensive products that's all. Pls be normal with apple and do you're genuine reviews ,Shan Prabu,10 ay önce,0
Nahh i like my pros ...in fact need to stop spending ..just got the iphone 13 and now ...this..and i just got the pros..,Pocahontas,10 ay önce,1
iJustine is getting old ,Vikrant Gunjal,9 ay önce,0
Why does this look make me think of cute Snoopy.,Aili Zhou,10 ay önce,0
