text,author,date,like
"Love all your videos iJustine
Gby",Nelson Díaz Jr tv,10 ay önce,0
Damn Justine is looking old now,Zain,10 ay önce,0
How do you get shocked so easily?,Kabir Chhabra,10 ay önce,0
I wonder how soon this will start to crack! Pass!,Bern on Cars,10 ay önce,0
"I DON'T WANT TO SOUND REPETITIVE,BUT,
APPLE SHOULD SELL AIRPODS PRO THAT HAVE CELLULAR FOR $699

THE AIRPODS CHARGING CASE COULD HAVE A PROJECTOR,A LASER KEYBOARD/TRACKPAD/DISPLAY EMITTER SYSTEM AND HARDWARE,AND THE IPHONE 13 PRO REAR CAMERAS BUILT-IN TO THE CASE ITSELF. USB-C/SD/HDMI PORTS/M1 MAX",kris ertmer,10 ay önce (düzenlendi),1
Wow extraordinary,Dr Caricature,10 ay önce,0
IJustine  why do you choose to ignore the ethics of apple products. I want to hear your views on the issue. They are currently exploiting people across sees and that’s not okay. I understand you like apple products and I’m not asking you to stop. But as an influencer you should let your viewers know the whole picture of these products. You are a wonderful person and I just wanted you to know what you are promoting.,Jesus,8 ay önce,0
Might remember? Still using earpods,Martin Caputto,10 ay önce,0
️️️,Md Saqib Ans,10 ay önce,0
️️️,Livestreaming fiveG,10 ay önce,0
️️️,Karl Gabriell,10 ay önce,0
Ijustine Ujustine every1justine ,CALL OF DUTY MOBILE ♪,10 ay önce (düzenlendi),0
"Didn’t have to guess, it was in the title of the vid ",John Thiel,10 ay önce,0
"İ love your videos but the moment u hear spatial audio and scared act is a little too much now :) i mean we know u have pro version and know what spatial audio is:) i love your channel but when you exaggerate reactions that much it is so far from reliable, we loved your real reactions forvall those years (they dont have to bee all real but they felt like, this dors not:)",Can Levi,10 ay önce,0
Justine I liked your iPhone. First generation.,Brady Lane,10 ay önce,0
Does anyone here in the comments section know where can I buy original and cute cases that ship to the US and are trustworthy??,Patricia Buena Falcón,10 ay önce,1
I don’t get it! Why would anyone buy the airpods3 when the AirPod pro cost slightly more but have the same features plus the absolut essential noise cancellation?!? Am I overlooking something?,Celisar1,10 ay önce,1
Will there be new pros too,Eman737,10 ay önce,0
Bro she forgot literally one of the most important things. How much does that shi cost,I oNlY sAy fAcTs,10 ay önce,0
Everyone has started uploading in macs and google pixels.. idk which channel i shud start watching,Thomas Martin,10 ay önce,0
Warning airpods 3 are missing how to set up what each bud does .. apple forgot to put these setting . Shame on apple  . These stupid youtubers dont even know these settings aint there ..,dominik kominik,10 ay önce,0
is she going to use these as her main airpods?,Jack Guignon,8 ay önce,0
Hello justine and how your day going and have you thought about live streaming on twitch and starting your own vlog channel on youtube and starting your own discord account and starting your own patreon account or onlyfans account in the future,walnes blanc,10 ay önce,0
Getting these I also just the new iPhone se,Michael's Explorations,10 ay önce,0
,Вадим Полещук,10 ay önce,0
why would they get rid of noise cancellation? make the sound better but then get rid of a key feature ????,thinosocray,8 ay önce,0
i still don’t know how to get to the hits in spacial audio playlist,Mel,10 ay önce,0
Y’all ever see a pair of AirPod pros with out the cushion tip,MRANDOM,10 ay önce,0
Justine the best ever . but btw how do you get those products please tell us is it a sponsorship and if it is how did you get it please say!!!!!!!,kirby's Dream Buffet,10 ay önce,0
I’m glad this youtuber is obsessed with Apple because I do,Gabicookie,7 ay önce,0
The drum roll sounds like some one gettin them cheeks clapped ,Sammers I_ate_sam,10 ay önce,0
"Noise cancellation is a must for me, unfortunately..",NxP,10 ay önce,0
"Apple is just a meme at this point, that’s the exact same head phone with a different label, smh",Jay876,10 ay önce,0
you spent $180+ for the EXACT same product sheep will be sheep,danteTM,10 ay önce,0
Awesome justine,AwesomeAdam From 2099,10 ay önce,0
Give me a new iPhone please !!!,qwerty,10 ay önce,0
Mind blowing sound quality lol?,Switch Unboxing,9 ay önce,1
Welp couldn’t get the pros so guess to ask for the 3rd generation AirPods,DawnEcplice,6 ay önce,0
Her reaction and over-exaggeration will have people thinking these are better than the pro's when in fact they're not and sound quality wise they're the same. Talk about misleading lol,Jack Amir,10 ay önce,0
Still using the wired earbuds and  also use the pro,Lala92,10 ay önce,0
When are u gonna do a Nintendo switch oled review,Father and son chanelle,10 ay önce,0
AirPod pro without the ear cussion basically lol,Itz Flaco,10 ay önce,0
Love you,Heather Astbury,10 ay önce,0
"i need one, please give me one Justine. Saludos desde Republica Dominicana.",Alex Hernandez,10 ay önce,0
Can you review 25 minutes video next generation of Apple Air Pods?,No other Like my own skin,7 ay önce,0
Hi Justine nice video you luck beautiful I love you ,pothuraju udayakiran,10 ay önce,0
I have the AirPods pro,Krishna Singh,10 ay önce,1
Im returning mine lol the Pro’s are better,Josh Johnston,9 ay önce,0
Apple AirPod 3 gn One mistake missing noice conclusion so sed news,KISHAN MAIYAD,10 ay önce,1
Airpods pro or airpods 3 ??,Nicat Valiyev,10 ay önce (düzenlendi),0
I am so excited to get the airpods 3 i dont care that they are very little change from last model and i am deaf but tim little cooks money and ijustines fake excitement got me.,zed j,10 ay önce,0
Does she pay for these or get for free ,Domenic Zarro,10 ay önce,0
"They barely fit her small ears lmao I hope they fit well for me, will see tomorrow",Fly Eagles Fly,10 ay önce,0
Me watching this using AirPods 3,Cristina Meleca,7 ay önce,0
,Kasun dushmantha,10 ay önce,0
Lots of “That’s what she said” moments in this video.,amit nagpal,10 ay önce,0
mines come in the mail this wednesday,oscar,10 ay önce,1
Apple AirPods Forever!,Артём Сафоненко,10 ay önce,1
At least she knows she is over dramatic ,German Gonzalez,10 ay önce,0
You can tell the AirPods don’t fit your ear. Lots of ppl complaining they keep falling out,SIRKSxFUNK,10 ay önce,0
Very nice,Mohammadreza Ahi,10 ay önce,0
1:23 still having PTSD from my last relationship,Anonymous,10 ay önce (düzenlendi),0
I had to get them because my Apple pros were acting up,Hannah Turner,10 ay önce,0
I love stevejobs I love apple ,Ga.vijaymurugan Vijay,10 ay önce,0
me and my sister are getting one and i lowkey just clicked to see if u can skip to the next song via touch,jughead wuz here,9 ay önce,1
What's the deal with the sleeves? Are all her clothes one size up? I noticed that in all videos. Is this a certain dressing style?,Panos P.,10 ay önce (düzenlendi),0
That’s cool,Hamda🫐,10 ay önce,0
HEY IJUSTINE!!!,Victor Hansen,10 ay önce,0
Can we see you unboxing apple cloth?,Garlic,10 ay önce,0
1:25 LITTLE STEM ,Rizal Arifin,10 ay önce,0
I just got the airpods pro but I’m thinking about exchanging for the airpods 3. Help me decide ,Alessandro Silva,9 ay önce,0
I LIKE THIS AIRPODS,chek4lovv,10 ay önce,0
"its a good job these don't vibrate or this would be a whole different video on a whole different website, that's all im saying",Shot on My Iphone,10 ay önce,0
"My take is that you guys as influencer are getting paid.. I bought it yesterday and my ears regretted after 5min in, they're huge and painful, i had to return them .exchange for second gen today...all the features most be good but it's not worth the trade for confort...The first gen naild the design no wonder every one try to copy them.",rafael deloera,10 ay önce,0
Would these not be airpods 4?,Caleb Iasona,10 ay önce,0
Eya sienpre abla bien de las cosas pero estabes le fallo estos audífonos no c conparan con los pro,Ezequiel Diaz,10 ay önce,0
Ordering mine rn….,Adrian,10 ay önce,0
Do they work with magsafe,Ben Monk,10 ay önce,0
Who else is listening to this with  AirPods 3,GodzillaFan,2 ay önce,1
Have fun with your radiation pods!!!!,Doog M,10 ay önce,0
Jewelry Review Next Time Pls... ,Alladz Dragneel D. Uchiha,10 ay önce,1
️,KAYAL PHOTOGRAPHER,10 ay önce,0
What iPhone were you using in the video? The one in the purple case,Missy Amy Casillas,10 ay önce,0
J.. same small ears! Pro would just never stay in. They popped out.. these were to big.. gen 1 are the best,Ali Z. Khan,10 ay önce,0
Superb,ULTRA Thanos,10 ay önce,0
I want to buy these so bad but idk what to buy these or AirPods pro cause there only ten dollars more at Best Buy,Avery Hosler,9 ay önce,0
I think I’ll be saving up,Calvin Casey,10 ay önce,0
Пока оставлю AirPods PRO,Dimon Reaper,10 ay önce,0
Our queen is also scared of Ed Sheeran,Halafaxa,10 ay önce,1
"""now that's a long stick"" o.o",Rey Ramos,10 ay önce,0
Nice 2021 MacBook pro,juname Name,10 ay önce,0
My beautiful blonde wife wants to buy an iPhone 13 Pro.,Younes Ten,10 ay önce,1
She looks good for a 40 year old,Orlando Pineda,9 ay önce,0
What is the spatial design thing ???,Bollywood Media,10 ay önce,1
Waiting ️,Hailam Hussain,10 ay önce,0
I just got these and returned them for the pros. Bc these ones kept falling out of my ears when I was just laying there. It’s annoying lol,Kristen Hawkins,2 ay önce,0
"It would have been nicer if there were different Colors, only white color?? kinda sad.",Ad Den,10 ay önce,0
I need my noise cancellation I like to travel airpod 2nd gen will win,Richard Johnson,10 ay önce,0
I don’t why she is freaking out so much,Lakshmi kanth,10 ay önce,0
"I’m here to tell you right now….we do care, we really care",ASVP HIOS,10 ay önce,0
1:47 that’s what she said!,Christian Becerra,10 ay önce,0
"ngl i rather have 20 chick fila chicken sandwich than airpods 3, just seems like i get 90% more enjoyment
let's be honest if you have existing airpods your money is better spent on 20 chick fil a sandwich ",Ethan t,10 ay önce,0
"I have the AirPods max, and I don't like them as much as I should. they make my ears hot and muggy. would these be better than the pros in sound quality?",Michael w,6 ay önce,0
AirPods Pro are better,Nia,9 ay önce,0
Ijustine Will u plz stop overreacting every time️️.,Every day iPhone apps,10 ay önce,0
"I love them, but my ears are so small, and they’re pretty fat!",Cassandra,9 ay önce,1
Today is my birthday  and I had to get this AirPods also my first AirPods,Hpack,10 ay önce,1
This is exclusive channel for sure,Maan rawal,10 ay önce,0
Where can I get one those portable box,James cagney,10 ay önce,0
okay so i was gonna get the airpods pro but now which one is better? like it doesn't matter the price which one Is better?,lilibeth ramirez,10 ay önce,0
I JUST GOT MINE TODAY!!!,Adorablyxevil _,10 ay önce,0
The battery life is still terrible 6 hours? Meh. I actually only use one airpod at time cause of this reason. I think its time to move to better wireless earphones. I was hoping for at least 8 hour battery life.,James R Warzyniak,9 ay önce,1
The AirPod Pro still are better.,Moka LARE,10 ay önce,0
️‍,AKA Abdur Rahman Mazumder,10 ay önce,1
"Excited? You and me, both...",Nicholas Mushi,10 ay önce,0
අපිත් ආවා!  🇱🇰,Sithumina Kasun,10 ay önce,0
Hey Old Lady.. you look so young ,Sha Hatim,10 ay önce,0
i have them lol,ur mama is gay,9 ay önce,0
Congrats on being early and finding this comment ,Help me reach 38k subs without any Videos,10 ay önce,1
I like the features of airpods pro and design ,Jeff Vardeleon,10 ay önce,1
the hard ones hurt tomuch for me.,Bel Be,10 ay önce,0
That's it new airpod 3,Lord Michael,10 ay önce,1
I got the air because it was cheaper and newer than the pro and I don’t care for noise cancellation,Stephen Shockley,4 ay önce,0
"2:36 after chat a little with my friend in front of my chrome book, when I doing some search. ""How do you know"" & ""How do you suppose to know""",De Aeolus,10 ay önce,0
They will fall out my ears,Richard Johnson,10 ay önce,0
Airpods 3 sounds okay,Rip Van Winkle,5 ay önce,0
how about without spatial audio........,M7mad,10 ay önce,0
"Tectober,love you//",joseph munyao,10 ay önce,0
3:02 apps name?,KTABIT,10 ay önce,0
give an oscar for acting),Stas Kasenkov,10 ay önce,0
Justine when will u unbox the new nintendo switch oled?,XsheeshPvp,10 ay önce,1
They always hurt my ears are they comfy though,Lauz14,10 ay önce,1
Wow two videos in one day,Edward Sanchez Productions,10 ay önce,0
hey here is the smile test,Christopher Chewe,10 ay önce,0
To anyone that has these. Can people around you hear your music. Pls reply this is rly a game changer for me,MeicGaming,5 ay önce,0
What in the world do you do with all that stuff that you bought??,QQF FXX,10 ay önce,0
Price?,allthatihave14,10 ay önce,0
Wow nice,A-ARonGamer,10 ay önce,0
Trending let’s go,- Bruno,10 ay önce,0
For me this design is better I don't like the silicone tip that goes inside the ear canal.,Edwin Gloria,10 ay önce,0
Sooo these are not an upgrade from the pros right? Cause that’s what I’m understanding,Edwin Lopez,10 ay önce,0
Is this works for Samsung phones ?,tinapa vlogs,10 ay önce,0
Close your eyes from 1:46 - 2:20,DividedShark,10 ay önce,0
"The design is horrible, no thank you. Why go back Apple, whyyyyyyy…..",Bdd,10 ay önce,0
Better than pro or not? btw what is going on with your hands and nails?,Aras,10 ay önce (düzenlendi),0
"Again !!!! this is so big to me, Unbelievable every gadget she ware want to highlight I'm so little  , is she grade 5 !",Omega X,10 ay önce,0
magsafe compatibility?,Luigi,10 ay önce,0
"Why does it look like unbox therapy's spirit is inside her 

The set? The DRUMROLL?!",Ankit Shah,10 ay önce (düzenlendi),0
I have gen 3 and my left airpod doesn’t play do you know why?,Ida Bech,6 ay önce,0
"You can't pause YT short's with a click.. ""it's a feature"":",Shazzshank,8 ay önce,0
Is it extra to work in Napa I bet ,Ninth Reign,10 ay önce,0
You do so much livestream in the YouTube channel today,Ravi Mahli,10 ay önce,0
It looks like Snoopy.,walang intro-intro,10 ay önce,0
"No one uses usbc, apple trying to start a fad that isn’t there.",Jared White,10 ay önce,0
I just bought these today,Jesus’s right CHEEK,10 ay önce,0
thanks for this,Lily Uzunovski,10 ay önce,0
Who else is watching this with AirPods on?,guhnun gang,10 ay önce,0
1:47 that’s what I was thinking,Jacob Tran,8 ay önce,1
It looks the sam... similliar!,iamArslan,10 ay önce,0
,Courtney Taylor Makeup,10 ay önce,0
,JiTU kumar,8 ay önce,0
They look too big for your ears,Hayley,10 ay önce (düzenlendi),0
Ur running was awesome though,Akshay Sharma,4 ay önce,0
they look too big for your ears,200009rahul,10 ay önce,0
Not an offence.. just for info what is your age?,Jason Rider,10 ay önce,0
Why doesn’t it have noise cancellation??? I work around loud noise and it’s hard to listen to my podcast…,MatchUp1,10 ay önce,0
Wow iJustine looking good,Никита Жидков,10 ay önce,0
Wow.,Star Boy Atlantian,10 ay önce,1
mine come in tomorrow and its raining in SoCal :(,R-1,10 ay önce,0
but can you comfortably lay on a pillow; that is the real test.,Joseph Glover,10 ay önce,0
My dream,Sehiru Virash,9 ay önce,1
Wait it doesn’t have noise cancellation ?!,Hope,6 ay önce,0
Omg ️‍️‍️‍,Приключения Троицы,10 ay önce,0
Cool,Lucky Roy,10 ay önce,0
You forgot magsafe,enzo frnt,10 ay önce,0
What is that big ole charger on the desk?,Cesar Aguilar,10 ay önce,0
PLEASE UNBOX NINTENDO SWITCH OLED :D,watqzz,10 ay önce,1
PLEASE UNBOX NINTENDO SWITCH OLED :D,watqzz,10 ay önce,1
actually spatial audio is not that cool and even the airpods pro sounds really flat,Peter Henrique,10 ay önce,0
It’s way to big for my ears,Bunny_Listens,9 ay önce,0
Cute tatoo,Ga Salah Makan,10 ay önce,0
Lol that's a long stick. That's what she said,Wargod Films,10 ay önce,1
Coooooooollllllllllll,Alvaro C.C. 5/7/2006,10 ay önce,1
Apple fan girl,Abrarul Karim Adib,10 ay önce,0
sound proof?,Sydney Danielle,10 ay önce,0
The next day every bozo at school finna flex this lol,MiscGG,10 ay önce,0
1:46 thats what she said,Cry Me A RiverR,10 ay önce,0
Already getting them hahahahahhaH,Andrew Rodriguez,10 ay önce,0
"Dolby Atmost Spatial Audio on Apple music sounds like shit. The Spatialise Audio is much better or Spatial Audio for movies and videos is excellent, but the Apple Music thing makes songs sound so bad. The mixing is all off and volume fluctuates. Idk how anyone can listen to those versions. Anyways, back to Spotify, since my Apple music free trial is ending lol.",Liam,10 ay önce,0
1:46 thats what she said,kris-08,10 ay önce,0
,Dary David,10 ay önce,0
very good,nuii246,10 ay önce,0
Did anyone get the apple polishing cloth,Ethan Tsai,10 ay önce,0
Why do you use the stupid AirPods will damage your ears use AirPods Max they are not much risk as these AirPods,Win10 fan,10 ay önce,0
Oled switch ??,Jorge Hernandez,9 ay önce,0
Ok but which is better this or apple he?,Chikis,10 ay önce,0
hi justine can you give me your old airpods thank you,Cathy Dennis,10 ay önce,0
Plot Twist: Justine brought the new AirPods Generation 3/Three because she wants views on her YouTube channel to get money.,Kaden🇺🇦,10 ay önce,1
2:13 thats what she said,Jeveet Soibam,10 ay önce,0
thats a long stick.,TotalySid,10 ay önce,0
Please do giveaway,Do Ruatkimi,10 ay önce,1
i bought them,kenan,10 ay önce (düzenlendi),1
Do you get paid by Apple or do they send you free stuff because your channel is 50% Apple promotion,Jacob Pratt,8 ay önce,1
My Christmas present is awesome,HpMaya,9 ay önce,2
I don’t like how they fit,Amaiya Starks,4 ay önce,0
Good contained,sanket Gautam,10 ay önce,0
Airpods pro  forever,intasam156 intasam,10 ay önce,0
I want these AirPods generation 3 is better thank AirPods pro,Karrie Temple,5 ay önce,0
Junk. I absolutely hated the original ones without the rubber tips. Could never bench without the damn things falling out.,Bill,10 ay önce,0
Wow,Porkchop,10 ay önce,0
Wow,Jenna Taleb,10 ay önce,0
How is the bass,Drago,10 ay önce,0
Omg girl u look kinda  like margot Robbie  haha,Kevlar W,8 ay önce,1
Airpods3? pro?,Doomer Wojak,10 ay önce,1
Nice,sunny simmons,10 ay önce,0
can you play acnh again ,Clickbait Vinnie,10 ay önce,0
She is overacting. She acts like it is her first time hearing Special Audio.,Joe Robinnette Biden,10 ay önce,1
,Nazanin Rahimi,10 ay önce,0
Why her hands look old @4:29 . Baby u need to use more lotion on them to bring them back to life  lbs !,Javon A’Mari,10 ay önce (düzenlendi),0
Good,LEE CHIN LEONG,10 ay önce,1
This is worth investing,Asian Sensei,10 ay önce,0
Nice Justine ,momo sasa,10 ay önce,0
You’re 37 years old ???,You Tube,10 ay önce,0
the plastic looks bluer,conekid,10 ay önce,0
great vdeo,Namashivath Saravanan,10 ay önce,0
Hey Justine what's up!?,SABARISH VG,10 ay önce,0
"""*NEW*""",Lonk,10 ay önce,0
She would’ve been a  A millionaire if she didn’t buy all those Apple products and other electronics um just saying,Vhgvhig V,10 ay önce,0
,Nuwen Sarathchandra,10 ay önce,0
Hey I’m from Napa valley too! ,Gameel The Second,10 ay önce,0
Super,Yerli,10 ay önce,0
Is Justine married?,DLAROC,10 ay önce,0
good,Ali m k,10 ay önce,0
,Nadir Bouba,10 ay önce,0
I just like that they don’t have the stupid rubber tips,Kevin Donis,10 ay önce,0
just buy the pro guys please dont buy these its so pointless,Mikey Estrada,10 ay önce,0
With what where u filming outside,Best of Cars,10 ay önce,0
"Your energy is so awesome! i had a really bad day and im dealing with a huge burnout from my work, but watching your unboxing videos of new fresh apple devices brought some light to my mind.. Thank You @iJustine for being so awesome!",Sam Invest,10 ay önce,35
Hey hey you can ask IJ ,dweem2009able,10 ay önce,0
Can I have your old ones,Lila Rowe,10 ay önce,0
Waitttt no cases?!?!,OMGiGi,10 ay önce,0
They look painful.,jt lu,10 ay önce,0
अगर महानता प्राप्त करना चाहते हो तो अनुमति मांगना बंद कर दो .,KISHAN TALKS,10 ay önce,0
thats a long stick sounds kinda sus,ShadowSpade_ Z,10 ay önce,0
The reviews are very superficial,Sayan Das,10 ay önce,0
Meme you are so beautiful,Ameer hamza Ameer hamza,10 ay önce,0
I got theses today,Avanni,8 ay önce,0
How do you like them.,Krishna Singh,10 ay önce,2
Kind of early huh  ,Emmanuel Rodriguez,10 ay önce,0
The fake excitement is really obvious this time !!,TECHNO GURU,7 ay önce,0
"""And ye shall know the truth, and the truth shall make you free.""",ourforgiveness *com,10 ay önce,1
Wow,Syahmi azli,10 ay önce,0
I hate how they fit :(,eminemlova12,7 ay önce,0
No ur just overreacting that’s all,Sam,10 ay önce,0
"I hear you!  :P.  :). Did anyone ever tell you you look like Maureen McCormick?   :). Now don't ask me to Ginger or Mary Ann that, cause you already know the answer?  Shhhh.   You are so talented, who knew!   I knew all along ! :)",greg bradford,7 ay önce (düzenlendi),0
Do video about APPLE POLISHING CLOTH…!!,Asad Riaz,10 ay önce,0
How mutch did cost,Inana B,8 ay önce,0
"ओके, धन्यवाद ",Paise Vasool,10 ay önce,0
SWITCH OLED Justineeee,Gabriel Gonçalves,10 ay önce,1
Can you make cooking videos.,Ilvars Ņikitins,10 ay önce,0
Hi i love you,Leon Zavia,10 ay önce,0
I have it,Ali Al Dahmani,2 ay önce,1
look at that little stem! yikes,Kurtis 45,10 ay önce,0
Yes was waiting,M. H. R,10 ay önce,0
I thought u liked long sticks ,aby rocky,10 ay önce,0
Gracais cariño a love,Jennilili,10 ay önce,0
"Do iJustice, just cut the crap",iTry,10 ay önce,0
"What crap, Samsungs ones are wayyyy better",Moon Walk,10 ay önce,1
I like your eyes ,Mokakiller91 Gamer,10 ay önce,0
There is nothing to be excited... Why are you so?,BadBot Studio,10 ay önce,0
Nice review Indians hit like here,Vidya Prakash,10 ay önce,0
After back to back exclusive vedio,Maan rawal,10 ay önce,0
Over exaggerated,Raju bhai,10 ay önce,0
You so rich,Josie 3B 8,9 ay önce,2
Calm down,duke togo,10 ay önce,0
Hi just asking I Justine you probably won’t see this but have you climbed snowdon (wales),Marcus King,10 ay önce,0
didn't guess.. I just saw the title...,ImDudePRO,10 ay önce,0
"I 
Iike 
Your 
Smile",Jan Edcel Bagasbas,10 ay önce,0
Hello Justine whats up,Yosef,10 ay önce,1
зачем все это,bossmatsymoto,10 ay önce,0
️️️️️️️,Hussien Alsafi,10 ay önce,0
Please gift me one i phone  you are so rich girl,Manoj Sharma,10 ay önce,1
Why the hell is she single,Austin Garvey,10 ay önce,0
You’re ALWAYS overdramatic.,Steven,10 ay önce,0
:),Dimitris Christou,10 ay önce,0
U look like kissa sins,DJ,10 ay önce,0
Beats are better ,mingo328,10 ay önce,0
Where's MKBHD,Abdul Majeed,10 ay önce,0
Huh..nice ,Agent父Clip,10 ay önce,0
Are day design to not fall of your hear like the old ones,Juan C Badillo,10 ay önce,0
you know apple is flopping so bad when the general pubic doesn’t care as much when they release new products ,hi,10 ay önce (düzenlendi),0
apple is bussin istg,jsismdiss,10 ay önce,0
Is she 40?,•,10 ay önce,0
Jast apple,pouya,10 ay önce,1
First time this early Yaaaaahhhh,Sierra Gaming,10 ay önce,0
Piano fingers.,Richy,10 ay önce,0
Not me being here early ,Jesus Velazquez,10 ay önce,0
7 from me,Putakka Putti,10 ay önce,1
Mine get here tomorrow,Juancho_pablo_s,10 ay önce,0
Ready to buy this ️ Gen3,Mohd Roshan,10 ay önce,0
Might buy these!,DaguDoi,10 ay önce,0
I want theseeeee,Klara Kuchtová,10 ay önce,1
Loveee From Philippines fan,Kim Anthony,10 ay önce (düzenlendi),0
Hi love your video,Mansoor Alkatheeri,10 ay önce,0
Hey love ur vids and also everyone claim your within the hour ticket,Zayyan’s World,10 ay önce,0
Just get the pros instead,Adrian Dolewski,10 ay önce,0
Damnnn.. ️️,Ansh Singh,10 ay önce,1
️️️,Vijay Sirohi Vlogs,10 ay önce,0
I was thinking of getting these however I have very strange ears so I think the airpods pro would be better for me cuz those would actually stay in my ears,Alex Singh,10 ay önce,0
Nice,Simmy Sekhon,10 ay önce,0
I love you,KANYE WAKE UP!,10 ay önce,1
91views… 140likes….,lil brooker,10 ay önce,0
Never this early,Elijah Pierre,10 ay önce,0
oh yessssss,Alekzy,10 ay önce,0
Not cringey at all.,MIGOS MARKLE,8 ay önce,0
I have them,Foggyboy,7 ay önce,0
Are you marry tho ?,Thoon Yati Aung,10 ay önce,0
Who are from india..???,Factopedia,10 ay önce (düzenlendi),1
Brother or sister who reads the comment  May God be pleased with their parents long life ,أميرة الرقص.dancing princess,10 ay önce,1
"Hello, Humans.
In 1923, a jockey suffered a fatal heart attack but his horse finished and won the race, making him the first and only jockey to win a race after death.",T-Virus Terrance,10 ay önce,0
Are you married??,kiͥshͣoͫr,7 ay önce,0
Apple Losless Spatial Audio,Nicholin V,10 ay önce,0
4:31 your hands is so old,John doe (HITS)🖇,10 ay önce,1
Why is shy such a bad actress,Andres C,10 ay önce,0
Bro her hands are really old !,OsoTix,10 ay önce,0
fake emotions,Shayan Kalantari,10 ay önce,0
Early Squad,Mitesh Sasi Magesh,10 ay önce,1
You are a sweety,Atahar Juhair,10 ay önce,0
So dramatic.,TPS Report,10 ay önce,0
Why you try to fake everything and act surprised,Ned,10 ay önce,0
What a useless product.,Haaris Waqas,10 ay önce,0
I like u,جاگو پاکستان سلام پاکستان,9 ay önce,1
So they don’t have the silicone thing anymore???? YEAYYYY i liked the airpods more than the pro,Aisya,10 ay önce,0
"Plus 
   1
Open bracket
     IV",Admin WhatsApp,10 ay önce,0
