text,author,date,like
No airpods comes close to this. Just so wonderful,Victor Omoseh,10 ay önce,17
I like these Air Pods though my ears is oddly shape and they had fell out of my ears twice. But the sound is so amazing and easy to connect. Btw Love seeing you making more videos. I'm not sure if it because of YouTube or not. I haven't been able to see if you made any new videos.,Brandon Edwards,7 ay önce,0
I just picked my ones up and I think they are amazing !! Best purchase I made in 2021. I think I’ll also be reviewing these on my channel ,Ryan Mikael,9 ay önce,4
That is very good now can make video off what is different off AirPods 3 vs Pro with sound good thank you ,Alonso Mestanza,10 ay önce,2
I can't wait till i get them next week!!,Yahir Alejandro Fabre Rubio,10 ay önce,0
As if you stand in the middle of the road to put in your AirPods ,mike’s Gaming channel,10 ay önce,1
"Two apple product videos from Justine in a day

this is a great day for humanity",Blitzar,10 ay önce,9
Can’t wait to get mines,TheSunshine1189,10 ay önce,0
I just got the pros and they are lovely ,Joshua Santhumayor,10 ay önce,1
Perfect to listen the ijustine channel on  YouTube ,Jean-Claude Henriques,10 ay önce,0
Been rocking since the 6 plus camp out with the Volkswagen van tint  love how genuine and real you’ve always kept it. Sending positive vibes,Tino Perez,10 ay önce,0
2:51 when apple no longer gives you the plug so Justine improvised.,Delicious apple,10 ay önce,1
1:46 “That’s a long stick. The real test though— is what’s it gonna fit like.”,J H,10 ay önce,4
"How was the bluetooth audio on the MacBook Pro MAX vs the MacBook Pro M1?  I continuously have audio desync issues on my MacBook Air M1 when using bluetooth audio during playback in Final Cut Pro, but when I use the speakers or wired headsets it doesn't have that issue.  Just wondering if you have ever had that issue with the M1 and if you did does the MAX work better.",MobileChaos,10 ay önce,2
"Yeah I luv it also, the design n sound prefect than the old version",Linp,6 ay önce,0
I am considering getting a pair of these because my pros hurt my ears sometimes but I have read some reports of high pitched buzzing in these when there is no music.  Anybody have this issue?,Brian T Morin,8 ay önce,0
Bought these a few weeks ago and didn’t even realize the box came with a charging cord until I watched this video…thank god I kept the box ,taeminstrash,6 ay önce,0
Okay but what’s the big charger thing? I need that in my life,Calvin Washington,10 ay önce,0
"Lol half the ear-tip sitting out of your ear is not something i would characterise as ""a good fit""",mogolfiero,10 ay önce,30
Love you so much. You are comfort and home vibes to a t,Dallen,10 ay önce,0
Can wait to get mines tomorrow ,al_a_2912,10 ay önce,0
My favourite design special audio I loved  injustine,KISHAN MAIYAD,10 ay önce,2
They look nice!,Albin ;D,10 ay önce,0
I'll buy this on Christmas.. I can buy it now but I wanna wait for my friend to buy it so i can test hahahha,Raph,10 ay önce,1
"""this is not me being over dramatic iJustine"" Not because of my comment earlier I hope. I liked the intro to ""New 16in and 14in Macbook Unboxint"" I like seeing you so happy over a new product.",Sunfrog,10 ay önce,9
Advance congratulations for 7 million subscribers ,Anas AJ,10 ay önce,0
"Just ordered a pair, getting them in Jan ",Kate Rose,8 ay önce,0
Finally I can make the non-pro Airpods figure.,Spiffing Pepe,10 ay önce,0
Well That looks like a long lasting portable charger ; I Seriously want one now!,alida flus,10 ay önce,3
"@2:23 yep! That’s exactly what I hate about ear tips on IEM’s. Every time I smile, the seal breaks. So I got these for every day and keep the Kaiser Encore for ‘real’ listening when it matters ",Millaray Morales,10 ay önce,1
This video has me hyped! Can’t wait to get mine tomorrow!,miko foin,10 ay önce,0
I really want them to make the AirPods Pro in the cool colors of the iMacs.  I would love some rose gold AirPods.,shelbypink1,10 ay önce,0
This airpods 3 feels big on my ear too.. debating to keep this with the 2nd gen :( what do u think ?,winterhappy25,8 ay önce,0
Is it a coincidence that at the apple event when they announced airpods three and said “whether your listening to Lizzo or….” A clip of her singing played saying “all the rumours are true” coincidence? I think not. Because they rumours are true!,Almighty NZ,10 ay önce (düzenlendi),9
"I got these to replace my 2nd gen ones, but they hurt my ears and they don’t stay in very well. They sound great, but I’ll have to return them. ",megan black,10 ay önce,0
"I tried the AirPods 3 at the apple store. I honestly don’t really like the fit. They don’t really go into your ears very much because they’re a lot bigger. The original AirPods fit my ears great, but these ones feel like they’re too big to even go in my ear. But I was like Justine with my reaction to the special audio, it’s really cool!",Bendy,10 ay önce (düzenlendi),0
"Had to return my AirPods Pro back in 2019 cause they hurt after ~4 minutes, really crossing my fingers that these ones won't have the same issue!",john,10 ay önce,0
Glad to see Apple's marketing department isn't hurting.,SparkyFister,10 ay önce,0
Cool! Thought the case have same size with AirPod Pro,Mohd Amri Razlan,10 ay önce,0
Offlate Justine has just been simping to everything Apple have released....hard to trust the reviews IMO,Nithin Harish,10 ay önce,3
i had mine for 3 days now - definitely prefer the pros over the gen 3’s,Jon Stroud,9 ay önce,1
"seriously, what i love about ijustine video is not even about the product, its more like im curious about her ""extra"" reaction on every little stuff its entertaining :))",cxsaga87,10 ay önce,0
i wait for your review on every apple product before buying hahaha,Chris T,10 ay önce,0
Just got my pros and I couldn't imagine not having noise cancellation and transparency,Trevor Hillier,10 ay önce,1
"AirPod gen 1 & 2 feel like nothing is in your ear . You can forget you have them in .
If these aren’t as comfortable as that then I’m selling my pros & getting gen 2 again .",RauL,10 ay önce,0
Does anyone else think spatial audio isn’t even that cool? I’ve used it for a while now and I don’t think it’s worth that much of a reaction.,Horizon301,10 ay önce,8
Absolutely magnificent,Zamir choudhury,10 ay önce,0
Just got them and I LOVE THEM! They are SO comfy,Susana F,10 ay önce,0
Is the sound quality better In this ones than previous pros,BTS IPURPLEYOU,10 ay önce,2
Wow today is really going to be an apple product review binging day ,Ashwath Singh,10 ay önce,2
“As some of you guys might remember” girl I’m still using them,speaking the word of truth,8 ay önce,0
I've never purchased any AirPods since they came out with the first gen. Should I go for the Pros or the new gen 3?,Queena Sterns,10 ay önce,3
"If you don't use spatial audio, are they worth it over the second gen?",Jerry Wanda,10 ay önce,2
Justine with ant new apple product: this is AWESOME! ,Kevin Martinez,10 ay önce,0
It’s weird bc they feel SO big but they stay in super well,Ben Clouse,9 ay önce,0
"Sounds like a good upgrade from the 2nd Gen but the pros are great! If you’re thinking of getting AirPods, get the pro.",LENalfaro,10 ay önce,0
"Me with my tws i12's,
I'm going full on apple next year iphone, airpods and all.",Botlhale Mashiane,10 ay önce,0
"“That’s a long stick”
Don’t say it
.
.",AdamA,10 ay önce,12
"I am not into tech but just love watching ijustin,marques brownlee and mrwhosboss",Rojitha herath,10 ay önce,0
I love justine! she's so sweet.,The Brandon Lee Cook,10 ay önce,0
i love your videos,Raja,10 ay önce,0
I love how surprised she is when Sony and Sennheiser have been the leading earbuds and headphones for years.  If you want the best ANC and the best audio get Sony or Sennheiser that's just a fact.,SnapRasta,6 ay önce,0
I got my airpod pros in may and I didn’t realize it came with a charger until I watched this ,Kaylen,10 ay önce,0
“That’s a long stick” “the real test though is how it’s gonna fit” “looks like it’s a little smaller” “it’s actually a lot larger” ur editor hates u ,Maki,10 ay önce (düzenlendi),12
Lol when she said this is not me being dramatic ijustine bahahah I just love her ,Ezekiel Lara ASMR,10 ay önce,0
i ordered them last monday and have been so excited for delivery,kittenmix,10 ay önce,0
Damn Ijustine is quick with these uploads. I couldn't even finish her MacBook review. JUST WAITNG FOR MARQUES BROWNLEE to post...,Thin Line,10 ay önce,0
"I got the 2nd Gen. They told me that they feel old, but they haven’t been in my possession for a year yet.",DandyDriver,10 ay önce,0
When AirPods Pro are on sale and actually cheaper than AirPods 3,Manan Kakkar,10 ay önce,0
“That’s a long stick”,Corey Smith,10 ay önce,4
That satisfying snap ,Avery Hosler,9 ay önce,0
i was waiting for you to review these so i can purchase them ,Lovely Jada,10 ay önce,0
I just ordered mine!! MY FIRST EVER AIRPODS SO EXCITED!!:),アニメ先輩,10 ay önce,0
What is the maximum watts adapter I can use to charge it?,Marcus,10 ay önce,0
would love to see airpod app for android,G R,8 ay önce,0
They look so cool and to pretend you aren’t broke lol,Grand Audio,10 ay önce,6
such a good review Justine! ,David Paris,9 ay önce,2
I use AirPods for business. How is the Mic quality compared to the original Air Pods?,Steve,10 ay önce,2
"HATED the Pros, love my Beats, but getting these bc I loved the OGs",CodeXANA,5 gün önce,0
These don’t fit my ears as well as the previous version either. Even though they don’t fall out all the time they do fall out more than the previous version. And yes the audio is much better.,WHIT,10 ay önce,0
AirPods Pro ,NARESH ITYALA,10 ay önce,1
Pros are perfect,,10 ay önce,382
I was planning to get these but this made me wanna get them a lot more,Joud,10 ay önce,0
I have had the AirPod pro for about six months. But I would love to have the AirPods 3rd gen.,Junior Woman,10 ay önce,0
So will there be a magic keyboard and mouse 3?,Parichit Amutha,10 ay önce,0
love that the white background is back!,Matt Magtoto,10 ay önce,0
Remember wired earpods? Yeah sure! It's what Iam using for 4 years now hahahaha.,Milkyboy Galia,10 ay önce,1
The one thing I hated about the pros were that they didn’t fit right so this definitely makes me nervous having bought the 3rd generation.,Corey Schmitz,10 ay önce,3
"Iphone: ""Hey do you wanna setup this thing?""
 
iJustine: ""Yeah I do how did you know?""
 ",Minx Yms,10 ay önce,2
Just remove the buds on the pro and boom!! You got yourself a pro 3,RinzuIsDed,10 ay önce (düzenlendi),0
Can’t wait for mine to come tomorrow :),Duncan Farmer,10 ay önce,0
I recently brought the pros and sending them back for these! The pros constantly fall out my ears no matter the size of the ear tip,Naeee,7 ay önce,0
Great video Justine. I'm going to grab a pair. Does anyone know what ring she's wearing on her right hand. The big gold one?,brian judge,10 ay önce,0
I love seeing unboxings about stuff that I can't afford .,Abdou Magico,10 ay önce,5
I hope they let you try them on the store. Because the original AirPods 1 and 2 did fit but not sure about these. I'm glad they keep making versions without that rubber tip.,Mauro,10 ay önce (düzenlendi),0
"I prefer the old AirPods 1 and 2 for one simple reason,  I prefer tapping rather than touching for skipping songs",H N,10 ay önce,0
Damn it now I have to get them for my friends.,Emmakinz!,9 ay önce,0
"i was actually a little bit disapointed on the fit.. As you said, i really liked the fit of the earlier Gens, but this one litterally took over from the Airpod pro design except for the tip.. Not really slipping out of my ear like the pros but still not as snug and comfy as the orginal design",Theo Alemayehou,10 ay önce (düzenlendi),0
Due for delivery tomorrow. Let special audio commence Big up Justine x,Everyday Techy,10 ay önce,0
"”that’s a long stick. the real test, though, is what’s it gonna fit like”",Joseph Ganbat,10 ay önce,3
She’s living our best life :) ily,Christian Miller,10 ay önce,2
Ahhhh I can’t wait!!,Logan Arndt,10 ay önce,0
I bought them and I like them but I prefer my AirPods Pro,Ellie Lanning,10 ay önce,0
Thought I was going to be first! Lmao haven’t watched the review yet but I’m sure it’s great. Keep up the great work Justine! My pair are coming tomorrow and I’m so excited,brionna95,10 ay önce,0
Only person I trust with reviews on Apple products is Justine and I will only trust her.,Dave_Starling_86,10 ay önce,0
Beautiful! ,Sydney Helton,10 ay önce,3
Love watching stuff that i cannot afford. It’s so painful Lol.,Levi Sumalabe Jr.,10 ay önce,0
I’m glad it’s just not the same look as gen 2. I was looking for a nice review cause I’m still getting them,B Rad,10 ay önce,0
Wish they made tips adjustable size. Cuz it's too big for me,durba -,10 ay önce,0
Over dramatic Justine. That was funny. Thank you for sharing your first thoughts about these. Will you be making another video about these?,ricky v,10 ay önce,1
But can you really enjoy the spatial audio without the noise cancellation. Just saying ️,Aly Arcega,10 ay önce,0
Bro does it do transparency mode and noise cancelation,Uh Huh:3,10 ay önce,3
"Hey, I wonder if YouTube music also support the “spatial audio” or it’s only Apple Music thing?",Estalfi,10 ay önce,0
I love this ,Mario Leonardo Lope Arica,10 ay önce,0
"When you find for your favorite song,but the music be like!  @iJustine",Tejfis Xhemollari,10 ay önce,0
I just got the generation 3s (been about a week)and they sound great but they fall out. I was going to return them and go back to the previous version but I ordered some Tips and now they fit. Still have a few more days before I can return them so I’ll see…,VaigVizion,10 ay önce,0
"I really need that big battery, where can I get it? Thanks  ️",Consuelo Gómez,10 ay önce,0
Can't wait to get mine tomorrow!!  Your hands and nails look really dry and sore so please get yourself some L'Occitane shea butter hand cream and use it every time you wash your hands ,Susan Beauchamp,10 ay önce,4
Justine is finally starting to age,Anthony Roman,10 ay önce,0
Which is good sound quality compare to - AirPods Pro (or) AirPods 3 ??,Vishnu Swaroop,9 ay önce,0
watching and listen with the new AirPods lol,Anthony Hernandez,10 ay önce,0
"So why would someone get these instead of the airpod pros? I get that they’re newer, but are they any better?",Tyler Kihm,10 ay önce,1
Sound is great but they dont fit well just like the other versions,Heidi S,8 ay önce,0
1:46 “That’s what she said”,Joab Shlafmitz,10 ay önce (düzenlendi),3
Eeeee! Can’t wait to get mine tomorrow!!,Jess,10 ay önce,0
okay but the white background is FREAKING AWESOME ,Reece Declan,10 ay önce,2
"Me: “I wonder if iJustine got hers yet and if she likes them”
open up YT
And this is the first video. ",Angelica Keller,10 ay önce,0
Perfect ,Ahsan Hashmi,10 ay önce,0
I'm so excited! Mine will be here tomorrow,Andre Moraes,10 ay önce,0
"To the person reading this: Even though I don’t know you, I wish you the best of what life has to offer ️",Darvin Charles,10 ay önce,4
This is what I wanted them to do. So glad I don't have to were the rubber inserts anymore.,Katie Patton,10 ay önce,0
"How have you found your rendering times on the new MacBook Pro? I can’t remember if that’s the one apple sent you or have you received yours yet? Either way, how fast is it swoosshh ",Keith Heavey,10 ay önce,0
"Pros never stayed in my ear so I
Prefer the old school air pods",Candace Nicole,10 ay önce,0
finally someone who dont compare them to pros whole video awesome,Samuel,5 ay önce,0
do people not know... that spatial audio exists with airpods pro? or am i missing something else here?,Jessie Liang,10 ay önce,0
1st one to comment <3,Mamudul Hassan,10 ay önce,3
The fact that there is lightning port on the case means that there will still be lightning for future iPhones.,Jason Tung,10 ay önce,0
"I’m so impressed, Great!",Zobir,10 ay önce,0
If I have small ears kinda like you should I get these airpods Or the original ones? Would these ones fit fine? I absolutely love your vids btw!!,Olivia Shockley,9 ay önce,0
"So wait which one is better, pro’s or 3rd gen?",Daniel Placencia,9 ay önce,1
Is spacial audio specific to Apple Music or does it also come thru on Spotify?,Z D,10 ay önce,0
"compared to the pros, which ones are the best?",Colby Durant,10 ay önce,0
This so amazing ,Aryan Nathan,10 ay önce,0
Love your video ,THE CACTUS,10 ay önce,0
What about the mic? I would have loved to hear a call recording as the mic is something that bothers me with previous generations.,Black Forest Girl in Oz,10 ay önce,0
i’m getting mine tomorrow i’m so excited,Tah,10 ay önce,0
"i hope they fit, the regular pods fit perfectly, but i have the pros now and its so annoying, i love the sound but they are falling out of my ears every second, i’m always adjusting them.",cloud saro,10 ay önce,0
Oh wow oh! The reaction ,Chancery Olmos,10 ay önce,0
What brand is your contaclense justin? It looks good on you :),Juname Nacilla,9 ay önce,0
"You make me want this item, can’t wait to shopping in online apple store",ink scamenove,10 ay önce,0
That powerbank  maybe a little overhead for airpods but it is nice ,Marius van Witzenburg,10 ay önce,0
Definitely not excited about the new shape. I like my silicone ear pieces. Hard pass. Love the video!!!!! Thank you!!,MountainsNC,10 ay önce,0
"so is the airpods pro still technically better? like, why is this new one priced much cheaper? been wanting the airpods for the longest time now, and i can't decide.",Jennifer Ann,10 ay önce,1
Perfect. I hate the pro...cuz of the buds,mantis,10 ay önce,0
Is it just me or is she giving a nod to Dune with the color corrected blue eyes? If so I love it!,Oneflewover,10 ay önce,0
Sold. I’m getting one. My gen 2 needs an upgrade!,零霊,10 ay önce,0
Spatial Audio is on Beats Studio Pro’s as well  I think the Beats are better than these.,Brandon,10 ay önce,0
Why do I watch these? lol Not like I can ever afford something as awesome as those lol Hard to believe I work EVERY single day and still cannot get a pair of Air pods lmao fml Anywaysssss Awesome Review Justine Love all of your content :D,Douglas Taylor,10 ay önce,0
Looks like it’s always gonna fall out,MT7,10 ay önce,2
"I just received mine and WOW tried second gen and this is 12 times better audio. Fit is really good and sound is the same almost any way you turn them in your ear! SPACIAL AUDIO IS MAGIC!!
Apple TV 4K tvOS 15.1 and hobbit battle of the five armies (the battle) special audio shines.. omg it’s so freaking good! Just go buy them!",Televisjon,10 ay önce,0
She’s payed by Apple to give positives review on their products.,Blah Blah,9 ay önce,0
"Mine showed up yesterday. The only complaint is that the new slick finish and weird case design make it a 2-handed operation to remove the pods from their case; often not on the first try. They have that ""you're not doing it right"" feel when attempting to remove them. So if you're a one-hander, you may not like the case. The sound is so good, but I'd wait for a refinement to these if you don't need them ""today"".",Bob Cozzi,10 ay önce,0
I just got these AirPods today for Christmas and I can’t wait to use them,Naiyah Patel,8 ay önce,0
Mine arrives tomorrow and im so excited :)),Justin Al Mullings,10 ay önce,0
Yay two videos in one day!,Wyatt,10 ay önce,0
So basically AirPods and AirPods Pro fused,Darius Holland,10 ay önce,0
Barbie's Reviews are the BEST!,Naresh Chandan N R,10 ay önce,0
just picked mine up yesterday. They are much better than the old versions. watching all my tech content to fig out the tips and tricks... Thanks,Allen Pleasant,6 ay önce,0
The intro sound ,Pelumi azeez,10 ay önce,0
It’s the shape I like most. Better than all enclosed fits.,ukixyzzzz,10 ay önce,0
Wish I can get that for free ,Sneakers Nstyles,9 ay önce,0
"i firstly wanted to buy the airpods pro but since the case is smaller and they are cheaper, it‘s my new number 1 to buy right now.
thanks for the review and just makind a trip for us to test them :)",yussfuss,10 ay önce,1
"You are the most beautiful content creator on YouTube; I might re-read your book, probably if you could move to Florida we could go out together. 

I will give you some pink roses, who knows I probably marry you!",Embargoman,9 ay önce,0
I.....LOVE ITTT,Lance Stockton,10 ay önce,1
"The new air pods best fits justine so,well",Kalai rajan,10 ay önce,0
I’m watching this on my AirPods gen 3 and I love em,fioooo,8 ay önce,0
So cute ,جاگو پاکستان سلام پاکستان,9 ay önce,1
“Shook”….now that’s a word I haven’t heard in a very long time. - Old Ben Kenobi,Angel De La Rosa,10 ay önce,0
"""Spacial freaking audio...it's working!!!"" LOL",PeopleCallMeCraig,10 ay önce,0
My Girlfriend of 3 years is getting this for me for Christmas can’t wait!!!,Supreme Khi,10 ay önce,0
"Hi, can you please compare the size and shape of AirPod 3 and AirPod pro after removing silicon tip from AirPod Pro.",Aditya Jangid,10 ay önce,0
APPLE SHOULD MAKE A HOMEPOD NANO THAT CONCEALS AIRPODS IN THE MIDDLE OF THE DEVICE THAT COULD HAVE A HIDDEN COMPARTMENT INSIDE. IT COULD BE THE NEW AIRPOD CASE OR ANOTHER OPTION FOR A CASE. IT COULD EASILY HOOK-UP TO A SET OF CAR KEYS AND STORE UP TO 2 PAIRS OF AIRPODS.,kris ertmer,7 ay önce (düzenlendi),0
Can't wait together these tomorrow,Shot on My Iphone,10 ay önce,0
POV : you just bought these are you’re seeing if they’re good,Janet Kamara,8 ay önce,0
I love  you JUSTINE… from Iraq 🇮🇶,Essa Dheyaa,10 ay önce,1
at least both the AirPods gen 3 and AirPods pro have MagSafe case,Naveen Gupta,10 ay önce,0
nice Goal Zero cameo,William Torres,10 ay önce,0
Her videos are so relaxing,Mr.pickle,10 ay önce,0
"I too am an Apple fanboy , but please review the new products rather than just praising them , Watching your videos since 6-7 years so just felt like commenting my thought",Subham Khetan,10 ay önce,1
Cool cool this is amazing. What’s more amazing is we have the same birthday and the animal crossing switch was released on our birthday,PsychoGlock,10 ay önce,0
Watch this with AirPods 2 ,EX,10 ay önce,0
️,Dixit Jasra,10 ay önce,0
I just ordered my grandson the car pod pros thought they were the newest ones?  He had the 3 on his list so I’m confused and the 3 were cheaper he’s 11,Norine Mueller,9 ay önce,0
Fun fact: i bought a pair of fake AirPods 2 and just noticed that they have spatial audio. How is that possible?,Olle’s filmmaking,10 ay önce,0
"Getting minę delivered tomorrow, can’t wait",Fufka the blue tongue skink,10 ay önce,0
Can be the Spatial Audio used with Spotify? Or uniquely Apple Music?,Tomás Villalobos,10 ay önce,0
What an actor you are .,Raju bhai,10 ay önce,0
"Your ear canals themselves aren’t oddly shaped, it’s the AirPods. I feel like no one’s ear canal is shaped that way",SinJon,10 ay önce (düzenlendi),0
"On the first day of Christmas my true love gave to me, a pair of AirPods 3",Max Milizia,10 ay önce,2
You should go fully gray. You’d be even more stunning.,Michelle C,10 ay önce,0
Lol she’s always so excited to try new products. Same same.,Ponskippa,10 ay önce,0
"Whenever I see the Airpods collection I think of the three minions
Airpods First gen is Kevin
Airpods pro is Stuart 
And Airpods third-gen is Bob",Arinjay Urs,10 ay önce,0
Justine is feeding us content WELL,KHVLIL,10 ay önce,1
I always come to your channel before i buy something new,Jo H Photography,5 ay önce,0
Beautiful :),Estudiante Isaac,10 ay önce,2
i watched your iphone se 2020 before buying my iphone and now i’m watching your airpods review before buying them:),abigail palmater,9 ay önce (düzenlendi),0
Yasss ma’am werk ,CorofCor,10 ay önce,0
"I like these just got them , haven’t never had AirPods really need them for work , will keep them for a while , I know they don’t have noice cancellation but they’re better then nothing plus it’s a good start ",Anthony,6 ay önce,0
Idk how to feel about these but.. lowkey just gonna wait for the pros 2 next year ( rumors ).. but on the other hand the 3rd gen of AirPods they go hard,KevinTheGoat58,10 ay önce,0
"At this point I‘m sure iJustine is a real android set up by Apple for product marketing purposes. Is there any Apple product, she‘s even a tad critical about? And I‘m an Apple user myself asking this.",Silent Rocco,10 ay önce,0
Okay okay we know that these are the best ones Apple has ever produced. But who asked you to do overacting?,Rai Ahsan Asfandyar,10 ay önce,0
""""""" let's pray for those people who doesn't have food to eat on lock down and for corona patient """""" ️️️",Ajay Gaming,10 ay önce,1
LOVING THE WHITE WALLL BACKKK AGAIN,Zexxo,10 ay önce,0
If only they had ANC ,Keshara A,10 ay önce,0
"So beautiful... I mean the Airpods not you Justine, you are beautiful beyond words",TechRank,10 ay önce (düzenlendi),1
Lots of love from Pakistan ️️,Awais Siddiqui,10 ay önce,0
""""""" let's pray for those people who doesn't have food to eat on lock down and for corona patient """""" ️️️",Ajay Gaming,10 ay önce,0
"New?  If my pros are destroyed I’m buying back pros, no noise cancellation is a no no",Tichaona Nhlangano,10 ay önce,0
Can they actually fit in my ear this time !!?,kendra ♡︎,10 ay önce,0
I got them for Christmas!,Nessa Perez,8 ay önce,0
"How do you get the airpods 3 when apple just released?

You r AMAZING",homework.study. Email,10 ay önce,1
