text,author,date,like
"Happy 23rd birthday hun! I remember being 23, I had my first child. I enjoy your videos and you’re a real one! Enjoy your birthday!",@SharineWalker,11 ay önce,0
Happy birthday Hannah!  loved the video! Can’t wait to see all your content as 23 years old ,@kateshorten9205,11 ay önce,0
Duuude i thought the editing couldn't get better!! HAPPY BIRTHDAY HANNAH <3,@soukainahmaida4002,11 ay önce,0
"HAPPY BIRTHDAY QUEEN!! love you and your videos, ive been watching for a couple years and it’s been so amazing and inspiring to see how you’ve grown, keep up the good work girly and i cant wait for the next one! hope you have the best bday, you deserve it",@brxndx4069,11 ay önce,7
Happpyyy birthdayyy!!!!  I drank water everytime you say capsule and I’m fully hydrated now  This was refreshing to see. It’s ridiculous but I am a willing victim of your repetitive closet clean outs!,@itsooyaaa_,11 ay önce,0
I wish you the happiest of birthdays <3 thank you for the wonderful company through all these years.,@makingorownhistory,11 ay önce,1
HAPPY BIRTHDAY! have a fantastic celebration after such a refreshing decluttering ~,@colleen5236,11 ay önce,0
Happy Birthday Hannah! Have a lovely day! I love your videos! I always look forward to Sundays when you're on! Have a great week! ,@cherylzink3612,11 ay önce,0
"Happy Birthday ICON! I feel the same way about everything in my closet. I just got rid of 4 bags of stuff, so progress!!",@clairelolyeah,11 ay önce,0
"Whenever she posts a new video it just always puts me in a good mood! Also, I’m a real one hehe ",@MaryamShuaib,11 ay önce,0
omg happy birthday hannah!! your videos inspire me so much so thank you️️️,@bellabrune2881,11 ay önce,0
HAPPY BIRTHDAY HANNAH!!!!! I hope that today is a great day for you! <3,@sarahgreen7956,11 ay önce,0
I LOVE hearing you describe New York as home. Makes me sooo  happy,@Piano4life97,11 ay önce,0
Happy birthday Hannah. You are surprisingly beautiful and your beauty is surreal. Your eyes are amazing,@juniorchavesopicassodeyahu988,11 ay önce (düzenlendi),2
"Happiest birthday Hannah!! ️️I love you and your work so much I hope you have a really fun 23rd, sending you so much love and happiness!",@parul8247,11 ay önce,1
Happy Birthday Hannah   Wishing you another great year! ,@brendacramton1665,11 ay önce,0
"Happy Birthday!

Also I thought I would leave a little tip that helps me get rid of things:",@alessiastar2105,11 ay önce,0
HAPPY BIRTHDAY ️ your vids have such cozy and comforting energy ,@BrielleJuliet,11 ay önce,0
"this is the first video of you im seeing and im looking for the other closet cleanout videos now,love the vibe of this video",@kimsky104,10 ay önce,0
Happy Birthday Hannah! As always incredible video!,@errivera98,11 ay önce,0
"HAPPY BIRTHDAY HANNAH!! Wish you all, the best!",@lizaruleva4692,11 ay önce,0
happy birthday! hope you have an amazing day as you deserve it queen ,@plantbvby,11 ay önce,0
i love these kind of vids they motivate me to clean out my closet too lol,@epicaashuu1887,11 ay önce,0
Happy birthday Hannah hope it’s everything you dream of it to be!!,@rileypaul9523,11 ay önce,3
"Way to start my another year on this fcked up world productive, cheers to us Miss Hannah! Happy Birthday!",@user-hr7vt7wp4j,11 ay önce,0
Happy birthday Hannah I absolutely love your videos ,@myahasarah507,11 ay önce,0
Happy Birthday you gorgeous queen! <3 Love your videos as always!,@ellielink9444,11 ay önce,0
Happy Birthday!!!! Love the vid (((: decluttering is always great,@heatherc5434,11 ay önce,1
Happy Birthday Bestie!!! Sending you lots of positivity!!,@Dana-fn5zt,11 ay önce,0
i’m gonna show this to my mom to convince her to have my own room ,@samiaosmanoriginal,11 ay önce,0
I have this issue! You never know when you’ll need or want something after you throw it out.  I definitely need a closet clean out though.,@morganvalentine6692,11 ay önce,0
"HAPPY BIRTHDAY BESTIE 
also you stopping everything to take a call from your friend who needs you? we all need a friend like you ",@kendallfarr9357,11 ay önce (düzenlendi),0
Happy Birthday beautiful closet clean out  Queen!!!,@christinchri,11 ay önce,0
happy birthday hannah!! im so glad i found ur channel years ago while i was figuring out college life.,@rubyavila904,11 ay önce,0
"Happy bday, to my favorite girl on YouTube! You are amazing, Hannah! I wish u so many good things! You deserve to achieve all your dreams! Love u ",@samybarcellos3522,11 ay önce,0
"welp gime for me to go cleanout my closet too ️ i’ve been putting it off for a while but i’ll take this video as a sign HAHAHA also, HAPPY BIRTHDAY HANNAH!! ",@trixiasharmaine4510,11 ay önce,0
"Happy birthday, Hannah! Sending lots of love ️",@Laura-zy8uf,11 ay önce,0
Happy birthday Hannah!!! Hope you're having an awesome day ️️️,@salleycat,11 ay önce,0
"happy birthday Hannah️ we love you, I love you have a great day queen and I already cannot wait for your next video",@barbaraberezowska397,11 ay önce,0
"Happy birthday Hannah, I'm a big fan of you and I have watched videos for a long time. I' m also happy because of the development of your channel",@ThuyBui-pb9tn,11 ay önce,0
happy bday hannah!!! love u sm i hope u have an amazing day. gonna be watching this vid as emotional support while cleaning my room <3,@joafrz,11 ay önce,0
"Hahah first time seeing your content and it’s so good!!! I was cleaning out my closet and I’m going thru the feelings. Like why have I kept these things thru multiple moves, relocations and weight fluctuations? I’m done hahah",@AL-gh2zz,6 ay önce,0
ahhh i needed inspiration to clean out my closet!!!!! love to see it,@Hollymodz,11 ay önce,0
Happy birthday Hannah! I hope you're having a wonderful day!,@hockeychick127,11 ay önce,0
"Getting rid of clothes is so hard, I always end up thinking there's gonna be a day I might need a certain piece and then boom, stored and never used again...",@estefaniazila,11 ay önce,0
Happy birthday Hannah   !!!! I hope you've a great day with family and friends,@amnoturgurl9323,11 ay önce,0
happy birthday hannah! u are so beautiful and im still in love with your new hair,@bernadettemary2135,11 ay önce,0
its okay to be a perfectionist and we would watch cleanout vds how many however times u post ... much love<<<<<3,@prisha25,11 ay önce,0
"a day late but Happy Birthday Hannah!!!  hope you had an amazing day, you deserve it ",@jacquelinetaylor42,11 ay önce,0
Happy Birthday Hannah  Hope you are having a wonderful day ,@katerinamarkopoulou6393,11 ay önce,0
Happy birthday queen!! Can't believe how fast you're growing up ,@nataliak.9986,11 ay önce,0
"Happy Birthday Hannah!!! ️‍
You're the best ",@user-bj5zf7rt5g,11 ay önce,0
Happy Birthday Hannah!! Hope you have a blessed day.,@sophierivera,11 ay önce,0
"I have the same Keurig! Told my husband I’m planning to upgrade to the mini plus once it stops working, so I can have a cute colored one that takes up less space. He replied: “I could help with that… ”  He uses it too, so it wouldn’t make sense for him to break it when it works fine, lol. Fun story tho, I found it for free on someone’s curb!",@cabbagecrosby5193,10 ay önce,0
"Between my closet in my apartment, my closet back home at my parent's, my ""closet"" at my boyfriend's....I know I have too much stuff. But every time I go to clean out my clothes, I rediscover clothes and I'm like ""wow! this is so cute"". It's like shopping, but I've already paid for it! Yet, I still buy more clothes. Life's a whirl.",@isabelleong863,11 ay önce,0
Happy Birthday Hannah!!!! Hope you had a great day!,@sairama6392,11 ay önce,0
Happy Birthday Hannah! Hope you have an amazing day   x,@lisaainsley6225,11 ay önce,0
Happy bday Hannah!!! I’m a new fan from Taiwan which is in a total different time zone from you(GMT+8) so I actually watch ur every vid as my Monday morning routine! Thx for ur company of all time love u so much hoping ur 23 become a new best year!!!!,@miak9323,11 ay önce (düzenlendi),0
"Happy Birthday Hannah  
Stay blessed,  Keep Smiling 
We love you
May all your dreams come true.",@parulsingh7683,11 ay önce,0
Happy bday girl!! Love watching your channel!!,@erinjones2013,11 ay önce,0
"Happy Birthday . Spring clean is great time to free you up from too much. Good rule is if not worn this year, it leaves. Also in apt living one item in one item out rule is very sensible. I'm a real one.",@tanithllywelyn6320,11 ay önce,0
Happy birthday Hannah!! I hope you have a amazing day!!,@heavensmith9594,11 ay önce,0
happy birthday!!! im an only child but with ur vids ur like a virtual big sis and ur vids are truly so personal and rly entertaining + comforting and even tho i havent been a fan for long im still so in love with ur vids so happy birthday ur so awesome keep doing what ur doing ,@elphie1834,11 ay önce,0
"HAPPPY BIRTHDAAAYYY HANNAHH !!!!! LOVE YOU SO MUCHHH, AND I LOVE YOUR VIDEOS. YOU'RE ONE OF THE REASONS WHI I WANTED TO MAKE VIDEOS AND ALSO STUDYING MARKETING ALWAYS REMINDS ME OF YOU LOL ",@MuskaanAroraa,11 ay önce,0
HAPPY BIRTHDAY QUEEEN  PS: I‘m A Real One! And will I watch This Video again Tomorrow to clean out my closet with you? Absolutely! ,@sarahs.booklove7232,11 ay önce,0
Happy birthday queen!!! I love your videos so much ,@ultimatecalming,11 ay önce,1
"happy birthday hannah!! I’ve been watching you forever, love u so much!!!",@valecorzo183,11 ay önce,0
HAPPY BIRTHDAY HANNAH! I LITERALLY BINGE UR CHANNEL NO JOKE. ,@alexarafferty7995,11 ay önce,0
I’m unironically so happy Hannah got to spend her birthday at home with her family. I spent my 20th alone last month because being away for college sucks lol.,@andrewmiddleton5773,11 ay önce,1
Im late watching this.. its Wednesday but HAPPY BIRTHDAY HANNAH ...  I hope its great... and you deserve all the happiness you have in you life right now I love watching your videos.  also im from pa too lol.,@stephanieenglish8264,11 ay önce,0
Happy Birthday!!! :) i hope you have a happy year and a lot of positive things coming into your life.,@nuchzara97,11 ay önce,0
"happy birthday hannah!! you amazing being, you're such a role model and inspiration to many. thank you for the content, giving me motivation/inspiration, being relatable, and overall being you. once again happy birthday, and i wish you nothing, but the best and much love!!",@lowkeymimiiii,11 ay önce,1
I’m doing this either next week or this week because I’m about to start school and it makes me feel better being organized hah,@katherinegeorge2387,11 ay önce,0
Happy birthday Hanna you are the best YouTuber ever i love your videos your personality is just so good and comforting we all love you and wish you all the best May God bless you and make all your dreams come true just keep going ,@meriemfalek2122,11 ay önce,0
wait wait wait we're the same age??? TECHNICALLY IM OLDER THAN YOU????? (13 days older but still) i am literally still a babie and you're so accomplished  taking you as inspo in manifesting a more stable life in my near future! happy (late) birthday hannah ,@artcadiabaey2086,10 ay önce,0
"HAPPY belated BIRTHDAY!!!!! I just started watching your channel, and I love it!",@jaclynjennings5354,11 ay önce,0
Awe happy birthday beautiful. Hope you have an amazing one and blessed with a lot of wonderful things. ,@celyaguilar168,11 ay önce,0
Happy birthday!!!  I hope you've had the best day and even better iced coffee today!  ,@holleighlooney9615,11 ay önce,0
omg sweetie happy birthday!! wishing you all the love and goodness from brazil 🇧🇷 ️ ily!,@raissafdd,11 ay önce,0
omg HAPPY BIRTHDAY!!!!!!!!!!! back at it with another one of my fav kind of videos and on such a special day??????? PERFECT REASON TO HAVE A PERFECT DAY,@indigobutterflyable,11 ay önce,0
HAPPY BIRTHDAY QUEEEEN! WE LOVE YOU. THE FAVOURITE YOUTUBER EVER <3,@meshvipatel3378,11 ay önce,0
"HAPPY BELATED BIRTHDAY!! Mine is April 26. So cool that we are almost birthday twins!! It is strange to think you are a year younger than me and have your life together lol. LOVE YOUR VIDEOS, I AM OBSESSED",@homecomingBubble,11 ay önce,0
HAPPIEST BIRTHDAY WISHES TO THE AWESOM-EST HUMAN EVER   ilysm queen nd i wish you a year full of laughter nd joy ,@rainclouds8046,11 ay önce,1
Happy birthday to you!!!I wish you all the best in this new chapter of your life,@sylviavalente__,11 ay önce,0
I’m a real one! And happy birthday! Love love these closet clean outs!,@myahenrie5192,11 ay önce,0
So proud of you. Also you should wear bralettes they are truly amazing!! They still give you “support” but you can’t feel them. And if you go to target or Ross they are super cheap,@dennettmolly,11 ay önce,0
"happy birthday hannie, hair = goals <3",@suitelifeofkami,11 ay önce,0
Happy Birthday  thanks for what you’re doing and continue to be who you are  # I am a real one,@f.c.2848,11 ay önce,0
Happy Birthday! I love watching your videos ,@lilanewton8500,11 ay önce,0
happy birthday hannah your channel is my happy place ️,@abbyshields724,11 ay önce,0
Happy birthday Hannah️️️ hope you have an amazing day,@ingridn9449,11 ay önce,0
HAPPY BIRTHDAY BESTIE HOPE YOU HAVE A WONDERFUL DAY!!!!!!,@alexandrakovacs2099,11 ay önce,0
Happy bday been watching you since your senior year of college haul and loved every video since xxx,@abigailwilson6319,11 ay önce,0
Happy belated birthday!!! You're my superhero ,@biancajc,11 ay önce,0
I love your channel and hope you had a great birthday. You are hilarious. Hope you had a great day,@lori929,11 ay önce,0
happy birthday hannah!! wish you just the best ,@fabiennemeier5499,11 ay önce,0
"BRB, running upstairs to clean out my closet!!",@jaeltombaugh7260,11 ay önce,0
"if you haven't donate them yet, wait to donate the winter-y clothes until next fall so they can get put out when people will be wearing them bc most thrift stores don't accept a lot of out of season clothes!",@MaggieRenner,11 ay önce,0
I love this video!! I have to go through all of my clothes and belongings since my fiancè and I are moving into an apartment and right now combined we have waayyyy too much stuff,@jenniferbeaman5356,11 ay önce,0
"Happy Birthday Hannah! 

(Is it just me or Hannah really looks like Bella Hadid in the outro?)",@tamarajovanovic3769,11 ay önce,0
"Happy birthday!! I'm 23 as well! It's wild how time flies, huh? Have the best year!! ",@madisonvilhauer8654,11 ay önce,0
HAPPY BIRTHDAY QUEEN  MY FAV YOUTUBER. I HAVE WATCHED YOU SINCE YOUR SOPHOMORE YEAR IN COLLEGE AND HAVE STAYED WITH YOU SINCE ️ I LOVE YOUR VIDEOS. AND I LOVE YOUR AURA ️ PLEASE. NEVER STOP. FOR US. HAVE THE BEST DAY EVER 🥹️,@saraha.8453,11 ay önce,0
"I feel ya with picking tops to wear with/without a bra. Im flat but I still hate wearing a bra but it doesn’t flatter every top I wear. 
Lovely video and lovely girl x",@proseandcons7730,10 ay önce,0
happy birthday! I hope you have an amazing day. your videos give me life.,@mendlainslie,11 ay önce,0
fun to watch and making a capsule wardobe for home is a great idea- I'm a real one-lol,@Raxx777,8 ay önce,0
"HAPPY BIRTHDAY HANNAH️️️
LOVE YOU SO MUCH ️",@amirasaadaligawish4106,11 ay önce,0
HAPPY LATE BIRTHDAY YOU STUNNING QUEEN ,@laceymarie5942,11 ay önce,0
Happy birthday Hannah!! Appreciate you Queen,@ayomideajala9832,11 ay önce,0
"Happy birthday, enjoy you day and may more blessings come your way!!",@joshuab7109,11 ay önce,0
Happy Birthday wishing you all the love ️I never comment so this is new to me but I got to say I love your content makes my day ,@victorialoveyou24,11 ay önce,0
Happy birthday queen!! Hope your having an amazing day! ilysm and I'm always a real one :) <3,@yarnellsaade6267,11 ay önce,0
love your videos soooo much n happy birthday Hannah!!!!!!,@CheerLiang,11 ay önce,0
Happy birthday bestie!! I hope you had an amazing day ️,@shawna-lynnrussell2703,11 ay önce,0
"Happy birthday Hannah!
I want to know where or how you sell your clothes and if you have any tips on that?",@salma_mio,11 ay önce,0
"Happy birthdayyyyyyyyy, Hannah (again), thanks for the video 🫶. 
Hope you have a great dayyy, love ya .",@janethzavala2070,11 ay önce,0
Happy birthday Hannah. We were born in the same month with you.:)<3,@severussnape5217,11 ay önce (düzenlendi),0
belated happy birthday Elise  enjoy your special day and More blessings to come...mwA,@evergasis9895,11 ay önce,0
"hey hannah, can you please do a podcast of your own where there're no guests...just you... talking about your thoughts and feelings all through the week..cuz i so love you and your voice is very calming... secondly...i relate with you a lot and i think a lot of others do as well... I'd love a podcast ....just you and only you talking about your feelings....aahhh...dream come true️️",@vedanshiawasthi,11 ay önce,0
Happy Bday Queeeeeen! Have so much fun ,@silvinhabruno,11 ay önce,0
Happy Birthday! I hope you enjoyed your special day!!,@mariansegal7209,11 ay önce,0
"Happy 23rd, miss ma’am!!! Hope you had a fabulous birthday, as you SHOULD ",@sofiabekar6450,11 ay önce,0
"I’m 27 and haven’t worn bras in almost six years. Sometimes I joke with my bf that I’ll try on a bra in target to see how it feels lol 
I live in San Francisco and it’s super common all around the Bay Area to be braless even in tanks or tighter clothing. You do what makes you feel comfortable but it’s okay to wear a top without a bra. When I first stopped wearing bras though I remember how naked I felt in public for a short period haha",@kurlykaitlyn,11 ay önce (düzenlendi),0
"LOVE that intro, LOVE your short hair happy birthday to you ",@denisegrandegger345,11 ay önce,0
"HAPPY BIRTHDAY QUEEN you are the most Talented. Brilliant.Amazing.Showstopping.Spectacular. person I know your video are the best. I just want to say, Mommy I am proud of you",@shravirajgor1192,11 ay önce,0
Ima real one. Thanks for helping me do my closet too!,@MsParismomo,11 ay önce,0
you literally describe me with clothes hoarding,@hannah-eg6ys,9 ay önce,0
"Wow, I I finally found someone who gets me about bras and outfits  I don't wanna wear a bra ever.",@nancyher1691,7 ay önce,0
Happy birthday lovely hannah !! ️️️️️️️️️,@haneen3941,11 ay önce,2
"Omg, I remember watching her on 20th and NOW TIME HAS PASSED. HBD GIRLLLLL ",@cacau8076,11 ay önce,0
Obsessed with the green knit cardigan you’re wearing during outro! Happy birthday ,@courtneyclark4890,11 ay önce,0
HAPPY BIRTHDAY HANNAH! ,@Abbyel,11 ay önce,0
Happy Birthday Hannah!!!! Queen!!! I miss you'd old videos !!!! :D,@areejramzan,11 ay önce,1
FELIZ CUMPLEAÑOS REINAAA,@karlaunzuetalopez9130,11 ay önce,0
"Hannah's new edition of ""journey to a become a minimalist""",@hannahm9091,11 ay önce,0
happy birthday Hannah!! i love your videos,@juleslooker2123,11 ay önce,0
Happy birthday beautiful angel!!! I love you so much. Let this be the best day ever. You are amazing and can do anything when you put your mind to it. Keep your beautiful aura. ,@arwenhigginbotham8121,11 ay önce,0
"I'd love to shop in Hannah's closet   just donated most of my corporate attire
Dresscode is no longer so strict. I want some fun things now ,",@petrasacksen598,11 ay önce,0
"Happy birthday ! 
Wish you a successful year and a happy life ",@mys4,11 ay önce,0
"Happy birthday Hannah, I love you so much xx ",@eloisacarter_,11 ay önce,0
HAPPY BIRTHDAY HANNAH!,@dragonfly3466,11 ay önce,0
Happy Birthday. I've been watching you since your Sophomore college what's in your backpack. I can't believe your 24th.  Love you ad your content. :),@anumnabiha8861,11 ay önce,1
Happy birthday Hannah! Have a great day,@fernandaparente1967,11 ay önce,0
Hope u had an amazing bday hannah!,@sojumimi9103,11 ay önce,0
Happy birthday love! also i prob have said this under your other videos but i just think your short hair suites you soo much… looks like imma real one ,@Tina20061,11 ay önce,0
Happy birthday queen!! Have the best day <3,@KatieBeatMusic,11 ay önce,0
Happy Birthday! May this be your best year ever!,@TheLizaanne2,11 ay önce,0
Happy Birthday Hannah!!! ,@LE123LE123,11 ay önce,0
"Heyy Hannah, I'm just clicking on this notification afta 3 hr nap, having a glass of wine now and saying Happy Birthday 2U!! I actually haven't seen any of ur 2022 Vlogs. Happy 2B back& I did  love those holiday ones! Luv Dani from Boston",@danibostonburbs,11 ay önce,0
Happy Birthday!! Have the best day queen ,@emilywillis6283,11 ay önce,0
I have a small closet too!!!!! Wow!!!!! I'm excited for this video girl!!!! Can you tail??? Happy Birthday Beautiful ,@thecozyspot3911,11 ay önce,1
Happy Birthday!! I love these videos so much!,@alana2592,11 ay önce,0
HAPPY BIRTHDAY HANNAH!!! ,@annabarrett1965,11 ay önce,0
I Love the Bra Talk  absolutely feeling it ,@kerstin.mariten,11 ay önce,0
I Love the Bra Talk  absolutely feeling it ,@kerstin.mariten,11 ay önce,0
HAPPY BIRTHDAY HANNAH ILYSM HAVE THE BEST DAY!!!! ️️,@emilyjarvis7155,11 ay önce,0
"Happy Birthday 
You're A Real One ",@becomingsophielivingacelia3522,11 ay önce (düzenlendi),0
HAPPY BIRTHDAY HANNAH!!!!,@abbydyer03,11 ay önce,2
Ohmygod I didnt know we had the same birthday!!  Happy birthday Queen!,@lishaborlongan6271,11 ay önce,0
"Im a real one! Love these videos, never tire of them.",@audrey2879,8 ay önce,0
HAPPY BIRTHDAY HANNAH!! ,@ericaalexandre3221,11 ay önce,0
Happy birthday!!! Hope you have a lovely day ,@abbieshort1765,11 ay önce,0
"Happy birthday hannah>3
U r the cutest person everrr love ya",@palwashacheema3652,11 ay önce,0
"Happy Birthday, Hannah! ",@cameronmitchell9359,11 ay önce,0
HAPPY BDAYYYYY️️️️HOPE UR HAVING/HAD AN AMAZING DAY,@natalia-gd1yv,11 ay önce,1
HAPPY BIRTHDAY SISTER   !  UR THE BEST ,@hackerinconnu5408,11 ay önce,1
Happy birthday beautiful fellow Taurus! I am turning 23 on Saturday! Love your videos ️️,@syrandawileydenavarro657,11 ay önce,0
"HAPPY BIRTHDAY, HANNAH!!!! ",@nathaliaoliveiradocarmo6853,11 ay önce,0
HAPPY BIRTHDAY!! You're a real one,@lucygarcia6659,11 ay önce,0
OMGGG HAPPY BIRTHDAYYYYYYYY  LOVE YOU HANNAHHHH ,@nooraseer,11 ay önce,0
we love you hannah! happy birthday!,@sierra3890,11 ay önce,0
"Just put the hangers in backwards and come back after like 3-5 months. You will see, which clothes you wore, because the hanger is now back in the right way. All things, which are still untouched (because hanger is backwards) you can 'easily' dontate or sell.",@isalenk4822,11 ay önce (düzenlendi),0
Happy birthday Hannah Elise !!!! From another Elise x),@elisefallot5929,11 ay önce,0
Happy birthday! I love your vídeos ,@VitorGomes-nk5gl,11 ay önce,0
Happy Birthday Hannah!! ️,@baileycx,11 ay önce,0
Hi! I hope your feelling amazing when you’re reading this comment! Have a nice day/night,@alice_8626,11 ay önce,1
Happy birthday! Love your videos <3,@silverwordsmith9160,11 ay önce,0
Happy Birthday! I hope you have a wonderful day!!,@victoriasantillan5940,11 ay önce,0
"Happy Birthday Queeeeen i am late cuz of timezone problems but i think its still ur bday in ur timezone so i hope u enjoy ur day to the fullest and give us more ~ content ~ this year 
luv u",@rajanyasengupta2544,11 ay önce,0
"love you, Hannah! Happy birthday",@vedagordon5925,11 ay önce,0
Happy birthday queen ️ love your vids ,@victoriawatine3003,11 ay önce,0
You look so good with short hair like omg,@sanashah6052,11 ay önce,0
Happy birthday  Hannah!!!!! ️,@sadhanacamilasyahoo5752,11 ay önce,0
"It would be great to live in your country and have the opportunity to buy these things, because your style is so similar to mine and I want some of that clothes. ",@Hanna-vi8qj,11 ay önce,0
I have a strong feeling. Kyler(is that his name?). He's definitely going to come back to Hannah's life. Cause he's a gentleman,@anamikamaruthara1514,11 ay önce,0
Happy Birthday Hannah!!,@damarisnatividad4856,11 ay önce,0
Happy birthday  I love your hair that length!,@lmb41,11 ay önce,0
I have the same problem like when i throw away clothes I fell like I'm throwing away something way important but in reallity im not. And happy birthday queen️,@neli1822,11 ay önce,0
HAPPY BIRTHDAY! also just wanted to let you know I made a modified version of your sandwich from the last video and it was VERY good,@Myla1225,11 ay önce,0
"Haha, I love the ""if I need to wear a bra, it's gone"" rule.",@acutelyamanda,9 ay önce,0
I’m watching on Monday but…Happy Birthday Queen !,@marialuizanichetti6691,11 ay önce,1
You should restore and paint your bedroom furniture A different color! Maybe a white? To give your room more brightness!? Just an idea ️,@delsi25,6 ay önce,0
Happy 23rd Birthday   I hope you had a fantastic day ️,@JessieGirl-tm1eo,11 ay önce,0
HAPPY BIRTHDAY!! I hope you have the best day ever!!!,@asteriodskyy4352,11 ay önce,0
Love your intro  and happy birthday!!,@lisavesely2155,11 ay önce (düzenlendi),0
OMG happy birthday girl love your videos so much!!!!,@jessicareddersen7864,11 ay önce,0
"Happy birthday, Hannah! ️",@almostfamousgurl16,11 ay önce,0
HAPPY BIRTHDAY QUEEN!!!! I love you ,@abbymudd6080,11 ay önce,0
HAPPY BIRTHDAY QUEEN!!! ,@jasminnoack3075,11 ay önce,0
So beautiful ️,@thompsonemmanuel6804,6 ay önce,0
"Happy Birthday, Hannah Elise!️️",@hannahmiller4716,11 ay önce,0
"Happy Birthday, Hannah! ",@bohemianfantasies,11 ay önce,0
Happy birthday     beautiful hope you have had a good day ,@kirstybines7199,11 ay önce,0
Same! I feel a big burden is lift from chest and head. It's a therapeutic experience tbh,@meghaathakur6534,11 ay önce,0
Happy birthday Hannah!! ,@jasminekoger4408,11 ay önce,0
HAPPY BIRTHDAY HANNAH!!!,@allanahhughes8851,11 ay önce,0
As someone from Australia I will say you can definitely get rid of the Gold Coast crop sweater,@BethGould,11 ay önce,1
Happy birthday Hannah I love ur videos ,@saraiorozco,11 ay önce,0
