text,author,date,like
Finally someone talking about this because I also graduated a year ago and Omg the struggle is REAL! Also congrats to all the grads you’ve completed such an incredible task no matter the age ,Khalilah D.,10 ay önce (düzenlendi),249
"I graduated from high school in 2018. My sophomore year in high school I made a decision that would completely change my life. I decided to go to a vocational school that my school had the option to go to. I went for welding. Turns out I have a passion for welding. There's just something about laying down a good weld just brings me so much joy. I'm good at my job and what I do. I love my job and my company and my supervisor. I'm so happy that things are finally turning around for me. I've been through a lot in my life. A lot of job hopping bc of a choice that I made a few years ago. If your reading this comment. If you happen to be in a relationship with someone who's manipulative, abusive in any way, forceful with everything, or just in anyway shape or form if your gut is telling you to leave. Take my advice and leave. If they are trying to make you quit your job that you love. Leave. Trust me if I could go back in time, I would've listened to my gut. Life will through you many challenges but you have to know and that you can get through it and you will. I guarantee that you will mke it through. If you ever feel lonely or you feel afraid, look up bible verses or positive quotes. You will make it. You are strong enough, you are beautiful/handsome. You are enough, you are loved.",Mariah Wyant,10 ay önce,128
"Hannah, I am probably one of your most unlikely followers. I am not only old enough to be your mother, I'm old enough to be your grandmother. But you are an influencer to me. What you do for a living was not imaginable when I was your age. There was no internet, no personal computers, no cell phones. We had libraries, typewriters and landlines. But we had the same issues as you do now. Anyone with an iota of humility will always have imposter syndrome. And who isn't tempted to waste the day away on social media or binging on some stupid show? You're doing just fine and you're adorable. Please keep making your content for your peers and us old farts too.",Jeri M,10 ay önce,117
Ok but imagine if Hannah had a podcast  That would be literally a dream come true,Janaína Araújo,10 ay önce,20
I just finished my degree this morning at exactly 11:40am!! This was posted at the perfect time ️,Yusra,10 ay önce,123
I'm impressed with you. I'm a 73 year old retired teacher. I think you have your act together. Good job!,Carolyn Landrum,10 ay önce,58
"have you considered doing a podcast bc I feel like you could make such an interesting one on living in nyc, post grad, your career, your life routines, etc! (I would definitely listen and hope you make one!!!)",Sydney Perkins,10 ay önce,51
"A year ago I commented one of your videos of how scared of not finding a job I was(or something like that) you replied and told me that a lot of people felt like it and that I would figure it out, today, one year later I have a job that has to do with the career I studied and I’m getting not so bad of a salary, I’m not where I wanna be yet but I’m working on itily🫶
(I graduated May 2021 too)",Mayra Rivera,10 ay önce,13
I just graduated two weekends ago (mine was May 14) and the post-grad stress and anxiety is real. I can totally relate to the feeling.,Darklink7884,10 ay önce (düzenlendi),53
I’m actually going to argue that it’s great to go into life without a plan at all and just let life take you wherever,Alexis,10 ay önce,23
"I graduated this past Saturday, and I have so many people asking me what I am doing and the next step. I tell them I'm young, I still have time to figure it out but whatever I decide to do is because I love and want to do it. Def needed to hear this!!",Gesselle Sanchez,10 ay önce,9
I'm moving across the country for the first time ever with my first big girl job (& still in school for my masters online lol) but its so encouraging to hear that you're so happy with your decision to move to NYC. Im very excited and know I'm gonna learn and grow so much so thanks for sharing your experience :))),Natalie Wright,10 ay önce,16
"I also graduated last year with literally no plan in mind. I decided to move back to my motherland that I haven't lived in for an extended amount of time since the age of 11. Those were the best months of my life to date. When I went back, I decided to apply for a masters degree next school year. And while waiting for my admission to come through. I randomly thought well why not just work while I wait. So now I'm working at one of the best hospitals in the Netherlands waiting to be admitted at one of the best universities in the Netherlands while all of this was not planned at all last year. Life is better when you don't plan everything out. You can have dreams, just don't put a deadline one them",Wallflower,10 ay önce,9
"I'm still in university, but sometimes thinking about post-grad life gives me so much anxiety, and listening to you talking about this topics made me feel so much better <3",Isi Draper,10 ay önce,4
I’m graduating undergrad this year after moving universities and taking a gap year. I’m literally feeling all of those emotions. Thank for sharing ,Ella Salvatore,10 ay önce,13
"I'm graduating high school this year and although it's completely different from what you're going through I found myself relating to many aspects of this video. If you ever decide to do a podcast in life I would listen to that religiously, you don't even know how much this video helped to ease my anxiety for University haha",chickenwing,10 ay önce,7
i relate to this so much. i just graduated from college a few weeks ago and i feel like i already have the post grad blues. i’ve been a student for literally my entire life and now all i can think is “wtf am i supposed to do now???” coming to terms with this new identity is hard!,blank space,10 ay önce,10
From a 62 yr old Mom and Grandma- this is great advice/ conversation. Thank you. I hope viewers your around your age listen to it. Sometimes they put too much pressure on themselves.,SueLeeG,10 ay önce,3
To be honest I was already worried that Hannah didn’t posted yesterday.I love her can’t live without her and her awesome videos ,Maria Luiza Nichetti,10 ay önce,18
I will be graduating from high school soon. This video is the literally the MOST useful video I’ve ever seen about college and life in general. Thank you so much for the video!!,Huanqing Li,10 ay önce,2
"I just finished my first year of college and I have no idea what I want to major in. This made me feel a lot better bc I always forget that there is so much time. And that I should not feel guilty for not being on the same path as others. I graduated high school in 2020 and I took a gap year and I've been struggling a lot with feeling almost embarrassed about it, which I know I shouldn't be! But it's hard.",Cindy Castro,10 ay önce,1
okay as a high schooler who's stressed tf out about what i want to do when i go to college- this helped me so much! thanks for this <33,the writer's afterglow,10 ay önce,4
I just graduated college this month and this video was SO helpful!!,SterlsTacos,10 ay önce,2
"I'm a real one!
Thank you so much for this video. As a newly graduate 2022, I mirror most of your thoughts and emtions that you shared. I'm happy that you said so much of what I am thinking. Hopely I'll be able to reflect a year from now, just as you are and see my personal growth and progress",Anna- Maria Williams,10 ay önce,4
"This marks the 5th month since I dropped out of college and I have been meaning to apply to another college but I haven’t been able to find motivation to pen down my thoughts and reasons why I wish to pick the major I’ve been meaning to change to. I don’t know what’s with this video but it has some sort of MAGIC and before I even finished the video, I started rapidly typing these thoughts and reasons down. This is really gonna help with my entry and application for the next phase of my education life, despite already turned 22. Thank you Hannah, for being magical yet so realistic ",Nicole Lim,10 ay önce,4
"Im a real one!!! bruh i was supposed to graduate last weekend but one class that wasn't available in the summer pushed my graduation back. I was so sad about graduating late and I started to think I was failing. I've learned that it is important to take my time. This video was reassuring for whatever happens after college, especially because I already made plans that needed to change.",Ariel Catanyag,10 ay önce (düzenlendi),1
I'm so excited you don't even understand!!! Loving the consistency and how open you are with your fans,Me,10 ay önce,17
"I graduated college in 2011 with a degree in Anthropology, but ended up getting a job at a corporate company right after graduation. Did I end up in my dream job? No. Did I end up learning more about myself and what I like and don’t like while at this company? Yes. And I’m still learning. Thru my various positions with this company I learned that I love training people and creating training material for various learning types. So I found my way into a position here with the company that does exactly that and I’m happy. Was it part of the plan? No. ",Steph,10 ay önce,1
I graduated a week ago from university and I TOTALLY started comparing myself with others who began other chapters and I feel like I have nothing yet. THANK YOU! Your words are so wise and exactly what I needed. ,Sashely,10 ay önce (düzenlendi),3
"I really love these motivational videos, I mean the post-grad, because gives me inspiration of doing my thesis and keeps me motivated of the ""adult life"" after college.",Zelda Skywalker,10 ay önce,1
Hannah this is such a special video for people your age. You're so insightful and kind and inspiring tbh! Even for someone like me who didn't just graduate. This is so important for young people to know. I wish I had a video like this when I had first graduated college in 2011. You really are a real one.,Fraisia Logan,10 ay önce,3
"i graduated last year as well and watching you going through the same thing reeeally helped <3 to anyone starting post-grad life, remember it's gonna be okay and no one's life is the same!! there are literally no rules",Fernanda Pantaleão,10 ay önce,1
you should do a video on how you've made friends since graduating and moving! I've done the same and it's been rough,alaria,10 ay önce,2
I found your channel during my last year of college (2019-2020) and that song you play at the end of your videos always gets me… I feel like I’ve grown so much and I see your growth as well! So proud of us! The sound is like a core memory for me now. Thank you for your videos!,Claudia Guzman,10 ay önce (düzenlendi),5
"I wanted to thank you Hannah, last year I was a nursing student, then I saw your videos and I learned about ""Marketing,"" I had never heard about Marketing as a major - in general I didn't know much about the business field options, mostly because I was in Healthcare. However, I saw your videos, and it really made me interested in Marketing (also other factors), so I switched my major. I will not lie, ot has been quite stressful, because ""bussiness"" is a complete new world, and I didn't had much knowledge about it. Recently I have felt like I should have done all these things already, and that I need to do this amount of things more, and then one advisor telling me to consider Accounting or HR... I don't know, it has been overwhelming and quite sad. You were so right about the ""unsolicited advice."" I don't have a channel like you, or social media presence as a creator, we come from different backgrounds and I probably don't have as much experience or knowledge as my advisors might want me to have, but I have certain goals, they might not be set on stone or have the most clear step by step layout, but I am simply trying my best ! Thank you for this video, for the advice of not having everything figure out, and that that is okay - for the advice of not comparing yourself to others, and that everyone is just trying their best too. This will definitely be my comfort video ♡",Durazno,10 ay önce,1
it’s so fun growing up with people you’ve watched forever ,amanda slozer,10 ay önce,1
So glad I clicked on this video today. I needed to hear this! I've been in such a rut with work and feeling like a failure and honestly I just needed to hear that it's enough. Thank you!,SKenzIe,10 ay önce,1
"Omg I love this video! Such a honest and real talk about starting your own life and yes, pushing past those uncomfortable  things! I love you and your moms saying about growing by pushing past your comfort zone",Rachel Agbi,10 ay önce,1
"I haven't even graduated yet, but I was scared about graduating from university and actually having to operate as a grown-up. I really don't like the current positions many fresh graduates have been forced into. Thank you for the graduating Ted Talk.",TT Moore,10 ay önce,5
"I just graduated from highschool, and I’m freaking out about my major, cause i want to be a full time content creator, but afraid to fail. Just found your channel and I’m loving it!!! You’re inspiring me sm",Valentina Vasconcelos,9 ay önce,0
"The amount of anxiety I felt just listening to you talk about this stuff is unreal, and I don’t even graduate college til December. Change is very hard for me as well but if you can do, then maybe I can do it too!",Amanda Coleman,7 ay önce,0
"Hannah you are so freakin beautiful, I literally can’t stop staring at your eye color and your makeup. I sound like a creepy old man but it’s true also I love your whole speech about “not having your life planned out”. I don’t have a plan whatsoever for my life and it’s very scary/stressful sometimes, but hearing someone else’s thoughts on that is so helpful",abby yates,10 ay önce,1
Hi Hannah I just graduated 2 weekends ago and it is terrifying! Thank you for giving me something to relate to queen. I’m in this weird limbo in between getting accepted at grad school / finding another source of income. You are literally one of my role models Hannah thank you so much for inspiring me with your videos!!,Julia BHS,10 ay önce,14
"Your videos are SO NEEDED. You don't know that, but you help me so much!! Thank you, Hannah!",Letícia,9 ay önce,1
"I’ve officially followed you for approximately a full year so happy for you and I’ve absolutely loved watching this transition for you, you’re absolutely glowing!!",abby yates,10 ay önce,1
"My boyfriend works for a small marketing agency as a marketing strategist, how funny that that’s something you’re working towards ",Sarah N,10 ay önce,5
"Hannah, this is a great video, and encourages me, someone who is old enough to be your mom. Even at my age I don’t have everything figured out. My family recently moved to a new state and I’m still working out what my life is going to look like in this new season.",Laurie Lee,10 ay önce,1
"So relatable. Once you figure out how to stick to your own plan, please let me know. No amount of bullet journaling and planning makes me stick to it.",Violetta Babenko,10 ay önce,1
"A lesson I learned the hard way re: creating a schedule. I made sure I made appointments/deadlines that I can't break. If I don't have an outside force making me accountable, I would never self-motivate. For me it's just a personality trait - I just needed to find a way to manage it that works for me.",Megan Moir,10 ay önce,4
Thank you for making a video about this! I didn’t realize how much I would relate to what you’re saying! (Graduated at the end of 2020),Madalyn Watson,10 ay önce,1
"I love your videos!! It's amazing to see your growth, from your college vlogs to now!!",Kailee,10 ay önce,8
"Thank you for this video Hannah. I just graduated from college 2 weeks ago and, still to this day, idk what I wanna do with my degree. I have an idea, but not a pinpoint job title. But your wisdom and encouragement help me and made me realize that I'm not the only one. I'm a homebody as well and the thought of leaving home one day is uncomfortable for me, even though I love being alone. I'm glad you were in the same boat that I am in today",Deb578,10 ay önce (düzenlendi),3
I loved when you said who ever said that life just gets worse after college is a big fat liar. That was funny. (:,jessica wise,10 ay önce,2
This video is nothing but FACTS. Post grad is such a relief and it’s true school teaches you to teach yourself. Its more about passing classes than even learning anything useful.,Amarie,10 ay önce,0
One year post grad and I struggle with the same thing of creating structure! I work remote 9-5 as a designer so being a creative person structure doesn’t come super natural to me. I see these like morning routines on insta like the really aesthetic ones and I’m like idk man I need 8-9 hours sleep min. ,Karen Emily,10 ay önce,3
This was so good to listen to I’m also a postgraduate just working out what to do next. This helped so much!! Especially the bit about jobs and finding what to do next. ️️️,Natasha Ralph,9 ay önce,0
"Hannah on a blind date with somebody 

Date: “What’s on your mind?” ",Haley Maxwell,10 ay önce,20
"OMG Hannah, this really helps me! I am in my 1st year of 2 yr comm college, and I have to say, that this will really come to handy when I finish. I get a really big relief knowing that life is just going without a plan and that I shouldn't be over-pressuring myself. Love you Hannah<3",yamilet agundiz,10 ay önce,3
I jus joined for my post graduation for community medicine / public health about which many people told me “u can do a lot better … y this ?? “ since I was an above average student … but this jus satisfies me and I can do my best in this course … I had taken another pg course - obgyn - about 3 yrs ago but I had to drop it because it was affecting my mental health and I had to drop out and people were very supportive when I took obgyn but I had to suffer through it alone (with my hubby ) and I took that hard decsision to drop out … remember that I had to pay for my 3 yrs fees while dropping it and it was the most difficult decision I had to take and I would have even graduated this year if I had continued it … but I know that I would never have been the same coming out of that course …. And even my parents were against me to drop the course but i did it and now after joining for public health I can feel myself feeling better and happy … ofcourse pg course means a lot of studying but doesn’t matter to me as long as I am happy and I enjoy it too… I jus thought I had to rant about it ,NIKHILA NANDU,10 ay önce,1
Wish I saw this after I graduated! I graduated college in 2017 and got done with my grad program in 2020 and it still feels weird not being in school anymore! So glad you posted this for those who are graduating this year! ,J E A N N E L L E,10 ay önce,9
"WOW. Not even through and I can honestly say, you nailed it. About passing grades vs learning. I’m 30 yrs older than you and to this day, I regret nothing about leaving college to pursue my sport, which lead to my  job and career. I was in an arts program and just found it a waste of money. Teaching me about ‘creative writing’ when I wanted to be IN the world living life to be able to write about that vs being taught to write. I was about 20 or 21, and it was some of the hardest work I’ve ever done, but the most rewarding and it expanded from there. Then, I went about becoming a certified coach, which was a process. This is why I don’t tell people to leave school, but to know that, like you, if it’s not working, you have to do what you feel is right for your situation and circumstances.",Darkhorse3211,10 ay önce,2
"This video came just in time!
Thank you, I am so grateful we have your channel. It always feels like I am talking with a friend.
Keep up with your journey️
Love you <3",Emerald,10 ay önce,2
"I struggled to find my right path after high school, but now that I finally study what I like and at a school that is right for me, I can't wait to get out and actually work somewhere where I can use the skills I'm learning here.
So I agree with Hannah. Post grad life will be awesome!",tschinkerl,10 ay önce,6
"Im just starting college next month but i still watched the whole thing. You have such a genuine persona and i enjoyed the message you had to share, things definitely do work out the way they are supposed to.",Camila Teves,8 ay önce,0
"I relate to your experience so much! I just graduated in May and moved out a couple weeks ago to a completely new city with my boyfriend. I'm working on building a business as an emotion release coach and have done a lot of social media work for it but I've been coming into a lot of the challenges you've expressed. Watched this video to get other perspectives on what I've been feeling post-grad and it really helped, thank you!",Skylar Sustin,8 ay önce,0
"SO MANY GEMS IN THIS VIDEO! I'm 36 and I 100% agree with everything you said. I love how much wisdom you are sharing with your channel. Great video, Hannah!",Stephanie Rodnez,10 ay önce,2
"I've been here since your college vlogs from 3 years ago!! you've come so far hannah! im sooo proud. I used to watch you in my first year of college and watched you every time since— now i'm one year away from MY own graduation. Would definitely go back and watch this video again when i'm on my own post-grad journey. It was nice spending my early-adult life with you, you indeed are the sister we never hand.",Kirsten Mendoza,10 ay önce,2
"I love this video. I graduated last year from high school and I have had those same feelings but wondering if I should go to college I have had mixed feelings about it, like should I go to make friend and be free or I don't need to go college isn't for everone and I still feel that way. I had a passion music since I knew of it and when it was that time to figure out what was my plans I frozen, listened to other, and then eventually gave up and I don't know where to go on from her i don't want to keep working a 9-5 my whole life. I'm feel stuck. ",Yazzy,10 ay önce,2
"You’re such a inspiration, im coming from sweden and i live alone in a apartment with my cat. I love your chilling videos, when you’re alone. Because I don’t feel alone anymore. So thank you Hannah!",Johanna Carlsson,9 ay önce,0
Hope you create lots of topic like this. It's really inspiring. ️,Thina Paredes,10 ay önce,1
"Love your videos ️ Im graduating from nursing school in Norway in under a month, and starting a fulltime job as a nurse in july!!  Im so excited to be done with school, but omg how scared and nervous i am ",Hanna K.O.,10 ay önce (düzenlendi),1
"I’ve been watching you since the beginning of 2020 and I’ve always resonated with you on your school journey because we are the same age and at the same level in school and I also graduated last year on May 15th, but at the beginning of last year I was also stressed about post grad life but then I found out I was pregnant and it seemed like that was where life was taking me so I let it and now I have a beautiful 8 month old baby boy and I couldn’t be happier. Moral of the story, I think life is going to choose for you no matter how much you plan so don’t even stress about it that much! Also love you and your channel, you’re such an inspiration Hannah",Alyssa Saucedo,10 ay önce,2
Your growth is amazing! I’ve been watching for a year!! Amazing amazing! You can’t even tell you have flourished so much!!,Cassandra Priscilla,10 ay önce,5
"Hey Hannah! I really want to say thank you about talking how it is important to get out of your comfort zone . I gave up on my plans after 24th February as my country in difficult economy situation due to sanctions and etc . That made me to stick to my work that I hate and refuse even thinking about moving . But what if I’ll success no matter what? It’s super scary to try something new and get out of my comfort zone ,it makes me cry lol . But I can’t stay forever in this comfy cage . Thank you for reminding me about be ,you’re amazing !",xunny,10 ay önce,1
"Hannah, you should definitely think about starting a podcast! 
I would loooove to listen to it, and know many others would too 

Much love ",Ásdís Simon,10 ay önce,2
"Wow, I never thought about how every decision we make shifts our opportunities, and not to mention, our view points of our own lives. 
Life is like a guided domino effect controlled by us!",Mary M,10 ay önce,5
Your life talk videos is literally my favorite video out of all your content! ️️,Jochelle Valenzuela,9 ay önce,1
"You're a LIFESAVER Hannah!! You always know the right things to say at the right time, I really needed to hear this message being almost a year post grad. Thank you!!️️",Rachael Mellblom,10 ay önce,3
"You would have an AMAZING podcast!!! I love listening to you talk about topics like this! It sort of reminds me of Emma Chamberlain :) you are such great influence on my life and so many others, thank you ",Vanessa Savig,9 ay önce,0
i really connected with what you said in this video... everything that you said is TRUE and 100%. You should make a podcast !,Carita Louie,10 ay önce,1
"I literally love this video and you, what a great way to say everything. I am about to graduate college in two days and I'm like wtf now LOL. I don't like change.",Ariel Rosov,10 ay önce,1
Hannah you did it again. The beginning of your video was just connecting with me on such a personal level. It’s so refreshing to know that I’m not the only one who felt these things. So thank you! You’re awesome!,Anthony Davis,10 ay önce,1
