text,author,date,like
Thank you! Thank you for sharing your post-graduation experience and pros and cons. I recently graduated from college with a Bachelor's degree in Agriculture and right now I am looking for any type of Agriculture job. Thank you!,Stacie Cornell,10 ay önce,1
"I just loved your approach to this topic because it talked directly with my life after gratuation six months ago!! I feel like it was the little push that needed to stop comparing myself (or at least try harder to), because you made really great points here. Thank you for being so honest! Love from Brazil 🇧🇷",Ana Célia Santos,10 ay önce,1
"This video was literally therapy for me. I just graduated last week so I have some ideas of what I want to do, but I don't have a true plan or timeline for how I can accomplish it but this helped me take a moment and slow down since I don't NEED to have a plan or know EXACTLY how everything will fall into place. Thank you for sharing this!",Brielle Skrutskie,10 ay önce,1
I graduated from college this month and the anxiety is real!! Thank you for making this video!,Elena Kellow,10 ay önce,1
"I needed this so much! I'll be graduating in less than a month (June 9th to be exact) and I'm terrified! I had a plan to get a master's degree right after I graduated, but after a serious burnout, I made the decision to take at least a year off. I'm really scared because I still want to move out of my parent's house and get a job but your video made me realize that this fear is a good thing. Also, the fact that my major is in Communications (and I have a passion for marketing) makes me feel like maybe I do have a shot to make it in this world!",Catarina Dias,10 ay önce,1
YOU ARE DOING A GREAT JOB. ️,Renalyn Lorizo,10 ay önce,1
"Welp. This video just threw me straight into a quarter-life crisis. I evaluated my life and how I don’t like where I’m at post-grad and what the heck am I gonna do?  Great content though, it truly provoked a lot of great thought.",Abree Ambrose,10 ay önce,1
"Just graduated about a week ago!! 
Congrats to all the grads out there!!!!
Hannah, I’m so glad I came upon this video because it’s so true. Although I just graduated, but I literally felt the same just before graduating! Just knowing there will be no more exams or group projects was so relieving! ",Dani Altaffer,10 ay önce (düzenlendi),1
Hi Hannah Elise! Thank you for this advice! I'll definitely need it someday when I graduate from community college in 2023!️️,Hannah Miller,10 ay önce,3
Loved this video Hannah! Have you considered starting a podcast? I would love to hear more of your thoughts on things in a longer-form format like that!,laur,10 ay önce,3
The best time of my life came 3 years after graduating. That's when I really started doing what makes me feel happy and fulfilled. Just keep going!,Celia Garrido Solé,10 ay önce,2
"I need to rewatch it when I graduate, love u Hannah ️",Paz Isidora Olavarría Muñoz,10 ay önce,1
"Hannah, I wanna say that all your college videos helped me get through year12 (SNR year of high school) and also made me consider learning a marketing major at TAFE (sorta like high school)",Rose McNamara,10 ay önce,1
"great podcast Hannah, as always tho ,but the thing is, i’ve been having the same problem as you, the one where you said you’re struggling to build and efficient routine and stick to it, so if find the answer to solve this equation and you could share it, it would be amazing and mean the world to me",Duda Rieger,10 ay önce,1
"I have my last oral exam tomorrow and then I am done with school, then I'll have my university entrance qualification (we actually call it Abitur/allgemeine Hochschulreife here in Germany). I am so excited, because thirteen years of school are finally over. 

I will now start an apprenticeship as a tax clerk and I really hope that it makes me happy and that it will be more fun than school.",samira hjr,10 ay önce,1
I'm going to graduate next year and I feel anxious. I found this video really helpful. Thanks Hannah for giving us the advice. I have followed your channel for more than two years. It is amazing to see you grow and come to where you are today. ,Elain Chang,10 ay önce,1
"hannah!!!! I love how you've been editing lately, it feels so much more natural with less abrupt cuts",444lani,10 ay önce,1
Love the message of your video ️ I’m graduating in a year and I’m so scared!,SophieBlack6,10 ay önce,1
"Yay! I’m early, this made me happy and so proud of you and all that you have achieved, keep being great hannah ",madeleine,10 ay önce,6
Loved this video! Thank you for sharing your experience ,Clara,10 ay önce,1
"You're such an inspiration Hannah, your videos just keep getting better and better and your personality is just chef's kiss <3",diannasz,10 ay önce,2
"I really hope you respond to this comment . I clicked on this video after watching your video made in 2020 about majoring in marketing & before I talk about anything else I just want to let you know that I really wish you the absolute best in life & hope you succeed in anything you set your mind on because based off of the two videos I watched I can tell you are a very driven person and I love how passionate you sound when speaking about your career & life. I really admire you. I clicked on your marketing video because I graduated in 2021 and went to CSU to major in business. I have always had an interest in business & was an undeclared business major because I as well had to take and pass general classes before declaring the college of Business. three months into my freshmen year I had to drop out due to a very traumatic family emergency. This traumatic event was going on during the three months I was in college & it really affected my performance in my classes. After I had dropped out late October I had lost hope in what I was going to do with my future & spent 10 months stressing about my future & trying to find other passions of mine. I even thought about going into real estate, but when I thought about myself being a real estate agent with no experience and just a high school diploma .... it didn't spark an interest in me. I am going to start at a community college in the spring because I also love to learn & school is really all I know. I am interested in majoring in marketing because I love the fact that I get to learn about psychology and what consumers really want. I have been doing more research on marketing & almost everything I read or listen to talks about how its a low salary, their isn't a guaranteed job after graduation, how if you want to make money in marketing you have to go to grad school, and just so many more negative things, but I don't see myself doing anything else other than studying entrepreneurship .. which is also not guaranteed to make you much money. after school  I am also interested in marketing with social media, but ive heard that most marketing classes are outdated when it comes to that. I don't know what to do. i don't want to waste money on college for no reason. I stress a lot because I also absolutely suck at math, but again I am only interested in business. while I was in CSU i was enrolled in a study hall for microeconomics and it was nothing how I thought it would be. It also has to do with math and I am scared that if I take it again this time around I won't do well due to the math aspect of it. I always hear mixed reviews & don't know what to do. I don't want a job that I will hate, but I also want to make a good income. I still haven't finished this video because I got excited to comment, but I really want to know more about what classes you took, if you found them difficult for a person like myself, what job did you land after graduation, do you enjoy it ?, and just any feedback you could give me is much appreciated. I am desperate for help. <3",Angie Arena,8 ay önce,0
"Love the advice in this video and was so so needed!! I still have a little bit of time before graduating college but I'm terrified about anything past that (I feel the whole 'school gives me structure' so much) and this made me feel a little better about it, thank youu <33",April R,10 ay önce,1
"This has really helped since I've graduated from high school. I've started my own business and I decided to take a gap year and people have been telling me it's a bad idea. So it just worries me but at the same time, ik what I doing and have a general plan. 

Ig what I'm saying is that your video(s) really help and confirm my thoughts and help my worries",WiggumCopCharger,10 ay önce,1
"I love your way of thinking!! It is really interesting hearing your perpectives. And how you are navegating more trough a gray area, saying that everyones path life is different. And not being like it is this or it is that. Also the chapters part. It is so right, everyone is through a different step of their lives, even if two people are the exact same age. You never can really know all of the process behind someone elses achievement.",hellothere,10 ay önce,1
I am finishing my MSc in June ..and people have been asking me since November what I am doing afterwards and where I will be afterwards. And I realised that it is okay to not know where you will be and what you will do. Step by step!,Maria Nicolaou,10 ay önce,1
"im about to start uni this fall, thanks for like telling me all this :D i dont have any older siblings so this is like almost a big sis life advice thing for me ️",anniewayscha0s,10 ay önce,1
I just graduated this semester as well and it's been v comforting watching your post grad journey!,Molly A,10 ay önce,1
"I totally agree with what you say! Actually, in July 2022 I'm finishing my career in college and I'm very excited to live the process of post grad. I really enjoy your videos!! ",Claudia Rosas Vásquez,10 ay önce,1
You desperately need a podcast! I would stream the hell out of it,Dhristii Chatterjee,10 ay önce,3
One thing I’ve had to do lately with getting things done/motivation is creating deadlines for myself and convincing my brain that that action or project or whatever is DUE that day and I still struggle with it but it’s definitely helped some. I usually make reminders on my phone or put it in my agenda btw,Lydia Willow,10 ay önce,1
What I learned - sometimes the hard way - you make plans and then life gets in the way !,Barbara Scharler,7 ay önce,0
by far one of my most favorite videos of yours hannah; i love love love you talking about this :),Angelina Cinco,8 ay önce,0
I'm graduating from university next March and your words resonated with me. Thank you for sharing,Lea @Japan,7 ay önce,0
"Great video Hannah…..side note, I’m learning so much about editing from watching your videos. ",ABSV,10 ay önce,2
"Thank you for this video, I really needed all that positive feedback while I'm in community college and next year I'll be graduating in 2023!",Cristal Queen3,10 ay önce (düzenlendi),1
"Thank you for touching on this topic, just graduated high school so I’m looking at things from a slight different perspective",Kennedy Kukom,10 ay önce,3
LOVED THIS VIDEO! So much helpful advice ,Georgina Dlm,10 ay önce,1
I just graduated from college and moving to NYC to pursue my dream of being a writer so this video was like highkey comforting to watch,David Kang,10 ay önce,4
I loved this video!!!! I graduate next year and I’m already nervous about it ,Nicole Arnone,10 ay önce,1
"I really enjoyed this video and made me feel more at peace with life. life is tricky and everyone puts such high expectations on themselves, sometimes we forget to just live. thanks for being open and honest, I know its not the easiest",Victoria Samuelsson,10 ay önce,1
"this felt like a podcast! i love it  i literally NEEDED this talk, thank you girl this video helped me more than you know

also I'm a real one ;)",Marissa Hickey,10 ay önce,1
"as a marketing major who just graduated, I really needed this. thank you ",Kimberly Marie,10 ay önce,1
These kind of videos are something I can just relate to,Sophia's Cruise,6 ay önce,0
Thank you for this video and thank you for constantly keeping it real you seem so relatable and like a real person with real life “problems” forever a real one ,Amanda Batstone,10 ay önce,1
I completely agree with point Number 1!!!!!!  Right now I am planning on returning to school to take my Prerequisite classes in science (3 classes I need) for my MS in Genetics Counseling because August 2021 I spoke with a doctor to Medical Students and I LOVED it...and in October I spoke with her through Genetics interest...and she suggested Genetics Counseling...and I did research and LOVED it!!!!!!  So much so that I have an Interview with the GC in her office on June 15th (which I might also see if I can shadow her).  Genetics Counseling is something I am SUPER passionate about and I LOVE the relationship with my doctor!!!!!!!!!,Kristin Anzelc,10 ay önce,1
I was literally just going back to some older videos on your channel for THIS...I just graduated and it's honestly been roughhhh. Thank you for making this video! Love you! :) ,Joia Doiron,10 ay önce,2
Good morning happy Tuesday morning and I just wanted to say that your vlogs is amazing and I loved your channel and you are amazing Supporter and I'm proud of you and your editing is sooo good,Edward Lee California USA,10 ay önce,1
Look at Hannah man so inspirational <3,Chosen Kody,10 ay önce,1
Thank you so much for making this video Hannah. Love you sm,Bertha Fulilwa,10 ay önce,0
"Hey! Hannah. Shreoshi this side. First of all, lots of love & good cheers to you, from India🇮🇳. I'm absolutely in love with the manner in which you talked about the stuffs, that most often than not gets buried within ourselves and is left unexpressed. Though I haven't got a chance to live the Post-Grad. Life. Still, is probably nearing to it and have just 1 yr. to get done with my Bachelors here. Thanks a lot for those honest list of PROS. & CONS. shared. You're amazing! ⚘",The Happiee Wanderer🌻,8 ay önce (düzenlendi),0
I'm a real one and I want a Hannah podcast please ,Bianca.,10 ay önce (düzenlendi),1
your sit-down videos just never missed hitting the right places.,Izzati Khairuzan,10 ay önce,0
you should have a podcast!! you have a really calming voice,zoe t,10 ay önce,2
THANK YOU VERY MUCH FOR THIS INFORMATION  HANNAH,Abdelhakim El-ouazzani,9 ay önce,0
Loved this video so much! Your videos always feel like a chat with a close friend.,Sofia Bekar,10 ay önce,1
"I agree with every word you said in this video. Thank you for this video, it is very comforting and you put everything so well. Very easy to understand. Thank youuuu and I love youuuu️️️️️️",moonchild,10 ay önce,1
You’re just a queen! No other words needed️,Sofia Rivero Perez,10 ay önce,1
"I'm a Real One! :-) It is really good to live in the present and not plan too far in the future, but saving money for the future might be the exception. Do what you love to do, but save a cushion in the bank for the future. I'm 40 years old and I wish I really learned that after my post grad life earlier.",Sarah Crowley,10 ay önce,1
I wish you had more than 1 video in a week:(((you are so great and i enjoy your videos,Niloufar,10 ay önce,1
Your future plan reminds me of Rowena’s career path. She’s also a youtuber and works with a skincare company to create marketing and content.,Kristy Calungsod,10 ay önce,1
"i am a real one! also love this type of content, keep it up. I just graduated May 7th and it is only up from here!",Valerie,10 ay önce,1
Hannah you should definitely start a podcast 🫶,Belu Fernández,10 ay önce,0
"i did a year and a half of college and kinda hated it. i did one semester from home and liked it a lot better but still didn’t love it cause it was all the basic required stupid classes that have nothing to do with my major (which was business at first then “undecided”) i’m taking a break from school rn to figure out what i wanna do and just work. i thought i knew what i wanted to do, interior design, i love building things and putting things together and also designing with interior spaces and i love tiles and things like that ",Emily Jarvis,10 ay önce,1
"I literally love you so much, one day I will come to New York, we'll gonna have that coffee together and talked all the things we can relate too,",SRI's worK,9 ay önce,0
"I f*#%ing love you girl,your videos are amazing,you are such a beautiful soul!!!I am a real one!",Florizë Dragusha,10 ay önce,3
I AM SO PROUD OF YOU,Ria Ojha,10 ay önce,1
Since graduating-ppl think I’m lazy and it’s just that I don’t have anything to b passionate about im trying to find hobbies that really I do for myself and motivates me well c,Brooke Alyssa,10 ay önce,0
"You seem really nice, and much of what you are talking about I can relate, specially the part of struggling with self structure. Can we become friends? Jajaja greetings from Mexico!",Monica Alatorre,6 ay önce,0
it's so motivating!!,Evak,10 ay önce,0
THIS IS WHY I LIKE HANNAH ELISE....QUEEN !!!!!,Nat,10 ay önce,0
I was that one person in the group project that gave a f*** about the project while no one else did.  anyways I'm 28 now and I'm a mom living with my handsome husband. Life is great.,Simple living Slow living,10 ay önce,1
Great video talk - you are amazing ,Judy Tombaugh,10 ay önce,0
"I am actually just 14 yrs old.. but i just love u and ur videos the most than any other utube channel.. and I came to know that we have the same passion... I too wanna do a business, but i'm not sure in which field",Malavi,9 ay önce,0
I just randomly found her channel in my recommendation now i'm obsessed with her videos she's so freaking talented.️,Asmaa vlog 아스마 브이로그,10 ay önce,21
"I sent my comment before the end. Do they still teach/preach the marketing platform: issues, objectives, strategies and tactics? It seemed like an annoying exercise but has turned out to be an amazine tool in all aspects of work and life.",Jeri M,10 ay önce,1
"0:15 speaking of which, why don't you start your podcast, Hannah, it'd be unique, it'd be a life saver <3",*Emilia*,10 ay önce,2
Love love love youuu hannah as usual im a real one of course ️,Haneen,10 ay önce,3
Really loved this videogonna cover all your life talks videos ,Ирина Шайхетдинова,9 ay önce,0
"Hi, Hannah and Happy Monday!. I graduated from high school in 2006 and it feels good that I'm free! YAY!!. And how was your weekend?",Justin Felt,10 ay önce (düzenlendi),1
thank you for saying this. helped a lot <3,silvia pellegatta,10 ay önce,0
I NEEDED this video. Thank you.,Nimra Hassan,10 ay önce,0
nice video very encouraging,Sylvia ValenteOFF,5 ay önce,0
"The vedio is so helpful thankuuu so much hannah ily 
U r literally the elder sister i never had thankuuuuu so much",Jasmine Barbie,10 ay önce,0
I love your conversation video!! Do you have your own podcast? I want,Yooni,10 ay önce,1
Do you have a podcast? If not you should totally start one! You'd be great at it :),Charlotte,9 ay önce,0
"Go on with the freelance marketing idea! This year I decided that only being a part of college wasn't for me. I wanted to go into the field. So I started freelancing as a graphic designer, which has already taught me more about what I want and don't want in my career than school ever could <3 (and yes I am still in school, I do both now)",Fancy Words,10 ay önce,0
"I have my last exam tomorrow. I looked forward to it since what feels like forever, but I also feel low-key empty now.. soo weird",Danique V,10 ay önce,0
You are so right about that.,Danielle Moses,10 ay önce,0
I loooooove these deep convossss,Javinha Granger,10 ay önce,0
"How do you try making new friends? I had a really hard time making friends through school/college because of bullying, insecurities, etc. and I recently graduated. I downloaded Bumble friends, however, it doesn't work that effectively. What can I do to fix this?",kelteatree,10 ay önce,0
"@HannahElise 
2:33 The fact that Hannah was jiving while that car was honking made me lose it. ",nini!! 🥰,10 ay önce (düzenlendi),3
I just graduated from NYU and I’m stressed in the city,Katherine Libenson,10 ay önce,1
PLEASE consider making a podcast. i could listen to you talk for hours honestly,Elise Wessels,10 ay önce,1
Amazing video ️,Zahide Carbajal,9 ay önce,0
Wow. Not me breaking down into tears about external pressures about the way my life should be going. And making me feel unsure if I’m making the ‘right’ move. It’s my life and my choice the way it should go. People can be well meaning with saying something but all it does is make you doubt. “Nobody else is living your life! Nobody else is responsible for your life or your quality of life or anything else but you! You’re just trying to do the best thing that you can do for yourself!” Thank you so much Hannah for this video!!! ,Ashlea Marie,9 ay önce,0
Maybe try out a co-working place in NYC to help with your structure?! I find that helped me a lot as a freelancer,Crimsonio,10 ay önce,0
Love your videos️ obsessed,Diana Vicente,10 ay önce (düzenlendi),1
"please start a podcast, literally the best.",Faizah Sharif,10 ay önce,2
"writing this today because i feel so tired and scared of my future. it is my final year in college now, i'll probably graduate in august (hopefully) and i feel so lost. i'm done defending my thesis it just needs a little revisions but i do not havw the energy to do that. i am jus so tired, scared and lost. :(",ree,3 hafta önce,0
your thumbnails are always on point!,Keosha Cosby,10 ay önce,4
Wonderful video ️️️️️️,Meyer Maged,10 ay önce,0
I am impressed with your videos,Waheeb Olamilekan,7 ay önce,0
You should really start a podcast,Naledi Charmaine,10 ay önce,3
The blank canvas feeling is REAL,Katherine Libenson,10 ay önce,0
RIGHT ON!!!!!!️️️🇨🇦,Beth Sims,10 ay önce,0
"I literally was waiting for you to post yesterday, Sunday, and I didn’t see anything, I’m so happy  you posted Welcome to NEW YORK 2:40, I LITERALLY thought that was my block making that sound, i was already looking out my window ",Kimberly Lemus,10 ay önce,0
The struggle is real,jumoke esther,7 ay önce,0
this really cures my post-grad anxiety. pls open ur podcast,Nicole Li,10 ay önce,0
"Old person input:  This is so spot on!  I relate to this 30 years after graduating.  So smart to recognize that other people's opinions are just that- theirs. Listen, sure, but then do your own thing. I ESPECIALLY resonate with the comment that I rarely if ever hear and that is ""you don't have to not do something just because everyone else is doing it"".  Wise Wise Wise ",Amy Woolsey,10 ay önce,2
One of the greatest videos ever made️,Sofia Rivero Perez,10 ay önce,0
"I havent seen your vids in forever but I want to say, I love ur hair!!!!",Sᕼᘿᒪᗷᖻ ᎷᏗᏒᎥᏋ,8 ay önce,0
IT DOESN'T LOOK LIKE A YEAR HAS PASSED ,비토리아,10 ay önce,0
"i have 32 days left, i literally can’t wait ",angie tuccitto,10 ay önce,2
"I´m a real one kisses from Argentina, South America Hannah. Loooove your channel so much",Rosario Bravo,10 ay önce,0
i love how real you are with your audience ,kawaii gallery,10 ay önce,2
i’ve been waiting for your video🥹️ sending you loads of love from the graduate-to-be in lessa than a monthhhh🥹️️,Kariman Mahmoud,10 ay önce,3
I just needed to hear this today. ,Jael Tombaugh,10 ay önce,1
27 minutes and 34 seconds of happines,Natalie Cáceres,10 ay önce,0
Love it,Ella Amos,10 ay önce,1
Perfect video of the year .,Asmaira Fatima,10 ay önce,0
spoiler alert:  in workplaces you will still be in groups with people who are not super motivated at the task or dont want to be there,Marie S,10 ay önce,4
needed this thank you!!!!!,Devon Martin,10 ay önce,0
"Investing in crypto now should be in every wise individuals list, in some months time you'll be ecstatic with the decision you made today",Englander,10 ay önce,20
Hannah i was waiting for u yesterday ️ did u change the day u ll be posting in or this week is an exception?? (ps: commenting before even watching to see if the answers are in the vid hhh) anyway wee loveeee youuuuuuuu ️,Oumaima Aymane,10 ay önce,1
you remind me so much of rory gilmore🫶 p.s. I love this video !,Nina Minkek,10 ay önce (düzenlendi),1
I would've graduated college if I had the money but oh well thats life I guess lol,Red MJDaay,10 ay önce,1
Amazing vlog,Miriam Ajigboye,7 ay önce,0
You need to add Charlie into your YouTube bio lol,Einav tabibi,10 ay önce,0
I can't believe that it has been a year since u graduated  ,Wolfe,10 ay önce,3
It's called welcome to adulthood in my country. Lol,Joseph Eboseremhen,6 ay önce,1
please do a podcast!,Marie S,10 ay önce,2
"We need to see you w friends, social time.",Barbara Snider,10 ay önce,0
Can you please start a podcast I'm so serious,Elena Kellow,10 ay önce,1
Great video,Crystalmariegee,10 ay önce,0
Awsome job,Kyle Williams,10 ay önce,1
You should reach out to Annmarie Chase. Plz. I would love a collab or even a vlog.,Mary M,10 ay önce,0
u should do podcasts!!!,epicaashuu,10 ay önce,1
"@Hannah Elise 
0:13 Do you know if you are going to start a podcast, if that’s something you’ve ever thought of?",nini!! 🥰,10 ay önce,3
"I will finish my master's in July
I'm so stress rn",Klaudia Pierzecka,10 ay önce,0
"i will gratuat from middle school lol,i feel that i am in the wrong place lool",meriam meliani,10 ay önce,0
Ohhh talk to Margot Lee! She consults :),Karen Emily,10 ay önce,0
"OK school is crazy right now but is that a tattoo on hannah's ""outer wrist""",Janine Manansala,10 ay önce,0
I wonder if you still want to get a masters degree,Wallflower,10 ay önce,0
Thanks for sharing,Gift Adisa,7 ay önce,0
️️,Ronald Roland,7 ay önce,0
