text,author,date,like
“Oh my god I’m having such a lovely day I’m having so much fun”. ️ this is why we all love you and would want to be friends with you in real life Lydia. So glad you guys had a great time. Im in America so thank you for taking us along with you to the Chelsea Show. So beautiful!,NightmasksHaven,10 ay önce,62
"I have loved your content recently. You’ve inspired me to buy more dresses and look at different brands than I wouldn't normally, H&M especially! You’ve helped me take a different outlook on my home life and I’m growing my own fruit and veg this year. I find your content a real joy to watch. Thank you. X",Wendy Gillett,10 ay önce (düzenlendi),42
"This Is Truly Living Your Best Life, Lydia! Reaping and Appreciating the Beenefits of Your Success! I for one am so proud of you, inspired by you  and so very excited for you. Your powerful positive personality in everything you set out to do is Your Super Power! You mindset controls your reality! I just love you! Your big sis in Tampa....lol...",Missy Belmont,10 ay önce,67
"The Chelsea flower show looks spectacular! I loved this vlog, such a beautiful video",Anastacia Leahey,10 ay önce,15
"Your enthusiasm is so joyful, thank you for sharing your lovely day ",ilovemaxie,10 ay önce,12
"Absolutely loved  this Lydia, makes me happy sitting down & and relaxing/, watching this, perfect end to a day ️",Jacq,10 ay önce,22
"My dear Lydia, I am so impressed by the growth and changes in you over the past three + years.  You have grown so much. Cheers.",Diana B,10 ay önce,8
The flower show was  Thank you so much for vlogging it!! Watching from so far away and so I can't thank you enough for letting me enjoy it too  ,Koko C,10 ay önce,3
"Fabulous visit to Chelsea Flower Show, right up my street .. thank you for taking us along Lydia ",Helen Stella,10 ay önce,12
This just brought me so much joy. It has me counting down the days until spring!,Samantha & Brad Eberhart,10 ay önce,1
This blog has been so soothing and inspirational. Enjoyed it immensely xx,Khadeejah Raja,10 ay önce,3
"Would love to see it! Absolutely gorgeous! I must say the UK has the best garden centres! Love from Vancouver Island, Canada!",Trisha Orr,10 ay önce,13
"I usually try to watch your videos as close to the time you post them as possible but lately I’ve been taking Thursdays off with my husband and I have to say, I so look forward to Fridays now when I can just sit at my desk, put my headphones in and listen/watch your lovely videos. They are such a highlight in my work week! ",Tiffany’s Epiphanies,10 ay önce,2
"Whow what an introduction to the Flower Show, didn’t realise there was so much other than the actual design displays.   You definitely died and went to heaven Lydia. Pure “dreamscape”.  Thanks for the video at the RHS xxx",Soo60,10 ay önce,2
"I had to watch this in two parts, so you made TWO of my days brighter! What a fabulous vlog!  Thank you!",thepjtx,10 ay önce,1
It’s a real dream for me over in Australia to see England in the Spring one day and travel to Chelsea for the garden show. Thank you Lydia - your garden looks so amazing btw!,starlightshimmery,10 ay önce,7
"Thank you for taking us to the Chelsea Garden Show, I’ve always wanted to see it and you and Ali look so stylish, your dress is the dream!  ️",Kristin Cheever,10 ay önce,2
Absolutely adored the blue and white “on hold” dress!!! Good luck on acquiring it.  Thank you for sharing the Flower Show with us (sigh). ️,C Thompson,10 ay önce (düzenlendi),3
You are such an inspiration Lydia I love your vlog  !!!! ️️️,Inga Kovalerova,8 ay önce (düzenlendi),1
"Wow.  I think i smiled through that whole vlog.  It was all so lovely.  Thanks for brightening my day.  Chelsea Flower show....OMG.  As you said, so much inspiration.  Thanks so much for sharing.",joanna wichers,10 ay önce,3
"Thank you for sharing the flower show, so beautiful! Loved how you kept saying what a wonderful day you were having  And your pups are the cutest!!",Lynn Walker,9 ay önce,1
"What a lovely video; beautiful flowers, a little glam and a touch of lux    that VCA necklace is on my wishlist for this year! It looks incredible on you, the perfect dainty nature inspired piece ",Divina Agellon,10 ay önce,1
"I totally, totally agree with what you say about home/hybrid working. I hate that some employers are just going back to 'normal' when there's absolutely no need for it whatsoever. Not having to waste money and time on commuting makes life so much easier and gives a far better balance. And for me it feeds my soul to be in my own surroundings and not in a soulless office. So where your job can be done from home and your own situation makes it possible or desirable then it should be made possible by employers.",Jess K,10 ay önce,2
Another amazing vlog x ty x love seeing the fur babies as I have one too x honestly you can tell your living your best life absolute pleasure to watch and see a sneak into your life ty x,Angela Hughes,10 ay önce,2
This festival is absolutely beautiful ,Tara Alston,10 ay önce,2
I just love you!! Only Lydia would say an all white outfit is perfect for gardening. Lol  ,Lacieface,10 ay önce,11
"i love the way your content has evolved!  I have been watching your content on and off for many years now, However, these days l look forward to watching your next VLOG, I love the mix of content and your happiness shines through xxx",Dianne Wheeler,10 ay önce,1
"Was so inspired through this whole video  I have placed 75% of your Amazon buys on my list!

Would love to know where your sage green dressing gown is from ️",Gretchen Pembrook,10 ay önce,1
Your life is like a fairytale. I share the same excitement when it comes to gardening! I hope to someday I have as much fashion sense and elegance as you,Lexi Lawley,10 ay önce (düzenlendi),0
"Lydia,
What a lovely Mother’s Day present  the “ after” is amazing! Side note, my favorite dress was the last one that you wore! ",Ruth Gaver,10 ay önce (düzenlendi),2
"I really want to go to the Chelsea flower  show , I got some good ideas for my new garden when we move in the autumn, you step mums hair is stunning",Debby Townsend,10 ay önce,1
"Thank you so much for showcasing the Gladwell and Paterson Gallery, as when looking up their collection I found my new favourite artist, Jonathan Walker! I also just bought my first pair of Dubarry boots today!",Caoimhe Ní Mhuireadhaigh,10 ay önce (düzenlendi),1
How amazing the Flower show was stunning loved it . ,Maxine Muhammad,10 ay önce,1
Wow it all looks AMAZING!,leahayes,10 ay önce,1
"Such beautiful clothes Lydia, everything looks fabulous  on you! x ",Beverley Roberts,10 ay önce,2
OMG - I went in and tried on the same necklace this week. It’s very pretty and yes they have matching earrings and a bracelet!,Sharyn Beech,10 ay önce,1
Thank you so much for all your varied posts. Love the literature and garden as well as the fashion of course,Sue Krook,10 ay önce,2
My husband is an artist and I just had to show him James Gillicks works. They are remarkable! What a fabulous day!,Melanie Carosi,10 ay önce,3
"I never comment on YouTubers videos, but I have to say you are so charming and engaging, I can’t help feeling gripped by your content. The way you hold yourself with such grace is captivating. I’ve been watching your videos for a long time but finally thought to leave a comment. Thank you for sharing Lydia. Ps your garden is flipping gorgeous xx",Chloe Brett,10 ay önce,2
Good morning beautiful lydia I hope you ali lumi and the boys are well babe it's so lovely to see you again thanks so much for sharing your lovely vlog love your house your garden your kitchen garden your green house and your chic dressing room everything is so stunning have a lovely time at london Chelsea flower show stay safe xxx,Alison Kovacs,10 ay önce,3
The flower festival was amazing ️ thanks for sharing ️️ hugs from Japan 🇯🇵,Martinez Dirce,10 ay önce,1
"We’ve been to the Chelsea Flower Show years ago, really want to go next year now. We live in Devon now so further to travel. Looks beautiful, thanks for sharing Lydia  x",Carolyn Marshall,9 ay önce,1
"I love your instagram and your content, nature, dogs, fashion, trips... your brand is perfect",Cristina Mirabet,10 ay önce,1
Lydia.. I love the green wall color in your bathroom! Your stepmother had beautiful results with her new hair style! Has your hair ever looked bad? You are so blessed with a gorgeous head of hair,Patty Barnes,10 ay önce,1
"Lovely vlog Lydia. Enjoyed the flower shop day with you, and everyone I think dressed elegantly. Well done",AJALA by Funmi Oladipo,10 ay önce,0
"That feeling of gratitude is wonderful. It is a feeling of peace, contentment, love and joy and happiness all rolled into one  . I adored all the Erdem pieces on you, so beautiful xx",Rachel26,10 ay önce (düzenlendi),4
absolutely loved every second watching this!....soooo beautiful in the amazon dresses inspired me to order the green gingham dress ...hair looked lovely and you seemed so calm chilled and happy....loved it xx,Karen Cox,10 ay önce,1
Absolutely gorgeous video as always Lydia you glow with happiness and it makes me so happy seeing you like this you truly deserve it ,Kristina Bell,10 ay önce,2
I've got the smaller checked ginham dress and wow!....its such a lovely dress!..going to take it on my holiday ....thanks lydia x,Karen Cox,9 ay önce,0
Must be nice to do what you like everyday. Love this thank you. Going to buy book about all I can afford lol,Dianne Rowley,10 ay önce,2
Who’s need Netflix when you got Lydia channel....your happiness is contagious.....sending love from the beautiful city of Québec ( Canada)..xoxo,Drouin Johnny,10 ay önce,2
I love the Erdem dress!!  I saw it on Ali’s video and I was hoping you would tell us about it.  Absolutely gorgeous!!️️,GmaMom,10 ay önce,1
"You have no idea as to how much you have inspired me to purchase such beautiful dresses, skirts, cool outs, etc. Thank you for your simply beautiful elegant taste and for sharing with us. Take care my dear.",Auretha,10 ay önce,5
"Definitely share more stay at home dresses. Plus could you recommend some ribbon or affordable belts from Amazon. My daughter is always looking for more options. Thank you Lydia. 
I agree finding that employer who allows women or men to work a few days at home would be a dream job. I do appreciate that businesses are open. Love how you speak your mind.",Ranalynn’s Lifestyle in Hawaii,10 ay önce,0
"I lived in the UK for 25 years and never went to Chelsea flower show, big regret, I did get to Kew gardens last time I came to visit which I had never done and it was lovely ",bcgirl,10 ay önce,9
Thank you so much for such a relaxing and joyful video  Have a wonderful evening ,K S,10 ay önce,4
Living a life you never dreamed you would have  -  and it bring your ‘best life’ makes your heart sing - enjoy it ,Dionne Voller,10 ay önce,0
I've literally been listening to the calming classical music play list on spotify all week. So good for the soul x,Ingrid Hyde,10 ay önce,1
"You truly deserve it , enjoy. All your hard work and love has come back to you",Kathy Kondolf,10 ay önce,2
I love the rocking horse based on Zara Tindall's horse ! The dream is to get one based off our horses.,Aly,10 ay önce (düzenlendi),0
"Oh that's looked so much fun ,I lahvr loved your recent content very relaxed and positive vibes  
From Sydney AUS",Sabreena Sobbi,10 ay önce,0
"LoL!!! I was so into your video I almost missed my study class which I facilitate. I was reminded because my student called wondering if we were meeting  Your videos, life and what you share with us is Magically Beautiful!! Thank you!",Nicole M,10 ay önce (düzenlendi),2
Lydia you’re so beautiful you look like my daughter . You’re so blessed!,Perla Sandoval,10 ay önce,1
"Love it that I know just the time to get on YouTube hahah! Love you and your content, such a ray of sunshine ️",הודיה שושני,10 ay önce,4
"Beautiful garden ideas….. random question. What are your top 3 perfume fragrances? 
I follow everything you do and I would buy whatever you recommend. You have impeccable taste in food, fashion, travel ideas, Amazon finds, dresses️️️️",Jasmine_ Valentine1998,10 ay önce (düzenlendi),0
You are just in a class all by yourself! I love your vlogs!,Meredith Jones,10 ay önce,2
"Thank you for taking us to the Chelsea Flower show sweetie, so enjoyable, also just bought on your site a coffee colour bodysuit xxx",Carole Buckle,10 ay önce,1
"Wonderful! Thank you for sharing ️you seem to be such a genuinely kind and loving person, your vlogs always give me the most happiest times too!
I don’t know if anyone has asked before but do you have a link for that gorgeous cake stand?
Thank you again for a beautiful time. ️",Jalon Burton,10 ay önce (düzenlendi),2
This is so inspiring . I'm manifesting this . ,Ana's Volg,10 ay önce,2
Ooooohhhhtat blue and white dress was unbelievably stunning!,Suzanne Davies,10 ay önce,0
My mum is obsessed with Chelsea flower show atm xx,Kelly Shields,10 ay önce,1
"Lyd's that dress looks abso stunning on your, I love that silhouette on you best!",Lanie Adamo,8 ay önce,1
im obsessed with you you're literally the cutest person ever,Ashley Rose,10 ay önce,0
I've really been looking forward to this one x,Katrina Lyall,10 ay önce,0
"Merci beaucoup ,Lydia, pour votre sourire et votre inspiration 🇧🇪",Meriem Bontemps,10 ay önce,3
"Small dogs have the biggest personalities! Porty and Barkley are so funny as they are stymied by that small piece of wooden screen!  My giant GSD, Norman, would just run right through that cute screen, break it into pieces, knock over the hall table, and shatter the nerves of anyone at my door.  Ah yes, welcome to my home...!",Sarah Rasmussen,10 ay önce,0
"Everything you wear is fabulous!!! 

Todays outfit I would have used :",TBM,10 ay önce,1
The green house is like cute rooms with flowers all over. Love the show.,Heidi M,10 ay önce,0
"Lydia considering you love nature checkout Sophie Paterson interiors, I came across her recently and the wallpaper that she does is incredible it is so much up your street ",Alison Smith,10 ay önce,1
"Hi Lydia , fabulous vlog outfits amazing and beautiful. Xx luv theses vlogs and necklace is lovely xx",Yiota Mintzas,10 ay önce,1
Omg the transformation was dreamy ,Noèmi,10 ay önce,0
"Hi Lydia.. watching you from California.. I love your videos..
Enjoyed the garden show with you. ️",Virginia Ramirez,10 ay önce,4
I also always bring a book whenever I leave the house just to squeeze in some reading whenever I get a chance ️️.,Sihle Mpungose,10 ay önce,0
Love this vlog!,Nisreen,10 ay önce,0
"I don’t know if it would be helpful to anyone else, but I’d love to see a few close ups of the items ",Monique Ruiz,10 ay önce,1
"Went straight for the like after like 10sec into the video I've been so busy, and missed your videos so much, but at least now I have a couple to watch",Anzsi Lux,9 ay önce,0
"Dear Lydia 

Love your content recently 
Although I have totally stopped shopping for two years now",Nic ST,10 ay önce,0
Santa Montefiore books are the perfect addition to this season  dream away.,Dorien Vullers,10 ay önce,0
And my dreams came true. Thanks for sharing. ️,Amanda W,10 ay önce,0
Just fallen for another James Gillick fig painting (insta messaged you) I’m in love ,Dionne Voller,10 ay önce,1
Gardening in a wooden greenhouse is a special experience and the plants seem to grow much better.,Sean's Gardening World,10 ay önce,0
"Just started reading ""The French Gardener"". Already wrapped up n the story as it is beginning.",Susan Gray,10 ay önce,0
The Erdem dress is gorgeous!,Christina White,10 ay önce,0
"I get so much joy from watching those wee sausage dogs be stopped by a tiny wooden screen...!  My German Shepherd dog would just plough right through that tiny screen, break the braces, knock over the table and shatter the nerves of anyone approaching the door.  Ah yes, welcome to my home...  lol!",Lynn Rasmussen,10 ay önce,1
Beautiful green and white halter neck dress and blue and white - first halter neck white top - looked STUNNING ,Linda W.,10 ay önce,0
"The happiest people don't have the best of everything, they make the best of everything they have.",insectosaurus-rex,10 ay önce,3
"Lydia, your outfits in this Vlog are lovely on you (as always)! but you haven't put together an outfit other than with your mini kelly . What about those lovely straw bags you were on the hunt for last year? They would look great with these feminine dresses, as well as your gold and straw Chanel. I loved how you wrapped a twilly around one inexpensive Amazon straw bag! It's summer! Enjoy your other bags and sandals! You also limit your shoe choices by having to match the leather. Not all your followers can afford Hermes, as they are 5 figures, (over 10k) so while Hermes is a beautiful brand, it would be more interesting to incorporate others as inspiration and ideas for designers that are more obtainable. I understand you are getting a lot of use for wear ",Glynis Leon,10 ay önce,0
Would love to know where your butterfly earrings are from? I’m in love with them!,Jesse Jacksini,9 ay önce,0
Beautiful,Amara Steve,10 ay önce,0
I love this so much,Tracy Goodger,10 ay önce,0
The green gingham dress reminds me of a jar of Bonne Maman Conserve  Jammy!,Jordan Star,10 ay önce,4
"David Austin Roses  are the best, I will have friends on my patio comment how wonderful the smell is. I am wanting to add a pizza oven to my back yard cooking area. I have never seen such large delphinium. Beautiful lupines.",sandy Hossman,10 ay önce,0
"Hi Lydia, I love your videos. I religiously watch you every Monday and Thursday. They are a breath of fresh air. I was wondering if you could recommend me a good painter/decorator. I live in Chelmsford (Essex). We moved here recently and we have struggled to find somebody competent. The painter we hired finished yesterday and when I saw the result I was literally in tears. I , like you, expect attention to detail and professionalism. I am desperate at this point. I know you can't answer all the messages but if you know somebody you could recommend to me I would be really grateful.",Josefina Fernandez,10 ay önce,0
Lydia babe you look so stunning wearing all white clothes,Alison Kovacs,10 ay önce,1
"Bless you Lydia, you could damage your eardrums stifling sneezes like that tho, my wife used to do the same and ended up in agony one day, great vlog",Steve Ellis,2 ay önce,0
"Hi Lydia,



I just watched Jenna Pierce's latest video of her bucket list visit to Chip & Joanna Gains' Magnolia Silos property in Waco, TX, USA. I thought there would be a lot of great inspiration offered that you might possibly be interested in seeing.",Emerald,10 ay önce,1
"Best thing ever, two dogs. And a cat that’s happy to have dog brothers. They are your children, like my dogs are mine. And they are great company. ️",ANGE K,10 ay önce,3
"Your the breath of fresh air I really needed today… thanks for being you.
I went on holiday to Spain with my wifey and her Mum it was like world war 3 everyday for the first 4 days , then I fell I’ll with gastroenterologist… I was so I’ll we came home early then to discover it was actually covid.. unknowingly I had traveled home this was May the 8 th 3 days ago I finally got a negative test result . I feel like a new born lamb , I bathe I sleep I try to eat it’s so hard . But then Lisa passed my IPad and said Lydia is on .",Karen Curtis,10 ay önce,1
Your videos. Golden ,FIT X STELLA,10 ay önce,0
"Oh God, when my fur baby got sick some years ago, I had him sleep next to me and I was dreaming every night that he was either dying or I lost him or he left and I could find him and all these happy things
When you have something on your mind ends up as a protagonist and n your dreams!
It’s terrible sometimes but thank God they are just dreams!",Κόλιους ΘΡΑΚΗ,10 ay önce,0
Can I come for coffee ️ too ? and you did give me beauty products for Mother’s Day x,Sophie Emma Millen,10 ay önce (düzenlendi),0
Lumi telling you to come to bed …. Best thing ever ,Delecia's World,10 ay önce,0
Not Ali wanting a dog and then there is Ali laying in the dogs bed with them ,FB,10 ay önce,0
Your greenish Dior bag would look sooo good with that and maybe black wedges,Lanie Adamo,8 ay önce,0
I think you need to pick more lemons so as you said “ others can grow.  The older lemons will dry out anyway.,Sharron Ribacchi,10 ay önce,2
Lydia babe have a lovely day in london,Alison Kovacs,10 ay önce,1
Perhaps your dream was a metaphor about moving house? I'm definitely checking out the book you're reading.,Amanda11762,10 ay önce,0
That treehouse lives rent free in my head now!,decemberclouds,10 ay önce,0
That day you had sounded lovely!,roxcandymountain,10 ay önce,0
"Lydia, where are your earrings from?? They're lovely!",Pia,10 ay önce,0
Its the simple things in life for sure. x,Elizabeth Olson,10 ay önce,0
"I hardly comment but that’s so strange I have a dachshund and I had a dream last night that his breeder who actually is his dog trainer in reality, his breeder was a completely different person, came and said she had to take Max back as we were just fostering and I in my dream was in tears. I was just telling my daughter about the dream and we herd you talking about your dream. Had to share. X",EmmaMC,10 ay önce,0
A good way to finish off a loaf cake with little effort is to dust powdered sugar on top. through a sieve.,Snoopy,10 ay önce,1
Fantastic...relax with Lydia time.,Teri Hillgartner,10 ay önce,0
"so just a thought because of the house hunting: why don't you just build an additional extension in your garden, which then serves as an office, instead of buying a completely new house?",Nadi M,10 ay önce,0
Lydia babe love your stunning white off the shoulder dress,Alison Kovacs,10 ay önce,0
The amazon smaller gingham dress looked much better without the white ribbon!,Natalie,10 ay önce,3
Sorry just popped over to see Louise Pentland talking to you. Didn’t realise Karen Millen did Petite and plus sizes. Great news.,Vicci Franklin,10 ay önce,1
"love your dress, wish i could feel like you do",Alexandra Reynolds,10 ay önce,0
Ali in a double breasted military blazer in the sun looking at gardens is the weirdest outfit choice I've seen yet...,Lucy Hyde,10 ay önce,2
OMG the puppy gate!!!!,Christina White,10 ay önce,0
"I thought you had decided not to use lip liner and had thought that you looked better without it? I see now that you are back to lining your lips and, in my opinion (for what it's worth), it's not a good look. I think your mouth looks so much more natural and pretty without using lip liner. Just a thought! Loved the video, especially the Flower Show. Bet you never thought a couple of years ago that you would be so excited by a flower show! ",Betty Reeder,10 ay önce (düzenlendi),5
" Big Bear Hugs from a 68 yr old grandma in Kirby, Texas, USA      ",Grammy Bear,10 ay önce,0
️️️,Angela Urlwin,9 ay önce,0
I worked for Elizabeth Arden I used to test all the creams and perfume  love them all,Colin Butterfield,10 ay önce,0
Santa Montefiore! I have read all her books !!,Enid Ford,10 ay önce,0
Treehouse magic,MsNanNan2u,10 ay önce,1
,Jebin Begum,10 ay önce,2
OBSESSED with your videos! Can you share which camera you use please? Xx,Rosie Mason,10 ay önce,0
"23:00
Bless you!!!",Eduardo Pinela,2 ay önce,2
Lydia babe love your long botanical patterned sleeveless dress so stunning,Alison Kovacs,10 ay önce,0
"Lydia, if you wouldn’t mind, can you please share what earrings you are wearing with outfit 1 (opening green gingham)? Thank you.",Anita Brandon,10 ay önce,0
️,Maricela Helo,10 ay önce,0
nice vlog,Muhammad Zama,10 ay önce,0
Love your white shorts,Alison Kovacs,10 ay önce,0
Love you so much I am a grandmother and great grandmother,Sherry LaFollette,9 ay önce,0
Perlee Collection at Van Cleef Lydia!! ,topphiladesigner,10 ay önce,0
"It’s crazy how cultures are different around the world , I mean 12:02 she had to put the disclaimer for touching something she made & she’s gonna eat where in india touching food with hands it’s such a normal thing ",Nishh,10 ay önce,0
Love the dogs,,10 ay önce,0
Lydia you need a tree house guest house on your property.,Ranalynn’s Lifestyle in Hawaii,10 ay önce,0
"Most of the Amazon dresses you show are see through not lined very thin, can you let us know in your video if they are see through",Patti Bonanno,10 ay önce,7
"Has your vlog been hacked? Someone has an account in regards to being shortlisted as a telegram with your photograph on it replying to all of the comments. 

Such a lovely vlog Lydia. ",Jennifer,10 ay önce,0
,Judith akunne,9 ay önce,0
She's only moving cause she wants a house like fashion mumbir,mary austria,9 ay önce,3
Oh bless you lydia what an awful dream babe,Alison Kovacs,10 ay önce,2
️️️️️️,Sofia Navratzoglou,10 ay önce,0
Nice video,Efe Umukoro,9 ay önce,0
🇨🇦,Darquise Krysciak,10 ay önce,0
,War Sa,10 ay önce,0
