text,author,date,like
I’m here for it : Lydia just like Every woman  asking their partner for their opinion on something and then completely ignoring it  xx,Vanessa Daniell,9 ay önce,205
Both Ali and the sunglasses are keepers!,Connie Hines,9 ay önce,17
The glasses are definitely classic. The square frames that are common now are definitely a modern style. Also you are my ultimate style icon! The most beautiful dresses always!!! Keep up the styling reels! Love to see how you style all your lovely pieces!,Kylan Higgs,9 ay önce (düzenlendi),81
"I think the sunglasses look great on you. I love that look of the “old movie” glamorous star in her convertible, sporting a headscarf and sunglasses! The Hollywood glamour from waaay back in the day, before our time, were so chic, sophisticated and styled brilliantly! If only Edith Head could create and style our wardrobes for us! I think the sunglasses definitely have a fifties/sixties vibe that can be considered timeless! ",EEN63,9 ay önce,25
I love these sun glasses! Absolutely classic and chic. Excellent choice.,Karen Suvi,9 ay önce,18
"Lydia, these Céline sunglasses suit you so well! They’re a keeper, IMO 
Also, couldn’t ignore Ali’s body language and facial expressions when you asked for his opinion. He’s definitely doing his best to listen to you and help you #ThatsAmore",Dottoressa Salima - Mental Coach sull’Autostima,9 ay önce,3
"Strawberry season in our garden is going crazy, we can fill up a big bowl literally everyday  And that with what started witb 4 little plants. Loved the vlog!",Yasemin Kuskal,9 ay önce,10
"Those sunglasses are very classic, Grace Kelly or Sophia Loren timeless beauty.",Alison Costa,9 ay önce,56
"I don’t think I’ve ever enjoyed your videos as much as I do now. I find you and your life (although still more glamorous than mine ) so relatable. I love fashion and nice things, but my animals, my plants and the simple things in life just gives me pure happiness. If this lifestyle makes you happy, then I really think you’ve done the right thing by changing lanes. Can’t wait for more vlogs of the dogs, your garden and everything else!",Louise,9 ay önce,4
"The glasses are crazy!! love them, actually my mum have ones like those, she bought them in the 70s 80s, so can be quite vintage but also cool and modern, love them so much!!",Estela Jimenez,9 ay önce,9
Lol I love how you went super boujee coastal granny when you called for Ali after you finished the beauty pie haul  in your timeless sunnies… they’re definitely timeless,Stevie Bolick,9 ay önce,2
"I heard Ali and couldn't help but comment haha The glasses are definately classic! I remember my grandma wearing a pair with very similar shape, just smaller frame. It fits in the coastal grandma vibe and even I,  at 25, I would certainly wear them!",Natalia Pastra,9 ay önce,2
"Hi Lydia! I always put a swipe of translucent powder over my eyelids to prevent the black dots you’re talking about, and it works wonderfully! I never get the black spots on my eyelids anymore",linnebt,9 ay önce,0
More and more beautiful everyday ️,리디아 Lydia,2 ay önce,0
"Bronze my life lol   Lydia you really at your best. Informative, funny and relaxed. Loved it",Emer Kelly,9 ay önce,3
"The Céline sun glasses are absolutely timeless and this shape is a classic. Definitely…maybe today‘s version is a bit bigger than they used to be in the old days, but otherwise TOP! BTW I‘m so with you, the DIOR bags at the moment are terrible.",JOHANNA BAUMGARTNER-CONVERSATION PIECES,9 ay önce,2
"I don't know if the sunglasses classify as classic or not, but they look great on you!",Ana G,9 ay önce,6
Best thing I’ve used for waterproof mascara remover is the Squalene cleanser from The Ordinary combined with Nivea’s waterproof mascara remover. And they’re both incredibly affordable ,Anna Backstrom,9 ay önce,9
"A GREAT mascara that does not transfer ever is the Thrive Cosmetics one. It’s such a game changer! (Not officially waterproof, easy to remove! You should work with them !!) I love the sunglasses! Very classic elegant look, love them. And I know you kept them cause they are in your latest IG post, right? I do love this last outfit you are wearing with the bag with your hair in a bun. You have made such a beautiful life for yourself ️ inspiring beyond measure.",Stara Baker,9 ay önce,0
"I LOVE those sunglasses so much more than the big/large framed styles you normally wear-So much more timeless, looks great on you!",nichole leahy,9 ay önce,1
Watching you and Ali laughing together just makes my heart full girrrl!!! I love it!!  * cue the Oliver Twist voice over * More please!! ,Koko C,9 ay önce (düzenlendi),3
The sunglasses looking lovely and I would definitely say they’re timeless!,Verity Stothard,9 ay önce,1
Loving the sun glasses and bag. Your house and grounds are just amazing. ,Amanda jane,9 ay önce,3
"The glasses are not 100% timeless, it is actually a 90s style....a 90s interpretation of a classic!",M Politely,9 ay önce,3
"The sunglasses are the epitome of class and timelessness on Lydia. On Ali, I’m getting Johnny Depp/Willy Wonka vibes ",Courtney,9 ay önce,5
"I recently got a waterproof mascara which I love, but I find that a cleansing balm like the Clinique ‘’take the day off’’ or anything else of the like works best and involves the least amount of rubbing or pulling at the eye area :) also just wanted to say that I love your videos no matter what you post, they’re a necessity for me to watch at this point ",Bensons Bits,9 ay önce,0
"I wear waterproof mascara everyday and I always use a Face Halo to take it off. It works great, it’s gentle and you don’t need any other eye makeup remover. Much better than these oil or balm cleansers in my opinion ️",Polly,9 ay önce,9
Strawberries from your own garden. Such a vibe ,Lola Maven,9 ay önce,1
Happy to see you! Live for Mon's and Thurs Days!!,Tricia Oquinn,9 ay önce,5
I never get bored watching your vlogs you're very inspirational  xx,Dianne Sheridan,9 ay önce,0
"Hey love, I know I’m late to the video, but with regard to waterproof mascara: try regular mascara of choice. Let set. Do 1-2 coats of clear mascara on top. Let dry. Et voilá. No black on your eyelids and no eyelash casualties when you remove ️",Catherine Cruz,8 ay önce,0
That beauty pie cream blush is lovely and so pigmented for the price. I love it,LucyC,9 ay önce,1
"Love the sunglasses, definitely timeless and chic! I was just going to get them in black. I also pictured the classic photo of a lady wearing a headscarf with those glasses in a convertible or on a vespa in Italy. My mom used to always wear this style of sunglasses in tortoise shell, glad I kept them. And about the waterproof mascara, I've always worn waterproof and the Farmacy clean green cleansing balm works amazing to take it all off.",Kristen Lisoski,9 ay önce,0
"Love the glasses, Lydia!! Definitely keepers!️️",Meredith Jones,9 ay önce,4
I have never had mascara transfer with loreal telescopic or maybelline sky high. My YSL babydoll and Lancome went in the bin after finding these. That blush colour looks gorgeous. Your skin looks amazing.,Rosy Apple Kitchen,9 ay önce (düzenlendi),3
I love the glasses and love you mentioning other handbags other than Hermes … I love the CH bags they are fantastic,mrsf,9 ay önce,1
And your glasses really suit you! Xxx Love your Beauty Py order! Xxx,Gail Lowry,8 ay önce,0
The sunglasses look great on you and will look equally as good with your hair in an updo. The shape and branding are more vintage in shape and style and obviously tortoiseshell is always timeless.,Lunar Faerie,9 ay önce,3
"Love the sunglasses Lydia! Have you tried Japanfusion pure transforming cleanser, it is part of the japanfusion range  and a true game changer when it comes to removing waterproof mascara, eyeliner, the lot. I have sensitive skin and break out easily with most balm cleansers, this one is awesome and not a breakout in sight, my skin has never looked better. X",Talia Laughlin,9 ay önce,5
What a beautiful vlog. Thank you ,Veronika Jelenc,9 ay önce,2
Love your content and your beautiful garden and home!,Needing Less,9 ay önce,1
"The Celine sunglasses look incredible, so classy ",Ann R,9 ay önce,7
"Lydia, your skin. It looks amazing!!",Sonja Lovig,9 ay önce,0
Ali is the best.  Lydia the sexy and classic sunglasses were made for your personality.  You are blessed with much beauty and grace that almost everything you wear complements you.,Eve Oliver,9 ay önce,6
Hi! Yes! I agree the sunglasses  looks vintage looks like a  classic piece in my opinion ️it!!,Fujiyama Marie Shell-Scott,9 ay önce,3
"LOVE love LOVE the sunglasses on you! Elegant, Timeless, effortless, sophisticated ",Lucille Jacobs,9 ay önce,1
"love the sunnies, Lydia, you look gorgeous in them, these are keepers for sure ))",Elza Darbaidze,9 ay önce,6
The sunglasses look like the sun will get all around them - keep going! Watching you buy sunglasses is great! Work hard at not settling just so we can learn from your sunglass buying struggle.  (This is not sarcasm just to be clear :),E W,9 ay önce (düzenlendi),5
Hope you kept the sunglasses. Agree with both of you! they look cool and timeless,Lin P,9 ay önce,0
Could you do a mini jewellery favorites collection ? You have such beautiful tastes,Gilda,9 ay önce,1
Ali is sweetly and carefully giving his opinion.  He's being honest without meaning to burst your bubble since you love the sunglasses.  :),D D,9 ay önce,10
Another great vlog Lydia. I would like to take this opportunity to recommend an amazing company that makes candles and diffusers. The Ruby Grace company. They are really fantastic. I hope Carrie is getting her eye problem sorted. ,Karon French,9 ay önce,0
Lydia you are so cute and such a lovely soul ,Tiffany’s Epiphanies,9 ay önce,0
Lydia pretty please can you do extra content on your kitchen garden? I have taken inspo from you and got my own but I’m a bit clueless where to start haha and I love a “come garden with me” where you show us what you are planting and when so we can do the same and follow along at home haha!,louise cameron,9 ay önce,1
"Those are definitely the most timeless and classic sunglasses you have, the others you own have always felt more trendy to me. I think these suit the style you’re transitioning to more",Sarah Solinger,9 ay önce,0
"YES TO THE GLASSES  classic shape, makes me think Parisian chic! 

Every video makes me laugh because you're always  rushing/saying it's the longest blog ever and I'm here like can we make every one the length of a film please? ",Sophie,9 ay önce,3
"The description you gave for the sun glasses, the lady with the scarf..was so accurate...they are The glasses ",Diana I,9 ay önce,3
Most definitely classic and timeless sunglasses and you rock them. Very breakfast at Tiffanys.,Max Copen,9 ay önce,0
The sunglasses are nice! I saw a very similar pair in Mango a month or so ago. I was also not sure if they were too big for my face - I think that is the style though.,Madeleine Eriksson,9 ay önce,2
ALI!!!!  Jacki O wore that style of sunglasses!!!!  Definitely a timeless and classic style of shades!!,LilWhit 28,9 ay önce,14
"Love the glasses Lydia, definitely a keeper xx",Rachel26,9 ay önce,8
Sunglasses are timeless!  Glamorous!  Perfect!!,GmaMom,9 ay önce,1
Can you do a favourite video where you talk through your favourite beauty / skincare products at the moment ? I’d love to hear your thoughts on all of the beautiful products you got recently.,Mynth,9 ay önce,0
Please do a full jewellery collection video ,Kimberley Painter,9 ay önce,0
"I work in PD in eyewear. That is a very classic women's shape with the update of the loud logo metal branding on temples. You look so lovely in it, definitely a staple for your wardrobe!",Nora Kavanagh,9 ay önce,3
I have the same problem with mascara leaving black marks on my upper lids. I’ve tried everything over the years - waterproof included. The only thing that worked so far is using tubing mascara like the one from Thrive Causemetics. Easy to take off as well - just warm water no eye makeup remover required.,Galina Chtyreva,9 ay önce,4
Fab sunglasses Lydia!  You always look great in your sunshades  you have such a lovely face shape.  And really nice striped dress too! ,Tina G,9 ay önce,0
"I have very straight eyelashes, so I only use waterproof mascara (to keep the curl). I have tried all types of products to gently remove it, including the Lancôme Bi-Facil Makeup Remover (which used to be my ride or die), but the best remover by far has been olive oil. Cheap, natural and efficient! If you try it, you won't use anything else, I promise!",Anzu Salazar,9 ay önce,0
"The best mascara to avoid transferring is the Honest Beauty mascara. I’ve been using it for years! It’s not waterproof, which I prefer, and comes with mascara primer as well.",Kylee Joy,9 ay önce,0
that Carolina Herrera bag is stunning!,mrs_leyva,9 ay önce,2
Little tip. Vaseline to take off waterproof mascara. Works like a treat! ,Abi De Montfort.,9 ay önce,4
"Lydia, those sunglasses are absolutely timeless, elegant and classy, don’t worry. Ali was so careful not to offend you and you clearly value his opinion. Love you two as a couple!! But, they are definitely timeless sunglasses ",Leah Triwahyuni,9 ay önce,0
"Wasn't too sure of the sunglasses until you pulled your hair back and it changed the game, absolutely gorgeous",Jessica Bredekamp,9 ay önce,0
Lydia!! Totally get the sunglasses vibe. I have the exact same pair with the matching medium straw bag.. I imagine hanging out of a vintage classic .. maybe a cornflower blue soft top Merc .. one day! xxx,Annabel 2020,9 ay önce,2
"Loving your vlogs and jealous of your trip at the weekend looked incredible I want to go,love the sunglasses  really suit you ️ looking into signing up to beauty pie after seeing what you have been buying ,wanting to try the Japanfusion range but trying to find out a little more on it like how does the payment work is it spread over the or do you just pay the full amount straight away please could you help xx",Jennifer Walters,9 ay önce,1
"Gorgeous sunglasses, I been using beauty Pie for couple years now its truly fantastic ",Kristina Bell,9 ay önce,3
"I’ve tried a few removers, but old fashioned Ponds works best to remove waterproof mascara. And little flexible reusable microfiber pads/rounds work better than cotton pads or cotton balls.",madelaine,9 ay önce,3
"I am in love with Carolina Herrera, her shoes are like gloves, so soft. I have the matryoshka bag and another smaller bag that i don't know the name. But yes love her soft leather. Beautiful and so classics",Giselleless,9 ay önce,2
Good morning beautiful  lydia I hope you ali lumi and the boys are well babe it's so lovely to see you again thanks so much for sharing your lovely luxorious vlog love your house your garden your kitchen garden your green house and your chic dressing room so stunning babe matches you perfectley I'm so excited because it's my birthday tommorow  have fun and stay safe babes xxx,Alison Kovacs,9 ay önce,1
sunglasses gorgeous! elegant and timeless. they look great on you! I want!,Rana Abdul Qadir - Rifaie,9 ay önce,1
"Lydia, I do love the sunglasses on you. They are very Jackie O. vibes.",Chrissy Nes,9 ay önce,4
Love it!!!,Jebin Begum,9 ay önce,1
Those are my absolute favourite sunglasses on you,Shari Henderson,9 ay önce,1
"I love the sunglasses ! They look a bit vintage, they are definitly a keeper. I wouldn't say that they are timeless though, but what matters the most is what you think ;)",Marine Verstraete,9 ay önce,2
Use organic coconut oil to take off waterproof mascara.  It melts it off better than anything and conditions your lashes at the same time. Then use your cleanser as the last step.,L Theisen,9 ay önce,0
Hi Lydia . The sunglasses look amazing on you . For a beautiful coral lip try Tom Ford Paradiso . You might like it ,Wendy Chiwawa,9 ay önce,0
Garden looks incredible!!! ,T Rehman,9 ay önce,1
"Audrey Hepburn , Julia Roberts vibes with the sunglasses - a keeper ",Tracey Wells,9 ay önce,5
The confusion with the glasses comes from the fact they're neither modern nor timeless - they're retro. They remind you of your aunt because they're the classic 90s shape :),stashastasha,9 ay önce,10
Loveee the sunglasses on you!,Aioanei Miriam,9 ay önce,0
That's why I really dislike waterproof mascara :( such a hard time removing it,Bianca Procopio,9 ay önce,3
sunglasses for sure are classic and timeless,Angelia's Pink Luggage,9 ay önce,0
"Lydia watch Breakfast at Tiffany’s with Audrey Hepburn and you will know why these sunglasses are so iconic. Actually they don’t come anymore timeless then this shape. Audrey Hepburn’s style was cultivated by her favorite designer of the time, Givenchy himself. Not only was she his muse, she was a major influence on the fashion world as whole. Jackie Onassis’ style was to some degree influenced by her. Hepburn was the epitome of flawless style darling. She made many pieces and looks world famous. Every influencer worth her salt should know this iconic woman. IMO",G G,9 ay önce (düzenlendi),6
Poor Ali  he knows he can’t win. The stuttering is the tell. Love the glasses ,Dorothy Sliben,9 ay önce,6
Waterprooof mascara ruined my eyelashes and dried them out.  Even when I used a gentle eye makeup remover it was just awful.  I want to hear how it works for you. I haven’t tried this brand yet!,Mar Lise,9 ay önce,2
"Lydia, wonderful mascara!  You’ll need an oil remover. I use one from cover girl and it take a few seconds, just don’t open your eyes until the oil is cleansed away by your face & eye cleanser, I use philosophy’s Purity. 
The glasses look like movies I watch that are from the 60’s, scarf and convertible and all .  I think they look amazing on you and on Ali. God Bless you all.  ",MsJustice007,9 ay önce,5
And the trick for removing waterproof mascara is oil based products. Work like a charm.,Jennifer Hallqvist,9 ay önce,0
Lydia babe love your sunglasses so chic and sophisticated,Alison Kovacs,9 ay önce,1
"Ali , pure perfection in that sunglasses!",Ka Pi,9 ay önce,1
I struggle taking off that waterproof mascara as well! it is so strong. I use an oil cleanser to make it melt.,Laura Olariu,9 ay önce (düzenlendi),0
Thank you for the lemon  tool tip,Alina Constantin,9 ay önce,1
"Hehe never ask a man. That is what my husband would say. So cute. When I think of timeless I think if Jackie O Kennedy would wear it, they are timeless. Those frames are definitely a Jackie O frame. Beautiful. I love your videos and always look forward to them.",NBad65,9 ay önce (düzenlendi),8
"Do you like Raspberry balsamic vinaigrette dressing? Try blueberry. Get a bottle of regular balsamic vinaigrette and throw it into a blender type appliance with a full cup of blueberries. If it needs a little sweet you can add sugar, honey or stevia. Delicious and you may not find it in stores. ",Terry Norton,9 ay önce,1
Gorgeous Celine with the Classic Triompe!,JLO,9 ay önce,0
"Beauty Pie seem wonderful, too bad they dont ship to Sweden Love your style Lydia",JessicaH,9 ay önce,1
Mascara above my eyes is the story of my life Little hack for removing waterproof mascara inexpensively. Use Vaseline.  I’ve been using it for years & it keeps my lashes nic️,Mindy Lamberth,9 ay önce,0
The garden looks wonderful. Great work well done eating the fruits of your labour can’t be bad ️,Maxine Muhammad,9 ay önce,3
Ali is adorable,susan jackson,9 ay önce,3
Loved watching this xx,linda chapman,9 ay önce,0
"Loving the sunglasses, very classic looking (timeless) 🇬🇧xx p.s wow you have come a long way sweetie, considering you started growing your little sprootlings on your windowsill  pat on the back Lydia, well done xx",Carole Buckle,9 ay önce (düzenlendi),1
Thanks for showing the bag……I was lucky enough to be able to get one with a brown stripe on it …very beautiful bag …..THANKS YOU….LYDIA !,Nancy Dushay,9 ay önce,1
Liz Hurley springs to mind you in those sunglasses!! I think they really suit you!,Vee1,9 ay önce,2
"The sunglasses are quite classic, they look 80s/early 90s to me. The only thing that makes them look more modern is that the temple pieces are quite thick. It seems the style you’re looking for is 50s/60s, where the temple pieces are thinner and more delicate.",hollabelle,6 ay önce,0
"The  sunny  suite you so well, keep them as I think they are timeless.. ",Alina Constantin,9 ay önce,2
Chanel makes am amazing eye make up remover. Takes waterproof mascara in one swipe. It’s genius. Demaquillant Yeux Intense. You’ll love it ,Dee B,9 ay önce,0
I love the Chanel sunnies on you I actually have a Prada pair that are about 6-8 years old in that silhouette,Tpink,9 ay önce,0
Yes sunglasses look really good on you. I think Ali is just teasing you ! ,ANGE K,9 ay önce,1
I do love the way Ali decides not to dig himself into a hole ,Brittany Lane,9 ay önce,1
very classic sun glass they look great,ADAM MOORE,9 ay önce,1
Ugh Lydia your sunglasses are so elegant and sexy such a good pair ,Dandan Laurie,9 ay önce,5
"Ali didn’t look all that interested in the sunglasses story whatsoever. Maybe it came off wrong in the vlog. The boys are so happy! We have deer  in our yard often and it’s quite the sight along with the black bears and moose. Nature is magnificent. My favorite content of yours specifically is your gardening tootling about, London, walks and your travels.",Jennifer,9 ay önce,6
Stunning glasses on you your in proportion xxx,Deborah Wates,9 ay önce,0
"Great videos & lifestyle videos, Mrs. Lydia Millen Gordon & Mr. Ali Millen Gordon. Great job on filming & sharing the beauty of England. Excellent fashion, lifestyle, home , & garden contents.  Inspirational. Happy Platinum Jubilee to England. Happy holidays from our channel: Australian Parakeets Stars",alexandria nguyen,9 ay önce,2
Sunglasses gorgeous and of course they suit you…what doesn’t…..,Mary K A,9 ay önce,0
"I never normally comment but I know the struggle with waterproof mascara. Have you tried a tubing mascara? It doesn’t run like waterproof or transfer into your face but you remove with water and it comes off in little tubes from your eyelashes a lot easier. My favourite is the L’Oréal air volume mascara in waterproof, volume and length and no transfer plus being affordable. I’d definitely give it a go ",Kerrie Holmes,9 ay önce,0
I wish Beauty Pie would ship to Holland. So much of their stuff I want!!! ,Karin Boonstra,9 ay önce,0
Sunglasses are classic ️,Koz Gj,9 ay önce,0
Greate clasic sunglasses. BDW mascara remover works much better on dry mascara.,ania7706,9 ay önce,1
You looking so stunning,Nikki Benz,6 ay önce,0
"Try really shaking the make up remover until its all one colour, then place that on the cotton pad, it should be easier to remove the mascara ️",Noo Onne,9 ay önce,1
"Our weather here in Vancouver BC is the same. Normally it would be sunny with little rain, warm. This year wet, cool and not much fun. Even my plants have taken a back seat in slow growth.",Snoopy,9 ay önce,3
Classic sunglasses very flattering on you.,Ana Pineiro,9 ay önce,1
Lydia those sunglasses looks beautiful on you they are giving Jackie Kennedy vibes and like you say a scarf on your head,FB,9 ay önce,1
You can spray for spiders on the outside of your greenhouse and that will stop them coming in and making webs. We get the local pest guys to come out and do it. Might want to lay some plastic over your garden beds though while they do it incase of any over spray.,Chloe McLean,9 ay önce,0
"The gardens looking fab, I use a Zyliss salad spinner to dry my leaves …….",Rachael Tate,9 ay önce,0
your lettuce looks amazing ,Sihle Mpungose,9 ay önce,3
Love the sunglasses,Carika Bornman,9 ay önce,1
Love this video !,Susan Stropparo,9 ay önce,1
Luxury world ,Nurses lecture Forum,6 ay önce,0
"Love the sunglasses,  they look great on you. They are a classic/timeless. Don't listen to Ali, he doesn't know women's fashion.",sandy Hossman,9 ay önce (düzenlendi),1
"I'm leaning more with Ali on the sunglasses, they look good but do they look great? do a comparison against your best sunglasses and then decide perhaps, have fun!",Melissa King,9 ay önce,5
"Please don't rush,l love longer video s",Liliana Dumiter,9 ay önce,0
I’m with you for Beauty Pie ,Sarah Westall,9 ay önce,1
Love those sunglasses,Oluwabukola Ashaye,6 ay önce,0
The sun glasses look classic to me. Very Jackie Kennedy ,Theresa S,9 ay önce,1
"I can’t believe I’m saying this but I think this is the first time I don’t think Ali knows what he’s talking about.  I think those are SO timeless and will never go out of style.  You could wear those 10-20 years from now, if you don’t lose them.  ",Connie Cofield,9 ay önce,1
Yes to the sunglasses ,Ranalynn’s Lifestyle in Hawaii,9 ay önce,1
"Hey Lyds,

Mascara clean up hack 101",Annette Faith Morton,9 ay önce,0
"I agree with Ali on the sunglasses. They look really pretty but more ""cool girl"" than ""classic""",Katie D,9 ay önce,10
"Those glasses look like Catherine Hepburn Breakfast at Tiffany's.  So yes timeless.  Well done. I love them. Tell Ali hush. I did love his let me have an out just incase with ""I haven't done my research. """,Denise Prokop,9 ay önce,0
Love the glasses. Audrey Hepburn vibes. Looks great on you. Can you give us the brand of your autobronzer cream?,Susan,9 ay önce,7
Love the sunglasses. The deer are muntjac deer.  ,Remi Koszuta,9 ay önce,1
Beautiful,okpako gabriel,6 ay önce,0
Ali is right about the sunglasses!! ,Sarah Westall,9 ay önce,2
