text,author,date,like
I just use some argan oil or coconut oil to remove waterproof mascara. It comes off very easily.,Laïla,9 ay önce,2
"I have the same issue with mascara transfer so what I do to combat it is wear a pale or skin tone powder eyeshadow under my brows. I don't know if that would work for you but it works great for me. 

Also, I know it might be over stepping but I wondered if I might say something and hope you don't take offense.  But please, please do not pull down on your face when you apply anything. Always  go up. Use an upward motion from your clavicle up to your jawline then from the jawline up to your temple. From your nose bridge out toward your ears and from your center forhead out to your temple. I know you don't like touching your neck but when you spray it, don't forget the back of your neck. It is important. I'm almost 60 and once upon a time I was young and beautiful,  too. And while I know things have changed, getting wrinkles has not. The last thing you want is to be 50yrs old and looking like a hound dog. You're far too pretty for that.",Katyjean Leslie,9 ay önce,0
"If you have a chance to try Lancôme Bifacil double action eye makeup remover, it works like a dream !!",Karen Cap2,9 ay önce,0
"Dear Lydia, I absolutely love your style. Your KM collections are gorgeous, your picks of clothing and accessories are just as beautiful. But this time, girl...over a thousand pounds for a basket bag is just over the top! It's not worth it. I'm sorry.",TinaHanoeman,9 ay önce,0
1950’s sunglasses  love them,Dionne Voller,9 ay önce,2
You need to use your influencing powers to influence Beauty Pie to ship worldwide. They don't ship to Australia and we are seriously deprived over here!!,Ingrid Hyde,9 ay önce,1
"Lydia:  ""Under... under...""  Me: ""under the radar...?""  ""Under appreciated...?"" ""Undervalued...?""  I know, you probably couldn't hear my prompts...",Sarah Rasmussen,9 ay önce,8
Thy you for the video. You can try: take the day of cleaning balm. Its magic!,Sarah Pulver,9 ay önce,1
"RE: Sunglasses. To be vintage, you are looking more at a cat eye shape. If you were going for headscarf, convertable car, (1950's early 60's) cat eye all the way. If you are going for the old fashion early car you would go for smaller rounder metal rimmed glasses (1920's/30's). There you go.",stareye8,9 ay önce,0
"The sunglasses are classic and timeless style, take it from someone who is 50 years old.. Never ask a man unless they are experts in women's fashion ",E N,9 ay önce (düzenlendi),0
Who CARES what the 25yr old TikTok’s think!! You do you! Your garden & your just lovely at it. NEVER feel like you to prove anything to anyone.,Heather W,9 ay önce,4
Lydia you need a salad spinner!!! Best thing ever for drying out your salad after washing it! Game changer! Xxx,Amie Towland,9 ay önce,2
Ali is correct the sunglasses aren't timeless. They are elderly grandma can't see glasses silhouette.,me you,9 ay önce,4
"I always enjoy your videos! 
Was “under appreciated” or “under rated” the saying you were looking for?",Fashionably FRANCIE,9 ay önce,1
"was excited by the Beauty Pie products,  only to discover not available in Australia ",Janice Evans,9 ay önce,1
You can let your leaves soaking in water with some white vinegar to get rid of all these tiny insects :-),hel Tc,9 ay önce,0
Only ever use wp mascara. I prefer to not wet my lashes first. Best ever mascara remover is Clinique Take The Day Off eye makeup remover.  No issue ever.,Dubravka Simic,9 ay önce,0
It's a Nap dress I heard. I am here for it too.,Teri Hillgartner,9 ay önce,0
"Lydia, where are your necklaces from? I love the combo!",Rebecca Anderson-Hall,9 ay önce,0
Love the glasses!,Erin Keck,9 ay önce,0
Nice sunnies Lydia ,pinksugar17,9 ay önce,0
Garnier and loreal are the best waterproof mascara removers.,KBV Vl,9 ay önce,0
"Ali is right look like a goggles such a good sense of humor ,I Luv Ali such a handsome you guys are meant to be both of you so blessed to have a perfect beauty",Johnlor Turner,9 ay önce,0
I’m dying for the hand wash from Bertioli. I don’t see it on their site. I am in the US so maybe it’s not available. It’s the basil soap I wanted.,Andrea Pettina,8 ay önce,0
Nice look,Omoniyi Omolayo,6 ay önce,0
"Lydia, I don't think they fit your face entirely. I always heard the rule of thumb was that eyeglasses/sunglasses need to frame your eyebrows. That's why they fit Alli's face so well.",Susan Asselstine,9 ay önce,3
Tomatoes are absolute water monsters - they love plenty of hydration so your little plant should be fine! ,Gemma Walton,9 ay önce,1
"“What do you mean cool” 
Ali Gordon: “I’m not a fashionista” 
excuse me mr millen-Gordon if I could find a hottie that dresses like you sir it would be ",charlierose214,9 ay önce,1
You need an oil cleanser and a water cleanser and problem solved. Use oil first on dry skin to melt makeup and you won’t have to drag to clean face,Aims at Life,9 ay önce,2
Sunglasses suit you ,Vinagre,9 ay önce,2
It looks as if the mascara remover is oil based.  You may find it works better on dry skin.  Oil and water don't mix well.,Terry Wilkinson,9 ay önce,0
"Your garden looks great, you could probably thin those carrots a bit!",jutka12,9 ay önce,0
"Agree with Ali don’t think the sunglasses are a classic look, but still look nice on you xx",A 123,9 ay önce,0
"Maybe someone else already commented this but please  use your influence and ask beautypie to not individually wrap each product. For the environment. I appreciate that it is a part of the experience they want to create but it is too much wrapping  as alway, love you and your content ",Jennifer Hallqvist,9 ay önce,1
The sunglasses are  similar to Audrey Hepburn's in Breakfast at Tiffany's!!!,Lori Penzato,9 ay önce,0
Use any sort of oil based cleanser or any oil it gets any the mascara off even those waterproof ones  x,Tee Ay,9 ay önce,0
️️️,Maxine Muhammad,9 ay önce,0
I love those sunglass,Amaka J Chigoziem,6 ay önce,0
"I love the sunglasses but would agree with Ali, oval isn’t a timeless shape lol",OnyekaOnline,9 ay önce,0
"I really like those sunglasses on you, Lydia …. Very Jackie O",kate leeder,9 ay önce,0
Congrates on the new pieces you've got. It looks amazing. May I know how much does it cost? I found something almost the same from xsreps.com  but cost $180 only. I just ordered mine.,Rena Mila,9 ay önce,0
If your mascara is transferring try a different mascara. Waterproof doesn't mean it won't transfer. Have a wonderful week xx,CanuckBeauty,9 ay önce,3
"It's taken me all day to watch your video...on pause because I've been so busy.... I love it when I can come home and refinish your or Josies videos

Sunglasses, I'm ok with those ones, but Hmmm.... they have to fit your eyebrows, kinds weird to say, but since you asked they are just OK.  In this case they look better on Ali but they are too wide on the side for him. I can never buy glasses of any sorts unless I try them on first. That's just me.",Snoopy,9 ay önce,0
️️️,ginika agatha,6 ay önce,0
"Well, maybe people don’t believe you do all that gardening by yourself because we have never seen you do it. We see you water the plants and talk about how beautiful they are looking but there’s no video where we see you doing the dirty job ",Melanie Herrmann,9 ay önce,3
Please do a review of your luxury jewellery.,,9 ay önce,0
Weeding a garden and making sure it is pest free is a huge part of why a garden even thrives at all… I hope nobody runs out and invests in a lot of plants with the idea that it is easy to have one from this video where someone is hired to do those things.,Edith Tierce,9 ay önce (düzenlendi),5
Why don`t you design a smaller bag as part of your next summers Karen Millen collection,Alison scrace,9 ay önce,1
"The sunglasses are great, very Audrey Hepburn.",Marcia Fellows,9 ay önce,0
"Although you attempted to change his response, I agree with Ali. The silhouette is not 'timeless'.",Vee Jay,9 ay önce,2
Ponds cold creme is the best for taking off mascara,Robin Rogers,9 ay önce,0
"Lol the sunnies actually suite Ali more than. You, don’t hate me for that ",Michele Pillay,9 ay önce,0
I haven't watched your Tik Tok yet Lydia. I just heard you say that no one believes you. Why don't you repurpose some of your YouTube footage in bites for Tik Tok to show the beginnings of your journey. Absolutely love your videos X,Toni Collins,9 ay önce,0
" Big Bear Hugs from a 68 yr old grandma in Kirby, Texas, USA     ",Grammy Bear,9 ay önce,0
Lydia why don't you design a couple bags with your clothes it would be nice,Michelle Emge,9 ay önce,2
I was waiting to see what you got from Aavelle x,Rebecca Moss London,9 ay önce,0
Lydia how do you keep the slugs and snails away from your courgettes? ,Elaine Owen,9 ay önce,0
Just do a Timelapse of gardening then people can’t say you didn’t do it.,Leslie Ann,9 ay önce,0
Awesome,Thompson Emmanuel,6 ay önce,0
"The sunglasses do not flatter you. Not the same sunglasses as AH…hers were Oliver Goldsmith, pre-Ray Ban Wayfarer, which are more round.",Susan Rice,9 ay önce,1
I thought sunglasses were like Audrey Hepburn breakfast at Tiffany’s. Vibe,Brida Harris,9 ay önce,0
"Lydia,
Please know that waterproof mascara is NOT good for your eyelashes as well as you are rubbing around your eye area, which I know you know is a No No.",EA,9 ay önce,0
Those sunglasses they are very Sophia Loren ,Kinia,9 ay önce,0
Beauty Pie shadows are the best The formula is sexy,Judi Skalet,9 ay önce,1
"Those barking Deer are called Muntjac, they came from China. Very sweet little things.",skydiverchick1,9 ay önce,0
Sunglasses are classic...makes me think-Audrey Hepburn!,Teresa Halliday,9 ay önce,0
Nice video,,7 ay önce,0
Interesting ,Jessica Chukwudum,6 ay önce,0
P.S. Love the garden lots….,Heidi M,9 ay önce,0
I like it,Joseph Eboseremhen,6 ay önce,0
Beauty Girl,Senaid Sehovic,9 ay önce,0
“Send them around the twist” oh your coming home with me…,Tracy Wear,9 ay önce,0
Ali those are a serious classic silhouet!! FR!,Carmen Grauwels,9 ay önce,0
I can’t hear “Mangetout “ without thinking of Del and Rodney.   Only Fools and Horses.,Kerry Harrison,9 ay önce,0
You are lovely :),J Mettler,9 ay önce,0
️️,Ronald Roland,6 ay önce,0
Love the glassess,M Rod,9 ay önce,0
Definitely classic. Almost Hepburn. Very Grace Kelly or Sophia Loren,Lauren Parkinson,9 ay önce,1
I like your pretty video is very awesome.,James Pittman,9 ay önce,0
It is almost a 100 degrees here in some places in the USA.,Brenda Green,9 ay önce,14
️,Gemma Woodcock,9 ay önce,1
The sunglasses look like Jacqueline Kennedy Onassis…Or old school Hollywood!,Melanie Carosi,9 ay önce (düzenlendi),1
Would you mind relinking the dress in outfit 2 please? The original link is taking me through to Google. Not sure if it is just me? Thanks in advance.,Kate Blyfield,8 ay önce,0
Love bag,Patti Bonanno,9 ay önce,0
"You asking Ali about the sunglasses was like a deer in the headlights, or do these pants make my ass look big ",Kathy Doran,9 ay önce,1
Very nice,Vella Pk,9 ay önce,0
"Hello Lydia how are you doing how's your health  
Well I need to let you know that I look up to you 
My question is I'm a new influencer on different platforms including here on youtube 
The name is living with endometriosis Marlyne Milfort what app do you use for editing as a new entrepreneur.",Marlyne Milfort,9 ay önce,1
I am thinking you don’t have a lot of Sun in The UK so maybe that’s why you don’t think about buying Sunglasses. In Sunny Climates people are obsessed with Sunglasses,JellyBeanParis,9 ay önce,0
OMG the deer sounds are hilarious!,jaiden9204,9 ay önce,1
You have a gardener? I'm confused aren't you guys doing all the gardening and mowing?,Mikaela Donges,9 ay önce,3
"I really like the first dress, but I cannot find it.  I am from the US. Sometimes I use Vaseline to remove mascara. It breaks down the formula. I do not know if I have tried it on waterproof.",Latisha Campbell,9 ay önce,0
Think glasses are lovely but not sure if you should see ur eyebrows over them . Your beautiful either way x,Tracy Birrell,9 ay önce,2
"Lydia, you love to shop period.  Girl you are a shopaholic ",Lidia Kuhn,9 ay önce,0
Nice,Bayode Adenike,6 ay önce,0
Nice,Ukachukwu Chinedu PraiseGod,6 ay önce,0
Nice,Okorie Esther,6 ay önce,0
Nice,Glenn,6 ay önce,0
Nice,Bunmi Ogunsanya,6 ay önce,0
Very Jackie O. ,T Boan,9 ay önce,1
LYDIA - just to be aware (I have reported it) you’ve got ‘someone’ piggy backing on your followers comments saying we’ve won a prize and to contact ‘you’ direct on a listing that is obviously not you  just in case any of your followers don’t realise it and link into it ️,Dionne Voller,9 ay önce,1
Wowww,MARTINS TIMOTHY,6 ay önce,0
Please Putin the recet of the salad,Marisela Nuñez,9 ay önce,0
"Guys I know the supplier who makes beautypie in case anyones interested, same that makes charlotte tilbury as well…",Hannah O,9 ay önce,0
Please do you have the details of these two necklaces you're wearing x,Adelle Prior,9 ay önce,0
The sunglasses are Jackie Kennedy-like sunglasses.,Leola Brown,9 ay önce,0
Send the sun glasses  back Lydia. Honestly you could get some that look stunning on you. Just being honest.x ,Beverley Roberts,9 ay önce,0
Lot of sunglasses look like bug eyes but these seem to be just right and would of loved the just a bit smaller. But they look really good on your with you hair color and skin color…..,Heidi M,9 ay önce,0
Everyone here screaming:  underrated ,ermizgrl,9 ay önce,1
Wow ,OLORUNLANA MUHYDEEN,6 ay önce,0
"Omg, you need a cardigan, and we are having a heat wave in TEXAS.  The temperature has been 100-  104    So so very hot, dangerous hot.",Lidia Kuhn,9 ay önce,1
"Lydia, what is the name of your amazon dress?  When I try the link it takes me to my Canadian site and I can't find it.",Janet Whittingham,9 ay önce,1
Luxury.,Atoyebi Abdulazeez,6 ay önce,0
"Lydia, do you use telegram for messaging?   I got a response to my reply…and it says to check telegram….I’m not sure it’s not a hack?",GmaMom,9 ay önce,1
Every waterproof Mascara needs an OIL. Oil looses up oil. Otherwise it won’t move. Everything you used is not a pure oil cleanser.,Davida F,9 ay önce,0
"Lovely video, and never fail to love to see the saucisson pooches.   Am sorry but the Celine sunglasses just didn’t look quite right in my opinion, they show your eyebrows too much over the top but that maybe just the camera angle.   Look back at video and check out Ali wearing them and you perhaps will see what I mean.  They are beautiful though, love them, very Jackie O xx ",Soo60,9 ay önce,0
Underappreciated LOL,JellyBeanParis,9 ay önce,0
lydia....ive just recieved my 3rd delivery trying to match the colour of your silk olive green cushions in the living room! still wrong!! please tell me where that material came from :( :( :(,pixied1992,9 ay önce,0
"Lydia there is some one on here who goes into peoples comments pretending to be you, they have a telegram account and have posted to go onto the site to a lydia account to win a prize, i have a telegram.account and its more for political comments etc, just so you are aware people may click onto it thinking its you.",ORESTES LATERALUS,9 ay önce,2
Love the celine glasses but a bit wide if I’m honest,Jacqui,9 ay önce,1
"Jaajjj, potato potato,  I also love Carolina Herrera",Maria Umbert,9 ay önce,0
The glasses are reminiscent of Jackie Onassis,Waukeysla Frazier,9 ay önce,0
Will you actually sell your sunglasses bc I haven’t seen your purses you said you would sell on depop,DrenchedInPink013,9 ay önce (düzenlendi),0
I was told not to use waterproof mascara. Your eyelashes need to breathe. I only wear waterproof for funerals and  ……maybe a very special wedding.  I lost lashes.,Janet Klein,9 ay önce (düzenlendi),0
Beauty Pie does not ship to Australia..not fair,elaine benis,9 ay önce,0
Sad  that Beauty pie dont sell in europe.,Gaby sante,9 ay önce,0
Cool,Ukachukwu Chinedu PraiseGod,6 ay önce,0
I feel like those Celine glasses are a touch wide for your face,jillmswift,9 ay önce,2
"I agree with Ali, they really cool, you look great but not a classic one.",Oh dear Karoline,9 ay önce,0
"21:07 i always think courgette courgette, hop in a .. jet like that...  :)",grizzly deener,9 ay önce,0
I think you need bigger sunglasses for you eyes it would suit you better :),Ana Nikodijevic,9 ay önce,0
"These are classic Jackie O glasses style.   If  you look at her pictures, you don't see her eyebrows.  I like the style on you but the frames need to be larger to cover more of your eyebrows",Diana Scott,9 ay önce,2
"25:35, May be they're mating of sorts, or possibly they're too hot ??!!30:20, just noticed your new chandelier, guess it's very different!! 25:40, usually they'll say it's a natural vein running through, but why doesn't it tuck in on the sides??!!  Years ago, it was either Celine,or Chloe, who had that similar design!? 32:05,  ""Ali you're so predictable, so says your wife""!!",Renée Charles,9 ay önce (düzenlendi),0
Looks Better  on Ali,eduarda simoes,9 ay önce,0
Square frames fit your face amazingly— these are too small & sit too low on your nose,Heather W,9 ay önce,1
Just wondering what happened to your lovely Hero ring? You never wear it anymore.,Shelley Poole,9 ay önce,3
"Hi Lydia, the sunglasses are lovely, but I am saying no. Sorry.",Sarah Davies,9 ay önce,2
How much more are you going to try and flog,Morag Dickson,9 ay önce,2
“Not today satan”….because of mascara…??,yetunde ogunade,9 ay önce,1
I think you were looking for the word Underrated??? Mmmm...poor Ali (but those sunglasses really suit him). Are they timeless and classic mmm......it depends on your perception of those terms I guess.,Mimi'sFashionLounge,9 ay önce,0
"I wish you had pushed the sunglasses all the way up on your nose. I feel like you keep setting them halfway down your nose. Lol like PLEASE put them on properly!  they are absolutely timeless. Sorry Ali, you're wrong! Lol ️",Alexa Rhiann McDonald,9 ay önce,0
The sunglass look very Jackie Onasis.,athanasia leontarakis,9 ay önce,0
"Ignore him - he wasn’t alive when these were classic  - Gina Lollobrigida, Sophia Loren, Grace Kelly - need I say more",Dionne Voller,9 ay önce,0
"Lol lydia
I think u wanted to say "" underrated""!!!",judith bitton,9 ay önce,2
Where is the second dress from? The link doesn't work. ,Kath,9 ay önce,0
"Pinch your suckers off your tomato plants, unless they are cherry or grape tomatoes.",Angela Shock,9 ay önce,0
"It’s just me, but I have a problem with my eyebrows on top of glasses.",Janet Klein,9 ay önce,0
"Sunglasses are way too wide and bug like , if they were a smaller style they be lovely though x",Sinead Sheridan,9 ay önce,0
"I think the word you are looking for is ""underrated""? ",angel,9 ay önce,3
"I think you look great in many things but not those sunglasses, only because you can see your eyebrows, maybe is you pushed them back on your nose, sorry, love you",Patti Bonanno,9 ay önce,4
Please help.  I cannot find the striped dress you are wearing on your link....doesn't work.  Can you elaborate how to find it.,Sassy Senior,9 ay önce,0
Personally I think the glasses are a little too small .,Johanna Collins,9 ay önce,1
Or the water,Sarah Pulver,9 ay önce,0
"""I live for my Lady Diors"" despite having not used them in ages, swapping/ selling or debating selling most of them, and declaring hermes is the only bag options for you now. Not v convincing",Lucy Hyde,9 ay önce,4
Underrated,sharon tisherman,9 ay önce,1
Real time,"AGYAKU BEMSEN,BENSON",6 ay önce,0
Good,Ebi Michael,6 ay önce,0
Goggles but beautiful,Cindy Brown,9 ay önce,0
Under-rated the word you were looking for? ,Julie Villeneuve,9 ay önce,0
underrated is the word you were looking for :P,Budoor Ashadawi,9 ay önce,1
Too many ads,H,9 ay önce,4
Prefer cloe ones,eduarda simoes,9 ay önce,0
if she says coastal grandmother one more time im going to have to stop watching.,Lindsey Covington,9 ay önce,7
Barkathon,breathpresent53,9 ay önce,0
"Sorry Lydia, nope to the glasses, agree with Ali not typically classic. Too heavy looking on your face.",Catholic Peace S,9 ay önce,1
Trust Ali.,Susan Gray,9 ay önce,0
"Hi Lydia weather here in v
Er",Alan Jones,9 ay önce,0
Not sure if the glasses fit your face…,Katie Robbins,9 ay önce,3
Underrated?....not sure about sunglasses when  brows are entirely visible above them when worn,M M,9 ay önce (düzenlendi),1
The sunglasses are a timeless style but sadly don’t suit you. You’re wearing them too low on the bridge of your nose to be any use as sun protection. x ,ruthyp1,9 ay önce,7
Glasses don’t look right to small,Colin Butterfield,9 ay önce,3
Dont like the sunglasses.,Trina Jensen,9 ay önce,5
What Does she say “not today Sa.....?,M Rod,9 ay önce,1
Omg!!!! On and on with sun glasses?????,Chrissy Rocco,9 ay önce,0
You mean underrated,mamandtwins,7 ay önce,0
Japan products... Is not cruelty free on animals,Lidia Camino,8 ay önce,0
Sunglasses are to big for ur face,jane leach,9 ay önce,3
I like pretty much everything you wear...however....those sunglasses are too small for your face!!!!  Your eyebrows are so dark which makes it look like you have another set of eyes???  sorry...,DeeDee D,9 ay önce,2
sunglasses seem too wide for your face shape.,Chaan K,9 ay önce,0
Grand Solar Minimum,Jean Buchanan,9 ay önce,0
Not a fan of the sunglasses on u,Rebecca Klompus,9 ay önce,4
The glasses doesn’t suit your face Lydia if I have to be honest,AAA,9 ay önce,3
"Coastalgrandma sounds corny and ageist and stereotypical , hate it",Sinead Eastwood,9 ay önce,9
Under utilised perhaps,Dionne Voller,9 ay önce,0
Sunglasses it is a no…sorry,MorningView,9 ay önce,0
"""And I saw the dead, small and great, standing before God, and books were opened. And another book was opened, which is the Book of Life. 
And the dead were judged according to their works, by the things which were written in the books.
The sea gave up the dead who were in it, and Death and Hades delivered up the dead who were in them. And they were judged, each one according to his works. ",Lochan,9 ay önce,3
Why do you love thyme in skin care,Morag Dickson,9 ay önce,2
those glasses don't fit you,# ajka,9 ay önce,10
Okay,Michael Muritala,7 ay önce,0
why do you wear your sunglasses so far down your nose..you need to push them up a bit..Hope you enjoyed your trip!,Sharon Carthy,9 ay önce,1
Your big eyebrows over power the sunglasses,Renee B,9 ay önce,0
